{
  "timestamp": "20250722_102755",
  "processing_info": {
    "date": "2025-07-22",
    "time": "10:28:12",
    "timezone": "WEST"
  },
  "url": "https://kleinbus-reich.de",
  "imprint_url": "https://kleinbus-reich.de/impressum/",
  "imprint_data": {
    "company_name": "Kleinbus Reich",
    "managing_directors": [
      "Ulla Reich-Hamburger",
      "Dennis Hamburger"
    ],
    "business_address": {
      "street": "Steinbacherstr. 21",
      "city": "Eschborn",
      "postal_code": "65760",
      "country": "Germany"
    },
    "phone_numbers": [
      "061718943747",
      "061718943745"
    ],
    "email_addresses": [
      "info@kleinbus-reich.de"
    ],
    "website_url": "http://www.kleinbus-reich.de",
    "registration_details": {
      "trade_register": null,
      "registration_number": null,
      "court": null
    },
    "vat_id": "DE 247 928 960",
    "tax_id": null,
    "professional_liability_insurance": "Allianz Deutschland GmbH, Königinstraße 28, 80802 München. Geltungsraum der Versicherung: Im Büro und Hauptsitz",
    "other_legal_info": {
      "regulating_authority": "Regierungspräsidium Darmstadt"
    }
  },
  "markdown_content": "Impressum | Kleinbus-Reich.de\n\n\n\n+49 (0) 6171 8943747\n[Info@Kleinbus-Reich.de](mailto:Info@Kleinbus-Reich.de)\n\n\n\n[![Kleinbus-Reich.de](https://kleinbus-reich.de/wp-content/uploads/2017/12/Logo_Kleinbus-Reich_v2.1.png)](https://kleinbus-reich.de/)\n\n* [Startseite](https://kleinbus-reich.de/)\n* [Schulen](https://kleinbus-reich.de/schulen-2/)\n* [Jobs](https://kleinbus-reich.de/jobs/)\n  + [Bewerbung](https://kleinbus-reich.de/bewerbung/)\n* [Service](https://kleinbus-reich.de/?page_id=258)\n  + [Door to Door](https://kleinbus-reich.de/door-to-door-service/)\n  + [Sammelbeförderung](https://kleinbus-reich.de/sammelbefoerderung/)\n  + [Late-Touren](https://kleinbus-reich.de/late-touren/)\n  + [Activities](https://kleinbus-reich.de/activitys/)\n  + [Ferienspiele](https://kleinbus-reich.de/ferienspiele/)\n* [Über Uns](https://kleinbus-reich.de/ueber-uns/)\n\nSeite wählen\n\n \n\n# Impressum\n\nAngaben gemäß § 5 TMG\n\nUlla Reich-Hamburger  \n Kleinbus Reich  \n Steinbacherstr. 21  \n 65760 Eschborn\n\n## Kontakt\n\nTelefon: 061718943747  \n Telefax: 061718943745  \n E-Mail: [info@kleinbus-reich.de](mailto:info@kleinbus-reich.de)  \n Internetadresse: [www.kleinbus-reich.de](http://www.kleinbus-reich.de)\n\n## Umsatzsteuer-ID\n\nUmsatzsteuer-Identifikationsnummer gemäß §27 a Umsatzsteuergesetz  \n DE 247 928 960 Hofheim\n\n## Aufsichtsbehörde\n\nRegierungspräsidium Darmstadt\n\n## Angaben zur Berufshaftpflichtversicherung\n\nName und Sitz der Gesellschaft  \n Allianz Deutschland GmbH  \n Königinstraße 28  \n 80802 München\n\nGeltungsraum der Versicherung  \n Im Büro und Hauptsitz\n\n## Verantwortlich für den Inhalt nach § 55 Abs. 2 RStV\n\nDennis Hamburger\n\n## Quellenangaben für die verwendeten Bilder und Grafiken\n\nistock\n\nStock-Fotografie-ID:826221156\n\nStock-Fotografie-ID:629481516\n\nStock-Fotografie-ID:515673512\n\nStock-Fotografie-ID:525834247\n\nStock-Fotografie-ID:875222380\n\nStock-Fotografie-ID:686890156\n\nStock-Fotografie-ID:640042252\n\nStock-Fotografie-ID:685864090\n\nStock-Fotografie-ID:621475196\n\nStock-Fotografie-ID:77990573\n\n## Haftungsausschluss\n\nHaftung für Inhalte  \n Die Inhalte unserer Seiten wurden mit größter Sorgfalt erstellt. Für die Richtigkeit, Vollständigkeit und Aktualität der Inhalte können wir jedoch keine Gewähr übernehmen. Als Diensteanbieter sind wir gemäß § 7 Abs.1 TMG für eigene Inhalte auf diesen Seiten nach den allgemeinen Gesetzen verantwortlich. Nach §§ 8 bis 10 TMG sind wir als Diensteanbieter jedoch nicht verpflichtet, übermittelte oder gespeicherte fremde Informationen zu überwachen oder nach Umständen zu forschen, die auf eine rechtswidrige Tätigkeit hinweisen. Verpflichtungen zur Entfernung oder Sperrung der Nutzung von Informationen nach den allgemeinen Gesetzen bleiben hiervon unberührt. Eine diesbezügliche Haftung ist jedoch erst ab dem Zeitpunkt der Kenntnis einer konkreten Rechtsverletzung möglich. Bei Bekanntwerden von entsprechenden Rechtsverletzungen werden wir diese Inhalte umgehend entfernen.\n\nHaftung für Links  \n Unser Angebot enthält Links zu externen Webseiten Dritter, auf deren Inhalte wir keinen Einfluss haben. Deshalb können wir für diese fremden Inhalte auch keine Gewähr übernehmen. Für die Inhalte der verlinkten Seiten ist stets der jeweilige Anbieter oder Betreiber der Seiten verantwortlich. Die verlinkten Seiten wurden zum Zeitpunkt der Verlinkung auf mögliche Rechtsverstöße überprüft. Rechtswidrige Inhalte waren zum Zeitpunkt der Verlinkung nicht erkennbar. Eine permanente inhaltliche Kontrolle der verlinkten Seiten ist jedoch ohne konkrete Anhaltspunkte einer Rechtsverletzung nicht zumutbar. Bei Bekanntwerden von Rechtsverletzungen werden wir derartige Links umgehend entfernen.\n\nUrheberrecht  \n Die durch die Seitenbetreiber erstellten bzw. verwendeten Inhalte und Werke auf diesen Seiten unterliegen dem deutschen Urheberrecht. Die Vervielfältigung, Bearbeitung, Verbreitung und jede Art der Verwertung außerhalb der Grenzen des Urheberrechtes bedürfen der Zustimmung des jeweiligen Autors bzw. Erstellers. Downloads und Kopien dieser Seite sind nur für den privaten, nicht kommerziellen Gebrauch gestattet. Soweit die Inhalte auf dieser Seite nicht vom Betreiber erstellt wurden, werden die Urheberrechte Dritter beachtet. Insbesondere werden Inhalte Dritter als solche gekennzeichnet. Sollten Sie trotzdem auf eine Urheberrechtsverletzung aufmerksam werden, bitten wir um einen entsprechenden Hinweis. Bei Bekanntwerden von Rechtsverletzungen werden wir derartige Inhalte umgehend entfernen.\n\n# Legal Disclosure\n\nInformation in accordance with section 5 TMG\n\nUlla Reich-Hamburger  \nKleinbus Reich  \nSteinbacherstr. 21  \n65760 Eschborn\n\n## Contact\n\nTelephone: 061718943747  \nFax: 061718943745  \nE-Mail: [info@kleinbus-reich.de](mailto:info@kleinbus-reich.de)  \nInternetadresse: [www.kleinbus-reich.de](http://www.kleinbus-reich.de)\n\n## VAT number\n\nVAT indentific ation number in accorance with section 27 a of the German VAT act\n\nDE 247 928 960 Hofheim\n\n## Regulating authority\n\nRegierungspräsidium Darmstadt\n\n## Professional indemnity insurance information\n\nName and location of the concern  \nAllianz Deutschland GmbH  \n Königinstraße 28  \n 80802 München\n\nExtent of insurance cover  \nIm Büro und Hauptsitz\n\n## Person responsible for content in accordance with 55 Abs. 2 RStV\n\nDennis Hamburger\n\n## Indication of source for images and graphics\n\nistock\n\n## \n\n## Disclaimer\n\nAccountability for content  \nThe contents of our pages have been created with the utmost care. However, we cannot guarantee the contents‘ accuracy, completeness or topicality. According to statutory provisions, we are furthermore responsible for our own content on these web pages. In this context, please note that we are accordingly not obliged to monitor merely the transmitted or saved information of third parties, or investigate circumstances pointing to illegal activity. Our obligations to remove or block the use of information under generally applicable laws remain unaffected by this as per §§ 8 to 10 of the Telemedia Act (TMG).\n\nAccountability for links  \nResponsibility for the content of external links (to web pages of third parties) lies solely with the operators of the linked pages. No violations were evident to us at the time of linking. Should any legal infringement become known to us, we will remove the respective link immediately.\n\nCopyright  \n Our web pages and their contents are subject to German copyright law. Unless expressly permitted by law (§ 44a et seq. of the copyright law), every form of utilizing, reproducing or processing works subject to copyright protection on our web pages requires the prior consent of the respective owner of the rights. Individual reproductions of a work are allowed only for private use, so must not serve either directly or indirectly for earnings. Unauthorized utilization of copyrighted works is punishable (§ 106 of the copyright law).\n\n\n\n* [Datenschutzerklärung](https://kleinbus-reich.de/datenschutzerklaerung-2/)\n* [Impressum](https://kleinbus-reich.de/impressum/)\n* [Kontakt](https://kleinbus-reich.de/kontakt/)\n\n\n\n\n\n\n\n\nDiese Website verwendet Cookies, um Ihnen den bestmöglichen Service zu gewährleisten. Wenn Sie auf der Seite weitersurfen, stimmen Sie der Cookie-Nutzung zu.OK"
}