{
  "timestamp": "20250722_102843",
  "processing_info": {
    "date": "2025-07-22",
    "time": "10:28:52",
    "timezone": "WEST"
  },
  "url": "https://reisebuero-schmidt.de",
  "imprint_url": "https://reisebuero-schmidt.de/site/impressum",
  "imprint_data": {
    "company_name": "Reisebüro Schmidt GmbH",
    "managing_directors": [
      "Elena Kilickan"
    ],
    "business_address": {
      "street": "Wagnergasse 19",
      "city": "Schwalmstadt/Treysa",
      "postal_code": "34613",
      "country": "Germany"
    },
    "phone_numbers": [
      "06691 919141",
      "06691 919140"
    ],
    "email_addresses": [
      "info@reisebuero-schmidt.de"
    ],
    "website_url": "https://reisebuero-schmidt.de",
    "registration_details": {
      "trade_register": "Handelsregister",
      "registration_number": "HRB 8148",
      "court": "Fritzlar"
    },
    "vat_id": "DE 113086738",
    "tax_id": null,
    "professional_liability_insurance": null,
    "other_legal_info": {
      "consumer_arbitration": "Gemäß § 37 VSBG sind wir verpflichtet, Sie darauf hinzuweisen, dass für Streitigkeiten zwischen Verbrauchern und Unternehmen Streitschlichtungsstellen eingerichtet wurden. Wir nehmen derzeit nicht an Streitbeilegungsverfahren vor einer Verbraucherschlichtungsstelle teil und sind dazu nicht verpflichtet. Sie können sich an diese Stellen wenden, die Teilnahme ist für beide Seiten aber freiwillig. Allgemeine Verbraucherschlichtungsstelle: Zentrum für Schlichtung e.V. | Straßburger Str. 8 77694 Kehl | mail@verbraucher-schlichter.de",
      "insurance_broker_status": "Wir vermitteln Reiseversicherungen im Status eines erlaubnisfreien Annexvermittlers gemäß § 34d Abs. 8 Nr. 1 Gewerbeordnung (GewO).",
      "insurance_ombudsman": "Beschwerdestelle bei Streitigkeiten mit Versicherungsvermittlern: Versicherungsombudsmann e.V. | Postfach 08 06 32 | 10006 Berlin | www.versicherungsombudsmann.de"
    }
  },
  "markdown_content": "Impressum – Reisebüro Schmidt GmbH\n\n\n\n[![](/assets/q/quadra/8372eb33-0fb0-4ad9-acdd-6c0c487147f0/wp-content/uploads/2024/04/LogoReisebueroSchmidt.jpg)](/site/startseite)\n\n* [Home](https://reisebuero-schmidt.de/site/startseite/)\n* [Urlaubsreisen](https://reisebuero-schmidt.de/site/urlaubsreisen/)\n* [Unterkunft](https://reisebuero-schmidt.de/site/unterkunft/)\n* [Kreuzfahrt](https://reisebuero-schmidt.de/site/kreuzfahrt/)\n* [Mehr](https://reisebuero-schmidt.de/site/mehr/)\n\n# Impressum\n\nReisebüro Schmidt GmbH  \n  \nWagnergasse 19  \nD 34613 Schwalmstadt/Treysa  \n  \nTel.: 06691 919141  \nFax: 06691 919140  \nE-Mail: info@reisebuero-schmidt.de  \n  \nGeschäftsführer: Elena Kilickan  \n  \nRegistergericht: Fritzlar  \nRegisternummer: HRB 8148  \nUmsatzsteuer-Identifikationsnummer: DE 113086738  \n  \n\nGemäß § 37 VSBG sind wir verpflichtet, Sie darauf hinzuweisen, dass für Streitigkeiten zwischen Verbrauchern und\nUnternehmen Streitschlichtungsstellen eingerichtet wurden. Wir nehmen derzeit nicht an Streitbeilegungsverfahren\nvor einer Verbraucherschlichtungsstelle teil und sind dazu nicht verpflichtet. Sie können sich an diese Stellen wenden,\ndie Teilnahme ist für beide Seiten aber freiwillig.\n\n**Allgemeine Verbraucherschlichtungsstelle:**\n  \nZentrum für Schlichtung e.V. | Straßburger Str. 8 77694 Kehl |\n[mail@verbraucher-schlichter.de](mailto:mail@verbraucher-schlichter.de)\n\nWir vermitteln Reiseversicherungen im Status eines erlaubnisfreien Annexvermittlers gemäß § 34d Abs. 8 Nr. 1 Gewerbeordnung (GewO).\n  \n**Beschwerdestelle bei Streitigkeiten mit Versicherungsvermittlern:**  \nVersicherungsombudsmann e.V. | Postfach 08 06 32 | 10006 Berlin |\n[www.versicherungsombudsmann.de](https://www.versicherungsombudsmann.de/)\n\n## Konzept, Gestaltung und Realisierung\n\nSchmetterling International GmbH & Co. KG\n\n### Bildrechte\n\nStartseite:  \n©hkama/stock.adobe.com  \n©sitthiphong/stock.adobe.com  \n©Timo Günthner/stock.adobe.com  \n©DisobeyArt/stock.adobe.com  \n©\\_eyetronic/stock.adobe.com  \n©8C9Patryk Kosmider/stock.adobe.com  \n©lumen-digital/stock.adobe.com  \n©Jag\\_cz/stock.adobe.com  \n©peja/stock.adobe.com  \n©Laura Pashkevich/stock.adobe.com  \n© Konstantin/stock.adobe.com  \n© olezzo/stock.adobe.com  \n© dietwalther/stock.adobe.com\n\nPauschalreisen:  \n©Andrew Mayovskyy/stock.adobe.com  \n© icemanphotos/stock.adobe.com\n\nKreuzfahrten  \n© alphaspirit/stock.adobe.com\n\nRundreisen:  \n©efesenko/stock.adobe.com  \n© day2505/stock.adobe.com\n\nMietwagen:  \n©Brian Jackson/stock.adobe.com  \n© Joshua Resnick/stock.adobe.com\n\nKlassenfahrten:  \n© luckybusiness/stock.adobe.com\n\nVersicherung:  \n©thodonal/stock.adobe.com  \n© catalinlazar/stock.adobe.com\n\nTickets & Events:  \n©lazyllama/stock.adobe.com  \n© DWP/stock.adobe.com\n\nHotels:  \n© eyetronic/stock.adobe.com\n\nHotels über Partner:  \n© Kittiphan/stock.adobe.com\n\nHotel & Bahn:  \n©murattellioglu/stock.adobe.com  \n© vitaliymateha/stock.adobe.com\n\nHotelguide:  \n© jdross75/stock.adobe.com\n\nHochseekreuzfahrten:  \n© NAN/stock.adobe.com\n\nFlusskreuzfahrten:  \n© mh90photo/stock.adobe.com\n\nFerienhaus:  \n©Maciej Czekajewski/stock.adobe.com  \n© olezzo/stock.adobe.com\n\nCharterflug + Linienflug:  \n©Jag\\_cz/stock.adobe.com  \n© Lukas Gojda/stock.adobe.com\n\nFlughafenparken:  \n© Day Of Victory Stu./stock.adobe.com\n\nBahn:  \n© HildaWeges/stock.adobe.com\n\nDeutschlandurlaub:  \n©JFL Photography/stock.adobe.com  \n©cityfoto24/stock.adobe.com  \n©mp1982\\_06/stock.adobe.com  \n©Silke Koch/stock.adobe.com  \n©karp5/stock.adobe.com  \n© TTstudio/stock.adobe.com\n\nPortugal:  \n©peja/stock.adobe.com  \n©daliu/stock.adobe.com  \n©ppohudka/stock.adobe.com  \n©vickysp/stock.adobe.com  \n© Evrymmnt/stock.adobe.com\n\nDubai:  \n© EdNurg/stock.adobe.com\n\nBalearen:  \n© vulcanus/stock.adobe.com\n\nCluburlaub:  \n©DisobeyArt/stock.adobe.com  \n© Mediteraneo/stock.adobe.com\n\nOstsee:  \n©Silke Koch/stock.adobe.com  \n©mmphotographie.de/stock.adobe.com  \n©Shambhala/stock.adobe.com  \n©Jens/stock.adobe.com  \n© Bauer Alex/stock.adobe.com\n\nBodensee:  \n©Timo Günthner/stock.adobe.com  \n©Susanne/stock.adobe.com  \n©zauberblicke/stock.adobe.com  \n©6okean/stock.adobe.com  \n© Manuel Schönfeld/stock.adobe.com\n\nGriechenland:  \n©8C9Patryk Kosmider/stock.adobe.com  \n©Balate Dorin/stock.adobe.com  \n©A.Jedynak/stock.adobe.com  \n©proslgn/stock.adobe.com  \n© Papadimitriou/stock.adobe.com\n\nItalien:  \n©Jag\\_cz/stock.adobe.com  \n©refresh(PIX)/stock.adobe.com  \n©stevanzz/stock.adobe.com  \n©Frédéric Prochasson/stock.adobe.com  \n© moofushi/stock.adobe.com\n\nHarz:  \n©Joppi/stock.adobe.com  \n©Elias Kostner/stock.adobe.com  \n©riebevonsehl/stock.adobe.com  \n©okram86/stock.adobe.com  \n© Manuel Pauls/stock.adobe.com\n\nBayern:  \n©Bayern Tourismus Marketing GmbH  \n© Wolfilser/stock.adobe.com\n\nAllgemein:\n\n©Schmetterling  \n©Gebeco  \n©FTI Touristik  \n©Aldiana GmbH  \n©vtours  \n©GIATA\n\n![](https://template-alpha-vacation.quadra-testen.de/wp-content/uploads/2022/08/slr-partner-LOGO_2line_left-neg.png \"slr-partner-LOGO_2line_left-neg\")\n\nRechtliche Informationen\n\n[Impressum](/site/impressum) | [Datenschutzerklärung](/site/datenschutzerklaerung) | [Online Check-In](/site/online_checkin) | [Service](/site/service) | [AGB](/site/agb) | [Blacklisted Airlines](https://transport.ec.europa.eu/transport-themes/eu-air-safety-list_en) | [Barrierefreiheitserklärung](/site/barrierefreiheitserklaerung)\n\n[![](https://template-alpha-vacation.quadra-testen.de/wp-content/uploads/2022/02/Icon_Kontakt_V2_105px.png)](/site/kontakt/)\n\n© 2025 • Schmetterling\n\nCookie-Zustimmung verwalten\n\nDiese Website verwendet Cookies und Targeting Technologien, um Ihnen ein besseres Internet-Erlebnis zu ermöglichen und die Werbung, die Sie sehen, besser an Ihre Bedürfnisse anzupassen. Diese Technologien nutzen wir außerdem, um Ergebnisse zu messen, um zu verstehen, woher unsere Besucher kommen oder um unsere Website weiter zu entwickeln.  \n  \nUm Ihnen ein optimales Erlebnis zu bieten, verwenden wir Technologien wie Cookies, um Geräteinformationen zu speichern und/oder darauf zuzugreifen. Wenn Sie diesen Technologien zustimmmen, können wir Daten wie das Surfverhalten oder eindeutige IDs auf dieser Website verarbeiten. Wenn Sie ihre Zustimmung nicht erteilen oder zurückziehen, können bestimmte Merkmale und Funktionen beeinträchtigt werden.  \n  \nWir verwenden Statistiken-Cookies und Marketing Cookies.  \n  \n[Cookie-Richtlinie](https://reisebuero-schmidt.de/site/cookie_richtlinie_eu/)\n\nFunktional\n\n\n\nFunktional\nImmer aktiv \n\nDie technische Speicherung oder der Zugang ist unbedingt erforderlich für den rechtmäßigen Zweck, die Nutzung eines bestimmten Dienstes zu ermöglichen, der vom Teilnehmer oder Nutzer ausdrücklich gewünscht wird, oder für den alleinigen Zweck, die Übertragung einer Nachricht über ein elektronisches Kommunikationsnetz durchzuführen.\n\n\n\n\nVorlieben\n\n\nVorlieben\n\nDie technische Speicherung oder der Zugriff ist für den rechtmäßigen Zweck der Speicherung von Präferenzen erforderlich, die nicht vom Abonnenten oder Benutzer angefordert wurden.\n\n\n\n\nStatistiken\n\n\nStatistiken\n\nDie technische Speicherung oder der Zugriff, der ausschließlich zu statistischen Zwecken erfolgt.\nDie technische Speicherung oder der Zugriff, der ausschließlich zu anonymen statistischen Zwecken verwendet wird. Ohne eine Vorladung, die freiwillige Zustimmung deines Internetdienstanbieters oder zusätzliche Aufzeichnungen von Dritten können die zu diesem Zweck gespeicherten oder abgerufenen Informationen allein in der Regel nicht dazu verwendet werden, dich zu identifizieren.\n\n\n\n\nMarketing\n\n\nMarketing\n\nDie technische Speicherung oder der Zugriff ist erforderlich, um Nutzerprofile zu erstellen, um Werbung zu versenden oder um den Nutzer auf einer Website oder über mehrere Websites hinweg zu ähnlichen Marketingzwecken zu verfolgen.\n\n[Optionen verwalten](#)\n[Dienste verwalten](#)\n[Verwalten von {vendor\\_count}-Lieferanten](#)\n[Lese mehr über diese Zwecke](https://cookiedatabase.org/tcf/purposes/)\n\nAlle Cookies akzeptieren\nNur technisch notwendige Cookies\nEinstellungen ändern\nEinstellungen speichern\n[Einstellungen ändern](#)\n\n[{title}](#)\n[{title}](#)\n[{title}](#)\n\nZustimmung verwalten"
}