{
  "timestamp": "20250722_103146",
  "processing_info": {
    "date": "2025-07-22",
    "time": "10:32:19",
    "timezone": "WEST"
  },
  "url": "https://rued-reisen.de",
  "imprint_url": "https://rued-reisen.de/impressum",
  "imprint_data": {
    "company_name": "Rüd GmbH",
    "managing_directors": [
      "Thomas Rüd",
      "Matthias Rüd"
    ],
    "business_address": {
      "street": "Auf der Fluhe 9",
      "city": "Albbruck",
      "postal_code": "79774",
      "country": "Germany"
    },
    "phone_numbers": [
      "+49 7755 8686"
    ],
    "email_addresses": [
      "info@rued-reisen.de"
    ],
    "website_url": "https://www.rued-reisen.de",
    "registration_details": {
      "trade_register": "Handelsregister",
      "registration_number": "HRB 621348",
      "court": "Amtsgericht Freiburg"
    },
    "vat_id": "DE 202980275",
    "tax_id": null,
    "professional_liability_insurance": "KRAVAG-Logistic Versicherungs-AG, Postfach 103905, Heidenkampsweg 102, 20097 Hamburg",
    "other_legal_info": {
      "supervisory_authority": "Landratsamt Waldshut",
      "professional_designation": "Busunternehmen",
      "competent_chamber": "IHK Schopfheim",
      "professional_regulations": "Straßenverkehrsordnung (http://www.gesetze-im-internet.de/stvo_2013/)",
      "copyright_jurisdiction": "Schweizer Urheberrecht",
      "copyright_statement": "Copyright 2025 Rüd GmbH. All Rights Reserved."
    }
  },
  "markdown_content": "Impressum - Rüd Reisen Start\n\n\n\n### Login\n\nBenutzername\n\nPasswort\n\nAnmelden\n\n[Register](#) | [Lost your password?](#)\n\n#### Support\n\nLorem ipsum dolor sit amet:\n\n24h / 365days\n\nWe offer support for our customers\n\n**Mon - Fri 8:00am - 5:00pm (GMT +1)**\n\n#### Get in touch\n\n**Cybersteel Inc.**  \n376-293 City Road, Suite 600  \nSan Francisco, CA 94102\n\n**Have any questions?**  \n+44 1234 567 890\n\n**Drop us a line**  \n[info@yourdomain.com](mailto:info@yourdomain.com)\n\n#### About us\n\n**Lorem ipsum dolor sit amet, consectetuer adipiscing elit.**\n\nAenean commodo ligula eget dolor. Aenean massa. Cum sociis natoque penatibus et magnis dis parturient montes, nascetur ridiculus mus. Donec quam felis, ultricies nec.\n\nAnmelden\n\n### LOGIN\n\nAngemeldet bleiben\n\n\n[Navigation überspringen](impressum#skipNavigation222)\n\n* [Company](about-us-233 \"Company\")\n  + [Team](http://www.premium-contao-themes.com/ \"Team\")\n  + [History](http://www.premium-contao-themes.com/ \"History\")\n  + [Vision](http://www.premium-contao-themes.com/ \"Vision\")\n* [Support](http://www.premium-contao-themes.com/ \"Support\")\n\n\n\nHaben Sie Fragen?  +49 7755 8686\n\n[info@rued-reisen.de](mailto:info@rued-reisen.de)\n\n---\n\n[Navigation überspringen](impressum#skipNavigation155)\n\n* 1. Home\n* [Busreisen](busreisen \"Busreisen\")\n* 1. [Linienverkehr](linienverkehr \"Linienverkehr\")\n     + 1. [Linienverkehr](linienverkehr \"Linienverkehr\")\n     + [Rollende Werbung](rollende-werbung \"Rollende Werbung\")\n* [Unternehmen](unternehmen \"Unternehmen\")\n  + [Firmenportrait](unternehmen \"Firmenportrait\")\n  + [Unser Fuhrpark](unser-fuhrpark \"Unser Fuhrpark\")\n  + [Jobs](jobs \"Jobs\")\n* [Kontakt](kontakt \"Kontakt\")\n  + 1. [Kontakt / Anfahrt](kontakt \"Kontakt / Anfahrt\")\n    2. [Impressum](impressum \"Impressum\")\n    3. [Datenschutz](datenschutz \"Datenschutz\")\n  + [Fotogalerie](fotogalerie \"Fotogalerie\")\n\n\n\n[Navigation überspringen](impressum#skipNavigation214)\n\n* [About us](about-us-233 \"About us\")\n  + [Team](http://www.premium-contao-themes.com/ \"Team\")\n  + [History](http://www.premium-contao-themes.com/ \"History\")\n  + [Vision](http://www.premium-contao-themes.com/ \"Vision\")\n* [Support](http://www.premium-contao-themes.com/ \"Support\")\n* [Testimonials](http://www.premium-contao-themes.com/ \"Testimonials\")\n\n# IMPRESSUM\n\nRüd GmbH\n\nIMPRESSUM\n\nAngaben gemäß § 5 TMG:\n\nRüd GmbH  \nAuf der Fluhe 9  \n79774 Albbruck\n\n**Vertreten durch die Geschäftsführer:**  \nThomas Rüd  \nMatthias Rüd  \n  \n**Kontakt:**  \nTel: +49 7755 8686  \neMail\\_ [info@rued-reisen.de](mailto:info@rued-reisen.de)  \nWeb: www.rued-reisen.de\n\n### Registereintrag:\n\nEintragung im Handelsregister.   \nRegistergericht:Amtsgericht Freiburg   \nRegisternummer: HRB 621348\n\n### Umsatzsteuer-ID:\n\nUmsatzsteuer-Identifikationsnummer gemäß §27 a Umsatzsteuergesetz:  \nDE 202980275\n\n### Aufsichtsbehörde:\n\nLandratsamt Waldshut\n\nBerufsbezeichnung: Busunternehmen  \nZuständige Kammer: IHK Schopfheim\n\nEs gelten folgende berufsrechtliche Regelungen: Straßenverkehrsordnung\n\n<http://www.gesetze-im-internet.de/stvo_2013/>\n\n### Angaben zur Berufshaftpflichtversicherung:\n\nName und Sitz der Gesellschaft:  \nKRAVAG-Logistic\n\nVersicherungs-AG\n\nPostfach 103905\n\nHeidenkampsweg 102\n\n20097 Hamburg\n\nQuelle: [www.e-recht24.de](https://www.e-recht24.de/)\n\n![](assets/images/b/monitor_01-9be18765.png)\n\n### Grafische Gestaltung\n\nWEBDESIGN\n\nWolfgang Ross  \nFreiberuflicher Webdesigner  \nLigusterweg 7  \n79804 Dogern  \n  \nTel:  +49 7751 306 9976  \neMail: wolf@rossidesign.de  \nWeb: [www.rossidesign.de](http://www.rossidesign.de)\n\n#### Quellenangaben für die verwendeten Fotos & Videos\n\n![@ Archivbilder Thomas Rüd](assets/images/0/oldie_02a-acc1c41e.jpg)\n\n![@ Archivbilder Thomas Rüd](assets/images/0/oldie_02a-acc1c41e.jpg)\n\n\n@ Archivbilder Thomas Rüd\n\n![@ Mitarbeiter Isabell Rüd](assets/images/e/IMG_0033_1-368c4117.jpg)\n\n![@ Mitarbeiter Isabell Rüd](assets/images/e/IMG_0033_1-368c4117.jpg)\n\n\n@ Mitarbeiterfotos Isabell Rüd\n\n![@ Rüd Reisebusse Isabell Rüd](assets/images/e/IMG_4070-19036dd7.jpg)\n\n![@ Rüd Reisebusse Isabell Rüd](assets/images/e/IMG_4070-19036dd7.jpg)\n\n\n@ Rüd Reisebusse Isabell Rüd\n\n![@ Isabell Rüd](assets/images/7/komfort-873c6e30.png)\n\n![@ Isabell Rüd](assets/images/7/komfort-873c6e30.png)\n\n\n@ Isabell Rüd\n\n![ADOBE STOCK - #65982517 @mojolo](assets/images/e/AdobeStock_65982517_72_bus_dark-d6d17cdc.jpg)\n\n![ADOBE STOCK - #65982517 @mojolo](assets/images/e/AdobeStock_65982517_72_bus_dark-d6d17cdc.jpg)\n\n\nADOBE STOCK - #65982517 @mojolo\n\n![ADOBE STOCK - #196684166 @polack](assets/images/c/AdobeStock_196684166_72-9c69bcd3.jpg)\n\n![ADOBE STOCK - #196684166 @polack](assets/images/a/AdobeStock_196684166_72_d-ee77a35c.jpg)\n\n\nADOBE STOCK - #196684166 @polack\n\n![ADOBE STOCK - #201330167 @dusanpetkovic1](assets/images/3/AdobeStock_201330167_72-18955b40.jpg)\n\n![ADOBE STOCK - #201330167 @dusanpetkovic1](assets/images/3/AdobeStock_201330167_72-18955b40.jpg)\n\n\nADOBE STOCK - #201330167 @dusanpetkovic1\n\n![ADOBE STOCK - #230358748 @OlegDoroshin](assets/images/e/AdobeStock_230358748_72-1bd8bc02.jpg)\n\n![ADOBE STOCK - #230358748 @OlegDoroshin](assets/images/e/AdobeStock_230358748_72-1bd8bc02.jpg)\n\n\nADOBE STOCK - #230358748 @OlegDoroshin\n\n### Haftungsausschluss (Disclaimer)\n\n**Haftung für Inhalte**\n\nAls Diensteanbieter sind wir für eigene Inhalte auf diesen Seiten nach den allgemeinen Gesetzen verantwortlich. Wir sind als Diensteanbieter jedoch nicht verpflichtet, übermittelte oder gespeicherte fremde Informationen zu überwachen oder nach Umständen zu forschen, die auf eine rechtswidrige Tätigkeit hinweisen. Verpflichtungen zur Entfernung oder Sperrung der Nutzung von Informationen nach den allgemeinen Gesetzen bleiben hiervon unberührt. Eine diesbezügliche Haftung ist jedoch erst ab dem Zeitpunkt der Kenntnis einer konkreten Rechtsverletzung möglich. Bei Bekanntwerden von entsprechenden Rechtsverletzungen werden wir diese Inhalte umgehend entfernen.\n\n**Haftung für Links**\n\nUnser Angebot enthält Links zu externen Webseiten Dritter, auf deren Inhalte wir keinen Einfluss haben. Deshalb können wir für diese fremden Inhalte auch keine Gewähr übernehmen. Für die Inhalte der verlinkten Seiten ist stets der jeweilige Anbieter oder Betreiber der Seiten verantwortlich. Die verlinkten Seiten wurden zum Zeitpunkt der Verlinkung auf mögliche Rechtsverstöße überprüft. Rechtswidrige Inhalte waren zum Zeitpunkt der Verlinkung nicht erkennbar. Eine permanente inhaltliche Kontrolle der verlinkten Seiten ist jedoch ohne konkrete Anhaltspunkte einer Rechtsverletzung nicht zumutbar. Bei Bekanntwerden von Rechtsverletzungen werden wir derartige Links umgehend entfernen.\n\n**Urheberrecht**\n\nDie durch die Seitenbetreiber erstellten Inhalte und Werke auf diesen Seiten unterliegen dem schweizer Urheberrecht. Die Vervielfältigung, Bearbeitung, Verbreitung und jede Art der Verwertung außerhalb der Grenzen des Urheberrechtes bedürfen der schriftlichen Zustimmung des jeweiligen Autors bzw. Erstellers. Downloads und Kopien dieser Seite sind nur für den privaten, nicht kommerziellen Gebrauch gestattet. Soweit die Inhalte auf dieser Seite nicht vom Betreiber erstellt wurden, werden die Urheberrechte Dritter beachtet. Insbesondere werden Inhalte Dritter als solche gekennzeichnet. Sollten Sie trotzdem auf eine Urheberrechtsverletzung aufmerksam werden, bitten wir um einen entsprechenden Hinweis. Bei Bekanntwerden von Rechtsverletzungen werden wir derartige Inhalte umgehend entfernen.\n\n#### RÜD VERKEHRS GMBH\n\nAuf der Fluhe 11  \nD-79774 Albbruck-Unteralpfen\n\n+49 (0)7755 8686\n\n+49 (0)7755 8639\n\n[info@rued-reisen.de](mailto:info@rued-reisen.de)\n\n#### RÜD GMBH\n\nAuf der Fluhe 9  \nD-79774 Albbruck-Unteralpfen\n\n+49 (0)7755 8686\n\n[info@rued-reisen.de](mailto:info@rued-reisen.de)\n\n#### Quicklinks\n\n* Busreisen\n* [Linienverkehr](linienverkehr)\n* [Unser Fuhrpark](unser-fuhrpark)\n* [Kontakt](kontakt)\n\n**Wir sind Mitglied im Verkehrsverbund Südbaden AG**\n\nDer Verkehrsverbund Südbaden ist ein Zusammenschluss von 26 familiengeführten Busunternehmen im Landkreis Waldshut\n\n![](assets/images/f/logo_VSAG-b15f639f.png)\n\nCopyright 2025 Rüd GmbH. All Rights Reserved.\n\n[Datenschutzerklärung](datenschutz)[Impressum](impressum)[Datenschutzeinstellungen ändern](https://rued-reisen.de/?clear_privacy_settings=1)\n\n* Home\n* [Busreisen](busreisen \"Busreisen\")\n* [Linienverkehr](linienverkehr \"Linienverkehr\")\n  + [Linienverkehr](linienverkehr \"Linienverkehr\")\n  + [Rollende Werbung](rollende-werbung \"Rollende Werbung\")\n* [Unternehmen](unternehmen \"Unternehmen\")\n  + [Firmenportrait](unternehmen \"Firmenportrait\")\n  + [Unser Fuhrpark](unser-fuhrpark \"Unser Fuhrpark\")\n  + [Jobs](jobs \"Jobs\")\n* [Kontakt](kontakt \"Kontakt\")\n  + [Kontakt / Anfahrt](kontakt \"Kontakt / Anfahrt\")\n  + [Impressum](impressum \"Impressum\")\n  + [Datenschutz](datenschutz \"Datenschutz\")\n  + [Fotogalerie](fotogalerie \"Fotogalerie\")\n\nEinstellungen gespeichert\n\nDatenschutzeinstellungen\n\nBitte treffen Sie eine Auswahl um fortzufahren\n\nErforderlich\n\nNotwendige Cookies und Google Fonts zulassen damit die Website korrekt funktioniert\n\nKomfort\n\nEs werden notwendige Cookies, Google Fonts, Google Maps und Youtube geladen\n\nStatistik\n\nEs werden notwendige Cookies, Google Fonts, Google Maps, Youtube geladen. Wir nutzen KEINE Analyseprogramme um ihr Nutzerverhalten aufzuzeichnen.\n\n[Datenschutzerklärung](datenschutz)[Impressum](impressum)[Weitere Informationen](#)\n\n##### Weitere Informationen\n\nDie Betreiber dieser Seiten nehmen den Schutz Ihrer persönlichen Daten sehr ernst. Wir behandeln Ihre personenbezogenen Daten vertraulich und entsprechend der gesetzlichen Datenschutzvorschriften sowie dieser Datenschutzerklärung.\nWenn Sie diese Website benutzen, werden verschiedene personenbezogene Daten erhoben. Personenbezogene Daten sind Daten, mit denen Sie persönlich identifiziert werden können. Die vorliegende Datenschutzerklärung erläutert, welche Daten wir erheben und wofür wir sie nutzen. Sie erläutert auch, wie und zu welchem Zweck das geschieht. Ausführliche Informationen zum Thema Datenschutz entnehmen Sie unserer unter diesem Text aufgeführten Datenschutzerklärung.\n\nSchließen\n\n\n\n[Navigation überspringen](impressum#skipNavigation261)\n\n* Home\n* [Busreisen](busreisen \"Busreisen\")\n* [Linienverkehr](linienverkehr \"Linienverkehr\")\n  + [Linienverkehr](linienverkehr \"Linienverkehr\")\n  + [Rollende Werbung](rollende-werbung \"Rollende Werbung\")\n* [Unternehmen](unternehmen \"Unternehmen\")\n  + [Firmenportrait](unternehmen \"Firmenportrait\")\n  + [Unser Fuhrpark](unser-fuhrpark \"Unser Fuhrpark\")\n  + [Jobs](jobs \"Jobs\")\n* [Kontakt](kontakt \"Kontakt\")\n  + [Kontakt / Anfahrt](kontakt \"Kontakt / Anfahrt\")\n  + [Impressum](impressum \"Impressum\")\n  + [Datenschutz](datenschutz \"Datenschutz\")\n  + [Fotogalerie](fotogalerie \"Fotogalerie\")"
}