{
  "timestamp": "20250722_102827",
  "processing_info": {
    "date": "2025-07-22",
    "time": "10:28:49",
    "timezone": "WEST"
  },
  "url": "https://sparcar-eppstein.com",
  "imprint_url": "https://sparcar-eppstein.com/impressum/",
  "imprint_data": {
    "company_name": "Sparcar Eppstein",
    "managing_directors": null,
    "business_address": {
      "street": "Hauptstraße 97.3",
      "city": "Eppstein",
      "postal_code": "65817",
      "country": "Germany"
    },
    "phone_numbers": [
      "+49 (0) 6198 58 84 966"
    ],
    "email_addresses": [
      "info@sparcar-eppstein.com"
    ],
    "website_url": "https://sparcar-eppstein.com",
    "registration_details": null,
    "vat_id": null,
    "tax_id": "046 869 31728",
    "professional_liability_insurance": null,
    "other_legal_info": {
      "supervisory_authority": "Public Order Office City of Eppstein",
      "institution_number": "600673845"
    }
  },
  "markdown_content": "Impressum | Sparcar Eppstein\n\n\n\n\n[![Logo](//sparcar-eppstein.com/wp-content/uploads/2019/10/Sparcar_eppstein-1.png)\n![Logo](//sparcar-eppstein.com/wp-content/uploads/2019/10/Sparcar_eppstein-1.png)](https://sparcar-eppstein.com/ \"Sparcar Eppstein\")\n\n* [Home](https://sparcar-eppstein.com/)\n* [Dienstleistungen](https://sparcar-eppstein.com/services/)\n* [News](https://sparcar-eppstein.com/news/)\n* [Impressum](https://sparcar-eppstein.com/impressum/)\n* [Kontakt](https://sparcar-eppstein.com/kontakt/)\n\n* [Home](https://sparcar-eppstein.com/)\n* [Dienstleistungen](https://sparcar-eppstein.com/services/)\n* [News](https://sparcar-eppstein.com/news/)\n* [Impressum](https://sparcar-eppstein.com/impressum/)\n* [Kontakt](https://sparcar-eppstein.com/kontakt/)\n\n## Impressum\n\n**Information according to § 5 TMG:**\n\nSpar Car Eppstein   \nHauptstraße 97.3   \n65817 Eppstein, 65817\n\nContact:   \nPhone: +49 (0) 6198 58 84 966\n\nE-mail: info@sparcar-eppstein.com\n\nDisclaimer:\n\n**Liability for content**  \n The contents of our pages have been created with the utmost care. However, we cannot assume any liability for the correctness, completeness and topicality of the contents. As a service provider, we are responsible according to § 7 Abs.1 TMG for our own content on these pages according to the general laws. According to §§ 8 to 10 TMG, however, we as a service provider are not obliged to monitor transmitted or stored third-party information or to investigate circumstances that indicate illegal activity. Obligations to remove or block the use of information in accordance with general laws remain unaffected by this. However, liability in this regard is only possible from the time of knowledge of a specific infringement. Upon becoming aware of such violations, we will remove this content immediately.\n\n**Liability for links**  \n Our offer contains links to external websites of third parties, on whose contents we have no influence. Therefore, we cannot assume any liability for these third-party contents. The respective provider or operator of the pages is always responsible for the content of the linked pages. The linked pages were checked for possible legal violations at the time of linking. Illegal content was not recognized at the time of linking. However, a permanent control of the content of the linked pages is not reasonable without concrete evidence of a violation of the law. Upon becoming aware of legal violations, we will remove such links immediately.\n\n**Copyright**  \n The content and works created by the site operators on these pages are subject to German copyright law. The duplication, processing, distribution and any kind of exploitation outside the limits of copyright require the written consent of the respective author or creator. Downloads and copies of this site are only permitted for private, non-commercial use. Insofar as the contents on this page were not created by the operator, the copyrights of third parties are observed. In particular, third-party content is marked as such. Should you nevertheless become aware of a copyright infringement, we ask for a corresponding notice. Upon becoming aware of legal violations, we will remove such content immediately.\n\n**Supervisory Authority**  \n Public Order Office City of Eppstein\n\n**Airport transfer**  \n According to desired date, our driver will pick you up at the airport as well as drive to the airport.\n\n**Data protection**  \n The use of our website is usually possible without providing personal data. Insofar as personal data (eg name, address or e-mail addresses) are collected on our pages, this is always done on a voluntary basis as far as possible. This data will not be passed on to third parties without your express consent. We would like to point out that data transmission on the Internet (eB when communicating by e-mail) may have security gaps. A complete protection of the data against access by third parties is not possible. The use of contact data published within the scope of the imprint obligation by third parties for the purpose of sending unsolicited advertising and information materials is hereby expressly prohibited. The operators of the pages expressly reserve the right to take legal action in the event of the unsolicited sending of advertising information, such as spam e-mails.\n\nSPAR CAR EPPSTEN   \nSt-Nr: 046 869 31728  \nIK-Nr:600673845\n\n**Bank details: SPAR CAR EPPSTEN**  \n BIC: HELADEF1TSK   \nIBAN: DE98 5125 0000 0050 0064 33\n\n\n\n\n[![Sparcar Eppstein](https://sparcar-eppstein.com/wp-content/uploads/2019/10/logo_weiss.png)](https://sparcar-eppstein.com/)\n\nWir bieten professionelle Dienstleistungen rund um den Bereich Fahrservice für Geschäfts- und Privatkunden. Wir befördern Sie **pünktlich** und **sicher** von A nach B! Ihr Weg ist Unser Ziel!\n\n[Datenschutz](https://sparcar-eppstein.com/datenschutz/) |\n[Impressum](https://sparcar-eppstein.com/impressum/)\n\nWir akzeptieren die folgenden Zahlungsarten:  \n![Visa](https://sparcar-eppstein.com/wp-content/uploads/2019/10/visa-card.png)\n![Master Card](https://sparcar-eppstein.com/wp-content/uploads/2019/10/mastercard-4-logo-png-transparent.png)\n![EC](https://sparcar-eppstein.com/wp-content/uploads/2019/10/mc_ec.png)\n\n#### Helpful Links\n\n* [Impressum](https://sparcar-eppstein.com/impressum/)\n* [Services](https://sparcar-eppstein.com/services/)\n* [Kontakt](https://sparcar-eppstein.com/kontakt/)\n* [News](https://sparcar-eppstein.com/category/news/)\n\n---\n\n © 2025 Sparcar Eppstein. All Rights Reserved.\n\n\n\n[Go to Top](#)\n\n\n\nDiese Website verwendet Cookies – nähere Informationen dazu und zu Ihren Rechten als Benutzer finden Sie in unserer Datenschutzerklärung am Ende der Seite. Klicken Sie auf „Ich stimme zu“, um Cookies zu akzeptieren und direkt unsere Website besuchen zu können.Akzeptieren\n\nPrivacy & Cookies Policy\n\nSchließen\n\n#### Privacy Overview\n\nThis website uses cookies to improve your experience while you navigate through the website. Out of these cookies, the cookies that are categorized as necessary are stored on your browser as they are essential for the working of basic functionalities of the website. We also use third-party cookies that help us analyze and understand how you use this website. These cookies will be stored in your browser only with your consent. You also have the option to opt-out of these cookies. But opting out of some of these cookies may have an effect on your browsing experience.\n\nNecessary\n\nNecessary\n\nimmer aktiv\n\nNecessary cookies are absolutely essential for the website to function properly. This category only includes cookies that ensures basic functionalities and security features of the website. These cookies do not store any personal information.\n\nNon-necessary\n\nNon-necessary\n\nAny cookies that may not be particularly necessary for the website to function and is used specifically to collect user personal data via analytics, ads, other embedded contents are termed as non-necessary cookies. It is mandatory to procure user consent prior to running these cookies on your website.\n\nSPEICHERN & AKZEPTIEREN\n\n[![de_DE](https://sparcar-eppstein.com/wp-content/plugins/translatepress-multilingual/assets/images/flags/de_DE.png \"German\")German](#)\n\n[![en_US](https://sparcar-eppstein.com/wp-content/plugins/translatepress-multilingual/assets/images/flags/en_US.png \"English\")English](https://sparcar-eppstein.com/en/impressum/ \"English\") \n[![de_DE](https://sparcar-eppstein.com/wp-content/plugins/translatepress-multilingual/assets/images/flags/de_DE.png \"German\")German](#)"
}