{
  "timestamp": "20250722_103334",
  "processing_info": {
    "date": "2025-07-22",
    "time": "10:33:49",
    "timezone": "WEST"
  },
  "url": "https://thumm-bus.de",
  "imprint_url": "https://thumm-bus.de/137-2/",
  "imprint_data": {
    "company_name": "Markus Thumm Busfahrten",
    "managing_directors": [
      "Markus Thumm"
    ],
    "business_address": {
      "street": "Gottlieb-Daimler-Straße 25",
      "city": "Weil im Schönbuch",
      "postal_code": "71093",
      "country": "Germany"
    },
    "phone_numbers": [
      "07157 8434"
    ],
    "email_addresses": [
      "info@thumm-bus.de"
    ],
    "website_url": "https://thumm-bus.de",
    "registration_details": {
      "trade_register": "Handelsregister",
      "registration_number": "HRB 727138",
      "court": "Amtsgericht 70190 Stuttgart"
    },
    "vat_id": null,
    "tax_id": null,
    "professional_liability_insurance": null,
    "other_legal_info": {
      "EU_online_dispute_resolution_platform": "https://ec.europa.eu/consumers/odr/",
      "consumer_dispute_resolution": "Not willing or obligated to participate in dispute resolution proceedings before a consumer arbitration board.",
      "source_of_legal_text": "eRecht24",
      "copyright_holder": "Thumm Busfahrten",
      "copyright_year": "2025",
      "hosting_provider_name": "Strato AG",
      "hosting_provider_address": "Otto-Ostrowski-Straße 7, 10249 Berlin"
    }
  },
  "markdown_content": "Thumm Busfahrten\n\n\n\n[![](https://thumm-bus.de/wp-content/uploads/2025/01/Thumm-Logo-freigestellt-ws.png)![](https://thumm-bus.de/wp-content/uploads/2025/01/Thumm-Logo-freigestellt-ws.png)](https://thumm-bus.de)\n\n* [Home](https://thumm-bus.de/)\n\n[![](https://thumm-bus.de/wp-content/uploads/2025/01/Thumm-Logo-freigestellt-ws.png)![](https://thumm-bus.de/wp-content/uploads/2025/01/Thumm-Logo-freigestellt-ws.png)](https://thumm-bus.de)\n\n* [Home](https://thumm-bus.de/)\n\n© 2019\n\n#\n\n# Impressum\n\nMarkus Thumm  \nMarkus Thumm Busfahrten  \nGottlieb-Daimler-Straße 25  \n71093 Weil im Schönbuch\n\nHandelsregister: HRB 727138  \nRegistergericht: Amtsgericht 70190 Stuttgart\n\n## Kontakt\n\nTelefon: 07157 8434  \nE-Mail: info[at]thumm-bus.de\n\n## EU-Streitschlichtung\n\nDie Europäische Kommission stellt eine Plattform zur Online-Streitbeilegung (OS) bereit: <https://ec.europa.eu/consumers/odr/>.  \n Unsere E-Mail-Adresse finden Sie oben im Impressum.\n\n## Verbraucher­streit­beilegung/Universal­schlichtungs­stelle\n\nWir sind nicht bereit oder verpflichtet, an Streitbeilegungsverfahren vor einer Verbraucherschlichtungsstelle teilzunehmen.\n\nQuelle: [eRecht24](https://www.e-recht24.de)\n\n# Datenschutz­erklärung\n\n## 1. Datenschutz auf einen Blick\n\n### Allgemeine Hinweise\n\nDie folgenden Hinweise geben einen einfachen Überblick darüber,\nwas mit Ihren personenbezogenen Daten passiert, wenn Sie diese Website besuchen. Personenbezogene Daten sind\nalle Daten, mit denen Sie persönlich identifiziert werden können. Ausführliche Informationen zum\nThema Datenschutz entnehmen Sie unserer unter diesem Text aufgeführten\nDatenschutzerklärung.\n\n### Datenerfassung auf dieser Website\n\n#### Wer ist verantwortlich für die Datenerfassung auf dieser Website?\n\nDie Datenverarbeitung auf dieser Website erfolgt durch den Websitebetreiber. Dessen\nKontaktdaten können Sie dem Abschnitt „Hinweis zur Verantwortlichen Stelle“ in dieser\nDatenschutzerklärung entnehmen.\n\n#### Wie erfassen wir Ihre Daten?\n\nIhre Daten werden zum\neinen dadurch erhoben, dass Sie uns diese mitteilen. Hierbei kann es sich z. B. um Daten handeln, die Sie in ein\nKontaktformular eingeben.\n\nAndere Daten werden automatisch oder nach Ihrer Einwilligung beim Besuch\nder Website durch unsere IT-Systeme erfasst. Das sind vor allem technische Daten (z. B. Internetbrowser,\nBetriebssystem oder Uhrzeit des Seitenaufrufs). Die Erfassung dieser Daten erfolgt automatisch, sobald Sie diese\nWebsite betreten.\n\n#### Wofür nutzen wir Ihre Daten?\n\nEin Teil der Daten wird erhoben, um eine\nfehlerfreie Bereitstellung der Website zu gewährleisten. Andere Daten können zur Analyse Ihres\nNutzerverhaltens verwendet werden. Sofern über die Website Verträge geschlossen oder angebahnt\nwerden können, werden die übermittelten Daten auch für Vertragsangebote, Bestellungen oder\nsonstige Auftragsanfragen verarbeitet.\n\n#### Welche Rechte haben Sie bezüglich Ihrer Daten?\n\nSie haben jederzeit das Recht, unentgeltlich Auskunft über Herkunft, Empfänger und Zweck Ihrer\ngespeicherten personenbezogenen Daten zu erhalten. Sie haben außerdem ein Recht, die Berichtigung oder\nLöschung dieser Daten zu verlangen. Wenn Sie eine Einwilligung zur Datenverarbeitung erteilt haben,\nkönnen Sie diese Einwilligung jederzeit für die Zukunft widerrufen. Außerdem haben Sie das Recht,\nunter bestimmten Umständen die Einschränkung der Verarbeitung Ihrer personenbezogenen Daten zu\nverlangen. Des Weiteren steht Ihnen ein Beschwerderecht bei der zuständigen Aufsichtsbehörde\nzu.\n\nHierzu sowie zu weiteren Fragen zum Thema Datenschutz können Sie sich jederzeit an uns\nwenden.\n\n## 2. Hosting\n\nWir hosten die Inhalte unserer Website bei folgendem Anbieter:\n\n### Strato\n\nAnbieter ist die Strato AG, Otto-Ostrowski-Straße 7, 10249 Berlin (nachfolgend\n„Strato“). Wenn Sie unsere Website besuchen, erfasst Strato verschiedene Logfiles inklusive Ihrer IP-\nAdressen.\n\nWeitere Informationen entnehmen Sie der Datenschutzerklärung von Strato: <https://www.strato.de/datenschutz/>.\n\nDie Verwendung von Strato erfolgt auf Grundlage\nvon Art. 6 Abs. 1 lit. f DSGVO. Wir haben ein berechtigtes Interesse an einer möglichst zuverlässigen\nDarstellung unserer Website. Sofern eine entsprechende Einwilligung abgefragt wurde, erfolgt die Verarbeitung\nausschließlich auf Grundlage von Art. 6 Abs. 1 lit. a DSGVO und § 25 Abs. 1 TDDDG, soweit die\nEinwilligung die Speicherung von Cookies oder den Zugriff auf Informationen im Endgerät des Nutzers\n(z. B. Device-Fingerprinting) im Sinne des TDDDG umfasst. Die Einwilligung ist jederzeit widerrufbar.\n\n## 3. Allgemeine Hinweise und Pflicht­informationen\n\n### Datenschutz\n\nDie Betreiber dieser Seiten nehmen den Schutz Ihrer persönlichen Daten sehr\nernst. Wir behandeln Ihre personenbezogenen Daten vertraulich und entsprechend den gesetzlichen\nDatenschutzvorschriften sowie dieser Datenschutzerklärung.\n\nWenn Sie diese Website benutzen,\nwerden verschiedene personenbezogene Daten erhoben. Personenbezogene Daten sind Daten, mit denen Sie\npersönlich identifiziert werden können. Die vorliegende Datenschutzerklärung erläutert,\nwelche Daten wir erheben und wofür wir sie nutzen. Sie erläutert auch, wie und zu welchem Zweck das\ngeschieht.\n\nWir weisen darauf hin, dass die Datenübertragung im Internet (z. B. bei der\nKommunikation per E-Mail) Sicherheitslücken aufweisen kann. Ein lückenloser Schutz der Daten vor\ndem Zugriff durch Dritte ist nicht möglich.\n\n### Hinweis zur verantwortlichen Stelle\n\nDie verantwortliche Stelle für die Datenverarbeitung auf\ndieser Website ist:\n\nFirma Markus Thumm Busfahrten  \nGottlieb-Daimler-Str. 25  \n71093 Weil im Schönbuch\n\nTelefon: 071578434  \n E-Mail: info[at]thumm-bus.de\n\nVerantwortliche Stelle ist die natürliche oder juristische Person, die allein oder gemeinsam mit anderen\nüber die Zwecke und Mittel der Verarbeitung von personenbezogenen Daten (z. B. Namen, E-Mail-\nAdressen o. Ä.) entscheidet.\n\n### Speicherdauer\n\nSoweit innerhalb dieser Datenschutzerklärung keine speziellere Speicherdauer\ngenannt wurde, verbleiben Ihre personenbezogenen Daten bei uns, bis der Zweck für die Datenverarbeitung\nentfällt. Wenn Sie ein berechtigtes Löschersuchen geltend machen oder eine Einwilligung zur\nDatenverarbeitung widerrufen, werden Ihre Daten gelöscht, sofern wir keine anderen rechtlich\nzulässigen Gründe für die Speicherung Ihrer personenbezogenen Daten haben (z. B. steuer-\noder handelsrechtliche Aufbewahrungsfristen); im letztgenannten Fall erfolgt die Löschung nach Fortfall\ndieser Gründe.\n\n### Allgemeine Hinweise zu den Rechtsgrundlagen der Datenverarbeitung auf dieser Website\n\nSofern Sie\nin die Datenverarbeitung eingewilligt haben, verarbeiten wir Ihre personenbezogenen Daten auf Grundlage von Art.\n6 Abs. 1 lit. a DSGVO bzw. Art. 9 Abs. 2 lit. a DSGVO, sofern besondere Datenkategorien nach Art. 9 Abs. 1 DSGVO\nverarbeitet werden. Im Falle einer ausdrücklichen Einwilligung in die Übertragung personenbezogener\nDaten in Drittstaaten erfolgt die Datenverarbeitung außerdem auf Grundlage von Art. 49 Abs. 1 lit. a DSGVO.\nSofern Sie in die Speicherung von Cookies oder in den Zugriff auf Informationen in Ihr Endgerät (z. B. via\nDevice-Fingerprinting) eingewilligt haben, erfolgt die Datenverarbeitung zusätzlich auf Grundlage von §\n25 Abs. 1 TDDDG. Die Einwilligung ist jederzeit widerrufbar. Sind Ihre Daten zur Vertragserfüllung oder zur\nDurchführung vorvertraglicher Maßnahmen erforderlich, verarbeiten wir Ihre Daten auf Grundlage des\nArt. 6 Abs. 1 lit. b DSGVO. Des Weiteren verarbeiten wir Ihre Daten, sofern diese zur Erfüllung einer\nrechtlichen Verpflichtung erforderlich sind auf Grundlage von Art. 6 Abs. 1 lit. c DSGVO. Die Datenverarbeitung\nkann ferner auf Grundlage unseres berechtigten Interesses nach Art. 6 Abs. 1 lit. f DSGVO erfolgen. Über die\njeweils im Einzelfall einschlägigen Rechtsgrundlagen wird in den folgenden Absätzen dieser\nDatenschutzerklärung informiert.\n\n### Empfänger von personenbezogenen Daten\n\nIm Rahmen unserer Geschäftstätigkeit\narbeiten wir mit verschiedenen externen Stellen zusammen. Dabei ist teilweise auch eine Übermittlung von\npersonenbezogenen Daten an diese externen Stellen erforderlich. Wir geben personenbezogene Daten nur dann an\nexterne Stellen weiter, wenn dies im Rahmen einer Vertragserfüllung erforderlich ist, wenn wir gesetzlich\nhierzu verpflichtet sind (z. B. Weitergabe von Daten an Steuerbehörden), wenn wir ein berechtigtes\nInteresse nach Art. 6 Abs. 1 lit. f DSGVO an der Weitergabe haben oder wenn eine sonstige Rechtsgrundlage die\nDatenweitergabe erlaubt. Beim Einsatz von Auftragsverarbeitern geben wir personenbezogene Daten unserer\nKunden nur auf Grundlage eines gültigen Vertrags über Auftragsverarbeitung weiter. Im Falle einer\ngemeinsamen Verarbeitung wird ein Vertrag über gemeinsame Verarbeitung geschlossen.\n\n### Widerruf Ihrer Einwilligung zur Datenverarbeitung\n\nViele Datenverarbeitungsvorgänge sind\nnur mit Ihrer ausdrücklichen Einwilligung möglich. Sie können eine bereits erteilte Einwilligung\njederzeit widerrufen. Die Rechtmäßigkeit der bis zum Widerruf erfolgten Datenverarbeitung bleibt vom\nWiderruf unberührt.\n\n### Widerspruchsrecht gegen die Datenerhebung in besonderen Fällen sowie gegen Direktwerbung (Art. 21 DSGVO)\n\nWENN DIE DATENVERARBEITUNG AUF GRUNDLAGE VON ART. 6 ABS. 1 LIT. E ODER F\nDSGVO ERFOLGT, HABEN SIE JEDERZEIT DAS RECHT, AUS GRÜNDEN, DIE SICH AUS IHRER\nBESONDEREN SITUATION ERGEBEN, GEGEN DIE VERARBEITUNG IHRER PERSONENBEZOGENEN DATEN\nWIDERSPRUCH EINZULEGEN; DIES GILT AUCH FÜR EIN AUF DIESE BESTIMMUNGEN GESTÜTZTES\nPROFILING. DIE JEWEILIGE RECHTSGRUNDLAGE, AUF DENEN EINE VERARBEITUNG BERUHT, ENTNEHMEN\nSIE DIESER DATENSCHUTZERKLÄRUNG. WENN SIE WIDERSPRUCH EINLEGEN, WERDEN WIR IHRE\nBETROFFENEN PERSONENBEZOGENEN DATEN NICHT MEHR VERARBEITEN, ES SEI DENN, WIR\nKÖNNEN ZWINGENDE SCHUTZWÜRDIGE GRÜNDE FÜR DIE VERARBEITUNG\nNACHWEISEN, DIE IHRE INTERESSEN, RECHTE UND FREIHEITEN ÜBERWIEGEN ODER DIE\nVERARBEITUNG DIENT DER GELTENDMACHUNG, AUSÜBUNG ODER VERTEIDIGUNG VON\nRECHTSANSPRÜCHEN (WIDERSPRUCH NACH ART. 21 ABS. 1 DSGVO).\n\nWERDEN IHRE\nPERSONENBEZOGENEN DATEN VERARBEITET, UM DIREKTWERBUNG ZU BETREIBEN, SO HABEN SIE DAS\nRECHT, JEDERZEIT WIDERSPRUCH GEGEN DIE VERARBEITUNG SIE BETREFFENDER PERSONENBEZOGENER\nDATEN ZUM ZWECKE DERARTIGER WERBUNG EINZULEGEN; DIES GILT AUCH FÜR DAS PROFILING,\nSOWEIT ES MIT SOLCHER DIREKTWERBUNG IN VERBINDUNG STEHT. WENN SIE WIDERSPRECHEN,\nWERDEN IHRE PERSONENBEZOGENEN DATEN ANSCHLIESSEND NICHT MEHR ZUM ZWECKE DER\nDIREKTWERBUNG VERWENDET (WIDERSPRUCH NACH ART. 21 ABS. 2 DSGVO).\n\n### Beschwerde­recht bei der zuständigen Aufsichts­behörde\n\nIm Falle von\nVerstößen gegen die DSGVO steht den Betroffenen ein Beschwerderecht bei einer\nAufsichtsbehörde, insbesondere in dem Mitgliedstaat ihres gewöhnlichen Aufenthalts, ihres\nArbeitsplatzes oder des Orts des mutmaßlichen Verstoßes zu. Das Beschwerderecht besteht\nunbeschadet anderweitiger verwaltungsrechtlicher oder gerichtlicher Rechtsbehelfe.\n\n### Recht auf Daten­übertrag­barkeit\n\nSie haben das Recht, Daten, die wir auf Grundlage\nIhrer Einwilligung oder in Erfüllung eines Vertrags automatisiert verarbeiten, an sich oder an einen Dritten in\neinem gängigen, maschinenlesbaren Format aushändigen zu lassen. Sofern Sie die direkte\nÜbertragung der Daten an einen anderen Verantwortlichen verlangen, erfolgt dies nur, soweit es technisch\nmachbar ist.\n\n### Auskunft, Berichtigung und Löschung\n\nSie haben im Rahmen der geltenden gesetzlichen\nBestimmungen jederzeit das Recht auf unentgeltliche Auskunft über Ihre gespeicherten personenbezogenen\nDaten, deren Herkunft und Empfänger und den Zweck der Datenverarbeitung und ggf. ein Recht auf\nBerichtigung oder Löschung dieser Daten. Hierzu sowie zu weiteren Fragen zum Thema personenbezogene\nDaten können Sie sich jederzeit an uns wenden.\n\n### Recht auf Einschränkung der Verarbeitung\n\nSie haben das Recht, die Einschränkung der\nVerarbeitung Ihrer personenbezogenen Daten zu verlangen. Hierzu können Sie sich jederzeit an uns wenden.\nDas Recht auf Einschränkung der Verarbeitung besteht in folgenden Fällen:\n\n* Wenn Sie die  \n  Richtigkeit Ihrer bei uns gespeicherten personenbezogenen Daten bestreiten, benötigen wir in der Regel Zeit,  \n  um dies zu überprüfen. Für die Dauer der Prüfung haben Sie das Recht, die  \n  Einschränkung der Verarbeitung Ihrer personenbezogenen Daten zu verlangen.\n* Wenn die  \n  Verarbeitung Ihrer personenbezogenen Daten unrechtmäßig geschah/geschieht, können Sie statt  \n  der Löschung die Einschränkung der Datenverarbeitung verlangen.\n* Wenn wir Ihre  \n  personenbezogenen Daten nicht mehr benötigen, Sie sie jedoch zur Ausübung, Verteidigung oder  \n  Geltendmachung von Rechtsansprüchen benötigen, haben Sie das Recht, statt der Löschung die  \n  Einschränkung der Verarbeitung Ihrer personenbezogenen Daten zu verlangen.\n* Wenn Sie einen  \n  Widerspruch nach Art. 21 Abs. 1 DSGVO eingelegt haben, muss eine Abwägung zwischen Ihren und unseren  \n  Interessen vorgenommen werden. Solange noch nicht feststeht, wessen Interessen überwiegen, haben Sie das  \n  Recht, die Einschränkung der Verarbeitung Ihrer personenbezogenen Daten zu verlangen.\n\nWenn Sie die Verarbeitung Ihrer personenbezogenen Daten eingeschränkt haben, dürfen diese\nDaten – von ihrer Speicherung abgesehen – nur mit Ihrer Einwilligung oder zur Geltendmachung,\nAusübung oder Verteidigung von Rechtsansprüchen oder zum Schutz der Rechte einer anderen\nnatürlichen oder juristischen Person oder aus Gründen eines wichtigen öffentlichen Interesses der\nEuropäischen Union oder eines Mitgliedstaats verarbeitet werden.\n\n### SSL- bzw. TLS-Verschlüsselung\n\nDiese Seite nutzt aus Sicherheitsgründen und zum Schutz\nder Übertragung vertraulicher Inhalte, wie zum Beispiel Bestellungen oder Anfragen, die Sie an uns als\nSeitenbetreiber senden, eine SSL- bzw. TLS-Verschlüsselung. Eine verschlüsselte Verbindung erkennen\nSie daran, dass die Adresszeile des Browsers von „http://“ auf „https://“ wechselt und\nan dem Schloss-Symbol in Ihrer Browserzeile.\n\nWenn die SSL- bzw. TLS-Verschlüsselung aktiviert ist,\nkönnen die Daten, die Sie an uns übermitteln, nicht von Dritten mitgelesen werden.\n\n## 4. Datenerfassung auf dieser Website\n\n### Cookies\n\nUnsere Internetseiten verwenden so genannte „Cookies“. Cookies sind kleine\nDatenpakete und richten auf Ihrem Endgerät keinen Schaden an. Sie werden entweder vorübergehend\nfür die Dauer einer Sitzung (Session-Cookies) oder dauerhaft (permanente Cookies) auf Ihrem Endgerät\ngespeichert. Session-Cookies werden nach Ende Ihres Besuchs automatisch gelöscht. Permanente Cookies\nbleiben auf Ihrem Endgerät gespeichert, bis Sie diese selbst löschen oder eine automatische\nLöschung durch Ihren Webbrowser erfolgt.\n\nCookies können von uns (First-Party-Cookies) oder\nvon Drittunternehmen stammen (sog. Third-Party-Cookies). Third-Party-Cookies ermöglichen die Einbindung\nbestimmter Dienstleistungen von Drittunternehmen innerhalb von Webseiten (z. B. Cookies zur Abwicklung\nvon Zahlungsdienstleistungen).\n\nCookies haben verschiedene Funktionen. Zahlreiche Cookies sind technisch\nnotwendig, da bestimmte Webseitenfunktionen ohne diese nicht funktionieren würden (z. B. die\nWarenkorbfunktion oder die Anzeige von Videos). Andere Cookies können zur Auswertung des\nNutzerverhaltens oder zu Werbezwecken verwendet werden.\n\nCookies, die zur Durchführung des\nelektronischen Kommunikationsvorgangs, zur Bereitstellung bestimmter, von Ihnen erwünschter Funktionen\n(z. B. für die Warenkorbfunktion) oder zur Optimierung der Website (z. B. Cookies zur Messung\ndes Webpublikums) erforderlich sind (notwendige Cookies), werden auf Grundlage von Art. 6 Abs. 1 lit. f DSGVO\ngespeichert, sofern keine andere Rechtsgrundlage angegeben wird. Der Websitebetreiber hat ein berechtigtes\nInteresse an der Speicherung von notwendigen Cookies zur technisch fehlerfreien und optimierten Bereitstellung\nseiner Dienste. Sofern eine Einwilligung zur Speicherung von Cookies und vergleichbaren\nWiedererkennungstechnologien abgefragt wurde, erfolgt die Verarbeitung ausschließlich auf Grundlage dieser\nEinwilligung (Art. 6 Abs. 1 lit. a DSGVO und § 25 Abs. 1 TDDDG); die Einwilligung ist jederzeit widerrufbar.\n\nSie können Ihren Browser so einstellen, dass Sie über das Setzen von Cookies informiert werden und\nCookies nur im Einzelfall erlauben, die Annahme von Cookies für bestimmte Fälle oder generell\nausschließen sowie das automatische Löschen der Cookies beim Schließen des Browsers aktivieren.\nBei der Deaktivierung von Cookies kann die Funktionalität dieser Website eingeschränkt sein.\n\nWelche Cookies und Dienste auf dieser Website eingesetzt werden, können Sie dieser\nDatenschutzerklärung entnehmen.\n\n### Kontaktformular\n\nWenn Sie uns per Kontaktformular Anfragen zukommen lassen, werden Ihre\nAngaben aus dem Anfrageformular inklusive der von Ihnen dort angegebenen Kontaktdaten zwecks Bearbeitung\nder Anfrage und für den Fall von Anschlussfragen bei uns gespeichert. Diese Daten geben wir nicht ohne Ihre\nEinwilligung weiter.\n\nDie Verarbeitung dieser Daten erfolgt auf Grundlage von Art. 6 Abs. 1 lit. b DSGVO,\nsofern Ihre Anfrage mit der Erfüllung eines Vertrags zusammenhängt oder zur Durchführung\nvorvertraglicher Maßnahmen erforderlich ist. In allen übrigen Fällen beruht die Verarbeitung auf\nunserem berechtigten Interesse an der effektiven Bearbeitung der an uns gerichteten Anfragen (Art. 6 Abs. 1 lit. f\nDSGVO) oder auf Ihrer Einwilligung (Art. 6 Abs. 1 lit. a DSGVO) sofern diese abgefragt wurde; die Einwilligung ist\njederzeit widerrufbar.\n\nDie von Ihnen im Kontaktformular eingegebenen Daten verbleiben bei uns, bis Sie\nuns zur Löschung auffordern, Ihre Einwilligung zur Speicherung widerrufen oder der Zweck für die\nDatenspeicherung entfällt (z. B. nach abgeschlossener Bearbeitung Ihrer Anfrage). Zwingende\ngesetzliche Bestimmungen – insbesondere Aufbewahrungsfristen – bleiben unberührt.\n\nQuelle: <https://www.e-recht24.de>\n\n© 2025 Thumm Busfahrten. Created with ❤ using WordPress and [Kubio](https://kubiobuilder.com)"
}