{
  "timestamp": "20250722_103259",
  "processing_info": {
    "date": "2025-07-22",
    "time": "10:33:12",
    "timezone": "WEST"
  },
  "url": "https://www.hellermann.reisen",
  "imprint_url": "https://www.hellermann.reisen/impressum",
  "imprint_data": {
    "company_name": "Hellermann Reisen GmbH",
    "managing_directors": [
      "Ulrich Hellermann",
      "Ulrike Hellermann"
    ],
    "business_address": {
      "street": "Alfred-Nägele-Str. 50",
      "city": "Bruchsal",
      "postal_code": "76646",
      "country": "Germany"
    },
    "phone_numbers": [
      "+49 7257 9254830",
      "+49 176 19450923"
    ],
    "email_addresses": [
      "info@hellermann.reisen",
      "anfragen@hellermann.reisen"
    ],
    "website_url": "https://www.hellermann.reisen",
    "registration_details": {
      "trade_register": "HR MA",
      "registration_number": "340386",
      "court": "Amtsgericht Mannheim"
    },
    "vat_id": "DE 219558650",
    "tax_id": "44077/19203",
    "professional_liability_insurance": null,
    "other_legal_info": {
      "supervisory_authority": "Regierungspräsidium Karlsruhe"
    }
  },
  "markdown_content": "Impressum\n\n\n\n  \n\n \n\n\n![](https://www.facebook.com/tr?id=831310928651739&ev=PageView&noscript=1)\n\n\n\n\n* [Home](/)\n* [Über uns](/überuns)\n* [Kontakt](/kontakt)\n* [Bus Anmietung](/bus-anmietung)\n\n[![](https://le-cdn.website-editor.net/s/8af32093579c4165bb42b69834ea041c/dms3rep/multi/opt/Logo+freigestellt+%28002%29-1920w.png?Expires=1755522796&Signature=ZbKLiU5AhxJ-2RcO0bv1KcNrvneg5wVCC1EYHevUWArVSyXJQtFL4oaYccHpyMcJNnfH~dXO2ZUCF8fb2hNeV3eYlto7dP0Au1IS7fhbvdO9hOXo9dEFhekgD6rnJTCGoavoZU3V5Uqqr1dZDIvE0yndQXb2D0Z1RD9ZUr4dXGfKzRSGpzGeo5ae~uHR8YNKUHwEMaZvKYnhot-nPmLQ9V5Z7t~8u-dhXuVBYrbBzjmRm~0J18vEbAxhVRMU4siwErPXAx1xY6VN5LV97fn8IOvk8WAUc3fTy-qhZj-fYJHTK7JYIs3~kZecPzBXJc-noAsZnA~esemklK660MSboA__&Key-Pair-Id=K2NXBXLF010TJW)](/home)\n\n* [Reiseangebote 2025](/reiseprogramm)\n  + [Reisekatalog\\_2025](/reisekatalog-2025-pdf)\n  + [Tagesfahrten 2025](/tagesfahrten)\n  + [Mehrtagesreisen 2025](/urlaubsreisen)\n  + [Musicals & Shows](/Musicals-Shows-Festspiele)\n* [Wichtige Informationen](/wichtige-Reiseinformationen)\n* [Reisegutschein](/reisegutschein)\n [Rufen Sie uns an](tel:+49 7257 9254830)\n\n---\n\nImpressum\n\n---\n\n# Impressum\n\n### Verantwortlich:\n\nHellermann Reisen GmbH\n\nGF Ulrich u. Ulrike Hellermann\n\nAlfred-Nägele-Str. 50\n\n76646 Bruchsal\n\n### Kontakt:\n\n### Unser Büro: BR-Büchenau,  Alfred-Nägele-Str. 50\n\n### Abfahrtsort der Busse: BR-Büchenau, Zum Heckgraben 27\n\nHellermann Reisen GmbH  \n Telefon:  +49 (0) 7257.925 48 30  \nTelefax:  +49 (0) 7257.925 48 31\n\nMobil:     +49 (o) 176 194 50 923\n\nE-Mail:    info@hellermann.reisen\n\nWebsite: www.hellermann.reisen\n\n### Registereintrag:\n\nRegistergericht:    Amtsgericht Mannheim  \nRegisternummer: HR MA 340386\n\n### Umsatzsteuer-ID:\n\nUSt. DE 219558650\n\n### Wirtschafts-Identifikationsnummer:\n\nSt. Nr. 44077/19203\n\n### Aufsichtsbehörde:\n\nRegierungspräsidium Karlsruhe\n\nRufen Sie uns an: +49 (0)7257 - 92 54 83-0 oder\n\nschreiben Sie uns eine E-Mail an: info@hellermann.reisen\n\nAbonnieren Sie unseren Newsletter!\n\n [Newsletter](mailto:anfragen@hellermann.reisen)\n\nCopyright ©  Hellermann Reisen GmbH 2022 Alle Rechte vorbehalten.\n\n[Datenschutzerklärung](/datenschutz)\n\n[Reisebedingungen](/Reisebedingungen)\n\n[Impressum](/impressum)\n\n\n\n\n\n\n\n\n\n\n\n\n\n\n\n\n\n\n\n\n\nShare by:"
}