{
  "timestamp": "20250722_102656",
  "processing_info": {
    "date": "2025-07-22",
    "time": "10:27:09",
    "timezone": "WEST"
  },
  "url": "https://www.rufbus-zollernalb.de",
  "imprint_url": "https://www.rufbus-zollernalb.de/impressum.html",
  "imprint_data": {
    "company_name": "Landratsamt Zollernalbkreis",
    "managing_directors": [
      "Günther-Martin Pauli MdL"
    ],
    "business_address": {
      "street": "Hirschbergstr. 29",
      "city": "Balingen",
      "postal_code": "72336",
      "country": "Germany"
    },
    "phone_numbers": [
      "+49 74 33 / 92 - 01",
      "07471 / 93 50 50"
    ],
    "email_addresses": [
      "post@zollernalbkreis.de"
    ],
    "website_url": "http://www.zollernalbkreis.de/",
    "registration_details": {
      "trade_register": null,
      "registration_number": null,
      "court": null
    },
    "vat_id": "DE144851104",
    "tax_id": null,
    "professional_liability_insurance": null,
    "other_legal_info": {
      "legal_form": "Körperschaft des Öffentlichen Rechts",
      "fax_number": "+49 74 33 / 92 - 16 66"
    }
  },
  "markdown_content": "Impressum - RufBUS Zollernalb\n\n\n\n![](files/cto/img-layout/logo-rufbus.png)\n\n\n[Navigation überspringen](impressum.html#skipNavigation109)\n\n* [Startseite](startseite.html \"Startseite\")\n* [Fahrpläne & Preise](fahrplaene.html \"Fahrpläne & Preise\")\n  + [Fahrplanauskunft](fahrplaene.html \"Fahrplanauskunft\")\n  + [Preise](preise.html \"Preise vom Nachtschwärmer - dem Nachtbus im Raum Hechingen\")\n* [Service](fundbuero.html \"Service\")\n  + [Fundbüro](fundbuero.html \"Fundbüro\")\n  + [Häufige Fragen](haeufige-fragen.html \"Häufige Fragen\")\n  + [Fahrgastrechte](fahrgastrechte.html \"Fahrgastrechte\")\n  + [Kontakt](kontakt.html \"Kontakt\")\n\n\n\n\nZielseite\n\nNavigation\nStartseite\nFahrpläne & Preise\n   Fahrplanauskunft\n   Preise\nService\n   Fundbüro\n   Häufige Fragen\n   Fahrgastrechte\n   Kontakt\n\n![](files/cto/img-layout/anrufen-mitfahren-rufbus.png)\n\n[Tel. 07471 / 93 50 50](tel:+497471935050)\n\n[![Bestellung auch per App \"bwrider\" möglich.](assets/images/d/Rufbus-button-app-3f24237d.png)](files/cto/img-layout/Rufbus-button-app.png)\n\n# Impressum / Rechtliches\n\n**Landratsamt Zollernalbkreis**  \nHirschbergstr. 29  \n72336 Balingen  \nTelefon: +49 74 33 / 92 - 01  \nTelefax +49 74 33 / 92 - 16 66  \ne-Mail: [post@zollernalbkreis.de](mailto:post@zollernalbkreis.de \"Öffnet in neuem Fenster\")  \nInternet: [www.zollernalbkreis.de](http://www.zollernalbkreis.de/)  \n  \nDas Landratsamt Zollernalbkreis ist eine Körperschaft des Öffentlichen Rechts. Sie wird vertreten durch den Landrat Günther-Martin Pauli MdL.  \nUmsatzsteuer-Identifikationsnummer: DE144851104  \n(gemäß § 27 Umsatzsteuergesetz)  \n  \n**Haftungsausschluss:**\n\nDiese Webseite und ihr Inhalt werden ohne Haftung und Gewähr zur Verfügung gestellt. Trotz sorgfältiger inhaltlicher Kontrolle übernehmen wir keine Haftung für die Inhalte externer Links. Für den Inhalt der verlinkten Seiten sind ausschließlich deren Betreiber verantwortlich.\n\n**Fotonachweise:**\n\nFotomotive Header:   \nistock.com - ©filadendron, ©pixelfit, ©izusek\n\n**Schutzwürdige Daten:**\n\nVon der Versendung von E-Mails mit schutzwürdigem Inhalt bitten wir Abstand zu nehmen. Es ist nicht sichergestellt, dass Unbefugte Kenntnis vom Inhalt erlangen oder die Nachricht verfälschen.  \n  \nDie Übermittlung von elektronischen Dokumenten an das Landratsamt Zollernalbkreis ist nur unter folgenden Voraussetzungen zulässig:  \nZugänge im Sinne dieser Zugangseröffnung sind die auf der Seite \"Kontakte\" publizierten eMail-Adressen.  \n  \n**Rechtserhebliche Anträge und Erklärungen via elektronische Post:**\n\nDer Landkreis Zollernalb bietet Möglichkeiten zur elektronischen Kommunikation an. Für den Bereich der Verwaltungsverfahren richtet sich die elektronische Kommunikation nach § 3a des Verwaltungsverfahrensgesetz.  \nDanach ist die Übermittlung elektronischer Dokumente zulässig, soweit der Empfänger hierfür einen Zugang eröffnet hat. Außerdem wird die elektronische Post (E-Mail) in Verbindung mit der qualifizierten elektronischen Signatur der Schriftform (das bedeutet der persönlichen Unterschrift) gleichgestellt.  \n  \nFür die elektronische Kommunikation per E-Mail, können Sie über folgenden Link Nachrichten an uns senden:  \n  \n[Virtuelle Poststelle Landratsamt Zollernalbkreis](http://www.zollernalbkreis.de/,Lde/97911.html)  \n  \nDarüber hinaus finden Sie in unserem Internetangebot weitere E-Mail-Adressen einzelner Dienststellen oder Personen, an die Sie ebenfalls E-Mails senden können, sofern hier keine technischen Besonderheiten wie Signatur oder Verschlüsselung verwendet werden.\n\n**Datenschutzerklärung**\n\nDie Nutzung unserer Webseite ist in der Regel ohne Angabe personenbezogener Daten möglich. Soweit auf unseren Seiten personenbezogene Daten (beispielsweise Name, Anschrift oder eMail-Adressen) erhoben werden, erfolgt dies, soweit möglich, stets auf freiwilliger Basis. Diese Daten werden ohne Ihre ausdrückliche Zustimmung nicht an Dritte weitergegeben.\n\nWir weisen darauf hin, dass die Datenübertragung im Internet (z.B. bei der Kommunikation per E-Mail) Sicherheitslücken aufweisen kann. Ein lückenloser Schutz der Daten vor dem Zugriff durch Dritte ist nicht möglich.\n\nDer Nutzung von im Rahmen der Impressumspflicht veröffentlichten Kontaktdaten durch Dritte zur Übersendung von nicht ausdrücklich angeforderter Werbung und Informationsmaterialien wird hiermit ausdrücklich widersprochen. Die Betreiber der Seiten behalten sich ausdrücklich rechtliche Schritte im Falle der unverlangten Zusendung von Werbeinformationen, etwa durch Spam-Mails, vor.\n\n**Datenschutzerklärung für die Nutzung von Google +1**\n\n*Erfassung und Weitergabe von Informationen:*  \nMithilfe der Google +1-Schaltfläche können Sie Informationen weltweit veröffentlichen. Über die Google +1-Schaltfläche erhalten Sie und andere Nutzer personalisierte Inhalte von Google und unseren Partnern. Google speichert sowohl die Information, dass Sie für einen Inhalt +1 gegeben haben, als auch Informationen über die Seite, die Sie beim Klicken auf +1 angesehen haben. Ihre +1 können als Hinweise zusammen mit Ihrem Profilnamen und Ihrem Foto in Google-Diensten, wie etwa in Suchergebnissen oder in Ihrem Google-Profil, oder an anderen Stellen auf Websites und Anzeigen im Internet eingeblendet werden.  \nGoogle zeichnet Informationen über Ihre +1-Aktivitäten auf, um die Google-Dienste für Sie und andere zu verbessern. Um die Google +1-Schaltfläche verwenden zu können, benötigen Sie ein weltweit sichtbares, öffentliches Google-Profil, das zumindest den für das Profil gewählten Namen enthalten muss. Dieser Name wird in allen Google-Diensten verwendet. In manchen Fällen kann dieser Name auch einen anderen Namen ersetzen, den Sie beim Teilen von Inhalten über Ihr Google-Konto verwendet haben. Die Identität Ihres Google-Profils kann Nutzern angezeigt werden, die Ihre E-Mail-Adresse kennen oder über andere identifizierende Informationen von Ihnen verfügen.\n\n*Verwendung der erfassten Informationen:*  \nNeben den oben erläuterten Verwendungszwecken werden die von Ihnen bereitgestellten Informationen gemäß den geltenden Google-Datenschutzbestimmungen genutzt. Google veröffentlicht möglicherweise zusammengefasste Statistiken über die +1-Aktivitäten der Nutzer bzw. gibt diese an Nutzer und Partner weiter, wie etwa Publisher, Inserenten oder verbundene Websites.\n\n**Auskunft, Löschung, Sperrung**\n\nSie haben jederzeit das Recht auf unentgeltliche Auskunft über Ihre gespeicherten personenbezogenen Daten, deren Herkunft und Empfänger und den Zweck der Datenverarbeitung sowie ein Recht auf Berichtigung, Sperrung oder Löschung dieser Daten. Hierzu sowie zu weiteren Fragen zum Thema personenbezogene Daten können Sie sich jederzeit über die im Impressum angegeben Adresse des Webseitenbetreibers an uns wenden.\n\n**Cookies**\n\nDie Internetseiten verwenden teilweise so genannte Cookies. Cookies richten auf Ihrem Rechner keinen Schaden an und enthalten keine Viren. Cookies dienen dazu, unser Angebot nutzerfreundlicher, effektiver und sicherer zu machen. Cookies sind kleine Textdateien, die auf Ihrem Rechner abgelegt werden und die Ihr Browser speichert.\n\nDie meisten der von uns verwendeten Cookies sind so genannte „Session-Cookies“. Sie werden nach Ende Ihres Besuchs automatisch gelöscht. Andere Cookies bleiben auf Ihrem Endgerät gespeichert, bis Sie diese löschen. Diese Cookies ermöglichen es uns, Ihren Browser beim nächsten Besuch wiederzuerkennen.\n\nSie können Ihren Browser so einstellen, dass Sie über das Setzen von Cookies informiert werden und Cookies nur im Einzelfall erlauben, die Annahme von Cookies für bestimmte Fälle oder generell ausschließen sowie das automatische Löschen der Cookies beim Schließen des Browser aktivieren. Bei der Deaktivierung von Cookies kann die Funktionalität dieser Website eingeschränkt sein.\n\n**Übermitteln von Daten**\n\nWir übermitteln personenbezogene Daten an Dritte nur dann, wenn dies im Rahmen der Vertragsabwicklung notwendig ist. Eine weitergehende Übermittlung der Daten erfolgt nicht. Eine Weitergabe Ihrer Daten an Dritte ohne ausdrückliche Einwilligung etwa zu Zwecken der Werbung erfolgt nicht.\n\n[nach oben](impressum.html#top)\n\n[Impressum](impressum.html)\n\n[Datenschutz](datenschutz.html)\n\n### [Tel.: 07471 / 93 50 50](tel:+497471935050 \"jetzt anrufen\")\n\n[Zum NACHTSCHWÄRMER](start-nachtschwaermer.html)\n\n\n\n\n\n\n\n\n\n\n\n\n\n\n\n\n\nDiese Webseite verwendet Cookies. Mit dem Besuch dieser Webseite, stimmen Sie der Nutzung von Cookies zu\n[Mehr dazu](datenschutz.html \"Mehr dazu\")\n\nOk, verstanden"
}