{
  "timestamp": "20250722_102722",
  "processing_info": {
    "date": "2025-07-22",
    "time": "10:27:35",
    "timezone": "WEST"
  },
  "url": "http://www.hutter-reisen.de",
  "imprint_url": "http://www.hutter-reisen.de/impressum.php",
  "imprint_data": {
    "company_name": "Hutter Reisen GmbH",
    "managing_directors": [
      "Thomas Hutter"
    ],
    "business_address": {
      "street": "Im Herrach 7",
      "city": "Leutkirch",
      "postal_code": "88299",
      "country": "Germany"
    },
    "phone_numbers": [
      "+49 (0) 7561/ 98 000"
    ],
    "email_addresses": [
      "info@hutter-reisen.de"
    ],
    "website_url": "https://www.hutter-reisen.de",
    "registration_details": {
      "trade_register": "Handelsregister",
      "registration_number": "HRB 144-L",
      "court": "Ravensburg"
    },
    "vat_id": "DE812038120",
    "tax_id": null,
    "professional_liability_insurance": null,
    "other_legal_info": {
      "responsible_for_content_according_to_RStV_55_2": "Thomas Hutter"
    }
  },
  "markdown_content": "Impressum - - Reisen ab Leutkirch\n\n* [Startseite](/)\n* [Reiseprogramm](/reise/)\n* [Gruppen- & Vereinsreisen](/reise/gruppenreise.php)\n* [über Hutter](/hutter/index.php)\n  + [Unsere Mitarbeiter](/hutter/mitarbeiter.php)\n  + [Firmengeschichte](/hutter/index.php)\n  + [Stellenangebote](/hutter/stellenangebote.php)\n* [Service & Kontakt](/kontakt.php)\n  + [Fahrpläne im Linienverkehr](/linienverkehr/index.php)\n  + [Reiseinformationen](/reiseinfo/index.php)\n  + [Reisebedingungen](/reiseinfo/reisebedingungen.php)\n  + [Katalog anfordern](/kontakt.php)\n  + [Büro und Anfahrt](/hutter/anfahrt.php)\n  + [Kontakt](/kontakt.php)\n  + [Impressum](/impressum.php)\n  + [Datenschutz](/datenschutz.php)\n\n![](/media/image/reisecms/Menschen/Paare/junges_paar_plant_den_urlaub_-_Foto_contrastwerkstattFotolia_49938117.jpg?crop=960:350)\n![](/media/image/reisecms/Menschen/Paare/junges_paar_plant_den_urlaub_-_Foto_contrastwerkstattFotolia_49938117.jpg?crop=960:350)\n\n##\n\n[![](/includes/img/ia_facebook.png)](http://www.facebook.com/sharer/sharer.php?t=Impressum&u=http://www.hutter-reisen.de/impressum.php \"Link auf Facebook teilen\")\n[![](/includes/img/ia_mail.png)](/microsites/send_link.php?link=http://www.hutter-reisen.de/impressum.php&title=SW1wcmVzc3Vt \"Link an Freund senden\")\n[![](/includes/img/ia_anruf.png)](/microsites/rueckrufservice.php \"Rückruf anfordern\")\n\n[![Logo Hutter](/includes/img/logo_hutter.png)](/ \"Hutter Reisen Startseite\")[![Telefon Hutter Reisen](/includes/img/tel_hutter.png)](tel:+49756198000)\n\n# Impressum\n\n## Bürozeiten\n\nMontag - Freitag:                    09.00 - 12.00 Uhr  \nDienstag und Donnerstag:      14.00 - 17.00 Uhr  \n**Montag, Mittwoch und Freitag nachmittag geschlossen**\n\n## Hausanschrift und Sitz der Firma\n\n**Hutter Reisen GmbH**  \nIm Herrach 7  \n88299 Leutkirch\n\n**Geschäftsführer**  \nThomas Hutter\n\n|  |  |\n| --- | --- |\n| Telefon: | +49 (0) 7561/ 98 000 |\n|  |  |\n| E-Mail: | [info@hutter-reisen.de](mailto:info@hutter-reisen.de) |\n\nUst.-IDNr.: DE812038120  \nEingetragen im Handelsregister Ravensburg HRB 144-L\n\n**Bankverbindungen**  \nLeutkircher Bank      IBAN :DE60650910400020356005  \n                            BIC:  GENODES1LEU\n\n## Verantwortlich für den Inhalt nach § 55 Abs. 2 RStV:\n\nThomas Hutter\n\n## Haftungsausschluss:\n\n**Haftung für Inhalte**\n\nDie Inhalte unserer Seiten wurden mit größter Sorgfalt erstellt. Für die Richtigkeit, Vollständigkeit und Aktualität der Inhalte können wir jedoch keine Gewähr übernehmen. Als Diensteanbieter sind wir gemäß § 7 Abs.1 TMG für eigene Inhalte auf diesen Seiten nach den allgemeinen Gesetzen verantwortlich. Nach §§ 8 bis 10 TMG sind wir als Diensteanbieter jedoch nicht verpflichtet, übermittelte oder gespeicherte fremde Informationen zu überwachen oder nach Umständen zu forschen, die auf eine rechtswidrige Tätigkeit hinweisen. Verpflichtungen zur Entfernung oder Sperrung der Nutzung von Informationen nach den allgemeinen Gesetzen bleiben hiervon unberührt. Eine diesbezügliche Haftung ist jedoch erst ab dem Zeitpunkt der Kenntnis einer konkreten Rechtsverletzung möglich. Bei Bekanntwerden von entsprechenden Rechtsverletzungen werden wir diese Inhalte umgehend entfernen.\n\n**Haftung für Links**\n\nUnser Angebot enthält Links zu externen Webseiten Dritter, auf deren Inhalte wir keinen Einfluss haben. Deshalb können wir für diese fremden Inhalte auch keine Gewähr übernehmen. Für die Inhalte der verlinkten Seiten ist stets der jeweilige Anbieter oder Betreiber der Seiten verantwortlich. Die verlinkten Seiten wurden zum Zeitpunkt der Verlinkung auf mögliche Rechtsverstöße überprüft. Rechtswidrige Inhalte waren zum Zeitpunkt der Verlinkung nicht erkennbar. Eine permanente inhaltliche Kontrolle der verlinkten Seiten ist jedoch ohne konkrete Anhaltspunkte einer Rechtsverletzung nicht zumutbar. Bei Bekanntwerden von Rechtsverletzungen werden wir derartige Links umgehend entfernen.\n\n**Urheberrecht**\n\nDie durch die Seitenbetreiber erstellten Inhalte und Werke auf diesen Seiten unterliegen dem deutschen Urheberrecht. Die Vervielfältigung, Bearbeitung, Verbreitung und jede Art der Verwertung außerhalb der Grenzen des Urheberrechtes bedürfen der schriftlichen Zustimmung des jeweiligen Autors bzw. Erstellers. Downloads und Kopien dieser Seite sind nur für den privaten, nicht kommerziellen Gebrauch gestattet. Soweit die Inhalte auf dieser Seite nicht vom Betreiber erstellt wurden, werden die Urheberrechte Dritter beachtet. Insbesondere werden Inhalte Dritter als solche gekennzeichnet. Sollten Sie trotzdem auf eine Urheberrechtsverletzung aufmerksam werden, bitten wir um einen entsprechenden Hinweis. Bei Bekanntwerden von Rechtsverletzungen werden wir derartige Inhalte umgehend entfernen.\n\n**Datenschutz**\n\nDie Nutzung unserer Webseite ist in der Regel ohne Angabe personenbezogener Daten möglich. Soweit auf unseren Seiten personenbezogene Daten (beispielsweise Name, Anschrift oder eMail-Adressen) erhoben werden, erfolgt dies, soweit möglich, stets auf freiwilliger Basis. Diese Daten werden ohne Ihre ausdrückliche Zustimmung nicht an Dritte weitergegeben.\n\nWir weisen darauf hin, dass die Datenübertragung im Internet (z.B. bei der Kommunikation per E-Mail) Sicherheitslücken aufweisen kann. Ein lückenloser Schutz der Daten vor dem Zugriff durch Dritte ist nicht möglich.\n\nDer Nutzung von im Rahmen der Impressumspflicht veröffentlichten Kontaktdaten durch Dritte zur Übersendung von nicht ausdrücklich angeforderter Werbung und Informationsmaterialien wird hiermit ausdrücklich widersprochen. Die Betreiber der Seiten behalten sich ausdrücklich rechtliche Schritte im Falle der unverlangten Zusendung von Werbeinformationen, etwa durch Spam-Mails, vor.\n\n**Datenschutzerklärung für die Nutzung von Google Analytics**\n\nDiese Website benutzt Google Analytics, einen Webanalysedienst der Google Inc. (\"Google\"). Google Analytics verwendet sog. \"Cookies\", Textdateien, die auf Ihrem Computer gespeichert werden und die eine Analyse der Benutzung der Website durch Sie ermöglichen. Die durch den Cookie erzeugten Informationen über Ihre Benutzung dieser Website werden in der Regel an einen Server von Google in den USA übertragen und dort gespeichert. Im Falle der Aktivierung der IP-Anonymisierung auf dieser Webseite wird Ihre IP-Adresse von Google jedoch innerhalb von Mitgliedstaaten der Europäischen Union oder in anderen Vertragsstaaten des Abkommens über den Europäischen Wirtschaftsraum zuvor gekürzt.\n\nNur in Ausnahmefällen wird die volle IP-Adresse an einen Server von Google in den USA übertragen und dort gekürzt. Im Auftrag des Betreibers dieser Website wird Google diese Informationen benutzen, um Ihre Nutzung der Website auszuwerten, um Reports über die Websiteaktivitäten zusammenzustellen und um weitere mit der Websitenutzung und der Internetnutzung verbundene Dienstleistungen gegenüber dem Websitebetreiber zu erbringen. Die im Rahmen von Google Analytics von Ihrem Browser übermittelte IP-Adresse wird nicht mit anderen Daten von Google zusammengeführt.\n\nSie können die Speicherung der Cookies durch eine entsprechende Einstellung Ihrer Browser-Software verhindern; wir weisen Sie jedoch darauf hin, dass Sie in diesem Fall gegebenenfalls nicht sämtliche Funktionen dieser Website vollumfänglich werden nutzen können. Sie können darüber hinaus die Erfassung der durch das Cookie erzeugten und auf Ihre Nutzung der Website bezogenen Daten (inkl. Ihrer IP-Adresse) an Google sowie die Verarbeitung dieser Daten durch Google verhindern, indem sie das unter dem folgenden Link verfügbare Browser-Plugin herunterladen und installieren: <http://tools.google.com/dlpage/gaoptout?hl=de>.\n\n**Datenschutzerklärung für die Nutzung von Twitter**\n\nAuf unseren Seiten sind Funktionen des Dienstes Twitter eingebunden. Diese Funktionen werden angeboten durch die Twitter Inc., 795 Folsom St., Suite 600, San Francisco, CA 94107, USA. Durch das Benutzen von Twitter und der Funktion \"Re-Tweet\" werden die von Ihnen besuchten Webseiten mit Ihrem Twitter-Account verknüpft und anderen Nutzern bekannt gegeben. Dabei werden auch Daten an Twitter übertragen.\n\nWir weisen darauf hin, dass wir als Anbieter der Seiten keine Kenntnis vom Inhalt der übermittelten Daten sowie deren Nutzung durch Twitter erhalten. Weitere Informationen hierzu finden Sie in der Datenschutzerklärung von Twitter unter <http://twitter.com/privacy>.\n\nIhre Datenschutzeinstellungen bei Twitter können Sie in den Konto-Einstellungen unter <http://twitter.com/account/settings> ändern.\n\n*Quellen:* *[Disclaimer](http://www.e-recht24.de/muster-disclaimer.htm) von eRecht24, dem Portal zum Internetrecht von Rechtsanwalt Sören Siebert, [Datenschutzerklärung Google Analytics](http://www.google.com/intl/de_ALL/analytics/tos.html), [Twitter Bedingungen](http://twitter.com/privacy)*\n\nHutter Reisen GmbH · 88299 Leutkirch · Tel. 07561 - 98000 · [info@hutter-reisen.de](/kontakt.php) | [Impressum](/impressum.php) | [Datenschutz](/datenschutz.php)\n\n© [reiseCMS®](http://www.reise-cms.com \"reise-CMS - das einfache System für Reisen! Branchenlösung für Reiseveranstalter: Reise-Management-System, Reiseportal-Software, Online Buchungssystem\") [by Werbeagentur Schmidt](http://www.uweschmidt.com \"Internetprogrammierung, Werbemittelerstellung, Service und Beratung - Webagentur Schmidt\")\n\n* [Startseite](/)\n* [Reiseprogramm](/reise/)\n  + [Alle Reisen](/reise/)\n* [Gruppen- & Vereinsreisen](/reise/gruppenreise.php)\n  + [Mietbusanfrage](/reise/gruppenreise.php)\n* [über Hutter](/hutter/index.php)\n  + [Unsere Mitarbeiter](/hutter/mitarbeiter.php)\n  + [Firmengeschichte](/hutter/index.php)\n* [Service & Kontakt](/kontakt.php)\n  + [Fahrpläne im Linienverkehr](/linienverkehr/index.php)\n  + [Reiseinformationen](/reiseinfo/index.php)\n  + [Reisebedingungen](/reiseinfo/reisebedingungen.php)\n  + [Büro und Anfahrt](/hutter/anfahrt.php)\n  + [Kontakt](/kontakt.php)\n  + [Datenschutz](/datenschutz.php)\n\nBildrechte: Clipdealer"
}