{
  "timestamp": "20250722_101841",
  "processing_info": {
    "date": "2025-07-22",
    "time": "10:19:05",
    "timezone": "WEST"
  },
  "url": "https://www.mueller-riedstadt.de",
  "imprint_url": "https://www.mueller-riedstadt.de/impressum.html",
  "imprint_data": {
    "company_name": "MÜLLERiedstadt Reisebüro - Omnibusbetrieb Fritz Müller e.K.",
    "managing_directors": [
      "Holger Müller"
    ],
    "business_address": {
      "street": "Industriestraße 2-5",
      "city": "Riedstadt-Crumstadt",
      "postal_code": "64560",
      "country": "Germany"
    },
    "phone_numbers": [
      "06158/1885-0",
      "06158 / 1885-20"
    ],
    "email_addresses": [
      "info@mueller-riedstadt.de"
    ],
    "website_url": "https://www.mueller-riedstadt.de",
    "registration_details": {
      "trade_register": "Handelsregister",
      "registration_number": "HRA 52186",
      "court": "Amtsgericht Darmstadt"
    },
    "vat_id": "DE 254439042",
    "tax_id": null,
    "professional_liability_insurance": "W.R. Berkley Europe AG, Niederlassung für deutschland, Kaiser-Wilhelm-Ring 27-29, 50672 Köln. Geltungsraum: Deutschland und Ausland (ausgen. USA/USA-Territorien für Produkte/Dienstleistungen, es sei denn, Zusatzbaustein ist vereinbart).",
    "other_legal_info": {
      "Online Dispute Resolution (ODR) Platform": "https://ec.europa.eu/consumers/odr",
      "Consumer arbitration participation": "Not willing or obliged"
    }
  },
  "markdown_content": "Impressum - Müller Riedstadt\n\n\n\n[![MÜLLER Riedstadt Reisebüro und Omnibusbetrieb](files/style/img/telefon.png \"MÜLLER Riedstadt Reisebüro und Omnibusbetrieb\")](tel:0615818850)\n\n\n[Navigation überspringen](impressum.html#skipNavigation2)\n\n\n* Home\n* [Reiseangebote](reiseangebote.html \"Reiseangebote\")\n* [Busanmietung](busanmietung.html \"Busanmietung\")\n\n  + [Busanmietung](busanmietung.html \"Busanmietung\")\n  + [Fahrzeugflotte](unternehmen/fahrzeugflotte.html \"Fahrzeugflotte\")\n  + [Reiseideen für Clubs & Vereine](busanmietung/reiseideen-fuer-clubs-vereine.html \"Reiseideen für Clubs & Vereine\")\n* [Linienverkehr](linienverkehr.html \"Linienverkehr\")\n* [Fahrschule](http://fahrschulemuellerriedstadt.de/ \"Fahrschule\")\n* [Unternehmen](unternehmen/standort-team.html \"Unternehmen\")\n\n  + [Standort & Team](unternehmen/standort-team.html \"Standort & Team\")\n  + [Firmenportrait](unternehmen/firmenportrait.html \"Firmenportrait\")\n  + [Fahrzeugflotte](unternehmen/fahrzeugflotte.html \"Fahrzeugflotte\")\n  + [Wir bilden aus](wir-bilden-aus.html \"Wir bilden aus\")\n  + [Karriere bei Müller](unternehmen/karriere-bei-mueller.html \"Karriere bei Müller\")\n  + [Stellenanzeigen](unternehmen/stellenanzeigen.html \"Stellenanzeigen\")\n  + [Reise-ABC](unternehmen/reise-abc.html \"Reise-ABC\")\n  + [Zustiegstellen](unternehmen/zustiegstellen.html \"Zustiegstellen\")\n* [Kontakt](kontakt.html \"Kontakt\")\n\n  + [Anfrage Busanmietung](busanmietung/busanmietung.html \"Anfrage Busanmietung\")\n  + [Anfrage Gruppenreisen](busanmietung/busanmietung.html \"Anfrage Gruppenreisen\")\n  + Impressum\n  + [Int-Formular](kontakt/int-formular.html \"Int-Formular\")\n* [Reisen suchen](mobile-seiten/reisen-suchen.html \"Reisen suchen\")\n\n\n\n![MÜLLER Riedstadt Reisebüro und Omnibusbetrieb](files/style/img/logo.jpg \"MÜLLER Riedstadt Reisebüro und Omnibusbetrieb\")\n\nREISEN SUCHEN\n\nReiseart wählen\nBusreise\nSchiffsreise\nFlugreise\n\nReiseland wählen\nEngland\nNiederlande\nÖsterreich\nSchweiz\nNorwegen\nTschechien\nDeutschland\nItalien\nSchottland\nSchweden\nFrankreich\nIrland\nSpanien\nKroatien\n\nReisekategorie wählen\nMusikreisen & Theatertouren\nJubiläumsreisen\nTagesfahrten\nStädtereisen\nUrlaub & Erholung\nOsterreisen\nFahrten ins Blaue\nKurz- und Eventreisen\nAdventreisen\nWeihnachten & Silvester\nSaisoneröffnungs- & -abschlussreisen\n\nReisethema wählen\nReisethema 1\nReisethema 2\n\nSuche starten\n\nSie befinden sich hier:\n\n* Müller Riedstadt\n* [Kontakt](kontakt.html \"Kontakt\")\n* Impressum\n\n# Impressum\n\n### Verantwortlich für den Inhalt:\n\nMÜLLERiedstadt Reisebüro - Omnibusbetrieb Fritz Müller e.K.  \n Industriestraße 2-5  \n 64560 Riedstadt-Crumstadt\n\n## Vertreten durch:\n\nHerr Holger Müller\n\n## Kontakt:\n\nTelefon: 06158/1885-0  \n Telefax: 06158 / 1885-20  \n E-Mail: info@mueller-riedstadt.de\n\n## Registereintrag:\n\nEintragung im Handelsregister.   \n Registergericht: Amtsgericht Darmstadt  \n Registernummer: HRA 52186\n\n## Umsatzsteuer:\n\nUmsatzsteuer-Identifikationsnummer gemäß §27 a Umsatzsteuergesetz:  \n DE 254439042\n\n## Angaben zur Berufshaftpflichtversicherung\n\nName und Sitz des Versicherers:  \n W.R. Berkley Europe AG  \n Niederlassung für deutschland  \n Kaiser-Wilhelm-Ring 27-29  \n 50672 Köln\n\nGeltungsraum der Versicherung: Geltungsbereich ist Deutschland sowie das Ausland. Folgender Ausschluss gilt. Ausgenommen sind in USA und USA-Territorien vorkommende Versicherungsfälle durch Erzeugnisse, die der Versicherungsnehmer dorthin geliefert hat oder dorthin hat liefern lassen und aus Montage-, Wartungs- und Reparaturarbeiten. Dies gilt nicht, soweit der Zusatzbaustein „Direktexporte in die USA und USA-Territorien“ vereinbart worden ist.\n\n## Streitschlichtung\n\nDie Europäische Kommission stellt eine Plattform zur Online-Streitbeilegung (OS) bereit: <https://ec.europa.eu/consumers/odr>.  \n Unsere E-Mail-Adresse finden Sie oben im Impressum.\n\nWir sind nicht bereit oder verpflichtet, an Streitbeilegungsverfahren vor einer Verbraucherschlichtungsstelle teilzunehmen.\n\n### Haftung für Inhalte\n\nAls Diensteanbieter sind wir für eigene Inhalte auf diesen Seiten nach den allgemeinen Gesetzen verantwortlich. Als Diensteanbieter sind wir jedoch nicht verpflichtet, übermittelte oder gespeicherte fremde Informationen zu überwachen oder nach Umständen zu forschen, die auf eine rechtswidrige Tätigkeit hinweisen.\n\nVerpflichtungen zur Entfernung oder Sperrung der Nutzung von Informationen nach den allgemeinen Gesetzen bleiben hiervon unberührt. Eine diesbezügliche Haftung ist jedoch erst ab dem Zeitpunkt der Kenntnis einer konkreten Rechtsverletzung möglich. Bei Bekanntwerden von entsprechenden Rechtsverletzungen werden wir diese Inhalte umgehend entfernen.\n\n### Haftung für Links\n\nUnser Angebot enthält Links zu externen Websites Dritter, auf deren Inhalte wir keinen Einfluss haben. Deshalb können wir für diese fremden Inhalte auch keine Gewähr übernehmen. Für die Inhalte der verlinkten Seiten ist stets der jeweilige Anbieter oder Betreiber der Seiten verantwortlich. Die verlinkten Seiten wurden zum Zeitpunkt der Verlinkung auf mögliche Rechtsverstöße überprüft. Rechtswidrige Inhalte waren zum Zeitpunkt der Verlinkung nicht erkennbar.\n\nEine permanente inhaltliche Kontrolle der verlinkten Seiten ist jedoch ohne konkrete Anhaltspunkte einer Rechtsverletzung nicht zumutbar. Bei Bekanntwerden von Rechtsverletzungen werden wir derartige Links umgehend entfernen.\n\n### Urheberrecht\n\nDie durch die Seitenbetreiber erstellten Inhalte und Werke auf diesen Seiten unterliegen dem deutschen Urheberrecht. Die Vervielfältigung, Bearbeitung, Verbreitung und jede Art der Verwertung außerhalb der Grenzen des Urheberrechtes bedürfen der schriftlichen Zustimmung des jeweiligen Autors bzw. Erstellers. Downloads und Kopien dieser Seite sind nur für den privaten, nicht kommerziellen Gebrauch gestattet.\n\nSoweit die Inhalte auf dieser Seite nicht vom Betreiber erstellt wurden, werden die Urheberrechte Dritter beachtet. Insbesondere werden Inhalte Dritter als solche gekennzeichnet. Sollten Sie trotzdem auf eine Urheberrechtsverletzung aufmerksam werden, bitten wir um einen entsprechenden Hinweis. Bei Bekanntwerden von Rechtsverletzungen werden wir derartige Inhalte umgehend entfernen.\n\n### Webdesign und Webprogrammierung der Website\n\n[**Online Buchungssystem für Reiseveranstalter:** Easy-BUS Reise-WEB 5.0 - CMS für Reisen](http://www.easy-bus.de \"Easy-BUS Reise-WEB - Das CMS für Reiseveranstalter und die Touristik\") | [**Webdesign:** 4NET Werbeagentur, Agentur für Print und Online Medien aus dem Sauerland in NRW](https://www.4net.de \"4NET Werbeagentur für Print und Online Medien, die Agentur aus NRW\")\n\n## Busanmietung\n\n![](files/easybus/bilder/bus.png)\n\n[Mehr erfahren](busanmietung.html)\n\n## Gruppen & Vereine\n\n![](files/easybus/bilder/gruppen.png)\n\n[Mehr erfahren](busanmietung.html)\n\n## Katalogreisen\n\n![](files/easybus/bilder/katalogreisen.png)\n\n[Reiseangebote](reisen_suchergebnisse.html)\n\nADRESSE\n\n**MÜLLERiedstadt** **Reisebüro** -  \n**Omnibusbetrieb Fritz Müller e.K.**  \nInhaber: Holger Müller   \nIndustriestraße 2-5  \n64560 Riedstadt-Crumstadt  \nTel.: +49 (0) 61 58 / 18 85-0  \n Fax.: +49 (0) 61 58 / 18 85-20  \n Mail: info@mueller-riedstadt.de\n\nREISEGUTSCHEIN\n\n![Geschenkgutschein von Müller Riedstadt](assets/images/4/geschenkgutschein-c58b0824.png \"Geschenkgutschein von Müller Riedstadt\")\n\n[Bestellen](reisegutschein.html)\n\n[Website by: **Easy-BUS Reise-WEB 5.0** | CMS für Reisen](http://www.easy-bus.de/reise-cms-reise-shopsystem-reisemanagement-software.html \"Reise-WEB 5.0 - Content-Management-System für Reisen\")\n\n[IMPRESSUM](impressum.html \"Impressum\") | [DATENSCHUTZ](datenschutzerklaerung.html \"Datenschutz\") | [REISEBEDINGUNGEN](reisebedingungen.html \"Reisebedingungen\")\n\n[Top](#0)"
}