{
  "timestamp": "20250722_103023",
  "processing_info": {
    "date": "2025-07-22",
    "time": "10:30:41",
    "timezone": "WEST"
  },
  "url": "http://www.gunzenhausen-mobil.de",
  "imprint_url": "http://www.gunzenhausen-mobil.de/impressum.html",
  "imprint_data": {
    "company_name": "Mobilitäts- und Verkehrs-GmbH",
    "managing_directors": [
      "Stefan Dietz"
    ],
    "business_address": {
      "street": "Marktplatz 44",
      "city": "Gunzenhausen",
      "postal_code": "91710",
      "country": "Germany"
    },
    "phone_numbers": [
      "+49 (0) 98 31 / 51 69 00",
      "09831 / 51 69 - 064"
    ],
    "email_addresses": [
      "info@mvg-gun.de"
    ],
    "website_url": "https://www.gunzenhausen-mobil.de",
    "registration_details": {
      "trade_register": "Handelsregister",
      "registration_number": "HRB 7687",
      "court": "Registergericht Ansbach"
    },
    "vat_id": "DE 348 359 311",
    "tax_id": null,
    "professional_liability_insurance": null,
    "other_legal_info": {
      "responsible_for_editorial_content": "Stefan Dietz",
      "eu_dispute_resolution_platform": "https://ec.europa.eu/consumers/odr/",
      "consumer_dispute_resolution_willingness": "Wir sind nicht bereit oder verpflichtet, an Streitbeilegungsverfahren vor einer Verbraucherschlichtungsstelle teilzunehmen.",
      "dsa_contact_email": "info@mvg-gun.de",
      "dsa_contact_languages": "Deutsch, Englisch"
    }
  },
  "markdown_content": "Impressum - Stadtbusverkehr, Rufbusangebot, Anrufsammeltaxi und Carsharing - Gunzenhausen Mobil\n\n\n\n\n\n\n \n\n\n\n[![Logo der Mobilitäts- und Verkehrs-GmbH Gunzenhausen](assets/images/9/MVG_23_038_Logo_mit_Slogan_unten_farbe_6-ea91d2c9.png \"Logo der Mobilitäts- und Verkehrs-GmbH Gunzenhausen\")](https://www.gunzenhausen-mobil.de \"zur Startseite\")\n\n[Navigation überspringen](impressum.html#skipNavigation2)\n\n* [Ihre MVG](ihre-mvg.html \"Ihre MVG\")\n* [Service](service.html \"Service\")\n* [Presse](presse.html \"Presse\")\n* [Kontakt](kontakt.html \"Kontakt\")\n* [Anzeigen](anzeigen.html \"Anzeigen\")\n* [Downloads](downloads.html \"Downloads\")\n* [FAQ](faq.html \"FAQ\")\n\nSuchbegriffe\n\nSuchen\n\n\n\n* [Startseite](./ \"Gunzenhausen: Mit der MVG mobil\")\n* [Aktuelles](aktuelles.html \"Aktuelles\")\n  + [Aktuelles Leseseite](aktuelles-leseseite.html \"News Leseseite\")\n* [Mobilitätsangebote](mobilitaetsangebote.html \"Mobilitätsangebote\")\n  + [Stadtbus](stadtbus.html \"Stadtbus\")\n  + [Rufbus](rufbus.html \"Rufbus\")\n  + [Freizeitlinien](freizeitlinien.html \"Freizeitlinien\")\n  + [Sonderlinien Kirchweih](sonderlinien-kirchweih.html \"Sonderlinien Kirchweih\")\n  + [Theaterbus](theaterbus.html \"Theaterbus\")\n  + [Anrufsammeltaxi](anrufsammeltaxi.html \"Anrufsammeltaxi\")\n  + [Carsharing](carsharing.html \"Carsharing\")\n  + [Elektromobilität](elektromobilitaet.html \"Elektromobilität\")\n* [Fahrplanauskunft](fahrplanauskunft.html \"Fahrplanauskunft\")\n  + [Fahrplan Stadtbusverkehr](fahrplan-stadtbusverkehr.html \"Stadtbusverkehr\")\n  + [Fahrplan Rufbusverkehr](fahrplan-rufbusverkehr.html \"Rufbusverkehr\")\n  + [Fahrplan Freizeitlinien](fahrplan-freizeitlinien.html \"Fahrplan Freizeitlinien\")\n  + [Sonderfahrpläne Kirchweih](sonderfahrplaene-kirchweih.html \"Sonderfahrpläne Kirchweih\")\n  + [Fahrplan Theaterbus](fahrplan-theaterbus.html \"Fahrplan Theaterbus\")\n  + [Fahrplan Anrufsammeltaxi](fahrplan-anrufsammeltaxi.html \"Fahrplan Anrufsammeltaxi\")\n* [Tickets & Abos](tickets-abos.html \"Tickets & Abos\")\n  + [Tickets & Abonnements](tickets-abonnements.html \"Tickets & Abonnements\")\n  + [Schüler-Azubi-Student](schueler-azubi-student.html \"Schüler-Azubi-Student\")\n  + [D - Ticket](d-ticket.html \"D - Ticket\")\n* [Freizeit](rad-in-bus-bahn.html \"Freizeit\")\n  + [Freizeitlinien](freizeitlinien.html \"Freizeitlinien\")\n  + [Rad in Bus / Bahn](rad-in-bus-bahn.html \"Rad in Bus / Bahn\")\n  + [Freizeitaktivitäten](freizeitaktivitaeten.html \"Freizeitaktivitäten\")\n* [Servicemenü](ihre-mvg.html \"Servicemenü\")\n  + [Ihre MVG](ihre-mvg.html \"Ihre MVG\")\n  + [Service](service.html \"Service\")\n  + [Presse](presse.html \"Presse\")\n  + [Kontakt](kontakt.html \"Kontakt\")\n  + [Anzeigen](anzeigen.html \"Anzeigen\")\n  + [Downloads](downloads.html \"Downloads\")\n  + [FAQ](faq.html \"FAQ\")\n* [Kontakt](kontakt.html \"Kontakt\")\n* [Barrierefreiheit](barrierefreiheit.html \"Barrierefreiheit\")\n* [Datenschutz](datenschutz.html \"Datenschutz\")\n* Impressum\n\n[Navigation überspringen](impressum.html#skipNavigation1)\n\n* [Aktuelles](aktuelles.html \"Aktuelles\")\n* [Mobilitätsangebote](mobilitaetsangebote.html \"Mobilitätsangebote\") \n\n  ![Stadtbus Gunzenhausen](assets/images/5/Stadtbus-2874bfd4.jpg \"Stadtbus Gunzenhausen\")\n\n\n  © MVG - Gunzenhausen\n\n  Stadtbus\n\n  Ob zur Arbeit, zur Schule oder zum Ein­kaufen - Der Stadtbusse bringen Sie hin.\n\n  [Stadtbusverkehr ...](stadtbus.html)  \n  [Fahrplanauskunft ...](fahrplan-stadtbusverkehr.html)\n\n  ![Rufbus in Gunzenhausen](assets/images/2/rufbus_2-88398d48.jpg \"Rufbus in Gunzenhausen\")\n\n\n  © MVG - Gunzenhausen\n\n  Rufbus\n\n  Der Rufbus - Die Perfekte Ergänzung der bestehenden Regional­buslinien.\n\n  [Konzept & Infos ...](rufbus.html)   \n  [Rufbus bestellen ...](rufbus.html#rufbus_bestellen)\n\n  ![Bus Freizeitlinie Gunzenhausen](assets/images/e/freizeitlinie_bus-ccf36062.jpg \"Bus Freizeitlinie Gunzenhausen\")\n\n\n  © MVG - Gunzenhausen\n\n  Freizeitlinien\n\n  Von Mai bis November bieten wir den Urlaubsgästen einen Freizeitlinienverkehr.\n\n  [Infos zu den Freizeitlinien](freizeitlinien.html)  \n  [Fahrplanauskunft ...](fahrplan-freizeitlinien.html)\n\n  ![Karussell Kirchweih Gunzenhausen](assets/images/1/kirchweihlinie-6bbaa94e.jpg \"Karussell Kirchweih Gunzenhausen\")\n\n\n  © Stadt Gunzenhausen\n\n  Sonderlinien Kirchweih\n\n  Die Stadt Gunzenhausen bietet zur Gunzenhäuser Kerwa sechs Sonderlinien.\n\n  [Preise & Infos ...](sonderlinien-kirchweih.html)  \n  [Fahrpläne ...](sonderfahrplaene-kirchweih.html)\n\n  ![Theaterbus Gunzenhausen](assets/images/6/Theaterbus_GUN-df9c712a.jpg \"Theaterbus Gunzenhausen\")\n\n\n  © MVG - Gunzenhausen\n\n  Theaterbus\n\n  Eine Fahrmöglichkeit für jeden zu den Theaterveranstaltungen.\n\n  [Infos zum Theaterbus](theaterbus.html)  \n  [Theaterbus bestellen ...](fahrplan-theaterbus.html)\n\n  ![Taxi](assets/images/e/taxi-4720993_1280-dd146217.jpg \"Taxi\")\n\n\n  © pixabay: birgl\n\n  Anrufsammeltaxi\n\n  Öffentliche Verkehrsmittel nutzen, auch ohne reguläre Bus/Bahn Verbindungen.\n\n  [Konzept ...](anrufsammeltaxi.html)  \n  [Anrufsammeltaxi bestellen ...](anrufsammeltaxi.html#ast_bestellen)\n\n  ![](assets/images/a/Standort%20Lindleinswasenstra%C3%9Fe%202-8ea094ee.jpg)\n\n\n  @MVG - Gunzenhausen\n\n  Carsharing\n\n  Leihen Sie sich ein Auto für Ihre besonderen Mobilitätsbedürfnisse.\n\n  [Carsharing Konzept ...](carsharing.html)  \n  [Buchungsablauf ...](carsharing.html#carsharing_buchen)\n\n  ![Elektroauto mit Ladestecker](assets/images/4/electric-car-2862381_1920-d3826230.jpg \"Elektroauto mit Ladestecker\")\n\n\n  © pixabay: anaterate\n\n  Elektromobilität\n\n  Hier finden Sie eine Übersicht über die Ladeinfrastruktur in Gunzenhausen\n\n  [Zur Ladeinfrastruktur ...](elektromobilitaet.html)\n* [Fahrplanauskunft](fahrplanauskunft.html \"Fahrplanauskunft\") \n\n  ![Stadtbus in Gunzenhausen](assets/images/4/Stadtbusverkehr-85684454.jpg \"Stadtbus in Gunzenhausen\")\n\n\n  © MVG- Gunzenhausen\n\n  Fahrpläne Stadtbusverkehr\n\n  Überblick des Liniennetzes sowie der Fahrpläne vom Stadtbus.\n\n  [Fahrplanauskunft Stadtbus ...](fahrplan-stadtbusverkehr.html)\n\n  ![Rufbus in Gunzenhausen](assets/images/2/rufbus_2-88398d48.jpg \"Rufbus in Gunzenhausen\")\n\n\n  © MVG - Gunzenhausen\n\n  Fahrpläne Rufbusverkehr\n\n  Überblick des Liniennetzes sowie der Fahrpläne vom Rufbus.\n\n  [Fahrplanauskunft Rufbus ...](fahrplan-rufbusverkehr.html)\n\n  ![Bus Freizeitlinie Gunzenhausen](assets/images/e/freizeitlinie_bus-ccf36062.jpg \"Bus Freizeitlinie Gunzenhausen\")\n\n\n  © MVG - Gunzenhausen\n\n  Fahrpläne Freizeitlinien\n\n  Überblick des Liniennetzes sowie der Fahrpläne der Freizeitlinien.\n\n  [Fahrplanauskunft Freizeitlinien ...](fahrplan-freizeitlinien.html)\n\n  ![Karussell Kirchweih Gunzenhausen](assets/images/1/kirchweihlinie-6bbaa94e.jpg \"Karussell Kirchweih Gunzenhausen\")\n\n\n  © Stadt Gunzenhausen\n\n  Sonderfahrpläne Kirchweih\n\n  Die Stadt Gunzenhausen bietet zur Gunzenhäuser Kerwa vier Sonderlinien.\n\n  [Sonderfahrpläne Kirchweih ...](sonderfahrplaene-kirchweih.html)\n\n  ![Theaterbus Gunzenhausen](assets/images/6/Theaterbus_GUN-df9c712a.jpg \"Theaterbus Gunzenhausen\")\n\n\n  © MVG - Gunzenhausen\n\n  Fahrplan Theaterbus\n\n  Hier erfahren Sie wie der Theaterbus funktioniert.\n\n  [Fahrplan Theaterbus ...](fahrplan-theaterbus.html)\n\n  ![Taxi](assets/images/e/taxi-4720993_1280-dd146217.jpg \"Taxi\")\n\n\n  © pixabay: birgl\n\n  Fahrplan Anrufsammeltaxi\n\n  Fahrpläne und Preise AST Gunzenhausen und AST Wassertrüdingen\n\n  [Fahrpläne Anrufsammeltaxi ...](fahrplan-anrufsammeltaxi.html)\n* [Tickets & Abos](tickets-abos.html \"Tickets & Abos\") \n\n  ![Gäste im Bus mit Daumen hoch](assets/images/0/abonnements-4e0b7ba3.jpg \"Gäste im Bus mit Daumen hoch\")\n\n\n  © Fotolia / Adobe Stock\n\n  Tickets & Abos\n\n  Ticketangebote und Abonnements für Gunzenhausen.\n\n  [zu Tickets & Abos ...](tickets-abonnements.html)\n\n  ![Jugendliche auf dem Schulweg](assets/images/c/schueler-7d820ecc.jpg \"Jugendliche auf dem Schulweg\")\n\n\n  © 123RF.com\n\n  Schüler-Azubi-Student\n\n  Wochen- oder Monatsticket, die flexiblen Tickets für Schule und Aus­bil­dung.\n\n  [zu den Tickets ...](schueler-azubi-student.html)\n\n  ![Busfahrerin bei der Arbeit](assets/images/2/swg-gun-header-aktuelles-5d3e615f.jpg \"Busfahrerin bei der Arbeit\")\n\n\n  © Fotolia / AdobeStock\n\n  VGN - Ticket - Preise\n\n  Der VGN bietet für jeden Fahrgast und jede Gelegenheit die richtige Fahrkarte.\n\n  [zu den VGN - Ticket - Preisen ...](files/mvg/pdf/vgn-preise-12024.pdf)\n\n  ![Deutschland Ticket](assets/images/6/deutschland-ticket-8d6b9332.jpg \"Deutschland Ticket\")\n\n\n  © pixabay\n\n  D - Ticket\n\n  Mit einem Fahrschein einfach und günstig bundesweit unterwegs sein.\n\n  [zum D - Ticket ...](d-ticket.html)\n* [Freizeit](rad-in-bus-bahn.html \"Freizeit\") \n\n  ![Bus Freizeitlinie Gunzenhausen](assets/images/e/freizeitlinie_bus-ccf36062.jpg \"Bus Freizeitlinie Gunzenhausen\")\n\n\n  © MVG - Gunzenhausen\n\n  Freizeitlinien\n\n  Vom **Mai bis Nov.** bieten wir Urlaubs­gästen einen **Freizeitlinienverkehr**.\n\n  [zu den Freizeitlinien ...](freizeitlinien.html)\n\n  ![Bus mit Fahrradanhänger](assets/images/4/Bus_Fahrrad_Freizeit-e83b82ff.jpg \"Bus mit Fahrradanhänger\")\n\n\n  © MVG - Gunzenhausen\n\n  Rad in Bus und Bahn\n\n  Hier finden unsere Gäste weitere Informationen\n\n  [zu Rad in Bus und Bahn ...](rad-in-bus-bahn.html)\n\n  ![Wander Tipps](assets/images/7/VGN%20l-Andrea_Gaspar-Klein_1092-845c6bee.jpg \"Wander Tipps\")\n\n\n  © VGN\n\n  Freizeitaktivitäten\n\n  Freizeitaktivitäten für Mitbürger und Gäste rund um Gunzenhausen.\n\n  [Zu den Freizeit-Tipps ...](freizeitaktivitaeten.html)\n\n  Weitere Informationen\n\n  [Kultur ...](https://www.gunzenhausen.info/kultur/)\n\n  [Tourismus ...](https://www.gunzenhausen.info)\n\n  [Altmühlsee ...](https://www.fraenkisches-seenland.de/tagungen/altmuehlsee-informationszentru-71/)\n\n  [Seenland Express ...](https://seenexpress.de)\n\n[![Telefonsupport](assets/images/6/swg-gun-rufbusbestellung-b9d88a08.jpg)](files/mvg/images/swg-gun-rufbusbestellung.jpg \"Telefonsupport\")\n\n\n© Adobe Stock\n\n# Impressum\n\nTransparenz und Vertrauen sind uns wichtig, daher stellen wir Ihnen hier alle relevanten Informationen über unser Unternehmen zur Verfügung. Im folgenden Abschnitt finden Sie die Kontaktdaten, rechtliche Hinweise und weiterführende Informationen.\n\nMobilitäts- und Verkehrs-GmbH  \nMarktplatz 44  \n91710 Gunzenhausen\n\nHandelsregister: HRB 7687  \nRegistergericht: Registergericht Ansbach\n\n**Vertreten durch:**  \nStefan Dietz\n\n## Kontakt\n\nTelefon: +49 (0) 98 31 / 51 69 00  \nE-Mail: info@mvg-gun.de\n\n## Umsatzsteuer-ID\n\nUmsatzsteuer-Identifikationsnummer gemäß § 27 a Umsatzsteuergesetz:  \nDE 348 359 311\n\n## Redaktionell verantwortlich\n\nStefan Dietz\n\n## EU-Streitschlichtung\n\nDie Europäische Kommission stellt eine Plattform zur Online-Streitbeilegung (OS) bereit: <https://ec.europa.eu/consumers/odr/>.  \nUnsere E-Mail-Adresse finden Sie oben im Impressum.\n\n## Verbraucher­streit­beilegung/Universal­schlichtungs­stelle\n\nWir sind nicht bereit oder verpflichtet, an Streitbeilegungsverfahren vor einer Verbraucherschlichtungsstelle teilzunehmen.\n\n## Zentrale Kontaktstelle nach dem Digital Services Act - DSA (Verordnung (EU) 2022/265)\n\nUnsere zentrale Kontaktstelle für Nutzer und Behörden nach Art. 11, 12 DSA erreichen Sie wie folgt:\n\nE-Mail: info@mvg-gun.de\n\nDie für den Kontakt zur Verfügung stehenden Sprachen sind: Deutsch, Englisch.\n\n## Fotos\n\nMobilitäts- und Verkehrs-GmbH\n\n[Stadt Gunzenhausen](https://www.gunzenhausen.de)\n\n[www.pixabay.com](https://pixabay.com)\n\n[www.istockphoto.com](https://www.istockphoto.com)\n\n[Nach oben](impressum.html#top \"Nach oben\")\n\n\n\n## Kontakt\n\nMobilitäts- und Verkehrs-GmbH  \nMarktplatz 44  \n91710 Gunzenhausen\n\n[09831 / 51 69 00](tel:+499831516900)   \n[info@mvg-gun.de](mailto:info@mvg-gun.de)\n\n## Rufbus bestellen\n\n[09831 / 51 69 - 064](tel:+4998315169064)\n\n## Wichtige Links\n\n[Website Stadt Gunzenhausen](https://www.gunzenhausen.de)\n\n[Tourist Information Gunzenhausen](http://www.gunzenhausen.info)\n\n[Altmühlsee Informationszentrum](https://www.fraenkisches-seenland.de/tagungen/altmuehlsee-informationszentru-71/)\n\n[Seenland Express](https://seenexpress.de)\n\n## Fahrplan & Tickets App\n\n[![App Store Logo](files/mvg/layout/Icon_AppStore_de.svg)](https://apps.apple.com/us/app/vgn-fahrplan-tickets/id932422485?ign-itscg=30200&ign-itsct=apps_box_badge)\n\n[![Play Store Logo](files/mvg/layout/Icon_PlayStore_de.svg)](https://play.google.com/store/apps/details?id=com.mdv.VGNCompanion&pcampaignid=pcampaignidMKT-Other-global-all-co-prtnr-py-PartBadge-Mar2515-1)\n\n© 2025 Mobilitäts- und Verkehrs GmbH Gunzenhausen. Alle Rechte vorbehalten.\n\n[Navigation überspringen](impressum.html#skipNavigation9)\n\n* [Kontakt](kontakt.html \"Kontakt\")\n* [Barrierefreiheit](barrierefreiheit.html \"Barrierefreiheit\")\n* [Datenschutz](datenschutz.html \"Datenschutz\")\n* **Impressum**\n\n\n\n\n\n\n\n\n![](/_contao/check_cookies)\n\n\n\n\n\n\n\n\n\n### Cookie- und Datenschutzhinweise\n\nDiese Webseite verwendet Cookies, um bestimmte Funktionen zu ermöglichen und das Angebot zu verbessern.\n\nEssenziell\n\nDetails einblenden für Essenziell\nDetails ausblenden für Essenziell\n\nContao HTTPS CSRF Token\n\nSchützt vor Cross-Site-Request-Forgery Angriffen.\n\nSpeicherdauer: Dieses Cookie bleibt nur für die aktuelle Browsersitzung bestehen.\n\nPHP SESSION ID\n\nSpeichert die aktuelle PHP-Session.\n\nSpeicherdauer: Dieses Cookie bleibt nur für die aktuelle Browsersitzung bestehen.\n\nErlebnis verbessern\n\nDetails einblenden für Erlebnis verbessern\nDetails ausblenden für Erlebnis verbessern\n\nMatomo Analytics\n\nErzeugt statistische Daten darüber, wie der Besucher die Website nutzt und hilft uns die Website zu verbessern.\n\nAnbieter: MATOMO https://matomo.org/\n\nAuswahl speichern\nAlle akzeptieren\nAlle ablehnen\n\n[Datenschutz](https://www.gunzenhausen-mobil.de/datenschutz.html)\n[Impressum](https://www.gunzenhausen-mobil.de/impressum.html)"
}