{
  "timestamp": "20250722_103413",
  "processing_info": {
    "date": "2025-07-22",
    "time": "10:34:35",
    "timezone": "WEST"
  },
  "url": "http://www.reisen-mueller.de",
  "imprint_url": "http://www.reisen-mueller.de/impressum",
  "imprint_data": {
    "company_name": "Walter Müller Reise GmbH & Co. KG",
    "managing_directors": [
      "Martin Müller",
      "Ludwig Müller"
    ],
    "business_address": {
      "street": "Gewerbestr. 34",
      "city": "Biblis",
      "postal_code": "68647",
      "country": "Germany"
    },
    "phone_numbers": [
      "+49 6245 7130",
      "+49 0621-102052",
      "+49 6245 99834"
    ],
    "email_addresses": [
      "info@reisen-mueller.de",
      "urlaub@reisen-mueller.de"
    ],
    "website_url": "https://www.reisen-mueller.de/",
    "registration_details": {
      "trade_register": "Handelsregister",
      "registration_number": "HRA 62024",
      "court": "Amtsgericht Lampertheim"
    },
    "vat_id": null,
    "tax_id": null,
    "professional_liability_insurance": null,
    "other_legal_info": {
      "fax_numbers": [
        "+49 6245 909860",
        "+49 6245 6101"
      ],
      "content_responsible_person": "Martin Müller",
      "online_dispute_resolution_platform": "http://ec.europa.eu/consumers/odr",
      "consumer_dispute_resolution_statement": "Es besteht keine Verpflichtung und keine Bereitschaft zur Teilnahme an einem Streitbeilegungsverfahren vor einer Verbraucherschlichtungsstelle.",
      "social_media_profile_facebook": "https://facebook.com/reisenmuellerbiblis",
      "image_credits": "Reisebüro Müller, Fotolia.de und andere Rechteinhaber."
    }
  },
  "markdown_content": "  \n\n\n\n\nImpressum\n\n\n\n**INFORMATION & BUCHUNG:**  \n \n Telefon:   **[+49 6245 7130](tel:+49 6245 7130)**\n\n* [Home](/ \"Home\")\n* [Reisen](#) \n\n  [Reisen](/katalog/Reiseangebote/ \"Reisen\")[Tagesfahrten](/katalog/Kategorien/Tagesfahrten/ \"Tagesfahrten\")[Mehrtagesfahrten](/katalog/Kategorien/Mehrtagesfahrten/ \"Mehrtagesfahrten\")[Reisekalender](/katalog/X/trip/date_view \"Reisekalender\")\n* [Informationen](#) \n\n  [Fuhrpark](/informationen/fuhrpark \"Fuhrpark\")[Linienverkehr](/linienverkehr \"Linienverkehr\")[Qualität und Sicherheit](/informationen/qualitaet-und-sicherheit \"Qualität und Sicherheit\")[Stellenangebote](/informationen/jobs \"Stellenangebote\")[Team Reisebüro](/informationen/mitarbeiter \"Team Reisebüro\")[Service](/informationen \"Service\")\n* [Kontakt](/kontakt \"Kontakt\")\n* [IMAGE Film](https://www.youtube.com/watch?v=A151PyseSWw \"IMAGE Film\")\n* [Broschüre](https://www.unserebroschuere.de/mueller-reise/MailView/ \"Broschüre\")\n* [BUSANMIETUNG](/busanmietung \"BUSANMIETUNG\")\n\nSuchen\n\n#### Walter Müller Reise GmbH & Co. KG\n\nDarmstädter Straße 68  \nD-68647 Biblis  \n[info@reisen-mueller.de](mailto:info@reisen-mueller.de)  \n[+49 06245 7130](tel:+49 06245 7130)  \n[+49 0621-102052](tel:+49 06245 7130)\n\n# Impressum\n\nWalter Müller Reise GmbH & Co. KG  \n Gewerbestr. 34  \n 68647 Biblis\n\nTelefon: +49 6245 99834  \n Fax: +49 6245 909860  \n Ansprechpartner ist Martin Müller\n\nE-Mail [info@reisen-mueller.de](mailto:info@reisen-mueller.de)  \n Internet [www.reisen-mueller.de](https://www.reisen-mueller.de/)\n\n**Vertretungsberechtigte:** Martin Müller, Ludwig Müller\n\n**Eingetragen beim Amtsgericht Lampertheim:** Handelsregister HRA 62024\n\n**Inhaltlich verantwortlich:**Martin Müller(Anschrift s.o.)\n\n**Verbraucherinformation gemäß Verordnung (EU) Nr. 524/2013:**  \n Im Rahmen der Verordnung über Online-Streitbeilegung in Verbraucherangelegenheiten steht Ihnen unter <http://ec.europa.eu/consumers/odr> eine Online-Streitbeilegungsplattform der EU-Kommission zur Verfügung.\n\n**Information nach dem Verbraucherstreitbeilegungsgesetz (§ 36 Abs. 1 Nr. 1 VSBG):**  \n Es besteht keine Verpflichtung und keine Bereitschaft zur Teilnahme an einem Streitbeilegungsverfahren vor einer Verbraucherschlichtungsstelle.\n\n**Bildnachweis:** Reisebüro Müller, Fotolia.de und andere Rechteinhaber.\n\n**Dieses Impressum gilt auch für unser Social-Media-Profil auf Facebook:**  \n<https://facebook.com/reisenmuellerbiblis>\n\n# Haftungsausschluss\n\n## **Inhalt des Onlineangebotes**\n\nWalter Müller Reise GmbH & Co. KG übernimmt keinerlei Gewähr für die Aktualität, Korrektheit, Vollständigkeit oder Qualität der bereitgestellten Informationen. Haftungsansprüche gegen Walter Müller Reise GmbH & Co. KG, welche sich auf Schäden materieller oder ideeller Art beziehen, die durch die Nutzung oder Nichtnutzung der dargebotenen Informationen bzw. durch die Nutzung fehlerhafter und unvollständiger Informationen verursacht wurden, sind grundsätzlich ausgeschlossen, sofern seitens von Walter Müller Reise GmbH & Co. KG kein nachweislich vorsätzliches oder grob fahrlässiges Verschulden vorliegt.\n\nAlle Angebote sind freibleibend und unverbindlich. Walter Müller Reise GmbH & Co. KG behält es sich ausdrücklich vor, Teile der Seiten oder das gesamte Angebot ohne gesonderte Ankündigung zu verändern, zu ergänzen, zu löschen oder die Veröffentlichung zeitweise oder endgültig einzustellen.\n\n## **Verweise und Links**\n\nBei direkten oder indirekten Verweisen auf fremde Internetseiten („Links“), die außerhalb des Verantwortungsbereiches von Walter Müller Reise GmbH & Co. KG liegen, würde eine Haftungsverpflichtung ausschließlich in dem Fall inkrafttreten, in dem Walter Müller Reise GmbH & Co. KG von den Inhalten Kenntnis hat und es Walter Müller Reise GmbH & Co. KG technisch möglich und zumutbar wäre, die Nutzung im Falle rechtswidriger Inhalte zu verhindern.\n\nWalter Müller Reise GmbH & Co. KG erklärt hiermit ausdrücklich, dass zum Zeitpunkt der Linksetzung keine illegalen Inhalte auf den zu verlinkenden Seiten erkennbar waren. Auf die aktuelle und zukünftige Gestaltung, die Inhalte oder die Urheberschaft der gelinkten/verknüpften Seiten hat Walter Müller Reise GmbH & Co. KG keinerlei Einfluss. Deshalb distanziert sich Walter Müller Reise GmbH & Co. KG hiermit ausdrücklich von allen Inhalten aller gelinkten/verknüpften Seiten, die nach der Linksetzung verändert wurden. Diese Feststellung gilt für alle innerhalb des eigenen Internetangebotes gesetzten Links und Verweise sowie für Fremdeinträge in vom Autor eingerichteten Gästebüchern, Diskussionsforen und Mailinglisten.\n\nFür illegale, fehlerhafte oder unvollständige Inhalte und insbesondere für Schäden, die aus der Nutzung oder Nichtnutzung solcherart dargebotenen Informationen entstehen, haftet allein der Anbieter der Seite, auf welche verwiesen wurde, nicht derjenige, der über Links auf die jeweilige Veröffentlichung lediglich verweist.\n\n## **Urheber- und Kennzeichenrecht**\n\nWalter Müller Reise GmbH & Co. KG ist bestrebt, in allen Publikationen die Urheberrechte der verwendeten Grafiken, Tondokumente, Videosequenzen und Texte zu beachten, von ihm selbst erstellte Grafiken, Tondokumente, Videosequenzen und Texte zu nutzen oder auf lizenzfreie Grafiken, Tondokumente, Videosequenzen und Texte zurückzugreifen.\n\nAlle innerhalb des Internetangebotes genannten und ggf. durch Dritte geschützten Marken- und Warenzeichen unterliegen uneingeschränkt den Bestimmungen des jeweils gültigen Kennzeichenrechts und den Besitzrechten der jeweiligen eingetragenen Eigentümer. Allein aufgrund der bloßen Nennung ist nicht der Schluss zu ziehen, dass Markenzeichen nicht durch Rechte Dritter geschützt sind. Das Copyright für veröffentlichte, vom Autor selbst erstellte Objekte bleibt allein beim Autor der Seiten.\n\nEine Vervielfältigung oder Verwendung solcher Grafiken, Tondokumente, Videosequenzen und Texte in anderen elektronischen oder gedruckten Publikationen ist ohne ausdrückliche Zustimmung des Autors nicht gestattet.\n\n## **Datenschutz**\n\nSofern innerhalb des Internetangebotes die Möglichkeit zur Eingabe persönlicher oder geschäftlicher Daten (E-Mailadressen, Namen, Anschriften) besteht, so erfolgt die Preisgabe dieser Daten seitens des Nutzers auf ausdrücklich freiwilliger Basis. Die Inanspruchnahme und Bezahlung aller angebotenen Dienste ist – soweit technisch möglich und zumutbar – auch ohne Angabe solcher Daten bzw. unter Angabe anonymisierter Daten oder eines Pseudonyms gestattet.\n\n## **Rechtswirksamkeit dieses Haftungsausschlusses**\n\nDieser Haftungsausschluss ist als Teil des Internetangebotes zu betrachten, von dem aus auf diese Seite verwiesen wurde. Sofern Teile oder einzelne Formulierungen dieses Textes der geltenden Rechtslage nicht, nicht mehr oder nicht vollständig entsprechen sollten, bleiben die übrigen Teile des Dokumentes in ihrem Inhalt und ihrer Gültigkeit davon unberührt.\n\n## Reisebüro Biblis\n\nWalter Müller Reise GmbH & Co. KG\n\nDarmstädter Straße 68  \n 68647 Biblis\n\n**Montag – Freitag:**  \n 09:00 – 12:30 und 14:00 – 18:00\n\n**Samstag:**  \n 09:00 – 12:00 Uhr  \n nur nach Terminabsprache!\n\n**Telefon**: +49 6245 7130  \n**Fax:** +49 6245 6101\n\n**E-Mail:** [urlaub@reisen-mueller.de](mailto:urlaub@reisen-mueller.de)\n\n[Google® Maps Karte](http://maps.google.com/maps?client=safari&q=Darmst%C3%A4dter+Stra%C3%9Fe+68+68647+Biblis&oe=UTF-8&ie=UTF8&hq=&hnear=Darmst%C3%A4dter+Stra%C3%9Fe+68,+68647+Biblis,+Bergstra%C3%9Fe,+Hessen,+Germany&ei=c7JeS86CD5iUnwOvtcmWAg&ved=0CAgQ8gEwAA&z=16&iwloc=r4)\n\n## Omnibus Betriebshof Biblis\n\nWalter Müller Reise GmbH & Co. KG\n\nGewerbestr. 34  \n 68647 Biblis\n\n**Telefon:** +49 6245 99834  \n**Fax:** +49 6245 909860\n\n**E-Mail:** [info@reisen-mueller.de](mailto:info@reisen-mueller.de)\n\n[Google® Maps Karte](https://www.google.de/maps/place/Walter+M%C3%BCller+Reise+GmbH+%26+Co.+KG/@49.6940234,8.4495133,17z/data=!3m1!4b1!4m6!3m5!1s0x4797d546919e115d:0x322026c53508317!8m2!3d49.69402!4d8.4520882!16s%2Fg%2F1tt8b6bt?entry=ttu)\n\n## Omnibus Betriebshof Bürstadt\n\nWalter Müller Reise GmbH & Co. KG\n\nGartenstraße 34  \n 68642 Bürstadt\n\n[Google® Maps Karte](http://maps.google.de/maps?f=q&source=s_q&hl=de&geocode=&q=Gartenstra%C3%9Fe+34,+68642+B%C3%BCrstadt+&sll=49.694263,8.452423&sspn=0.009216,0.017145&ie=UTF8&hq=&hnear=Gartenstra%C3%9Fe+34,+68642+B%C3%BCrstadt,+Bergstra%C3%9Fe,+Hessen&z=16)\n\n#### Walter Müller Reise GmbH & Co. KG\n\nDarmstädter Straße 68  \nD-68647 Biblis  \n[info@reisen-mueller.de](mailto:info@reisen-mueller.de)  \n[+49 06245 7130](tel:+49 06245 7130)  \n[+49 0621-102052](tel:+49 06245 7130)\n\n#### Reisearten\n\n* [Adventsreisen](/katalog/Reisethemen/Adventsreisen/?search%5Btourtype%5D=1481)\n* [Busreisen](/katalog/Reisethemen/Busreisen/?search%5Btourtype%5D=1488)\n* [Flugreisen](/katalog/Reisethemen/Flugreisen/?search%5Btourtype%5D=1487)\n* [Mehrtagesfahrten](/katalog/Reisethemen/Mehrtagesfahrten/?search%5Btourtype%5D=1485)\n* [Silvesterreisen](/katalog/Reisethemen/Silvesterreisen/?search%5Btourtype%5D=1482)\n* [Städtereisen](/katalog/Reisethemen/St%C3%A4dtereisen/?search%5Btourtype%5D=1500)\n* [Tagesfahrten](/katalog/Reisethemen/Tagesfahrten/?search%5Btourtype%5D=1484)\n* [Wellnessreisen](/katalog/Reisethemen/Wellnessreisen/?search%5Btourtype%5D=1480)\n\n#### Service\n\n* Blätterkatalog\n* [Busanmietung](/busanmietung \"Busanmietung\")\n\n#### Informationen\n\n* [Kontakt](/kontakt \"Kontakt\")\n* [Impressum](/impressum \"Impressum\")\n* [Datenschutz](/datenschutzerklaerung \"Datenschutz\")\n\n[![xtoura logo](/theme/ReisenMueller-B4//images/footer_xtoura_logo.png?1020)](//www.xtoura.de)\n\nCookieeinstellungen\n\n[xtoura](//www.xtoura.de) ist ein Produkt von [satzart](//www.satzart.de) © 2025"
}