{
  "timestamp": "20250722_103047",
  "processing_info": {
    "date": "2025-07-22",
    "time": "10:31:10",
    "timezone": "WEST"
  },
  "url": "http://www.regiobus-kronach.de",
  "imprint_url": "http://www.regiobus-kronach.de/kontakt/impressum",
  "imprint_data": {
    "company_name": "moVeas GmbH",
    "managing_directors": [
      "Knut Gräbedünkel",
      "Susanne Gaurun"
    ],
    "business_address": {
      "street": "Ichtershäuser Straße 7",
      "city": "Arnstadt",
      "postal_code": "99310",
      "country": "Germany"
    },
    "phone_numbers": [
      "+49 3628 6133-0"
    ],
    "email_addresses": [
      "info@moveas.de"
    ],
    "website_url": "https://www.moveas.de",
    "registration_details": {
      "trade_register": "Handelsregister",
      "registration_number": "110 950",
      "court": "Jena"
    },
    "vat_id": "DE202362601",
    "tax_id": null,
    "professional_liability_insurance": null,
    "other_legal_info": {
      "fax_number": "+49 3628 613322",
      "editorial_responsibility": "Anja Gräbedünkel",
      "consumer_dispute_resolution_statement": "We are obliged to participate in dispute resolution procedures before a consumer arbitration board.",
      "copyright_year": "2025"
    }
  },
  "markdown_content": "Impressum\n\n\n\n\n\n\n\n\n\n\n\n\n\n\n\n\n \n\n\n\n\n\n\n\n\n\n\n\n\n\n\n\n \n\n\n[![Moveas Logo](/typo3conf/ext/mmos_sitepackage/Resources/Public/Images/moveas_logo_wir_bewegen.svg)](/)\n\n[info@moveas.com](#)[+49 3628 6133-0](tel:+49362861330)\n\n* moVeas\n  + [Öffentlicher Personennahverkehr](/moveas/oepnv-planung)\n  + [Serviceleistungen](/moveas/serviceleistungen)\n  + [Mitarbeiter und Karriere](/mitarbeiter-und-karriere)\n    - [Aktuelle Stellenangebote](/mitarbeiter-und-karriere/aktuelle-stellenangebote)\n* [REISEN & TOURISTIK](https://touristik.moveas.de/)\n* [FAHRZEUGTECHNIK](https://fahrzeug.moveas.de)\n* [Sponsoring und Kooperationen](/sponsoring)\n* [News](/news)\n* [Kontakt](/kontakt)\n  + [Impressum](/kontakt/impressum)\n  + [Datenschutz](/kontakt/datenschutz)\n\n# IMPRESSUM\n\n1. moveas.de\n2. [Kontakt](/kontakt)\n3. Impressum\n\n**Angaben gemäß § 5 TMG**  \n moVeas GmbH  \n Ichtershäuser Straße 7  \n 99310 Arnstadt\n\nHandelsregister: 110 950  \n Registergericht: Handelsregister Jena\n\n**Vertreten durch:**  \n Knut Gräbedünkel (Geschäftsführender Gesellschafter), Susanne Gaurun (Geschäftsführerin)\n\n**Kontakt**  \n Telefon: +49 3628 6133-0  \n Telefax: +49 3628 613322  \n E-Mail: [info@moveas.de](#)\n\n**Umsatzsteuer-ID**  \n Umsatzsteuer-Identifikationsnummer gemäß § 27 a Umsatzsteuergesetz:  \n DE202362601\n\n**Redaktionell verantwortlich**  \n Anja Gräbedünkel\n\n**Verbraucher­streit­beilegung/Universal­schlichtungs­stelle**  \n Wir sind verpflichtet, an Streitbeilegungsverfahren vor einer Verbraucherschlichtungsstelle teilzunehmen.\n\n## Haftungsausschluss\n\n**Haftung für Inhalte**  \n Als Diensteanbieter sind wir gemäß § 7 Abs.1 TMG für eigene Inhalte auf diesen Seiten nach den allgemeinen Gesetzen verantwortlich. Nach §§ 8 bis 10 TMG sind wir als Diensteanbieter jedoch nicht verpflichtet, übermittelte oder gespeicherte fremde Informationen zu überwachen oder nach Umständen zu forschen, die auf eine rechtswidrige Tätigkeit hinweisen.\n\nVerpflichtungen zur Entfernung oder Sperrung der Nutzung von Informationen nach den allgemeinen Gesetzen bleiben hiervon unberührt. Eine diesbezügliche Haftung ist jedoch erst ab dem Zeitpunkt der Kenntnis einer konkreten Rechtsverletzung möglich. Bei Bekanntwerden von entsprechenden Rechtsverletzungen werden wir diese Inhalte umgehend entfernen.\n\n**Haftung für Links**  \n Unser Angebot enthält Links zu externen Websites Dritter, auf deren Inhalte wir keinen Einfluss haben. Deshalb können wir für diese fremden Inhalte auch keine Gewähr übernehmen. Für die Inhalte der verlinkten Seiten ist stets der jeweilige Anbieter oder Betreiber der Seiten verantwortlich. Die verlinkten Seiten wurden zum Zeitpunkt der Verlinkung auf mögliche Rechtsverstöße überprüft. Rechtswidrige Inhalte waren zum Zeitpunkt der Verlinkung nicht erkennbar.\n\nEine permanente inhaltliche Kontrolle der verlinkten Seiten ist jedoch ohne konkrete Anhaltspunkte einer Rechtsverletzung nicht zumutbar. Bei Bekanntwerden von Rechtsverletzungen werden wir derartige Links umgehend entfernen.\n\n**Urheberrecht**  \n Die durch die Seitenbetreiber erstellten Inhalte und Werke auf diesen Seiten unterliegen dem deutschen Urheberrecht. Die Vervielfältigung, Bearbeitung, Verbreitung und jede Art der Verwertung außerhalb der Grenzen des Urheberrechtes bedürfen der schriftlichen Zustimmung des jeweiligen Autors bzw. Erstellers. Downloads und Kopien dieser Seite sind nur für den privaten, nicht kommerziellen Gebrauch gestattet.\n\n##### moVeas\n\nDer Öffentliche Personennahverkehr verändert sich in Richtung Zukunft. Deshalb, und um den Menschen im ÖPNV ein Plus an Leistung und Service zu bieten, entwickelt sich auch moVeas ständig weiter. Als familiengeführtes Unternehmen ist es uns wichtig, unseren Kunden ein zuverlässiger Dienstleister und in unseren Kooperationen ein verlässlicher Partner zu sein. Und das seit 1999.\n\nmoVeas GmbH  \n Ichtershäuser Str. 7  \n 99310 Arnstadt\n\nTel. +49 3628 6133-0  \n Fax +49 3628 6133-33\n\n[info@moveas.de](#)\n\n[Beratung](/moveas/serviceleistungen)  \n[Service](/moveas/oepnv-planung)  \n[Karriere](/mitarbeiter-und-karriere)\n\n[Mitarbeiter-Login](/login)  \n[MyNet](https://mynet.moveas.de)  \n[FileTresor](https://1730995790.file-tresor.de)\n\n[Kontakt](/kontakt)  \n[Impressum](/kontakt/impressum)\n\n[Haftungsausschluss](/kontakt/impressum)  \n[Datenschutz](/kontakt/datenschutz)\n\nCopyright © 2025\n\n### Cookie-Hinweis\n\nWir setzen auf unserer Website Cookies ein. Einige von ihnen sind wesentlich, um die Funktionalität zu gewährleisten, während andere uns helfen, unser Onlineangebot stetig zu verbessern. Nähere Hinweise erhalten Sie in unserer [Datenschutzerklärung](/kontakt/datenschutz) und auf unserer [Cookie-Seite](/cookies) (siehe Fußbereich). Sie können dort auch jederzeit Ihre Einstellungen selbst bearbeiten.\n\nAlle annehmen\n\n[Selbst einstellen](#)\n\n[Nur wesentliche Cookies annehmen](#)\n\n### Einstellungen bearbeiten\n\nHier können Sie verschiedene Kategorien von Cookies auf dieser Website auswählen oder deaktivieren. Per Klick auf das Info-Icon können Sie mehr über die verschiedenen Cookies erfahren.\n\nTechnisch erforderliche Cookies\n\nTechnisch erforderliche Cookies\n\nAnalyse Cookies\n\nAnalyse Cookies\n\n[Alle annehmen](#)\n\nSpeichern"
}