{
  "timestamp": "20250722_103218",
  "processing_info": {
    "date": "2025-07-22",
    "time": "10:32:40",
    "timezone": "WEST"
  },
  "url": "http://www.kurzenberger-reisen.de",
  "imprint_url": "http://www.kurzenberger-reisen.de/impressum",
  "imprint_data": {
    "company_name": "Omnibus Kurzenberger GmbH",
    "managing_directors": [
      "Karl Kurzenberger",
      "Nicole Kurzenberger-Fink",
      "Nadine Kurzenberger-Schneider"
    ],
    "business_address": {
      "street": "Albstrasse 18",
      "city": "Sonnenbühl-Erpfingen",
      "postal_code": "72820",
      "country": "Germany"
    },
    "phone_numbers": [
      "07128 653",
      "+49 (0) 712 86 53"
    ],
    "email_addresses": [
      "info@kurzenberger-reisen.de"
    ],
    "website_url": "https://kurzenberger-reisen.de/",
    "registration_details": {
      "trade_register": "Handelsregister",
      "registration_number": "HRB 351709",
      "court": "Stuttgart"
    },
    "vat_id": "DE 146 480 508",
    "tax_id": "78075/46603",
    "professional_liability_insurance": null,
    "other_legal_info": {}
  },
  "markdown_content": "Impressum - Omnibus Kurzenberger GmbH\n\n\n\n\n\n\n\n\n\n\n\n\n\n\n\n\n\n\n\n\n\n\n\n\n\n\n\n\n\n\n\n\n\n\n\n\n\n\n\n\n\n\n\n\n\n\n\n \n\n\n* [Start](https://kurzenberger-reisen.de/)\n* [Wir über uns](https://kurzenberger-reisen.de/wir-ueber-uns/)\n* [Busflotte](https://kurzenberger-reisen.de/busflotte/)\n* [Reiseangebote](https://kurzenberger-reisen.de/unser-qualitaetsversprechen/)\n\n[![Omnibus Kurzenberger GmbH](https://kurzenberger-reisen.de/wp-content/uploads/2022/12/leer.h1-e1675778084350.jpg)](https://kurzenberger-reisen.de/)\n\n* [Start](https://kurzenberger-reisen.de/)\n* [Wir über uns](https://kurzenberger-reisen.de/wir-ueber-uns/)\n* [Busflotte](https://kurzenberger-reisen.de/busflotte/)\n* [Reiseangebote](https://kurzenberger-reisen.de/unser-qualitaetsversprechen/)\n\n# Impressum\n\n**Omnibus Kurzenberger GmbH**  \nGeschäftsführer: Karl Kurzenberger , Nicole Kurzenberger-Fink, Nadine Kurzenberger-Schneider  \nAlbstrasse 18  \n72820 Sonnenbühl-Erpfingen\n\nTel: 07128 653\n\nUst.-ID:  DE 146 480 508\n\nSteuerNr.:78075/46603\n\nRegistergericht Stuttgart : HRB 351709\n\nE-Mail: [**Info (at) Kurzenberger-Reisen.de**](mailto:info@kurzenberger-reisen.de)\n\nHinweis: Für diesen Inhalt ist JavaScript erforderlich.\n\n#### Kontakt\n\nTel.: [+49 (0) 712 86 53](tel:+497128653)  \nE-Mail:  [info@kurzenberger-reisen.de](mailto:info@kurzenberger-reisen.de)\n\n#### Adresse\n\nOmnibus Kurzenberger GmbH  \nAlbstraße 18  \n72820 Sonnenbühl\n\n#### Weitere Links\n\n[Impressum](/impressum)  \n[Datenschutz](/datenschutz)  \n[Reisebedingungen](https://kurzenberger-reisen.de/wp-content/uploads/2025/02/Reisebedingungen-Pauschalreise.pdf)\n\n---\n\n© 2023 Omnibus Kurzenberger GmbH\n\nCookie-Zustimmung verwalten\n\nWir verwenden Cookies, um unsere Website und unseren Service zu optimieren. [Datenschutz](/datenschutz) – [Impressum](/impressum)\n\nFunktional\n\n\n\nFunktional\nImmer aktiv \n\nDie technische Speicherung oder der Zugang ist unbedingt erforderlich für den rechtmäßigen Zweck, die Nutzung eines bestimmten Dienstes zu ermöglichen, der vom Teilnehmer oder Nutzer ausdrücklich gewünscht wird, oder für den alleinigen Zweck, die Übertragung einer Nachricht über ein elektronisches Kommunikationsnetz durchzuführen.\n\n\n\n\nVorlieben\n\n\nVorlieben\n\nDie technische Speicherung oder der Zugriff ist für den rechtmäßigen Zweck der Speicherung von Präferenzen erforderlich, die nicht vom Abonnenten oder Benutzer angefordert wurden.\n\n\n\n\nStatistiken\n\n\nStatistiken\n\nDie technische Speicherung oder der Zugriff, der ausschließlich zu statistischen Zwecken erfolgt.\nDie technische Speicherung oder der Zugriff, der ausschließlich zu anonymen statistischen Zwecken verwendet wird. Ohne eine Vorladung, die freiwillige Zustimmung deines Internetdienstanbieters oder zusätzliche Aufzeichnungen von Dritten können die zu diesem Zweck gespeicherten oder abgerufenen Informationen allein in der Regel nicht dazu verwendet werden, dich zu identifizieren.\n\n\n\n\nMarketing\n\n\nMarketing\n\nDie technische Speicherung oder der Zugriff ist erforderlich, um Nutzerprofile zu erstellen, um Werbung zu versenden oder um den Nutzer auf einer Website oder über mehrere Websites hinweg zu ähnlichen Marketingzwecken zu verfolgen.\n\n[Optionen verwalten](#)\n[Dienste verwalten](#)\n[Verwalten von {vendor\\_count}-Lieferanten](#)\n[Lese mehr über diese Zwecke](https://cookiedatabase.org/tcf/purposes/)\n\nCookies akzeptieren\nAblehnen\nEinstellungen anzeigen\nEinstellungen speichern\n[Einstellungen anzeigen](#)\n\n[{title}](#)\n[{title}](#)\n[{title}](#)\n\nZustimmung verwalten\n\n\n\n\n\n\n\n\n\n\n\n\n\n\n\n\n\n\n\n\n\n\n\n\n\n\n\n\n\n\n\n\n\n\n\n\n\n\n\n\n\n\n\n\n\n\n\n\n\n\n\n\n\n\n\n\n\n\n\n\n "
}