{
  "timestamp": "20250722_102849",
  "processing_info": {
    "date": "2025-07-22",
    "time": "10:29:03",
    "timezone": "WEST"
  },
  "url": "https://www.lta-alsfeld.de",
  "imprint_url": "https://www.lta-alsfeld.de/impressum/",
  "imprint_data": {
    "company_name": "Lerch Touristik Alsfeld GmbH",
    "managing_directors": [
      "Carmen Lerch"
    ],
    "business_address": {
      "street": "Mainzer Gasse 22-24",
      "city": "Alsfeld",
      "postal_code": "36304",
      "country": "Germany"
    },
    "phone_numbers": [
      "+49 (0)6631 8014450",
      "+49 (0)6636 8424",
      "+49 6631 8014460",
      "+49 171 6514880"
    ],
    "email_addresses": [
      "info@lta-alsfeld.de"
    ],
    "website_url": "https://www.lta-alsfeld.de/",
    "registration_details": {
      "trade_register": "Amtsgericht Gießen",
      "registration_number": "HRB 8784",
      "court": "Gießen"
    },
    "vat_id": null,
    "tax_id": null,
    "professional_liability_insurance": null,
    "other_legal_info": {}
  },
  "markdown_content": "Impressum – Lerch Touristik Alsfeld\n\n\n[Zum Inhalt springen](#content \"Zum Inhalt springen\")\n\nTAXI Alsfeld [+49 (0)6631 8014450](tel:004966318014450)\n\nTAXI Romrod [+49 (0)6636 8424](tel:004966368424)\n\n[![Lerch Touristik Alsfeld](https://www.lta-alsfeld.de/wp-content/uploads/2021/10/LTA_Logo.svg \"Lerch Touristik Alsfeld\")](https://www.lta-alsfeld.de/ \"Lerch Touristik Alsfeld\")\n\nMenü \n\n* [![](https://www.lta-alsfeld.de/wp-content/uploads/2023/01/logo_alsfeld_taxi.svg)Alsfeld Taxi](https://www.alsfeld.taxi)\n* [![](https://www.lta-alsfeld.de/wp-content/uploads/2023/01/romrod_taxi_logo.svg)Romrod Taxi](https://www.romrod.taxi)\n* [Start](https://www.lta-alsfeld.de/)\n* [Holidayland](#)\n  + [Holidayland Alsfeld](https://www.holidayland-alsfeld.de/)\n  + [Holidayland Fulda](https://www.holidayland-fulda.de/)\n* [Kontakt](https://www.lta-alsfeld.de/kontakt/)\n\n# Impressum\n\n**Lerch Touristik Alsfeld GmbH**\n\nMainzer Gasse 22-24  \n36304 Alsfeld\n\nTelefon: +49 6631 8014460  \nMobil: +49 171 6514880  \nE-Mail: [info@lta-alsfeld.de](mailto:info@lta-alsfeld.de)\n\nHandelsregister: Amtsgericht Gießen HRB 8784  \nGeschäftsführer: Carmen Lerch\n\n* [Impressum](https://www.lta-alsfeld.de/impressum/)\n* [Datenschutzerklärung](https://www.lta-alsfeld.de/datenschutzerklaerung/)\n* [Cookie-Richtlinie (EU)](https://www.lta-alsfeld.de/cookie-richtlinie-eu/)\n\n© 2025 Lerch Touristik Alsfeld GmbH. Alle Rechte vorbehalten.\n\n\n\nCookie-Zustimmung verwalten\n\nUm dir ein optimales Erlebnis zu bieten, verwenden wir Technologien wie Cookies, um Geräteinformationen zu speichern und/oder darauf zuzugreifen. Wenn du diesen Technologien zustimmst, können wir Daten wie das Surfverhalten oder eindeutige IDs auf dieser Website verarbeiten. Wenn du deine Zustimmung nicht erteilst oder zurückziehst, können bestimmte Merkmale und Funktionen beeinträchtigt werden.\n\nFunktionale Cookies\n\n\n\nFunktionale Cookies\nImmer aktiv \n\nDie technische Speicherung oder der Zugang ist unbedingt erforderlich für den rechtmäßigen Zweck, die Nutzung eines bestimmten Dienstes zu ermöglichen, der vom Teilnehmer oder Nutzer ausdrücklich gewünscht wird, oder für den alleinigen Zweck, die Übertragung einer Nachricht über ein elektronisches Kommunikationsnetz durchzuführen.\n\n\n\n\nVorlieben\n\n\nVorlieben\n\nDie technische Speicherung oder der Zugriff ist für den rechtmäßigen Zweck der Speicherung von Präferenzen erforderlich, die nicht vom Abonnenten oder Benutzer angefordert wurden.\n\n\n\n\nStatistik Cookies\n\n\nStatistik Cookies\n\nDie technische Speicherung oder der Zugriff, der ausschließlich zu statistischen Zwecken erfolgt.\nDie technische Speicherung oder der Zugriff, der ausschließlich zu anonymen statistischen Zwecken verwendet wird. Ohne eine Vorladung, die freiwillige Zustimmung deines Internetdienstanbieters oder zusätzliche Aufzeichnungen von Dritten können die zu diesem Zweck gespeicherten oder abgerufenen Informationen allein in der Regel nicht dazu verwendet werden, dich zu identifizieren.\n\n\n\n\nMarketing Cookies\n\n\nMarketing Cookies\n\nDie technische Speicherung oder der Zugriff ist erforderlich, um Nutzerprofile zu erstellen, um Werbung zu versenden oder um den Nutzer auf einer Website oder über mehrere Websites hinweg zu ähnlichen Marketingzwecken zu verfolgen.\n\n[Optionen verwalten](#)\n[Dienste verwalten](#)\n[Anbieter verwalten](#)\n[Lese mehr über diese Zwecke](https://cookiedatabase.org/tcf/purposes/)\n\nAlle akzeptieren\nAblehnen\nEinstellungen ansehen\nEinstellungen speichern\n[Einstellungen ansehen](#)\n\n[{title}](#)\n[{title}](#)\n[{title}](#)\n\nZustimmung verwalten"
}