{
  "timestamp": "20250722_103323",
  "processing_info": {
    "date": "2025-07-22",
    "time": "10:33:34",
    "timezone": "WEST"
  },
  "url": "http://www.martin-regionalbus.de",
  "imprint_url": "http://www.martin-regionalbus.de/impressum",
  "imprint_data": {
    "company_name": "Martin Regionalbus GmbH",
    "managing_directors": [
      "Dieter Martin"
    ],
    "business_address": {
      "street": "Kronacher Straße 28",
      "city": "Pressig",
      "postal_code": "96332",
      "country": "Germany"
    },
    "phone_numbers": [
      "09265 959-0",
      "09265/959-21",
      "09265/959-59"
    ],
    "email_addresses": [
      "info@martin-regionalbus.de"
    ],
    "website_url": null,
    "registration_details": {
      "trade_register": "HRB",
      "registration_number": "6442",
      "court": "Amtsgericht Coburg"
    },
    "vat_id": "DE330029331",
    "tax_id": "212/132/00795",
    "professional_liability_insurance": null,
    "other_legal_info": {
      "business_hours": "Montag – Freitag: 08.00 – 17.00 Uhr"
    }
  },
  "markdown_content": "  \n\n\n\n\nImpressum\n\n\n\n##### **Martin Regionalbus GmbH**\n\nKronacher Straße 28  \nD-96332 Pressig  \n  \n**Telefon:** 09265 959-0\n  \n**E-Mail:**  \n [info@martin-regionalbus.de](mailto:info@martin-regionalbus.de)\n\n* [Unternehmen](/unternehmen/wir-ueber-uns \"Unternehmen\")\n* [Fahrpläne](https://www.landkreis-kronach.de/wirtschaft-und-verkehr/oeffentlicher-nahverkehr/busfahrplaene/ \"Fahrpläne\")\n* [Stellenangebote](/gutscheinbestellung/stellenangebote \"Stellenangebote\")\n* [Kontakt](/kontakt \"Kontakt\")\n\n# Impressum\n\n## Regionalbus Martin GmbH\n\nKronacher Straße 28, 96332 Pressig  \n  \n Telefon: 09265/959-21  \n Telefax: 09265/959-59\n\nE-Mail: [info@martin-regionalbus.de](mailto:info@martin-regionalbus.de)\n\nGeschäftsführer: Dieter Martin  \n Amtsgericht Coburg: HRB 6442  \n Steuer-Nr. 212/132/00795  \n USt.-IdNr.  DE330029331  \n  \n**Geschäftszeiten**  \n Montag – Freitag: 08.00 – 17.00 Uhr\n\n## Haftungsausschluss\n\n##### **1. Inhalt des Onlineangebotes**\n\nDer Autor übernimmt keinerlei Gewähr für die Aktualität, Korrektheit, Vollständigkeit oder Qualität der bereitgestellten Informationen. Haftungsansprüche gegen den Autor, welche sich auf Schäden materieller oder ideeller Art beziehen, die durch die Nutzung oder Nichtnutzung der dargebotenen Informationen bzw. durch die Nutzung fehlerhafter und unvollständiger Informationen verursacht wurden, sind grundsätzlich ausgeschlossen, sofern seitens des Autors kein nachweislich vorsätzliches oder grob fahrlässiges Verschulden vorliegt. Alle Angebote sind freibleibend und unverbindlich. Der Autor behält es sich ausdrücklich vor, Teile der Seiten oder das gesamte Angebot ohne gesonderte Ankündigung zu verändern, zu ergänzen, zu löschen oder die Veröffentlichung zeitweise oder endgültig einzustellen.\n\n##### **2. Verweise und Links**\n\nBei direkten oder indirekten Verweisen auf fremde Webseiten (\"Hyperlinks\"), die außerhalb des Verantwortungsbereiches des Autors liegen, würde eine Haftungsverpflichtung ausschließlich in dem Fall in Kraft treten, in dem der Autor von den Inhalten Kenntnis hat und es ihm technisch möglich und zumutbar wäre, die Nutzung im Falle rechtswidriger Inhalte zu verhindern. Der Autor erklärt hiermit ausdrücklich, dass zum Zeitpunkt der Linksetzung keine illegalen Inhalte auf den zu verlinkenden Seiten erkennbar waren. Auf die aktuelle und zukünftige Gestaltung, die Inhalte oder die Urheberschaft der verlinkten/verknüpften Seiten hat der Autor keinerlei Einfluss. Deshalb distanziert er sich hiermit ausdrücklich von allen Inhalten aller verlinkten /verknüpften Seiten, die nach der Linksetzung verändert wurden. Diese Feststellung gilt für alle innerhalb des eigenen Internetangebotes gesetzten Links und Verweise sowie für Fremdeinträge in vom Autor eingerichteten Gästebüchern, Diskussionsforen, Linkverzeichnissen, Mailinglisten und in allen anderen Formen von Datenbanken, auf deren Inhalt externe Schreibzugriffe möglich sind. Für illegale, fehlerhafte oder unvollständige Inhalte und insbesondere für Schäden, die aus der Nutzung oder Nichtnutzung solcherart dargebotener Informationen entstehen, haftet allein der Anbieter der Seite, auf welche verwiesen wurde, nicht derjenige, der über Links auf die jeweilige Veröffentlichung lediglich verweist.\n\n##### **3. Urheber- und Kennzeichenrecht**\n\nDer Autor ist bestrebt, in allen Publikationen die Urheberrechte der verwendeten Bilder, Grafiken, Tondokumente, Videosequenzen und Texte zu beachten, von ihm selbst erstellte Bilder, Grafiken, Tondokumente, Videosequenzen und Texte zu nutzen oder auf lizenzfreie Grafiken, Tondokumente, Videosequenzen und Texte zurückzugreifen. Alle innerhalb des Internetangebotes genannten und ggf. durch Dritte geschützten Marken- und Warenzeichen unterliegen uneingeschränkt den Bestimmungen des jeweils gültigen Kennzeichenrechts und den Besitzrechten der jeweiligen eingetragenen Eigentümer. Allein aufgrund der bloßen Nennung ist nicht der Schluss zu ziehen, dass Markenzeichen nicht durch Rechte Dritter geschützt sind! Das Copyright für veröffentlichte, vom Autor selbst erstellte Objekte bleibt allein beim Autor der Seiten. Eine Vervielfältigung oder Verwendung solcher Grafiken, Tondokumente, Videosequenzen und Texte in anderen elektronischen oder gedruckten Publikationen ist ohne ausdrückliche Zustimmung des Autors nicht gestattet.\n\n##### **4. Datenschutz**\n\nLesen Sie hierzu unsere [Datenschutzbestimmung](https://web.archive.org/web/20210617213850/https://martin.mcpurl.de/httpdocs/index.php?article_id=67)\n\n##### **5. Rechtswirksamkeit dieses Haftungsausschlusses**\n\nDieser Haftungsausschluss ist als Teil des Internetangebotes zu betrachten, von dem aus auf diese Seite verwiesen wurde. Sofern Teile oder einzelne Formulierungen dieses Textes der geltenden Rechtslage nicht, nicht mehr oder nicht vollständig entsprechen sollten, bleiben die übrigen Teile des Dokumentes in ihrem Inhalt und ihrer Gültigkeit davon unberührt.\n\n© 1999 - 2014 disclaimer.de. Keine Haftung für Daten und Inhalte, die Nutzung dieses Dienstes erfolgt auf eigene Gefahr. Die Verwendung dieses Dokumentes außerhalb des Verantwortungsbereiches von disclaimer.de ist untersagt. Obwohl aus Gründen der Lesbarkeit im Text die männliche Form gewählt wurde beziehen sich die Angaben auf Angehörige beider Geschlechter.\n\n#### Martin Regionalbus GmbH\n\nKronacher Straße 28  \nD-96332 Pressig  \n  \nTelefon: 09265 959-0\n  \n [info@martin-regionalbus.de](mailto:info@martin-regionalbus.de)\n\n[![Facebook](/fileadmin/content/SozialMedia/faceboog-white-02.svg)](https://www.facebook.com/p/Martin-Regionalbus-GmbH-100079392713982/ \"Facebook Logo\")[![Instagram](/fileadmin/content/SozialMedia/Instagram_Glyph_White.svg)](https://www.instagram.com/martinregionalbusgmbh/ \"Instagram Logo\")\n\n#### Reisearten\n\n#### Unternehmen\n\n* [Wir über uns](/unternehmen/wir-ueber-uns \"Wir über uns\")\n* [Kontakt](/kontakt \"Kontakt\")\n* [Impressum](/impressum \"Impressum\")\n* [Datenschutz](/datenschutzerklaerung \"Datenschutz\")\n* [AGB](/agb \"AGB\")\n\n[![xtoura logo](/theme/Martin-Reisen//images/footer_xtoura_logo.png?1020)](//www.xtoura.de)\n\nCookieeinstellungen\n\n[xtoura](//www.xtoura.de) ist ein Produkt von [satzart](//www.satzart.de) © 2025"
}