{
  "timestamp": "20250722_103247",
  "processing_info": {
    "date": "2025-07-22",
    "time": "10:33:18",
    "timezone": "WEST"
  },
  "url": "http://www.muellerreisen-pf.de",
  "imprint_url": "http://www.muellerreisen-pf.de/article/463-impressum",
  "imprint_data": {
    "company_name": "Müller-Reisen GmbH & Co. KG",
    "managing_directors": [
      "Hartin Müller",
      "Viktoria Müller"
    ],
    "business_address": {
      "street": "Bleichstraße 3a",
      "city": "Pforzheim",
      "postal_code": "75173",
      "country": "Germany"
    },
    "phone_numbers": [
      "+49 (0) 7231 92266-0",
      "+49 (0) 7231 92266-26"
    ],
    "email_addresses": [
      "info@muellerreisen-pf.de"
    ],
    "website_url": "https://www.muellerreisen-pf.de",
    "registration_details": {
      "trade_register": "Handelsregister",
      "registration_number": "HRB 501765",
      "court": "Amtsgericht Mannheim"
    },
    "vat_id": "DE 144602270",
    "tax_id": null,
    "professional_liability_insurance": null,
    "other_legal_info": {
      "legal_basis_tmg": "Angaben gemäß § 5 TMG",
      "online_dispute_resolution_platform": "https://ec.europa.eu/consumers/odr",
      "consumer_arbitration_participation_statement": "Not willing or obligated to participate in dispute resolution before a consumer arbitration board.",
      "data_protection_authority": "Der Landesbeauftragte für den Datenschutz und die Informationsfreiheit Baden-Württemberg, https://www.baden-wuerttemberg.datenschutz.de",
      "copyright_owner": "Müller-Reisen GmbH & Co. KG 2025"
    }
  },
  "markdown_content": "Impressum | Müller Reisen Pforzheim\n\n\n[Reisebüro](/article/464-reisebuero)\n\n[Busreisen](/)\n\n[Blätterkatalog & Kataloganfrage](/kataloge)[Zustiegsorte](/article/474-zustiegsorte)[Tagesfahrten](/reiseuebersicht/Tagesfahrten)[Mehrtagesreisen](/reiseuebersicht/331-Mehrtagesreisen)\n\n[Busbetrieb](/busbetrieb)\n\n[Linienverkehr](/article/471-linie)[Mietbus Anfrage](/mietbus)[Fuhrpark](/article/475-fuhrpark)\n\n[Service](/)\n\n[Versicherung](/article/472-versicherung)[Gutscheine](/forms/Gutschein)[Fundsachen](/article/477-fundsachen)[Parken Betriebshof](/article/478-parken-betriebshof)\n\n[Über uns](/team)\n\n[Ansprechpartner](/team)[Über uns](/historie)[Buch](/article/479-buch)\n\n[07231 92266-0](tel: 07231922660)  [info@muellerreisen-pf.de](mailto:info@muellerreisen-pf.de)\n\n |   Suchen ...\n\n[Kontakt\n\nSchreiben Sie uns!](/forms/Kontakt)\n\n \n\n[Facebook\n\nTeil Sie einen Beitrag!](https://www.facebook.com/MuellerReisenPF)\n\n \n\n[Instagram\n\nFolgen Sie uns!](https://www.instagram.com/muellerreisenpf/)\n\n \n\n[Spotify\n\nHören Sie uns!](https://open.spotify.com/show/0JzBMoLfKmMTgtH9Jo6JbZ?si=5e3f9c377ab7414a)\n\n## Angaben gemäß § 5 TMG:\n\nImpressum  \nAngaben gemäß § 5 TMG:\n\nMüller-Reisen GmbH & Co. KG  \nBleichstraße 3a  \nSedanplatz  \n75173 Pforzheim\n\n**Vertreten durch:**  \nKommanditgesellschaft: Sitz Birkenfeld, Registergericht Mannheim HRA 50 2312, pers. h. Ges.: Müller-Reisen Verw.-GmbH  \nSitz Birkenfeld, Registergericht HRB 50 1765 Mannheim, Geschäftsführer: Hartin Müller, Viktoria Müller\n\n**Kontakt:**  \nTelefon: +49 (0) 7231 92266-0  \nTelefax: +49 (0) 7231 92266-26  \nE-Mail: [info@muellerreisen-pf.de](mailto:info@muellerreisen-pf.de)\n\n**Registereintrag:**  \nEintragung im Handelsregister.  \nRegistergericht: Amtsgericht Mannheim  \nRegisternummer: HRB 501765\n\n**Umsatzsteuer:**  \nUmsatzsteuer-Identifikationsnummer gemäß §27 a Umsatzsteuergesetz:  \nDE 144602270\n\n**Datenschutzbehörde:**  \nDer Landesbeauftragte für den Datenschutz und die Informationsfreiheit Baden-Württemberg  \nPostfach 10 29 32, 70025 Stuttgart  \nKönigstraße 10a, 70173 Stuttgart  \nTel.: 0711/61 55 41 – 0  \nFax: 0711/61 55 41 – 15  \nE-Mail: [poststelle@lfdi.bwl.de](mailto:poststelle@lfdi.bwl.de)  \nInternet: <https://www.baden-wuerttemberg.datenschutz.de>\n\n**Streitschlichtung**  \nDie Europäische Kommission stellt eine Plattform zur Online-Streitbeilegung (OS) bereit: <https://ec.europa.eu/consumers/odr>.  \nUnsere E-Mail-Adresse finden Sie oben im Impressum.  \nWir sind nicht bereit oder verpflichtet, an Streitbeilegungsverfahren vor einer Verbraucherschlichtungsstelle teilzunehmen.\n\n**Haftung für Inhalte**  \nAls Diensteanbieter sind wir gemäß § 7 Abs.1 TMG für eigene Inhalte auf\ndiesen Seiten nach den allgemeinen Gesetzen verantwortlich. Nach §§ 8\nbis 10 TMG sind wir als Diensteanbieter jedoch nicht verpflichtet,\nübermittelte oder gespeicherte fremde Informationen zu überwachen oder\nnach Umständen zu forschen, die auf eine rechtswidrige Tätigkeit\nhinweisen.\n\nVerpflichtungen zur Entfernung oder Sperrung der Nutzung von\nInformationen nach den allgemeinen Gesetzen bleiben hiervon unberührt.\nEine diesbezügliche Haftung ist jedoch erst ab dem Zeitpunkt der\nKenntnis einer konkreten Rechtsverletzung möglich. Bei Bekanntwerden von\nentsprechenden Rechtsverletzungen werden wir diese Inhalte umgehend\nentfernen.\n\n**Haftung für Links**  \nUnser Angebot enthält Links zu externen Websites Dritter, auf deren\nInhalte wir keinen Einfluss haben. Deshalb können wir für diese fremden\nInhalte auch keine Gewähr übernehmen. Für die Inhalte der verlinkten\nSeiten ist stets der jeweilige Anbieter oder Betreiber der Seiten\nverantwortlich. Die verlinkten Seiten wurden zum Zeitpunkt der\nVerlinkung auf mögliche Rechtsverstöße überprüft. Rechtswidrige Inhalte\nwaren zum Zeitpunkt der Verlinkung nicht erkennbar.\n\nEine permanente inhaltliche Kontrolle der verlinkten Seiten ist\njedoch ohne konkrete Anhaltspunkte einer Rechtsverletzung nicht\nzumutbar. Bei Bekanntwerden von Rechtsverletzungen werden wir derartige\nLinks umgehend entfernen.\n\n**Urheberrecht**  \nDie durch die Seitenbetreiber erstellten Inhalte und Werke auf diesen\nSeiten unterliegen dem deutschen Urheberrecht. Die Vervielfältigung,\nBearbeitung, Verbreitung und jede Art der Verwertung außerhalb der\nGrenzen des Urheberrechtes bedürfen der schriftlichen Zustimmung des\njeweiligen Autors bzw. Erstellers. Downloads und Kopien dieser Seite\nsind nur für den privaten, nicht kommerziellen Gebrauch gestattet.\n\nSoweit die Inhalte auf dieser Seite nicht vom Betreiber erstellt\nwurden, werden die Urheberrechte Dritter beachtet. Insbesondere werden\nInhalte Dritter als solche gekennzeichnet. Sollten Sie trotzdem auf eine\nUrheberrechtsverletzung aufmerksam werden, bitten wir um einen\nentsprechenden Hinweis. Bei Bekanntwerden von Rechtsverletzungen werden\nwir derartige Inhalte umgehend entfernen\n\n[Anfahrt](/kontakt)\n\n[Müllers Hühnerglück](https://www.huehnerglueck.de/)\n\n[AGB's Reisebedingungen](/article/459-agb-reise)\n\n[AGB's Mietomnibus](/article/460-abg-mietbus)\n\n[Cookie-Einstellungen](#)\n\n[Datenschutz](/article/462-datenschutz)\n\n[Impressum](/article/463-impressum)\n\n[Stellenangebote](/article/480-stellenangebote)\n\n[Sitemap](/sitemap)\n\n© Müller-Reisen GmbH & Co. KG 2025 - Alle Rechte vorbehalten\n\nFenster Schließen\n\n[Reisebüro](/article/464-reisebuero)\n\nBusreisen\n\nBusbetrieb\n\nService\n\nÜber uns"
}