{
  "timestamp": "20250722_103317",
  "processing_info": {
    "date": "2025-07-22",
    "time": "10:33:31",
    "timezone": "WEST"
  },
  "url": "http://www.scherer-reisen.de",
  "imprint_url": "http://www.scherer-reisen.de/impressum.html",
  "imprint_data": {
    "company_name": "Scherer Reisen Omnibus Gesellschaft mbH",
    "managing_directors": [
      "Frank Scherer"
    ],
    "business_address": {
      "street": "Hauptstraße 49",
      "city": "Gemünden",
      "postal_code": "55490",
      "country": "Germany"
    },
    "phone_numbers": [
      "06765 270",
      "+49 (6765) 270"
    ],
    "email_addresses": [
      "info@scherer-reisen.de"
    ],
    "website_url": "https://www.scherer-reisen.de",
    "registration_details": {
      "trade_register": "Handelsregister",
      "registration_number": "HRB 4245",
      "court": "Bad Kreuznach"
    },
    "vat_id": "DE813816522",
    "tax_id": null,
    "professional_liability_insurance": null,
    "other_legal_info": {
      "consumer_dispute_resolution_statement": "Wir sind nicht bereit oder verpflichtet, an Streitbeilegungsverfahren vor einer Verbraucherschlichtungsstelle teilzunehmen.",
      "supervisory_authority": "Bundesamt für Logistik und Mobilität, Werderstraße 34, 50672 Köln",
      "fax_number": "06765 960774"
    }
  },
  "markdown_content": "Impressum - Scherer Reisen\n\n\n\n\n\n \n\n\nVideo schließen\n\n[![\n\n](files/media/vlcsnap-2016-11-09-15h37m40s176.jpg)](files/media/German_Jack_Kurz.mp4)\n\nTel. [+49 (6765) 270](tel:+496765270)\nE-Mail [info@scherer-reisen.de](mailto:info@scherer-reisen.de)\n\nWerbevideo\n\n[Navigation überspringen](impressum.html#skipNavigation6)\n\n* [Stellenangebote](stellenangebote.html \"Stellenangebote\")\n\n[![Scherer Reisen](files/themes/scherer/img/logo.png)](./)\n\n[Navigation überspringen](impressum.html#skipNavigation1)\n\n* [Home](./ \"Busreisen, Busvermietung & Gruppenfahrten\")\n* [Busvermietung & Gruppenreisen](busvermietung_gruppenreisen.html \"Busvermietung & Gruppenreisen\")\n* [Reiseziele](reiseziele.html \"Reiseziele\")\n* [Fuhrpark](kleinbusse.html \"Furhpark\")\n* [Service](kontakt-anfahrt.html \"Service\")\n* [Scherer-Gruppe](bus_lkw_service_center.html \"Scherer-Gruppe\")\n\n[Navigation überspringen](impressum.html#skipNavigation26)\n\n* Menü\n  + Home\n  + [Busvermietung & Gruppenreisen](busvermietung_gruppenreisen.html \"Busvermietung & Gruppenreisen\")\n  + [Reiseziele](reiseziele.html \"Reiseziele\")\n  + [Fuhrpark](kleinbusse.html \"Furhpark\")\n  + [Service](kontakt-anfahrt.html \"Service\")\n  + [Scherer-Gruppe](bus_lkw_service_center.html \"Scherer-Gruppe\")\n\n* Sie befinden sich hier::\n* Scherer Reisen::\n* Impressum\n\n# Impressum\n\n## Angaben gemäß § 5 TMG\n\n**Scherer Reisen Omnibus Gesellschaft mbH**Hauptstraße 49  \n55490 Gemünden\n\nHandelsrgister: HRB 4245  \nRegistergericht: Bad Kreuznach\n\n**Vertreten durch:**  \nFrank Scherer\n\n## Kontakt\n\nTelefon 06765 270  \nFax 06765 960774  \n[info@scherer-reisen.de](mailto:info@scherer-reisen.de)\n\n## Umsatzsteuer-ID\n\nUmsatzsteuer-Identifikationsnummer gemäß § 27 a Umsatzsteuergesetz: DE813816522\n\n## Verbraucherstreitbeilegung / Universal­schlichtungsstelle\n\nWir sind nicht bereit oder verpflichtet, an Streitbeilegungsverfahren vor einer Verbraucherschlichtungsstelle teilzunehmen.\n\n## Realisierung\n\nHIT Hahn Informations-Technologie GmbH & Co. KG   \nWerbeagentur für Design und Marketing  \n[www.hahn-it.de](http://www.hahn-it.de/werbeagentur-hunsrueck.html)\n\n## Haftung für Inhalte\n\nAls Diensteanbieter sind wir gemäß § 7 Abs.1 TMG für eigene Inhalte auf diesen Seiten nach den allgemeinen Gesetzen verantwortlich. Nach §§ 8 bis 10 TMG sind wir als Diensteanbieter jedoch nicht verpflichtet, übermittelte oder gespeicherte fremde Informationen zu überwachen oder nach Umständen zu forschen, die auf eine rechtswidrige Tätigkeit hinweisen.\n\nVerpflichtungen zur Entfernung oder Sperrung der Nutzung von Informationen nach den allgemeinen Gesetzen bleiben hiervon unberührt. Eine diesbezügliche Haftung ist jedoch erst ab dem Zeitpunkt der Kenntnis einer konkreten Rechtsverletzung möglich. Bei Bekanntwerden von entsprechenden Rechtsverletzungen werden wir diese Inhalte umgehend entfernen.\n\n## Haftung für Links\n\nUnser Angebot enthält Links zu externen Websites Dritter, auf deren Inhalte wir keinen Einfluss haben. Deshalb können wir für diese fremden Inhalte auch keine Gewähr übernehmen. Für die Inhalte der verlinkten Seiten ist stets der jeweilige Anbieter oder Betreiber der Seiten verantwortlich. Die verlinkten Seiten wurden zum Zeitpunkt der Verlinkung auf mögliche Rechtsverstöße überprüft. Rechtswidrige Inhalte waren zum Zeitpunkt der Verlinkung nicht erkennbar.\n\nEine permanente inhaltliche Kontrolle der verlinkten Seiten ist jedoch ohne konkrete Anhaltspunkte einer Rechtsverletzung nicht zumutbar. Bei Bekanntwerden von Rechtsverletzungen werden wir derartige Links umgehend entfernen.\n\n## Urheberrecht\n\nDie durch die Seitenbetreiber erstellten Inhalte und Werke auf diesen Seiten unterliegen dem deutschen Urheberrecht. Die Vervielfältigung, Bearbeitung, Verbreitung und jede Art der Verwertung außerhalb der Grenzen des Urheberrechtes bedürfen der schriftlichen Zustimmung des jeweiligen Autors bzw. Erstellers. Downloads und Kopien dieser Seite sind nur für den privaten, nicht kommerziellen Gebrauch gestattet.\n\nSoweit die Inhalte auf dieser Seite nicht vom Betreiber erstellt wurden, werden die Urheberrechte Dritter beachtet. Insbesondere werden Inhalte Dritter als solche gekennzeichnet. Sollten Sie trotzdem auf eine Urheberrechtsverletzung aufmerksam werden, bitten wir um einen entsprechenden Hinweis. Bei Bekanntwerden von Rechtsverletzungen werden wir derartige Inhalte umgehend entfernen.\n\n## Aufsichtsbehörde\n\nBundesamt für Logistik und Mobilität  \nWerderstraße 34  \n50672 Köln\n\n### Top-Themen\n\n[Navigation überspringen](impressum.html#skipNavigation13)\n\n* [Spanien | Italien Urlaub](http://www.wink-reisen.de/web/krm/index.php?tc=1463470833&search=1&tripCategory=1744&tripKeyword= \"Spanien | Italien Urlaub\")\n* [Alpenurlaub](http://www.wink-reisen.de/web/krm/index.php?tc=1463471095&search=1&tripCategory=1770&tripKeyword= \"Alpenurlaub\")\n* [Wanderreisen](http://www.wink-reisen.de/web/krm/index.php?tc=1463471087&search=1&tripCategory=1509&tripKeyword= \"Wanderreisen\")\n* [Städtereisen](http://www.wink-reisen.de/web/krm/index.php?tc=1463471136&search=1&tripCategory=1045&tripKeyword= \"Städtereisen\")\n\n### Reisemöglichkeiten\n\n[Navigation überspringen](impressum.html#skipNavigation20)\n\n* [Reisebusse](reisebusse.html \"Reisebusse\")\n* [Doppeldecker](doppeldecker.html \"Doppeldecker\")\n* [Selbstfahrer](selbstfahrer.html \"Ausflugsbusse\")\n* [Bistrobusse](bistrobusse.html \"Bistrobusse\")\n\n### Scherer Reisen\n\n[Navigation überspringen](impressum.html#skipNavigation21)\n\n* [Kontakt & Anfahrt](kontakt-anfahrt.html \"Kontakt & Anfahrt\")\n* **Impressum**\n* [Datenschutz](datenschutz.html \"Datenschutz\")\n* [AGB](files/documents/agb-scherer-reisen.pdf \"AGB\")\n\n© 2025 Scherer-Reisen - website by [hit](http://www.hahn-it.de/referenzen.html)\n\n\n\n\n\n\n\n\n\n### Datenschutzeinstellungen\n\nDiese Website nutzt für eine optimale Funktionalität und Nutzungskomfort Cookies. Über die Schaltflächen können Sie sehen, welche Cookies gesetzt werden und Ihre Einwilligung entsprechend anpassen. Änderungen sind jederzeit in unserem [Datenschutz](https://www.scherer-rentme.de/datenschutz.html) möglich.\n\nEssenziell\n\nDetails einblenden\nDetails ausblenden\n\nContao HTTPS CSRF Token\n\nSchützt vor Cross-Site-Request-Forgery Angriffen.\n\nSpeicherdauer: Dieses Cookie bleibt nur für die aktuelle Browsersitzung bestehen.\n\nPHP SESSION ID\n\nSpeichert die aktuelle PHP-Session.\n\nSpeicherdauer: Dieses Cookie bleibt nur für die aktuelle Browsersitzung bestehen.\n\nFunktional\n\nDetails einblenden\nDetails ausblenden\n\nGoogle Maps\n\nAnbieter: Google Ireland Ltd., Gordon House, Barrow Street, Dublin 4, Ireland\n\nSpeicherdauer: Hier können Sie mehr über die Speicherdauer des Cookies erfahren https://policies.google.com/privacy.\n\nAuswahl speichern\nAlle akzeptieren\nAlle ablehnen\n\n[Impressum](https://www.scherer-reisen.de/impressum.html)\n[Datenschutz](https://www.scherer-reisen.de/datenschutz.html)"
}