{
  "timestamp": "20250722_102925",
  "processing_info": {
    "date": "2025-07-22",
    "time": "10:29:41",
    "timezone": "WEST"
  },
  "url": "http://www.nediva-reisen.com",
  "imprint_url": "http://www.nediva-reisen.com/Impressum",
  "imprint_data": {
    "company_name": "NEDIVA - Reisen GmbH",
    "managing_directors": [
      "Nicole Mayer"
    ],
    "business_address": {
      "street": "Pirmasenser Weg 40",
      "city": "Pirmasens",
      "postal_code": "66954",
      "country": "Germany"
    },
    "phone_numbers": [
      "06331 / 6888 455",
      "06331 / 6888 450"
    ],
    "email_addresses": [
      "nediva@gmx.de"
    ],
    "website_url": null,
    "registration_details": {
      "trade_register": "Handelsregister",
      "registration_number": "HRB 30925",
      "court": "Zweibrücken"
    },
    "vat_id": "DE 282566933",
    "tax_id": "35/666/00029",
    "professional_liability_insurance": null,
    "other_legal_info": {
      "responsible_tax_office": "Pirmasens - Zweibrücken"
    }
  },
  "markdown_content": "NEDIVA-Reisen - Impressum\n\n–\n\nNavigation\n\n* [Home](/Home \"Home\")\n* [Fahrzeuge](/Fahrzeuge \"Fahrzeuge \")\n* [Kontaktformular](/Kontaktformular \"Kontaktformular\")\n* [Impressum](/Impressum \"Impressum\")\n* [Datenschutz](/Datenschutz \"Datenschutz\")\n\nEDIVA\n\n|  |  |  |\n| --- | --- | --- |\n| NEDIVA - Reisen GmbH Nicole Mayer Pirmasenser Weg 40 66954 Pirmasens Tel.:  06331 / 6888 455 Fax.: 06331 / 6888 450 Mail: [nediva@gmx.de](mailto:nediva%40gmx.de?subject=) |  |  |\n\nZuständiges Amtsgericht: Zweibrücken  \n  \nHandelsregistereintrag: HRB 30925  \n  \nZuständiges Finanzamt: Pirmasens - Zweibrücken  \nSt.Nr. [35/666/00029](tel:35/666/00029)  \nU.St.Identnr. DE 282566933  \n  \n  \nKeine Gewähr für Inhalte:  \nNEDIVA - REISEN GmbH ist um Richtigkeit und Aktualität der auf dieser Internetpräsentz bereitgestellten Informationen bemüht. Trotzdem können Fehler und Unklarheiten nicht vollständig ausgeschlossen werden. Wir übernehmen deshalb keine Gewähr für die Aktualität, Richtigkeit, Vollständigkeit oder Qualität der bereitgestellten Informationen.Für Schäden materieller oder immaterieller Art, die durch die Nutzung oder Nichtnutzung der dargebotenen Informationen bzw. durch die Nutzung fehlerhafter und unvollständiger Informationen unmittelbar oder mittelbar verursacht werden, haftet die Firma NEDIVA nicht, sofern ihr nicht nachweislich oder grob fahrlässiges Verschulden zur Last fällt. Die Firma NEDIVA behält sich vor, Teile des Internetangebotes oder das gesamte Angebot ohne gesonderte Ankündigung zu verändern, zu ergänzen, zu löschen oder die Veröffentlichung zeitweise oder entgültig einzustellen.  \n  \nKeine Gewähr für fremde Inhalte:  \nDie Verantwortlichkeit für \"fremde Inhalte\", die beispielsweise durch direkte oder indirekte Verknüfungen (z.B. sogenannte \"Links\") zu anderen Anbietern bereitgehalten werden, setzt unter anderem positive Kenntnis des rechtswidrigen bzw. Strafbaren Inhaltes voraus. NEDIVA hat auf fremde Inhalte keinerlei Einfluss und macht sich diese Inhalte auch nicht zu Eigen. NEDIVA hat keine Kenntnis über rechtswidrige oder anstößige Inhalte auf den mit dieser Internetpräsenz verknüpften Seiten fremder Anbieter. Sollten auf den verknüpften Seiten fremder Anbieter dennoch rechtswidrige oder anstößige Inhalte enthalten sein, so distanziert sich die Firma NEDIVA von diesen Inhalten ausdrücklich.  \n  \nKeine Beratung  \nDie auf den Internet-Seiten bereitgestellten Informationen stellen keine individuelle Beratung dar und können diese nicht ersetzten. Für individuelle Beratungsgespräche stehen wir Ihnen gerne zu unseren Bürozeiten zur Verfügung.  \n  \nUrheberrecht / Nutzung der Internet - Seiten  \nInhalt, Layout, Gestaltung der Internet-Seiten, die verwendeten Grafiken sowie die sonstigen Inhalte der internet-Seiten sind urheberrechtlich geschützt. Eine Vervielfältigung der Seiten oder ihrer Inhalte bedarf der vorherigen schriftlichen Zustimmung von der Firma NEDIVA, soweit die Vervielfältigung nicht ohnehin gesetztlich gestattet ist.\n\nKONTAKT\n\nNEDIVA - Reisen GmbH  \nPirmasenser Weg 40  \n66954 Pirmasens  \nTel.:  06331 / 6888 455  \nFax.: 06331 / 6888 450  \nE-Mail: [nediva@gmx.de](mailto:nediva%40gmx.de?subject=)\n\nBÜROZEITEN  \n  \n**Montag-Freitag**09:00 - 12:00  \n  13:00 - 16:00    \n  sowie nach Vereinbarung **Samstag** **&Sonntag**   \nGeschlossen\n\n[![](//homepagedesigner.telekom.de/imageprocessor/processor.cls/CMTOI/cm4all/com/widgets/PhotoToi/17/82/79/88/15df5926d86/scale_288_0%3Bdonotenlarge/15df5926d86)](https://www.facebook.com/nediva.reisen/)"
}