{
  "timestamp": "20250722_100243",
  "processing_info": {
    "date": "2025-07-22",
    "time": "10:02:57",
    "timezone": "WEST"
  },
  "url": "https://www.vgvs.de",
  "imprint_url": "https://www.vgvs.de/impressum/",
  "imprint_data": {
    "company_name": "Verkehrsgemeinschaft Villingen-Schwenningen GmbH",
    "managing_directors": [
      "Frank Wiest",
      "Jörg Schürmann",
      "Fabienne Maier"
    ],
    "business_address": {
      "street": "Niederwiesenstraße 27-1",
      "city": "Villingen-Schwenningen",
      "postal_code": "78050",
      "country": "Germany"
    },
    "phone_numbers": [
      "07721 22053"
    ],
    "fax_numbers": [
      "07721 22054"
    ],
    "email_addresses": [
      "info@vgvs.de"
    ],
    "website_url": "https://www.vgvs.de/",
    "registration_details": {
      "register_name": "Amtsgericht Villingen-Schwenningen",
      "registration_number": "HRB 1711"
    },
    "vat_id": "DE 142985717",
    "professional_liability_insurance": null,
    "other_information": {
      "website_creation_and_design": "WAS WerbeAgentur",
      "copyright_year": "2025"
    }
  },
  "markdown_content": "Impressum - Verkehrsgemeinschaft\n\n[Zum Inhalt springen](#content \"Zum Inhalt springen\") \n\n[![Verkehrsgemeinschaft](https://www.vgvs.de/wp-content/uploads/2025/02/Logo-VGVS.png)](https://www.vgvs.de/)\n\nMenü \n\n\nMenü \n\n* [VGVS](/#vgvs)\n* [Service](/#service)\n* [VGB](/#vgb)\n* [Karriere](/#karriere)\n* [Kontakt](/#kontakt)\n* [Anfragen](/#kontakt)\n\n# Impressum\n\n**Verkehrsgemeinschaft**  \n**Villingen-Schwenningen GmbH**  \nNiederwiesenstraße 27-1  \n78050 Villingen-Schwenningen  \nTel.: 07721 22053  \nFax: 07721 22054  \nEmail: info@vgvs.de\n\n**Amtsgericht Villingen-Schwenningen**  \nHRB 1711  \nUst.ID Nr. DE 142985717\n\n**Geschäftsführer**  \nHerr Frank Wiest  \nHerr Jörg Schürmann  \nFrau Fabienne Maier\n\n**Konzeption, Gestaltung & Umsetzung**  \nWAS WerbeAgentur\n\n### Haftungsausschluss für unsere Websites\n\n**1. Inhalt des Onlineangebotes**  \nDer Autor dieser Website übernimmt keinerlei Gewähr für die Aktualität, Korrektheit, Vollständigkeit oder Qualität der bereitgestellten Informationen. Haftungsansprüche gegen den Autor, welche sich auf Schäden ideeller oder materieller Art beziehen, die durch die Nutzung oder Nichtnutzung der dargebotenen Informationen bzw. durch die Nutzung fehlerhafter oder unvollständiger Informationen verursacht wurden, sind grundsätzlich ausgeschlossen, sofern seitens des Autors dieser Website kein nachweislich vorsätzliches oder grob fahrlässiges Verschulden vorliegt.\n\nDie Angebote sind freibleibend und unverbindlich. Der Autor behält es sich ausdrücklich vor, Teile dieser Seiten oder das gesamte Angebot ohne gesonderte Ankündigung zu verändern, zu ergänzen, zu löschen und die Veröffentlichung zeitweise oder endgültig und vollkommen einzustellen.\n\n**2. Verweise und Links**  \nBei indirekten und direkten Verweisen auf fremde Webseiten durch Hyperlinks, die außerhalb des Verantwortungsbereiches des Autors liegen, würde eine Haftungsverpflichtung ausschließlich in dem Fall in Kraft treten, in dem der Autor dieser Website von den Inhalten Kenntnis hat und es ihm technisch möglich und sowohl zumutbar wäre, die Nutzung im Falle rechtswidriger Inhalte zu verhindern.\n\nDer Autor dieser Website erklärt hiermit, dass zum Zeitpunkt der Linksetzung keine illegalen Inhalte auf den zu verlinkenden Seiten erkennbar oder ersichtlich waren. Auf die aktuelle / zukünftige Gestaltung, die Inhalte oder die Urheberschaft der gelinkten/verknüpften Seiten hat der Autor dieser Website keinerlei Einfluss. Deshalb distanziert wir uns hiermit ausdrücklich von allen Inhalten aller gelinkten und/oder verknüpften Seiten, die nach der Linksetzung verändert wurden. Diese Feststellung gilt für alle innerhalb dieses eigenen Internetangebotes gesetzten Links und Verweise sowie für Fremdeinträge in vom Autor eingerichteten Gästebüchern, Diskussionsforen / Mailinglisten. Für illegale, fehlerhafte oder unvollständige Inhalte und insbesondere für Schäden, welche aus der Nutzung oder Nichtnutzung solcherart dargebotener Informationen entstehen, haftet allein der Anbieter der Seite, auf welche verwiesen wurde, nicht derjenige, welcher über Links auf die jeweilige Veröffentlichung lediglich verweist.\n\n**3. Urheber- und Kennzeichenrecht**  \nDer Autor dieser Website ist bestrebt, in allen Publikationen die Urheberrechte der verwendeten Tondokumente, Grafiken, Videosequenzen und Texte zu beachten, von ihm selbst erstellte Grafiken, Videosequenzen, Tondokumente und Texte zu nutzen oder auf lizenzfreie Videosequenzen, Grafiken, Tondokumente und Texte zurückzugreifen.\n\nAlle innerhalb des Internetangebotes genannten und evtl. durch Dritte geschützten Waren- und Markenzeichen unterliegen uneingeschränkt den Bestimmungen des jeweils gültigen Kennzeichenrechts und den Besitzrechten der jeweiligen eingetragenen Eigentümer. Allein aufgrund der bloßen Nennung ist nicht der Schluss zu ziehen, das Markenzeichen nicht durch Rechte Dritter geschützt sind.\n\nDas Copyright für veröffentlichte, vom Autor selbst erstellte Objekte bleibt beim Autor der Seiten. Eine Vervielfältigung oder Verwendung der Grafiken, Tondokumente, Videosequenzen und Texte in anderen elektronischen oder gedruckten Publikationen ist ohne ausdrückliche Zustimmung des Autors nicht gestattet.\n\n**4. Datenschutz**  \nSofern innerhalb dieses Internetangebotes die Möglichkeit zur Eingabe persönlicher oder geschäftlicher Daten (E-Mail Adressen, Namen und Anschriften) besteht, so erfolgt die Preisgabe dieser Daten seitens des Nutzers auf ausdrücklich freiwilliger Basis. Die Inanspruchnahme und Bezahlung aller angebotenen Dienste ist - soweit technisch möglich und zumutbar - auch ohne Angabe solcher Daten bzw. unter Angabe anonymisierter Daten oder eines Pseudonyms gestattet. Die Nutzung der im Rahmen dieses Impressums oder vergleichbarer Angaben veröffentlichten Kontaktdaten wie Postanschriften, Telefon und Faxnummern sowie E-Mail Adressen durch Dritte zur Übersendung von nicht ausdrücklich angeforderten Informationen ist nicht gestattet. Rechtliche Schritte gegen die Versender von unaufgeforderten Werbezuschriften und Telefonate, Spam-Mails und bei allen weiteren Verstössen gegen dieses Verbot sind ausdrücklich vorbehalten. Mehr dazu im Datenschutz.\n\n**5. Rechtswirksamkeit dieses Haftungsausschlusses**  \nDieser Haftungsausschluss ist als ein Teil des Internetangebotes zu betrachten, von dem aus auf diese Seite verwiesen wurde. Sofern Teile und einzelne Formulierungen dieses Textes der geltenden Rechtslage nicht mehr oder nicht vollständig entsprechen sollten, bleiben die übrigen Teile des Dokumentes im Inhalt und ihrer Gültigkeit davon unberührt.\n\n![](https://www.vgvs.de/wp-content/uploads/2025/02/Logo-VGVS-2.png)\n\n* [VGVS](/#vgvs)\n* [Service](/#service)\n* [VGB](/#vgb)\n* [Karriere](/#karriere)\n* [Kontakt](/#kontakt)\n* [Buswerbung buchen](/#kontaktformular)\n\nTel.: 07721/22053 | Fax.: 07721 22054 | E-Mail: info@vgvs.de\n\n* [Impressum](https://www.vgvs.de/impressum/)\n* [Datenschutz](https://www.vgvs.de/datenschutzerklaerung/)\n\n© 2025 Verkehrsgemeinschaft • Erstellt mit [GeneratePress](https://generatepress.com)"
}