{
  "timestamp": "20250722_102703",
  "processing_info": {
    "date": "2025-07-22",
    "time": "10:27:21",
    "timezone": "WEST"
  },
  "url": "http://www.kraft-bus.de",
  "imprint_url": "http://www.kraft-bus.de/impressum-929.html",
  "imprint_data": {
    "company_name": "Schülerverkehr Kraft GmbH",
    "managing_directors": [
      "Frank Kraft",
      "Thilo Kraft"
    ],
    "business_address": {
      "street": "Robert-Bosch-Strasse 5-7",
      "city": "Frickenhausen",
      "postal_code": "72636",
      "country": "Germany"
    },
    "phone_numbers": [
      "+49 (0) 70 22 • 2 16 42 - 0",
      "+49 (0) 70 22 • 2 16 42 - 18"
    ],
    "email_addresses": [
      "info@schuelerverkehr-kraft.de"
    ],
    "website_url": "http://www.kraft-bus.de",
    "registration_details": {
      "trade_register": "Registergericht Stuttgart",
      "registration_number": "HRB 762330",
      "court": "Stuttgart"
    },
    "vat_id": "DE313902089",
    "tax_id": null,
    "professional_liability_insurance": null,
    "other_legal_info": {
      "liability_disclaimer": "Details on liability for website content and external links are provided according to German law (§§ 7-10 TMG).",
      "copyright_notice": "Content and works on these pages are subject to German copyright law; reproduction requires written consent."
    }
  },
  "markdown_content": "Impressum - KRAFT Schülerverkehr und Personenbeförderung, KRAFT Busreisen und Busvermietung, KRAFT Autovermietung, mit KFZ-Werkstatt, Frickenhausen, Esslingen, Tübingen, Reutlingen, Metzingen\n\n\n\n### Login\n\nBenutzername\n  \nPasswort\n\n[Register](#) | [Lost your password?](#)\n\n#### Support\n\nLorem ipsum dolor sit amet:\n\n24h / 365days\n\nWe offer support for our customers\n\n**Mon - Fri 8:00am - 5:00pm (GMT +1)**\n\n#### Get in touch\n\n**Cybersteel Inc.**  \n376-293 City Road, Suite 600  \nSan Francisco, CA 94102\n\n**Have any questions?**  \n+44 1234 567 890\n\n**Drop us a line**  \n[info@yourdomain.com](mailto:info@yourdomain.com)\n\n#### About us\n\n**Lorem ipsum dolor sit amet, consectetuer adipiscing elit.**\n\nAenean commodo ligula eget dolor. Aenean massa. Cum sociis natoque penatibus et magnis dis parturient montes, nascetur ridiculus mus. Donec quam felis, ultricies nec.\n\nAnmelden\n\n### LOGIN\n\n|  |  |\n| --- | --- |\n| Benutzername |  |\n| Passwort |  |\n|  | Angemeldet bleiben |\n|  |  |\n\n\n[Navigation überspringen](impressum-929.html#skipNavigation222)\n\n* [Support](http://www.premium-contao-themes.com/ \"Support\")\n\n\n\nHave any Questions?  +01 123 444 555\n\n[info@company.com](mailto:info@company.com)\n\n---\n\nSuchen\n\n\n[Navigation überspringen](impressum-929.html#skipNavigation155)\n\n* 1. [Home](home.html \"Home\")\n  2. [Schülerverkehr](schuelerverkehr.html \"Schülerverkehr\")\n* [Miet-Omnibus](bus-vermietung.html \"Miet-Omnibus\")\n  + [Miet-Wohnmobil](miet-wohnmobil.html \"Miet-Wohnmobil\")\n* [Transporter-Vermietung](transportervermietung.html \"Transporter-Vermietung\")\n* 1. [KFZ-Werkstatt](kfz-werkstatt.html \"KFZ-Werkstatt\")\n  2. [Aktuelles](infos-download.html \"Aktuelles\")\n\n\n\n\n* [Home](home.html \"Home\")\n* [Schülerverkehr](schuelerverkehr.html \"Schülerverkehr\")\n* [Miet-Omnibus](bus-vermietung.html \"Miet-Omnibus\")\n  + [Miet-Wohnmobil](miet-wohnmobil.html \"Miet-Wohnmobil\")\n* [Transporter-Vermietung](transportervermietung.html \"Transporter-Vermietung\")\n* [KFZ-Werkstatt](kfz-werkstatt.html \"KFZ-Werkstatt\")\n* [Aktuelles](infos-download.html \"Aktuelles\")\n\n\n\n[Navigation überspringen](impressum-929.html#skipNavigation214)\n\n* [Über uns](team-kraft.html \"Über uns\")\n  + [Team](team-kraft.html \"Team\")\n* [Kontakt](kontakt.html \"Kontakt\")\n* [Impressum](impressum-929.html \"Impressum\")\n* [Datenschutz](datenschutz-1.html \"Datenschutz\")\n\nImpressum\n\n* [KRAFT](home.html \"KRAFT Schülerverkehr und Personenbeförderung, KRAFT Busreisen und Busvermietung, KRAFT Autovermietung, mit KFZ-Werkstatt, Frickenhausen, Esslingen, Tübingen, Reutlingen, Metzingen\")\n* Impressum\n\n## Impressum\n\n#### Verantwortlich für den Inhalt der Webseite\n\n**Schülerverkehr Kraft** GmbH  \n  \nRobert-Bosch-Strasse 5-7   \nD-72636 Frickenhausen   \n  \nTelefon +49 (0) 70 22 • 2 16 42 - 0   \nTelefax +49 (0) 70 22 • 2 16 42 - 18   \n  \n[info@schuelerverkehr-kraft.de](mailto:info@schuelerverkehr-kraft.de)  \nhttp://www.kraft-bus.de\n\nGeschäftsführer:  \nFrank Kraft, Thilo Kraft\n\nUmsatzsteuer-ID:DE313902089\n\nRegistergericht Stuttgart HRB 762330\n\n#### Haftungshinweis / Disclaimer:\n\n**Haftung für Inhalte**\n\nAls Diensteanbieter sind wir gemäß § 7 Abs.1 TMG für eigene Inhalte auf diesen Seiten nach den allgemeinen Gesetzen verantwortlich. Nach §§ 8 bis 10 TMG sind wir als Diensteanbieter jedoch nicht verpflichtet, übermittelte oder gespeicherte fremde Informationen zu überwachen oder nach Umständen zu forschen, die auf eine rechtswidrige Tätigkeit hinweisen. Verpflichtungen zur Entfernung oder Sperrung der Nutzung von Informationen nach den allgemeinen Gesetzen bleiben hiervon unberührt. Eine diesbezügliche Haftung ist jedoch erst ab dem Zeitpunkt der Kenntnis einer konkreten Rechtsverletzung möglich. Bei Bekanntwerden von entsprechenden Rechtsverletzungen werden wir diese Inhalte umgehend entfernen.\n\n**Haftung für Links**\n\nUnser Angebot enthält Links zu externen Webseiten Dritter, auf deren Inhalte wir keinen Einfluss haben. Deshalb können wir für diese fremden Inhalte auch keine Gewähr übernehmen. Für die Inhalte der verlinkten Seiten ist stets der jeweilige Anbieter oder Betreiber der Seiten verantwortlich. Die verlinkten Seiten wurden zum Zeitpunkt der Verlinkung auf mögliche Rechtsverstöße überprüft. Rechtswidrige Inhalte waren zum Zeitpunkt der Verlinkung nicht erkennbar. Eine permanente inhaltliche Kontrolle der verlinkten Seiten ist jedoch ohne konkrete Anhaltspunkte einer Rechtsverletzung nicht zumutbar. Bei Bekanntwerden von Rechtsverletzungen werden wir derartige Links umgehend entfernen.\n\n**Urheberrecht**\n\nDie durch die Seitenbetreiber erstellten Inhalte und Werke auf diesen Seiten unterliegen dem deutschen Urheberrecht. Die Vervielfältigung, Bearbeitung, Verbreitung und jede Art der Verwertung außerhalb der Grenzen des Urheberrechtes bedürfen der schriftlichen Zustimmung des jeweiligen Autors bzw. Erstellers. Downloads und Kopien dieser Seite sind nur für den privaten, nicht kommerziellen Gebrauch gestattet. Soweit die Inhalte auf dieser Seite nicht vom Betreiber erstellt wurden, werden die Urheberrechte Dritter beachtet. Insbesondere werden Inhalte Dritter als solche gekennzeichnet. Sollten Sie trotzdem auf eine Urheberrechtsverletzung aufmerksam werden, bitten wir um einen entsprechenden Hinweis. Bei Bekanntwerden von Rechtsverletzungen werden wir derartige Inhalte umgehend entfernen.\n\n#### KRAFT Bus\n\nKraft Busunternehmen in Nürtingen, Frickenhausen: Schülerverkehr, Behindertentransport, Busreisen, Transporter-Vermietung, KFZ-Werkstatt\n\nWir halten uns an die [Datenschutzbestimmungen](datenschutz-1.html)\n\n#### Informationen\n\n* [Home](home.html)\n* [Schülerverkehr](schuelerverkehr.html)\n* [Miet-Omnibus](bus-vermietung.html \"Miet-Omnibus\")\n* [Transporter-Vermietung](transportervermietung.html)\n* [KFZ-Werkstatt](kfz-werkstatt.html)\n* [Über uns](team-kraft.html)\n* [Kontakt](kontakt.html)\n\n#### Kontakt\n\nSchülerverkehr Kraft GmbH  \nRobert-Bosch-Strasse 5-7   \nD-72636 Frickenhausen\n\n[+49 (0) 70 22 • 2 16 42 - 0](tel:+497022216420)\n\n+49 (0) 70 22 • 2 16 42 - 18\n\n[info@schuelerverkehr-kraft.de](mailto:info@schuelerverkehr-kraft.de)\n\n<http://www.kraft-bus.de>\n\n#### Social Media\n\nEmpfehlen Sie uns weiter!\n\nCopyright © KRAFT Personenbeförderung Frickenhausen\n\n[Impressum](/impressum-929.html)[Datenschutz](/datenschutz-1.html)\n\nAuf unserer Webseite werden nur technisch notwendige Cookies gesetzt - Session Cookies - für die keine aktive Zustimmung notwendig ist. Die brauchen wir, damit die Webseite korrekt funktioniert. [MEHR DAZU](https://www.kraft-bus.de/datenschutz-1.html)\n\nVerstanden\n\nSearch\n\nSuchbegriffe\n\n\n\n[Navigation überspringen](impressum-929.html#skipNavigation261)\n\n* [Home](home.html \"Home\")\n* [Schülerverkehr](schuelerverkehr.html \"Schülerverkehr\")\n* [Bus-Reisen](bus-reisen.html \"Bus-Reisen\")\n* [Transporter-Vermietung](transportervermietung.html \"Transporter-Vermietung\")\n* [KFZ-Werkstatt](kfz-werkstatt.html \"KFZ-Werkstatt\")\n* [Team](team-kraft.html \"Team\")\n* [Aktuelles](infos-download.html \"Aktuelles\")\n* [Kontakt](kontakt.html \"Kontakt\")\n* [Impressum](impressum-929.html \"Impressum\")"
}