{
  "timestamp": "20250722_103110",
  "processing_info": {
    "date": "2025-07-22",
    "time": "10:31:27",
    "timezone": "WEST"
  },
  "url": "http://www.busreisen-koessler.de",
  "imprint_url": "http://www.busreisen-koessler.de/about/",
  "imprint_data": {
    "company_name": "Kößler GmbH",
    "managing_directors": [
      "Josef Kößler",
      "Manuel Kößler"
    ],
    "business_address": {
      "street": "Zalingerstraße 1",
      "city": "Füssen",
      "postal_code": "87629",
      "country": "Germany"
    },
    "phone_numbers": [
      "+49-8362-4069",
      "+49 8362 9300400"
    ],
    "email_addresses": [
      "info@busreisen-koessler.de"
    ],
    "website_url": "http://www.busreisen-koessler.de/",
    "registration_details": {
      "trade_register": "Handelsregister",
      "registration_number": "HRB 7363",
      "court": "Kempten (Allgäu)"
    },
    "vat_id": "DE 212 830 105",
    "tax_id": null,
    "professional_liability_insurance": null,
    "other_legal_info": {
      "genehmigungsbehoerde": "Landratsamt Ostallgäu",
      "verantwortlich_redaktioneller_inhalt": "Firma Kößler",
      "copyright": "© 2012 Kößler GmbH. Alle Rechte vorbehalten."
    }
  },
  "markdown_content": "Busreisen-Kößler - busreisen-koessler\n\n\n\n\n\n\n\n \n\n\n\n[![](https://image.jimcdn.com/app/cms/image/transf/dimension=950x10000:format=png/path/sdffe1ab8773cc3b6/image/ie0aed993a0690b31/version/1669362684/image.png)](https://www.busreisen-koessler.de/)\n\n* [Home](/)\n* [Über uns](/über-uns/)\n* [Fuhrpark](/fuhrpark/)\n  + [Reisebusse](/fuhrpark/reisebusse/)\n  + [School Bus](/fuhrpark/school-bus/)\n  + [Midibusse](/fuhrpark/midibusse/)\n  + [Kleinbusse](/fuhrpark/kleinbusse/)\n  + [Personenwagen](/fuhrpark/personenwagen/)\n  + [Anhänger](/fuhrpark/anhänger/)\n* [Jobs & Karriere](/jobs-karriere/)\n* [Kontakt / Anfrage](/kontakt-anfrage/)\n* [Shop](/shop/)\n\n## INFORMATION & RECHTLICHES:\n\nFirmensitz:\n\nKößler GmbH\n\nZalingerstraße 1\n\n87629 Füssen\n\n \n\nZweigstelle:\n\nKößler GmbH\n\nTirolerstraße 170\n\n87459 Pfronten\n\n**Geschäftsführer:**\n\nJosef Kößler, Manuel Kößler\n\n**Kontakt:**\n\nTelefon: +49-8362-4069\n\nTelefax: +49-8362-39952\n\neMail: info![](https://www.busreisen-koessler.de/fileadmin/busreisen/templates/images/at.gif)busreisen-koessler.de\n\nInternet: [www.busreisen-koessler.de](http://www.busreisen-koessler.de/)\n\n**Finanzamt Kaufbeuren:**\n\nUSt-IdNr.:DE 212 830 105 (gemäß § 27a Umsatzsteuergesetz)\n\nHandelsregister:  \nHRB 7363 Registergericht Kempten (Allgäu)\n\n**Genehmigungsbehörde:**\n\nLandratsamt Ostallgäu\n\n**Verantwortlich für den redaktionellen Inhalt:**\n\nFirma Kößler\n\n## NUTZUNGSBEDINGUNGEN\n\nDie Bereitstellung von Informationen auf dieser Website erfolgt ausschließlich unter Geltung der folgenden Nutzungsbedingungen, mit denen sich der/die Nutzer/-in durch Nutzung einverstanden\nerklärt:\n\n**Hinweis:**\n\nIm Falle von Domainstreitigkeiten oder wettbewerbsrechtlichen oder anderen Problemen bitten wir Sie, zu Vermeidung unnötiger Rechtsstreite und Kosten, uns bereits im Vorfeld zu kontaktieren.\nDie Kostennote einer anwaltlichen Abmahnung ohne vorhergehende Kontaktaufnahme mit uns wird im Sinne der Schadensminderungspflicht als unbegründet zurückgewiesen.\n\n**Inhalte:**\n\nÄnderung und Irrtum vorbehalten. Die Informationen auf unserer Website werden sorgfältig und in regelmäßigen Abständen bzw. bei aktuellem Anlass überprüft, berichtigt, ergänzt und\naktualisiert.\n\nDennoch können fehlerhafte, unrichtige und/oder lückenhafte Informationen enthalten sein. Auch die Abwesenheit gewerblicher oder geistiger Schutzrechte Dritter kann nicht garantiert werden.\nAlle genannten Firmen-, Produkt- und Markenbezeichnungen sind Eigentum der jeweiligen Inhaber und in der Regel  marken-, gebrauchsmuster- oder patentrechtlich geschützt. Wir machen uns\nkeine fremden Marken zu Eigen.\n\nBitte beachten Sie, dass unsere Website teilweise Informationen enthält, die von Dritten selbst eingestellt werden. Die Verantwortung für diese Inhalte liegt vollständig beim jeweiligen\nAutor.\n\n**Haftung:**\n\nWir übernehmen keine Haftung für unmittelbare oder mittelbare Schäden, die durch die Nutzung dieser Website, das Vertrauen auf die darin enthaltenen Informationen oder den Download von Daten\nund/oder Programmen entstehen. Dies gilt auch für einen möglichen Virenbefall. Die auf unserer Website veröffentlichten Inhalte legen das Recht der Bundesrepublik Deutschland zugrunde. Wir\nübernehmen keine Gewähr dafür, dass die Informationen für die Nutzung an anderen Orten geeignet sind oder sich in Übereinstimmung mit der Gesetzgebung dieser Orte befinden.\n\n**Links:**\n\nDieser Internetauftritt enthält Links zu anderen Internetseiten. Wir erklären ausdrücklich, dass wir keinen Einfluss auf deren Inhalte und die Gestaltung dieser Internetseiten haben und\nmachen uns Ihre Inhalte nicht zueigen.\n\nLinks auf andere Webseiten haben lediglich informativen Charakter und spiegeln nicht zwingend unsere Meinung wieder. Wir haften nicht für die Inhalte fremder Webseiten und übernehmen\ninsbesondere auch keine Verantwortung für deren Inhalte, Funktionsfähigkeit, Fehlerfreiheit oder Rechtmäßigkeit.\n\n**Verlinkung:**\n\nDie Einrichtung von Links von anderen Websites auf zu dieser Website gehörende Seiten bzw. Daten ist gestattet, wir bitten allerdings um eine entsprechende Benachrichtigung.\n\nUnzulässig und ausdrücklich unerwünscht ist allerdings eine Verlinkung, die die Herkunft der Informationen verschleiert. Dies gilt vor allem für die Einbindung oder Darstellung von Seiten\nbzw. Daten in einem Teilfenster (Frame).\n\n**Zitate:**\n\nDie Wiedergabe von Seiten, Texten und/oder Artikeln ist ausschließlich nur dann gestattet, wenn sie in vollem Umfang und ohne irgendeine inhaltliche oder redaktionelle Veränderung\nwiedergegeben werden, und die Quelle mit einem Link zu uns genannt wird.\n\n**Änderungen:**\n\nWir behalten uns vor, jederzeit und unangekündigt Änderungen in den Nutzungsbedingungen vorzunehmen.\n\n**Gültigkeit:**\n\nSollte eine der vorgenannten Klauseln ungültig sein, wird die Gültigkeit der verbleibenden Klauseln hierdurch nicht berührt.\n\n**Rechtlicher Hinweis:**\n\n©  2012 Kößler GmbH. Alle Rechte vorbehalten.\n\nJede Vervielfältigung, auszugsweise oder gewerbliche Nutzung bedarf der vorherigen schriftlichen Genehmigung. Wir behalten uns vor, Änderungen oder Ergänzungen der bereitgestellten\nInformationen oder Daten jederzeit und ohne Ankündigung vorzunehmen.\n\n**Datenschutzerklärung:**\n\nSpeicherung von Zugriffsdaten. Bei jeder Anforderung einer Datei aus der Webseite werden Zugriffsdaten gespeichert.\n\n* der Seite, von der aus die Datei angefordert wurde\n* dem Namen der Datei\n* dem Datum und Uhrzeit der Anforderung der übertragene Datenmenge\n* dem Zugriffsstatus (Datei übertragen, Datei nicht gefunden etc.)\n* einer Beschreibung des Typs des verwendeten Webbrowsers\n* IP-Adresse des anfragenden Rechners\n\nDie gespeicherten Daten werden ausschließlich zu internen statistischen Zwecken ausgewertet. Persönliche oder geschäftliche Daten (E-Mail Adressen, Namen, Anschriften) werden grundsätzlich\nnicht an Dritte weitergegeben, außer es ist im Zuge der vertraglichen Leistungserfüllung unumgänglich.\n\n**Rechtswirksamkeit dieses Haftungsausschlusses**\n\nDieser Haftungsausschluss ist als Teil des Internetangebotes zu betrachten, von dem aus auf diese Seite verwiesen wurde. Sofern Teile oder einzelne Formulierungen dieses Textes der geltenden\nRechtslage nicht, nicht mehr oder nicht vollständig entsprechen sollten, bleiben die übrigen Teile des Dokumentes in ihrem Inhalt und ihrer Gültigkeit davon unberührt.\n\n  \n  \n\n## Diese Seite wurde mit Jimdo erstellt!\n\n[![Jimdo](https://assets.jimstatic.com/s/img/cms/siteadmin/newlogostuff/jimdologo2015.png \"Jimdo\")](https://de.jimdo.com?utm_medium=about%20box&utm_source=business)\n\nMit Jimdo kann sich jeder kostenlos und ohne Vorkenntnisse eine eigene Homepage gestalten. Design auswählen, Klick für Klick anpassen, Inhalte in Sekunden integrieren, fertig!   \nJetzt unter [de.jimdo.com](https://de.jimdo.com?utm_medium=about%20box&utm_source=business) für eine kostenlose Webseite anmelden und sofort loslegen.\n\n\n\n![](https://image.jimcdn.com/app/cms/image/transf/dimension=259x10000:format=png/path/sdffe1ab8773cc3b6/image/i2a496bb1d549c538/version/1669195765/image.png)\n\n### Busreisen Kößler GmbH\n\nSchäfflerstr. 12\n\n87629 Füssen\n\nTel: +49 8362 9300400\n\nFax: +49 8362 930040 20\n\nE-Mail: info@busreisen-koessler.de\n\n![](https://image.jimcdn.com/app/cms/image/transf/dimension=152x10000:format=jpg/path/sdffe1ab8773cc3b6/image/ib2187caeb0b82e2b/version/1669188353/image.jpg)\n\n1 Gilt für Lieferungen in folgendes Land: Deutschland. Lieferzeiten für andere Länder und Informationen zur Berechnung des Liefertermins siehe hier: [Liefer- und Zahlungsbedingungen](https://www.busreisen-koessler.de/j/shop/deliveryinfo)  \n2 inkl. MwSt.\n\n[Impressum](/about/) | [Liefer- und Zahlungsbedingungen](//www.busreisen-koessler.de/j/shop/deliveryinfo) | [Datenschutz](//www.busreisen-koessler.de/j/privacy) | [Cookie-Richtlinie](javascript:window.CookieControl.showCookieSettings();) | [Sitemap](/sitemap/)\n\n[Anmelden](/login)\n\n[Abmelden](https://cms.e.jimdo.com/app/cms/logout.php) \n|\n[Bearbeiten](https://a.jimdo.com/app/auth/signin/jumpcms/?page=2421669349)\n\n[zuklappen](# \"Dieses Element zuklappen\")"
}