{
  "timestamp": "20250722_100528",
  "processing_info": {
    "date": "2025-07-22",
    "time": "10:05:52",
    "timezone": "WEST"
  },
  "url": "http://www.domhan-reisen.de",
  "imprint_url": "https://www.domhan-reisen.de/impressum/",
  "imprint_data": {
    "company_name": "Domhan GmbH",
    "managing_directors": null,
    "business_address": {
      "street": "Gmünder Straße 37",
      "city": null,
      "postal_code": null,
      "country": "Germany"
    },
    "phone_numbers": [
      "+49 (0) 7171 82372"
    ],
    "email_addresses": [
      "info@domhan-reisen.de"
    ],
    "website_url": "https://www.domhan-reisen.de/",
    "registration_details": {
      "type": "Handelsregister",
      "number": "HRB 701931",
      "court": null
    },
    "vat_id": null,
    "tax_id": null,
    "professional_liability_insurance": null,
    "other_relevant_information": {
      "fax_number": "+49 (0) 7171 88190",
      "impressum_source_generator": "http://www.e-recht24.de",
      "legal_links": {
        "data_protection_policy": "https://www.domhan-reisen.de/datenschutzerklaerung/",
        "dispute_resolution": "https://www.domhan-reisen.de/streitbeilegung/",
        "travel_conditions": "https://www.domhan-reisen.de/reisebedingungen/"
      },
      "disclaimer_summary": "The page includes disclaimers regarding liability for content and links, and copyright information. The service provider (Domhan GmbH) is responsible for its own content but not obliged to monitor third-party information. Links to external sites are not constantly controlled, and content will be removed upon knowledge of legal violations. Content is subject to German copyright law, allowing private, non-commercial use."
    }
  },
  "markdown_content": "Impressum – Omnibus-Reisen\n\n\n\n[Zum Inhalt springen](#content) \n\n[![Omnibus-Reisen](https://www.domhan-reisen.de/wp-content/uploads/2016/11/cropped-2016-11-21_Logo-Pfeile_03.jpg)](https://www.domhan-reisen.de/)\n\n[Omnibus-Reisen](https://www.domhan-reisen.de/)\n\nMenü und Widgets\n\n* [Reisen 2025](https://www.domhan-reisen.de/reisen-2025/)\n  + [Tagesreisen](https://www.domhan-reisen.de/tagesreisen/)\n    - [Samstag, 05.04.2025 Heidelberg  \n      Domhans „Mach-was-de-willsch-Fahrten“](https://www.domhan-reisen.de/samstag-05-04-2025-heidelberg/)\n    - [Mittwoch, 23.04.2025  \n      Osterei-Fahrt auf die schwäbische Alb](https://www.domhan-reisen.de/mittwoch-23-04-2025-osterei-fahrt/)\n    - [Samstag, 07.06.2025 München  \n      Domhans „Mach-was-de-willsch-Fahrten“](https://www.domhan-reisen.de/samstag-07-06-2025-muenchen/)\n    - [Samstag, 06.09.2025 Friedrichshafen  \n      Domhans „Mach-was-de-willsch-Fahrten“](https://www.domhan-reisen.de/samstag-06-09-2025-friedrichshafen/)\n    - [Dienstag, 16.09.2025  \n      Hillu’s Herzdropfa im Alb Stadl – Schwäbische Comedy](https://www.domhan-reisen.de/dienstag-16-09-2025-hillus-herzdropfa-im-alb-stadl/)\n    - [Sonntag, 28.09.2025  \n      Zur „Älplerletze“ am Fellhorn](https://www.domhan-reisen.de/sonntag-28-09-2025-zur-aelplerletze-am-fellhorn/)\n    - [Samstag, 18.10.2025 Nürnberg  \n      Domhans „Mach-was-de-willsch-Fahrten“](https://www.domhan-reisen.de/samstag-18-10-2025-nuernberg/)\n    - [Mittwoch, 19.11.2025  \n      Traditionelle Nikolausfahrt](https://www.domhan-reisen.de/mittwoch-19-11-2025-traditionelle-nikolausfahrt/)\n    - [Sonntag, 30.11.2025  \n      …zum Zillertaler Weihnachtskonzert im Alb Stadl mit Rita & Andreas](https://www.domhan-reisen.de/sonntag-30-11-2025-alb-stadl-weihnachtskonzert/)\n    - [Samstag, 06.12.2025  \n      Weihnachtliches Allgäu: Wangener Weihnachtsmarkt](https://www.domhan-reisen.de/samstag-06-12-2025-wangener-weihnachtsmarkt/)\n  + [Mehrtagesreisen](https://www.domhan-reisen.de/mehrtagesreisen/)\n    - [5 Tage 18.04.-22.04.2025  \n      Ostern in der steirischen Krakau](https://www.domhan-reisen.de/5-tage-18-04-22-04-2025ostern-in-der-steirischen-krakau/)\n    - [8 Tage 11.05.-18.05.2025  \n      Genießerwoche in Bad Kissingen](https://www.domhan-reisen.de/8-tage-11-05-18-05-2025geniesserwoche-in-bad-kissingen/)\n    - [4 Tage 03.08.-06.08.2025  \n      Ostschweizer Bergwelt: Der Säntis](https://www.domhan-reisen.de/4-tage-03-08-06-08-2025ostschweizer-bergwelt-der-saentis/)\n    - [4 Tage 21.10.-24.10.2025  \n      Zum Bierfest in Kaltern mit Vincent & Fernando](https://www.domhan-reisen.de/4-tage-21-10-24-10-2025brzum-bierfest-in-kaltern-mit-vincent-fernando/)\n  + [Theater- und Musicalfahrten](https://www.domhan-reisen.de/theater-und-musicalfahrten/)\n    - [Samstag, 12.04.2025  \n      Theaterscheuer Ebersbach – „No koin Domma an Deigsel“](https://www.domhan-reisen.de/samstag-12-04-2025-theaterscheuer-ebersbach/)\n    - [Samstag, 26.07.2025  \n      Freilichtspiele Schwäbisch Hall  \n      Musical: „West Side Story“](https://www.domhan-reisen.de/samstag-26-07-2025-freilichtspiele-schwaebisch-hall/)\n    - [Freitag 08.08.2025  \n      Bregenzer Festspiele „Der Freischütz“](https://www.domhan-reisen.de/freitag-08-08-2024-bregenzer-festspiele-der-freischuetz/)\n    - [Samstag, 16.08.2025  \n      „Elisabeth“ – das Musical  \n      Festspielhaus Neuschwanstein](https://www.domhan-reisen.de/samstag-16-08-2025-elisabeth-festspielhaus-neuschwanstein/)\n    - [Sonntag, 21.12.2025  \n      „Der Geist der Weihnacht“ – Musical  \n      Festspielhaus Neuschwanstein](https://www.domhan-reisen.de/sonntag-21-12-2025-der-geist-der-weihnacht-musicalfestspielhaus-neuschwanstein/)\n* [Informationen](https://www.domhan-reisen.de/informationen/)\n  + [Fuhrpark](https://www.domhan-reisen.de/fuhrpark/)\n  + [Reisebedingungen](https://www.domhan-reisen.de/reisebedingungen/)\n  + [Pauschalreisen](https://www.domhan-reisen.de/pauschalreisen/)\n  + [Ihre Vorteile](https://www.domhan-reisen.de/ihre-vorteile/)\n* [Haustür-Service](https://www.domhan-reisen.de/haustuer-service/)\n* [Kooperation](https://www.domhan-reisen.de/kooperation/)\n* [Kontakt](https://www.domhan-reisen.de/kontakt/)\n* [Impressum](https://www.domhan-reisen.de/impressum/)\n* [Datenschutzerklärung](https://www.domhan-reisen.de/datenschutzerklaerung/)\n* [Streitbeilegung](https://www.domhan-reisen.de/streitbeilegung/)\n\nSuche nach:\n\n# Impressum\n\n## Angaben gemäß § 5 DDG:\n\nDomhan GmbH\n\nGmünder Straße 37\n\nHandelsregister HRB 701931\n\n## Kontakt:\n\n|  |  |\n| --- | --- |\n| Telefon: | +49 (0) 7171 82372 |\n| Telefax: | +49 (0) 7171 88190 |\n| E-Mail: | [info@domhan-reisen.de](mailto:info@domhan-reisen.de) |\n\nQuelle: *[http://www.e-recht24.de](http://www.e-recht24.de/impressum-generator.html)*\n\n# Haftungsausschluss (Disclaimer)\n\n**Haftung für Inhalte**\n\nAls Diensteanbieter sind wir für eigene Inhalte auf diesen Seiten nach den allgemeinen Gesetzen verantwortlich. Nach §§ 7 und 8 Digitale-Dienste-Gesetz (DDG)  sind wir als Diensteanbieter jedoch nicht verpflichtet, übermittelte oder gespeicherte fremde Informationen zu überwachen oder nach Umständen zu forschen, die auf eine rechtswidrige Tätigkeit hinweisen. Verpflichtungen zur Entfernung oder Sperrung der Nutzung von Informationen nach den allgemeinen Gesetzen bleiben hiervon unberührt. Eine diesbezügliche Haftung ist jedoch erst ab dem Zeitpunkt der Kenntnis einer konkreten Rechtsverletzung möglich. Bei Bekanntwerden von entsprechenden Rechtsverletzungen werden wir diese Inhalte umgehend entfernen.\n\n**Haftung für Links**\n\nUnser Angebot enthält Links zu externen Webseiten Dritter, auf deren Inhalte wir keinen Einfluss haben. Deshalb können wir für diese fremden Inhalte auch keine Gewähr übernehmen. Für die Inhalte der verlinkten Seiten ist stets der jeweilige Anbieter oder Betreiber der Seiten verantwortlich. Die verlinkten Seiten wurden zum Zeitpunkt der Verlinkung auf mögliche Rechtsverstöße überprüft. Rechtswidrige Inhalte waren zum Zeitpunkt der Verlinkung nicht erkennbar. Eine permanente inhaltliche Kontrolle der verlinkten Seiten ist jedoch ohne konkrete Anhaltspunkte einer Rechtsverletzung nicht zumutbar. Bei Bekanntwerden von Rechtsverletzungen werden wir derartige Links umgehend entfernen.\n\n**Urheberrecht**\n\nDie durch die Seitenbetreiber erstellten Inhalte und Werke auf diesen Seiten unterliegen dem deutschen Urheberrecht. Die Vervielfältigung, Bearbeitung, Verbreitung und jede Art der Verwertung außerhalb der Grenzen des Urheberrechtes bedürfen der schriftlichen Zustimmung des jeweiligen Autors bzw. Erstellers. Downloads und Kopien dieser Seite sind nur für den privaten, nicht kommerziellen Gebrauch gestattet. Soweit die Inhalte auf dieser Seite nicht vom Betreiber erstellt wurden, werden die Urheberrechte Dritter beachtet. Insbesondere werden Inhalte Dritter als solche gekennzeichnet. Sollten Sie trotzdem auf eine Urheberrechtsverletzung aufmerksam werden, bitten wir um einen entsprechenden Hinweis. Bei Bekanntwerden von Rechtsverletzungen werden wir derartige Inhalte umgehend entfernen.\n\n[Datenschutzerklärung](https://www.domhan-reisen.de/datenschutzerklaerung/)\n\n\n\n[Datenschutzerklärung](https://www.domhan-reisen.de/datenschutzerklaerung/) [Mit Stolz präsentiert von WordPress](https://de.wordpress.org/)"
}