{
  "timestamp": "20250722_103338",
  "processing_info": {
    "date": "2025-07-22",
    "time": "10:33:46",
    "timezone": "WEST"
  },
  "url": "https://www.bus-fecht.de",
  "imprint_url": "https://www.bus-fecht.de/about/",
  "imprint_data": {
    "company_name": "Fecht Omnibus GmbH",
    "managing_directors": [
      "Gerhard Fecht"
    ],
    "business_address": {
      "street": "Industriestraße 8",
      "city": "Meßkirch",
      "postal_code": "88605",
      "country": "D"
    },
    "phone_numbers": [
      "+49 7575-858",
      "+49 7771 929753"
    ],
    "email_addresses": [
      "info@fecht-reisen.de"
    ],
    "website_url": "https://www.bus-fecht.de/",
    "registration_details": {
      "trade_register": "Registergericht Ulm",
      "registration_number": "HRB 710807",
      "court": "Ulm"
    },
    "vat_id": "DE 186809482",
    "tax_id": null,
    "professional_liability_insurance": null,
    "other_legal_info": {
      "imprint_status_date": "Januar 2012",
      "liability_for_content": "Despite careful creation, no guarantee for correctness, completeness, or topicality of content. As service provider, responsible for own content. No obligation to monitor third-party information.",
      "liability_for_links": "No influence or guarantee for external third-party content. Responsibility lies with the respective provider/operator. Links are removed upon knowledge of legal violations.",
      "copyright": "Content and works created by site operators are subject to German copyright law. Third-party contributions are marked. Reproduction, editing, distribution, and any kind of exploitation outside copyright limits require written consent. Downloads/copies for private, non-commercial use only.",
      "data_protection_note": "Personal data collected on a voluntary basis where possible. Usage of services possible without personal data. Expressly contradict use of contact data for unsolicited advertising (spam-mails)."
    }
  },
  "markdown_content": "Impressum - Fecht Omnibus GmbH - Meßkirch & Stockach\n\n\n\n\n\n\n\n \n\n\n\n[FECHT OMNIBUS GMBH Messkirch & Stockach](https://www.bus-fecht.de/)\n\n* [Linienverkehr](/)\n* [Bus-Charter](/bus-charter/)\n* [Feedback](/feedback/)\n* [Jobs](/jobs/)\n* [Standorte](/standorte/)\n\n\n\n[![](https://image.jimcdn.com/app/cms/image/transf/dimension=551x10000:format=png/path/sd9321033bd9c06f1/image/i3138035ed6ab291d/version/1505768709/image.png)](https://www.bus-fecht.de/)\n\n**Fecht Omnibus GmbH**\n\nIndustriestraße 8\n\nD-88605 Meßkirch\n\nTel. +49 7575-858\n\nFax  +49 7575-4715\n\ninfo@fecht-reisen.de\n\nGeschäftsführer: Gerhard Fecht\n\nUSt.-Ident. Nr. DE 186809482\n\nRegistergericht Ulm HRB 710807\n\n**Haftung für Inhalte**\n\nDie Inhalte unserer Seiten wurden mit größter Sorgfalt erstellt. Für die Richtigkeit, Vollständigkeit und Aktualität der Inhalte können wir jedoch keine Gewähr übernehmen. Als Diensteanbieter\nsind wir gemäß § 6 Abs.1 MDStV und § 8 Abs.1 TDG für eigene Inhalte auf diesen Seiten nach den allgemeinen Gesetzen verantwortlich. Diensteanbieter sind jedoch nicht verpflichtet, die von ihnen\nübermittelten oder gespeicherten fremden Informationen zu überwachen oder nach Umständen zu forschen, die auf eine rechtswidrige Tätigkeit hinweisen. Verpflichtungen zur Entfernung oder Sperrung\nder Nutzung von Informationen nach den allgemeinen Gesetzen bleiben hiervon unberührt. Eine diesbezügliche Haftung ist jedoch erst ab dem Zeitpunkt der Kenntnis einer konkreten Rechtsverletzung\nmöglich. Bei bekannt werden von entsprechenden Rechtsverletzungen werden wir diese Inhalte umgehend entfernen.\n\n**Haftung für Links**\n\nUnser Angebot enthält Links zu externen Webseiten Dritter, auf deren Inhalte wir keinen Einfluss haben. Deshalb können wir für diese fremden Inhalte auch keine Gewähr übernehmen. Für die Inhalte\nder verlinkten Seiten ist stets der jeweilige Anbieter oder Betreiber der Seiten verantwortlich. Die verlinkten Seiten wurden zum Zeitpunkt der Verlinkung auf mögliche Rechtsverstöße überprüft.\nRechtswidrige Inhalte waren zum Zeitpunkt der Verlinkung nicht erkennbar. Eine permanente inhaltliche Kontrolle der verlinkten Seiten ist jedoch ohne konkrete Anhaltspunkte einer Rechtsverletzung\nnicht zumutbar. Bei bekannt werden von Rechtsverletzungen werden wir derartige Links umgehend entfernen.\n\n**Urheberrecht**\n\nDie Betreiber der Seiten sind bemüht, stets die Urheberrechte anderer zu beachten bzw. auf selbst erstellte sowie lizenzfreie Werke zurückzugreifen. Die durch die Seitenbetreiber erstellten\nInhalte und Werke auf diesen Seiten unterliegen dem deutschen Urheberrecht. Beiträge Dritter sind als solche gekennzeichnet. Die Vervielfältigung, Bearbeitung, Verbreitung und jede Art der\nVerwertung außerhalb der Grenzen des Urheberrechtes bedürfen der schriftlichen Zustimmung des jeweiligen Autors bzw. Erstellers. Downloads und Kopien dieser Seite sind nur für den privaten, nicht\nkommerziellen Gebrauch gestattet.\n\n**Datenschutz**\n\nSoweit auf unseren Seiten personenbezogene Daten (beispielsweise Name, Anschrift oder eMail-Adressen) erhoben werden, erfolgt dies soweit möglich stets auf freiwilliger Basis. Die Nutzung der\nAngebote und Dienste ist, soweit möglich, stets ohne Angabe personenbezogener Daten möglich. Der Nutzung von im Rahmen der Impressumspflicht veröffentlichten Kontaktdaten durch Dritte zur\nÜbersendung von nicht ausdrücklich angeforderter Werbung und Informationsmaterialien wird hiermit ausdrücklich widersprochen. Die Betreiber der Seiten behalten sich ausdrücklich rechtliche\nSchritte im Falle der unverlangten Zusendung von Werbeinformationen, etwa durch Spam-Mails, vor.\n\n**Mietomnibusbedingungen**\n\n**Vertragsbedingungen der Firma Fecht Omnibus GmbH und Fecht Bus GmbH für die Anmietung von Omnibussen**\n\nSehr geehrte Kunden,\n\ndie nachfolgenden Mietomnibusbedingungen, nachfolgend „MOB“ abgekürzt, werden, soweit wirksam vereinbart, Inhalt des\nVertrages, der im Falle der Anmietung von Omnibussen zwischen uns, der Firma Fecht Omnibus GmbH\nbzw. Fecht Bus GmbH, nachfolgend als „Busunternehmen“ bezeichnet und „FB“ abgekürzt, und dem Auftraggeber, nachfolgend „AG“ abgekürzt, zu Stande kommt. Bitte lesen Sie diese MOB vor der\nAuftragserteilung sorgfältig durch. Wir empfehlen die Mitführung dieser MOB während der Fahrt, die\nUnterrichtung Ihrer Reiseleiter und sonstigen Beauftragten sowie Ihrer Fahrgäste über den Inhalt dieser Vertragsbedingungen, damit diese sich jederzeit über ihre Rechte und Pflichten als AG und deren Auswirkungen für das Verhalten der Reiseleiter, Beauftragten und Fahrgäste selbst\norientieren können.\n\n \n\n1. Rechtsgrundlagen, Anwendungsbereich dieser Geschäftsbedingungen\n\n1.1. Auf die gesamten Rechts- und Vertragsbeziehungen zwischen FB und dem AG finden in erster Linie die im Einzelfall getroffenen Vereinbarungen (insbesondere zu Preisen und Leistungen), soweit wirksam vereinbart diese Vertragsbedingungen und hilfsweise die Vorschriften des\nMietrechts über die Anmietung beweglicher Sachen\n\n(§§ 535 ff. BGB) Anwendung.\n\n1.2. Diese Vertragsbedingungen gelten, soweit wirksam vereinbart, für Verträge mit natürlichen Personen und Gruppen, soweit der Vertrag weder ihrer gewerblichen, noch ihrer selbstständigen beruflichen Tätigkeit zugerechnet werden kann (Verbraucher im Sinne von §13 BGB). Diese\nVertragsbedingungen gelten auch für Verträge mit\n\ngewerblichen oder selbstständigen Auftraggebern, soweit diese den Vertrag in Ausübung ihrer gewerblichen oder selbstständigen beruflichen Tätigkeit abschließen (Unternehmer i.S. von § 14 BGB).\n\n1.3. Folgende Vertragsbestimmungen gelten nur für Unternehmer als AG:\n\na) Diese Vertragsbedingungen gelten auch für alle künftigen Verträge des AG mit FB und zwar auch dann, wenn diese Vertragsbedingungen\n\nnicht ausdrücklich vereinbart, in Bezug genommen oder für anwendbar erklärt worden sind.\n\nb) Allgemeine Geschäftsbedingungen des AG haben für das Vertragsverhältnis mit FB keine Gültigkeit und zwar auch dann nicht, wenn sie vom AG für anwendbar erklärt wurden und auch dann nicht, wenn FB diesen\nBedingungen nicht widerspricht.\n\n1.4. Auf das Vertrags- und Rechtsverhältnis zwischen dem AG und FB anwendbare zwingende gesetzliche Bestimmungen, insbesondere des Gewerberechts und des Personenbeförderungsrechts, sowie anwendbare Vorschriften aus Verordnungen der Europäischen Union (insbesondere der\nFahrgastrechteverordnung), bleiben durch\n\ndiese Vertragsbestimmungen unberührt.\n\n2. Vertragsabschluss\n\n2.1. Der AG kann sein Interesse an der Anmietung eines Busses mündlich, telefonisch, schriftlich, per E-Mail, per Telefax und – soweit FB dies auf seiner Internetseite vorsieht – online mit einem entsprechenden Anfrageformular übermitteln.\n\n2.2. FB unterrichtet den AG auf der Grundlage der übermittelten Angaben über die zur Verfügung stehenden Fahrzeuge, die Preise, Leistungen und sonstigen Konditionen. Diese Unterrichtung stellt noch kein verbindliches Vertragsangebot FB an den AG dar. Gleichzeitig unterrichtet FB den AG über die\nForm einer eventuellen Auftragserteilung.\n\n2.3. Mit der Auftragserteilung bietet der AG der Firma FB den Abschluss eines Mietvertrages verbindlich an. Soweit in der Unterrichtung FB über die Vertragskonditionen keine bestimmte Form ausdrücklich vorgegeben ist, kann die Auftragserteilung mündlich, schriftlich, telefonisch, per E-Mail, per Telefax oder – soweit FB so vorgesehen\n\n– online erfolgen.\n\n2.4. Wird seitens FB die Möglichkeit einer verbindlichen Onlinebuchung über die Internetseite von FB angeboten, so informiert FB den AG im Internetauftritt über die einzelnen Schritte zur verbindlichen Buchung und den weiteren Ablauf des Vertragsabschlusses. Die Onlinebuchung wird in diesem\nFall seitens des AG durch Anklicken des\n\nButtons „Zahlungspflichtig buchen“ in dem Sinne verbindlich, dass der AG durch Anklicken dieses Buttons von FB ein verbindliches Vertragsangebot auf Abschluss eines Mietvertrages unterbreitet, welches im Falle der Annahme dieses Vertragsangebotes durch FB zum\nzahlungspflichtigen Vertragsabschluss mit dem AG führt. Die Regelungen in Ziff. 2.3 bis 2.7 gelten\nfür diesen Buchungsablauf entsprechend.\n\n2.5. An das mit der Auftragserteilung erfolgende Vertragsangebot ist der AG, soweit keine andere Frist ausdrücklich vereinbart ist, 7 Werktage gebunden.\n\n2.6. Grundlage des Vertragsangebots des AG an FB sind die Angaben zum Fahrzeug, zu Preisen und Leistungen in der Unterrichtung über die Vertragskonditionen nach Ziff. 2.2 sowie diese Vertragsbedingungen.\n\n2.7. Der Vertrag kommt für FB und den AG rechtsverbindlich mit Zugang der Auftragsbestätigung von FB beim AG zu Stande.\n\n2.8. Unterbreitet FB, gegebenenfalls nach vorheriger Klärung der Verfügbarkeit der vom AG gewünschten oder in Aussicht genommenen Mietomnibusleistungen, ein ausdrücklich als verbindlich bezeichnetes Angebot, so\nkommt der Vertrag abweichend von den Regelungen in Ziff. 2.1 bis 2.3 und 2.5 bis 2.7 wie folgt zu\nStande:\n\na) In diesem Fall stellt das Angebot FB das verbindliche Angebot auf Abschluss eines entsprechenden Mietvertrages auf der Grundlage der in diesem Angebot bezeichneten Preise und Leistungen und dieser MOB dar.\n\nb) Der Vertrag kommt rechtsverbindlich dadurch zu Stande, dass der AG dieses Angebot ohne Erweiterungen, Einschränkungen oder sonstige Änderungen in der von FB vorgegebenen Form annimmt und\nFB diese Annahmeerklärung innerhalb einer gegebenenfalls von FB vorgegebenen Frist zugeht. FB ist\nberechtigt, aber nicht\n\nverpflichtet, verspätet eingehende Annahmeerklärungen anzunehmen. Es wird davon den AG unverzüglich unterrichten.\n\nc) FB wird dem AG den Eingang seiner Annahmeerklärung bestätigen. Der Vertrag ist in diesem Fall jedoch rechtsverbindlich bereits mit Eingang der Annahmeerklärung des AG bei FB abgeschlossen und\ndie Rechtsverbindlichkeit des Vertrages damit nicht vom Zugang dieser Eingangsbestätigung beim AG\nabhängig.\n\n2.9. Bei Gruppen, Behörden, Vereinen, Institutionen und Firmen ist Auftraggeber und Vertragspartner von FB ausschließlich die jeweilige Gruppe, Behörde usw., bzw. der jeweilige Rechtsträger, soweit die Auftragserteilung nicht ausdrücklich für eine andere natürliche oder juristische\nPerson oder Personenmehrheit als AG erfolgt oder sich\n\naus den Umständen ergibt, dass die Auftragserteilung in deren Namen erfolgen soll. Die Person, welche\nfür eine Gruppe, Behörde, einen Verein, eine Institution oder eine Firma den Auftrag erteilt, hat\nfür die Verpflichtungen des AG, für den sie handelt, wie für ihre eigenen Verpflichtungen\neinzustehen, soweit sie diese besondere Einstandspflicht durch\nausdrückliche und gesonderte Erklärung übernommen hat oder nach den gesetzlichen Bestimmungen (§ 179 BGB) als Vertreter ohne\n\nVertretungsmacht gehandelt hat.\n\n3. Leistungen und Umfang der Vertragspflichten des BU, termingebundene Transporte, Sitzplatzzuweisungen\n\n3.1. Die Leistungspflicht von FB besteht in der mietweisen Überlassung des Fahrzeugs einschließlich des/der Fahrer(s) zur Personenbeförderung nach Maßgabe der vertraglichen Vereinbarungen. FB schuldet demnach nicht die Beförderung selbst im Sinne eines werkvertraglichen Erfolges.\n\n3.2. Der Anlass und/oder der Zweck der vertragsgegenständlichen Beförderung ist ohne diesbezügliche ausdrückliche Vereinbarung mit FB nicht Vertragsgrundlage. Der Wegfall oder die Änderung von Anlass und\nZweck (ganz oder teilweise), insbesondere der Wegfall oder Ausfall von Zielorten, Veranstaltungen,\nBesuchen oder Ähnlichem\n\nbegründen daher keinen Anspruch des AG auf einen kostenlosen Vertragsrücktritt, eine Kündigung, eine Preisreduzierung oder sonstige Anpassungen des Vertrages.\n\n3.3. Dient der vertraglich geschuldete Einsatz des Busses der termingebundenen Erreichung von Zielen oder Veranstaltungen, so gilt:\n\na) FB plant unter Berücksichtigung der Streckenführung, der Witterung, der Lenkzeiten und notwendiger Pausen den Zeitbedarf und den sich hieraus ergebenden Abfahrtszeitpunkt.\n\nb) Es obliegt dem AG, insbesondere soweit dieser Unternehmer ist, und insbesondere soweit der AG über entsprechende Erfahrungen mit dem Ziel, der Veranstaltung und/oder der Strecke verfügt, entsprechende Hinweise und Bedenken zur geplanten Streckenführung oder zum Zeitbedarf\nrechtzeitig gegenüber FB vorzubringen.\n\nc) Soweit FB keine vertraglichen oder gesetzlichen Verpflichtungen verletzt, haftet FB nicht für das rechtzeitige Erreichen des Ziels, bzw. der Veranstaltung. Durch die Verspätung verursachte Kosten des AG oder seiner Fahrgäste gehen zu Lasten des AG.\n\nd) Trifft FB zur Vermeidung von Verspätungen oder als deren Folge nach Anweisung oder in Übereinstimmung mit dem AG bzw. dessen Beauftragten Maßnahmen (z.B. Kommunikation, Einsatz zusätzlicher Fahrer, Nutzung alternativer Verkehrsmittel), so hat der AG an FB die\nentsprechenden Aufwendungen zu erstatten.\n\n3.4. Die Leistungspflicht von FB umfasst nicht die Beaufsichtigung der Fahrgäste. Bei der Beförderung von Minderjährigen übernimmt FB insbesondere keine vertragliche Aufsichtspflicht.\n\n3.5. Für die Leistungspflicht von FB bei behinderten Personen oder Personen mit eingeschränkter Mobilität gilt:\n\na) Hilfs- und Betreuungsleistungen sind von FB nur dann geschuldet, wenn dies ausdrücklich vereinbart ist.\n\nb) Den AG trifft die Pflicht, FB bereits vor Vertragsschluss auf die voraussichtliche Zahl hilfsbedürftiger Personen hinzuweisen und genaue Angaben über deren Einschränkungen und Hilfsbedürfnisse zu\nmachen; die Angaben sind rechtzeitig vor Fahrtbeginn zu ergänzen und zu konkretisieren. Macht eine\nwesentliche Erhöhung\n\nder Zahl hilfsbedürftiger Personen gegenüber den Angaben vor Vertragsschluss den Einsatz eines anderen Busses, zusätzlicher Fahrer oder sonstige besondere Maßnahmen erforderlich, so hat der AG hierfür ein\nbesonderes Entgelt über die vereinbarte Vergütung hinaus zu bezahlen.\n\n3.6 FB trifft keine Verpflichtung zur Beaufsichtigung von Sachen, die der AG oder seine Fahrgäste im Fahrgastraum des Fahrzeugs zurücklassen; ebenso trifft FB keine Verpflichtung zur Beaufsichtigung des Gepäcks beim Be- und Entladen. Hiervon unberührt bleiben Ansprüche des\nAG und seiner Fahrgäste aufgrund von Pflichtverletzungen von FB und/oder des Fahrers bezüglich\ndes ordnungsgemäßen Abstellens und des Verschlusses des Busses und der Gepäckfächer sowie diesbezüglicher technischer Mängel des Busses.\n\n3.7. Soweit etwas Anderes nicht ausdrücklich vereinbart wurde, gilt für Informationen und Bestimmungen im Zusammenhang mit der Fahrt, vor allem bei Fahrten ins Ausland:\n\na) FB ist nicht verpflichtet, dem AG oder seinen Fahrgästen Hinweise zu Visa-, Einreise-, Devisen- und Zollbestimmungen zu erteilen. Der AG ist selbst für die Beachtung dieser Bestimmungen, deren Einhaltung sowie die Beschaffung notwendiger Dokumente, Genehmigungen und\nUnterlagen verantwortlich. Er ist verpflichtet, seine\n\nFahrgäste zur Einhaltung der Bestimmungen und zur Mitführung entsprechender Unterlagen, Ausweispapiere und Dokumente anzuhalten.\n\nb) FB schuldet dem AG keine Hinweise zu rechtlichen Konsequenzen, welche sich aus der Anmietung des Busses, dem Anlass, dem Ziel, dem Zweck und der Durchführung der Fahrt ergeben. Insbesondere obliegt es ausschließlich dem AG zu überprüfen, ob er mit der Erteilung des\nAuftrages an FB und/oder der Durchführung der\n\nFahrt in die Rechtsstellung eines Pauschalreiseveranstalters gelangt oder bezüglich der Fahrt in sonstiger Weise eigene vertragliche oder gesetzliche Verpflichtungen des AG seinerseits gegenüber seinen Fahrgästen begründet werden. Zur Einhaltung entsprechender Vorschriften\nist der AG ausschließlich selbst verpflichtet.\n\nc) FB ist ohne ausdrückliche Vereinbarung mit dem AG nicht verpflichtet, über die ihm nach den gesetzlichen Bestimmungen obliegenden Versicherungen hinaus Versicherungen zu Gunsten des AG oder\nseiner Fahrgäste abzuschließen oder auf solche Versicherungen hinzuweisen. Dies gilt insbesondere\nfür Reiserücktrittskostenversicherungen, Reiseabbruchversicherungen oder\nVersicherungen zur Deckung der Kosten einer Rückführung bei Unfall oder Krankheit.\n\n3.8. Im Rahmen geltender gesetzlicher Bestimmungen (insbesondere der Beachtung von Vorschriften durch FB betreffend Bustransporte von behinderten Personen oder Personen mit eingeschränkter Mobilität) liegen die Zuweisung bestimmter Sitzplätze im Bus sowie diesbezügliche\nvertragliche Vereinbarungen mit den Fahrgästen\n\nausschließlich im Ermessen und im Zuständigkeitsbereich des AG.\n\n3.9. FB, dessen Fahrer oder sonstige Beauftragte trifft ohne ausdrückliche diesbezügliche vertragliche Vereinbarung keine Verpflichtung, bestimmte Sitzplatzzuweisungen zu organisieren, umzusetzen und\nsicherzustellen; insbesondere besteht diesbezüglich keine Verpflichtung zur Information oder zur\nAnweisung gegenüber den\n\nFahrgästen.\n\n3.10. FB, dessen Fahrer oder sonstige Beauftragte sind jedoch berechtigt, Sitzplatzzuweisungen des AG oder seiner Fahrer oder Beauftragten zu ändern, insbesondere Fahrgästen verbindlich andere als die\nvorgesehenen oder mit dem AG vereinbarten Sitzplätze zuzuweisen, falls dies aufgrund der Erfüllung\ngesetzlicher Pflichten (insbesondere gegenüber behinderten Fahrgästen oder Fahrgästen\nmit eingeschränkter Mobilität) oder aus Sicherheitsgründen\nerforderlich ist. Dies gilt auch, soweit sich eine solche Sitzplatzzuweisung\nals eine Maßnahme darstellt, die aus den in Ziff. 10.5 a) bis f)\ngenannten Gründen an Stelle eines Ausschlusses von der Beförderung\ngetroffen wird.\n\n4. Leistungsänderungen, Änderungen bezüglich des eingesetzten Fahrzeugs\n\n4.1. Änderungen wesentlicher vertraglicher Leistungen, insbesondere eine Änderung des vorgesehenen Fahrzeugtyps, die nach Vertragsabschluss notwendig werden und FB nicht wider Treu und Glauben herbeigeführt wurden, sind nur gestattet, soweit die Änderungen nicht\nerheblich sind und den Vertragszweck nicht beeinträchtigen.\n\n4.2. Eventuelle Gewährleistungsansprüche bleiben unberührt, soweit die geänderten Leistungen mit Mängeln behaftet sind.\n\n4.3. FB ist verpflichtet, den AG über wesentliche Leistungsänderungen unverzüglich nach Kenntnis vom Änderungsgrund zu informieren.\n\n4.4. Im Fall einer erheblichen Änderung einer wesentlichen vertraglichen\n\nLeistung ist der AG berechtigt, unentgeltlich vom Vertrag zurückzutreten. Der AG hat dieses Recht unverzüglich nach der Erklärung von FB über die erhebliche Änderung der vertraglichen Leistungen dieser\ngegenüber geltend zu machen.\n\n4.5. Wird aufgrund eines einseitigen Änderungswunsches des AG, für dessen Berücksichtigung kein vertraglicher oder gesetzlicher Anspruch des AG besteht, oder aufgrund entsprechender Vereinbarungen im Vertrag oder nach Vertragsabschluss eine Reduzierung der\nSitzplatzkapazität, der Streckenführung, der Streckenlänge, der\n\nVertragsdauer oder sonstiger wesentlicher vertraglicher Leistungen vorgenommen, so ist FB berechtigt, ein anderes als das vertraglich vorgesehene Fahrzeug, gegebenenfalls an Stelle eines Fahrzeugs maximal zwei andere oder kleinere Fahrzeuge, einzusetzen. Diese Fahrzeuge dürfen\nnach Art und Ausstattung qualitativ vom vertraglich vereinbarten Fahrzeug abweichen. Eventuelle\nMinderungsansprüche des AG im Falle eines solchen ersatzweisen\nEinsatzes bleiben unberührt.\n\n4.6. Die Regelung in Ziff. 4.5 gilt entsprechend, wenn der Einsatz eines vertraglich vorgesehenen Fahrzeugs durch Umstände unmöglich\n\ngeworden ist, die außerhalb des Risiko- und Herrschaftsbereichs FB liegen. Hierzu zählen insbesondere der Ausfall durch höhere\n\nGewalt (Witterungsschäden, Diebstahl, Vandalismus) sowie Schäden durch Kfz-Unfälle, welche nicht von FB oder dessen Erfüllungs- oder Verrichtungsgehilfen zu vertreten sind.\n\n5. Preise, Zahlung\n\n5.1. Es gilt der bei Vertragsabschluss vereinbarte Mietpreis, soweit nichts anderes vereinbart ist oder soweit nicht die Voraussetzungen einer Preiserhöhung gemäß Ziffer 6. dieser Vertragsbedingungen gegeben sind.\n\n5.2. Im vereinbarten Mietpreis sind die Kosten für Treibstoff, Öl und sonstige Betriebsmittel und die Personalkosten für den/die Fahrer nach Maßgabe der vereinbarten Miet-/Einsatzzeit und der vereinbarten Fahrtstrecke enthalten. Sonstige Zusatz- und Nebenkosten, insbesondere Maut- und\nParkgebühren, trägt der AG. FB wird den\n\nAG, soweit möglich, vor Vertragsabschluss über die Art und die voraussichtliche Höhe solcher Zusatz- und Nebenkosten informieren. Sind Übernachtungs- und Verpflegungskosten für den Fahrer im Preis nicht\nbeinhaltet, so wird FB den AG hierauf vor Vertragsabschluss (insbesondere im Angebot) hinweisen.\n.\n\n5.3. Mehrkosten, die aufgrund vom AG gewünschter Leistungsänderungen anfallen, werden zusätzlich berechnet.\n\n5.4. Rechnungen sind nach Erhalt ohne Abzug zahlungsfällig. Andere Zahlungsarten als in bar oder durch Banküberweisung sind nur möglich, wenn dies zuvor ausdrücklich vereinbart wurde. Zahlungen in Fremdwährungen sind ausdrücklich ausgeschlossen.\n\n5.5. Überweisungen, vor allem aus dem Ausland, haben kosten- und spesenfrei zu erfolgen.\n\n5.6. Für die Rechtzeitigkeit von Zahlungen kommt es auf die Gutschrift auf dem Konto von FB an.\n\n5.7. Sind Vorauszahlungen vereinbart, so gilt, dass FB, soweit es zur Erbringung der vertraglichen Leistungen bereit und in der Lage ist und kein gesetzliches oder vertragliches Zurückbehaltungsrecht des AG besteht, nach Mahnung mit Fristsetzung berechtigt ist, vom Vertrag\nzurückzutreten und den AG mit Rücktrittskosten gemäß Ziff. 7. dieser Bedingungen zu\nbelasten.\n\n5.8. Befindet sich der AG gegenüber FB mit unbestrittenen Zahlungsforderungen aus früheren Verträgen oder aufgrund gesetzlicher Zahlungsansprüche\n\nvon FB in Verzug, so kann FB die Erbringung der vertraglichen Leistungen aus späteren Aufträgen verweigern, bis die unbestrittene Forderung einschließlich Verzugszinsen, Mahnkosten, Gerichts- und\nAnwaltskosten vollständig bezahlt sind. Der AG kann die Zahlung zur Abwendung des\nZurückbehaltungsrechts von FB unter Rückforderungsvorbehalt leisten. Besteht Zahlungsverzug\nmit bestrittenen vertraglichen oder gesetzlichen\nZahlungsansprüchen, so kann FB vertragliche Leistungen aus späteren Verträgen\nverweigern, soweit der AG nicht zuvor Sicherheit durch unbedingte,\nunwiderrufliche und selbstschuldnerische Bankbürgschaft oder durch\n\nHinterlegung auf einem Treuhandkonto eines von FB bestimmten Rechtsanwalts oder Notars leistet.\n\n6. Preiserhöhung\n\n6.1. Soweit im Einzelfall nichts anderes vereinbart wurde, ist FB berechtigt, eine Preiserhöhung bis zu 10% des vertraglich vereinbarten Preises zu verlangen bei einer Erhöhung von Kraftstoffkosten, Personalkosten sowie Steuern und Abgaben, soweit sich diese Erhöhung auf den vereinbarten\nMietpreis auswirkt.\n\n6.2. Eine Erhöhung ist nur zulässig, sofern zwischen Vertragsabschluss und dem vertraglich vereinbarten Beginn der Beförderungsleistung mehr als 4 Monate liegen und die zur Erhöhung führenden Umstände vor Vertragsabschluss noch nicht eingetreten und bei Vertragsabschluss für FB\nnicht vorhersehbar waren. FB hat den AG\n\nunverzüglich nach Bekanntwerden des Erhöhungsgrundes zu unterrichten, die Erhöhung geltend zu machen und den Erhöhungsgrund nachzuweisen.\n\n6.3. Im Falle einer zulässigen Erhöhung, die 3% des vereinbarten Grundmietpreises übersteigt, kann der AG ohne Zahlungsverpflichtung gegenüber FB vom Vertrag zurücktreten. Die Rücktrittserklärung bedarf keiner\nbestimmten Form und ist FB gegenüber unverzüglich nach Zugang des Erhöhungsverlangens zu erklären.\nDem AG wird\n\nfür die Rücktrittserklärung zur Vermeidung von Missverständnissen jedoch die Schriftform oder Textform (E-Mail) empfohlen.\n\n7. Rücktritt und Kündigung durch den Auftraggeber\n\n7.1. Die nachfolgenden Vorschriften gelten nur, soweit zwischen FB und dem AG im Einzelfall nichts anderes vereinbart ist. Rücktrittsrechte kraft Handelsbrauch werden ausdrücklich ausgeschlossen.\n\n7.2. Ohne ausdrückliche diesbezügliche Vereinbarung ist der AG nicht berechtigt, einseitig eine Reduzierung bzw. Änderung der Sitzplatzkapazität, der Einsatzzeit, der Vertragsdauer, der Streckenführung, der Streckenlänge, des vertraglich vorgesehenen Fahrzeugtyps oder sonstiger\nwesentlicher vertraglicher Leistungen zu verlangen.\n\nStimmt FB solchen Änderungen zu, stehen ihm die Rechte nach Ziff. 4.5 dieser Vertragsbedingungen zu. Ein Anspruch auf Minderung des vereinbarten Mietpreises kommt nur gem. Ziff. 4.5 bei ersatzweisem Fahrzeugeinsatz in Betracht.\n\n7.3. Der AG kann jederzeit vor Leistungsbeginn vom Vertrag zurücktreten. Vertragspartner, die Kaufleute oder juristische Personen des privaten oder öffentlichen Rechts sind, haben einen Rücktritt in Schriftform oder in elektronischer Textform zu erklären. Anderen AG wird dringend empfohlen, den Rücktritt schriftlich oder in elektronischer\n\nTextform zu erklären.\n\n7.4. Im Falle eines Rücktritts hat sich FB im Rahmen seines gewöhnlichen Geschäftsbetriebes und ohne eine Verpflichtung zu besonderen Anstrengungen zu bemühen, den vertraglich vereinbarten Bus, bzw.\ndie vertraglich vereinbarten Beförderungskapazitäten anderweitig zu verwenden.\n\n7.5. FB hat sich auf den Vergütungsanspruch die Einnahmen aus einer anderweitigen Verwendung anrechnen zu lassen. Ist eine anderweitige Verwendung des Busses bzw. der vertraglich vereinbarten Beförderungskapazitäten nicht möglich, so bleibt der Anspruch FB auf Bezahlung\ndes vollen Mietpreises bestehen. FB hat sich jedoch\n\nersparte Aufwendungen anrechnen zu lassen.\n\n7.6. Die ersparten Aufwendungen können von FB mit einem pauschalen Abzug von 30% des Mietpreises angesetzt werden. Dieser Abzug berücksichtigt ersparte Kraftstoff- und Personalkosten.\n\n7.7. Dem AG bleibt es ausdrücklich vorbehalten, FB nachzuweisen, dass ihm kein oder nur ein wesentlich geringerer Ausfall entstanden ist und/oder dass die ersparten Aufwendungen wesentlich höher waren als der pauschale Abzug von 30%. Es bleibt dem AG außerdem der Nachweis\nvorbehalten, dass eine anderweitige Verwendung\n\nder nicht in Anspruch genommenen vertraglichen Leistungen (insbesondere ein anderweitiger Einsatz des Busses) seitens von FB erfolgt ist oder ohne sachlich rechtfertigenden Grund unterlassen wurde. Im Falle solcher Nachweise hat der AG keine oder nur eine entsprechend\ngeringere Entschädigung zu bezahlen.\n\n7.8. Der Anspruch von FB besteht nur dann, wenn FB zum Zeitpunkt des Rücktritts zur Erbringung der vertraglich geschuldeten Leistungen bereit und in der Lage war, die Nichtinanspruchnahme nicht auf einem Umstand beruht, den FB zu vertreten hat und kein Fall der höheren Gewalt vorliegt. Ein Anspruch auf Entschädigung besteht\n\nebenfalls nicht, wenn der Rücktritt darauf zurückzuführen ist, dass FB erhebliche und für den AG nicht zumutbare Leistungsänderungen vorgenommen oder angekündigt hat.\n\n8. Rücktritt und Kündigung durch das BU\n\n8.1. FB kann außer dem in diesen Vertragsbedingungen geregelten Fall eines Zahlungsverzuges des AG\n\n• vom Vertrag vor Fahrtantritt zurücktreten\n\n• oder den Vertrag nach Leistungsbeginn (Fahrtantritt) kündigen,\n\na) wenn der AG trotz entsprechender Abmahnung von FB vertragliche oder gesetzliche Pflichten in erheblicher Weise verletzt oder solche Pflichtverletzungen objektiv zu erwarten sind und wenn solche Pflichtverletzungen objektiv geeignet sind, die ordnungsgemäße Erbringung der vertraglichen Leistungen durch FB erheblich zu gefährden,\n\nzu erschweren oder zu beeinträchtigen. FB ist beim Vorliegen dieser Voraussetzungen zum Rücktritt bzw. zur Kündigung nur dann berechtigt, wenn FB ein Festhalten am Vertrag aufgrund der Pflichtverletzung auch unter Berücksichtigung der Interessen des AG an der\nDurchführung des Vertrages objektiv nicht zumutbar ist.\n\nb) soweit der AG und/oder seine Beauftragten und/oder seine Fahrgäste gegen Sicherheitsbestimmungen verstoßen oder in anderer Weise objektiv die Sicherheit des Busses, des Fahrers, der Insassen des\nBusses oder anderer Verkehrsteilnehmer oder sonstiger Dritter gefährden,\n\nc) wenn die Erbringung der Leistung durch höhere Gewalt oder durch eine Erschwerung, Gefährdung oder Beeinträchtigung erheblicher Art durch nicht vorhersehbare Umstände wie Krieg oder kriegsähnliche Vorgänge, Feindseligkeiten, Aufstand oder Bürgerkrieg, Verhaftung, Beschlagnahme oder Behinderung durch Staatsorgane\n\noder andere Personen, Straßenblockaden, Quarantänemaßnahmen sowie von ihm nicht zu vertretende Streiks, Aussperrungen oder Arbeitsniederlegungen erheblich erschwert, gefährdet oder beeinträchtigt wird\n\n8.2. Im Falle eines Rücktritts oder einer Kündigung nach Ziff. 8.1 lit. a) und b) bleibt der Anspruch FB auf die vereinbarte Vergütung bestehen. Die Regelungen in Ziff. 7.5 bis 7.7 gelten entsprechend.\n\n8.3. Im Falle einer Kündigung von FB nach Fahrtantritt aus den in Ziff. 8.1 lit. c) genannten Gründen ist FB auf Wunsch des AG verpflichtet, die Fahrgäste zurückzubefördern, wobei ein Anspruch auf die Rückbeförderung nur mit einem Bus besteht. Die Pflicht zur Rückbeförderung entfällt, wenn und soweit die Rückbeförderung für FB\n\nunmöglich oder auch unter Berücksichtigung der Interessen des AG und/oder seiner Teilnehmer unzumutbar ist. Entstehen bei einer solchen Kündigung Mehrkosten für die Rückbeförderung als solche, so sind diese vom AG und FB je zur Hälfte zu tragen. Anderweitige Mehrkosten,\ninsbesondere Kosten für eine zusätzliche Verpflegung oder Unterbringung der Fahrgäste des AG, trägt\nder AG.\n\n8.4. Kündigt FB den Vertrag aus den in Ziff. 8.1 lit. c) genannten Gründen, so steht ihm eine angemessene Vergütung für die bereits erbrachten und die nach dem Vertrag noch zu erbringenden Leistungen zu,\nsofern letztere für FB trotz der Kündigung noch von Interesse sind.\n\n9. Beschränkung der Haftung von FB\n\n9.1. Die Haftung von FB bei vertraglichen Ansprüchen ist, ausgenommen die Haftung für Sachschäden, für die Ziff. 9.2 gilt, auf den 10-fachen Mietpreis beschränkt. Diese Haftungsbeschränkung gilt nicht,\n\na) für Schäden aus der Verletzung des Lebens, des Körpers oder der Gesundheit, die auf einer fahrlässigen Pflichtverletzung von FB oder einer vorsätzlichen oder fahrlässigen Pflichtverletzung eines gesetzlichen Vertreters oder Erfüllungsgehilfen von FB beruhen,\n\nb) für Ansprüche aus sonstigen Schäden, die auf einer grob fahrlässigen Pflichtverletzung von FB oder auf einer vorsätzlichen oder grob fahrlässigen Pflichtverletzung eines gesetzlichen Vertreters oder\nErfüllungsgehilfen von FB beruhen,\n\nc) für typische und vorhersehbare Schäden aus der fahrlässigen Verletzung von Hauptleistungspflichten von FB 9.2. § 23 PBefG bleibt unberührt. Die Haftung für Sachschäden ist damit ausgeschlossen, soweit der Schaden je befördertem Gepäckstück 1.200,- €\nübersteigt und nicht auf Vorsatz oder grober Fahrlässigkeit beruht. Pflichten und Haftung des\nAuftraggebers, seiner Mitarbeiter und seiner Fahrgäste, Mängelrügen (Beschwerden),\nInformationen über Verbraucherstreitbeilegung\n\n10. Kündigung aus verhaltensbedingten Gründen\n\n10.1. Dem AG obliegt die Verantwortung für das Verhalten seiner Fahrgäste während der Beförderung.\n\n10.2. Anweisungen des Fahrers oder sonstiger Mitarbeiter von FB ist seitens des AG, seiner Reiseleiter oder sonstiger Beauftragten und seiner Fahrgäste Folge zu leisten,\n\na) soweit sich diese Anweisungen auf die Durchführung und Einhaltung gesetzlicher Vorschriften im Inland und Ausland, insbesondere auf die Einhaltung von Sicherheitsvorschriften und Einreisevorschriften beziehen,\n\nb) soweit solche Anweisungen objektiv berechtigt sind, um einen ordnungsgemäßen Fahrtablauf zu ermöglichen oder sicherzustellen,\n\nc) soweit die Anweisungen dazu dienen, unzumutbare Beeinträchtigungen für den Fahrer und/oder die Fahrgäste zu verhindern oder zu unterbinden.\n\n10.3. Der AG haftet selbst, gegebenenfalls gesamtschuldnerisch mit seinen Fahrgästen, Reiseleitern oder Beauftragten für Sach- oder Vermögensschäden von FB, die durch seine Fahrgäste, Reiseleiter oder Beauftragte verursacht wurden, insbesondere Schäden am Fahrzeug, soweit für\ndie Entstehung des Schadens die Verletzung\n\neigener vertraglicher oder gesetzlicher Pflichten des AG ursächlich oder mit ursächlich geworden ist und der AG nicht nachweist, dass weder er noch seine Fahrgäste, Reiseleiter oder Beauftragten den Schaden zu vertreten haben.\n\n10.4. Gemäß § 21 StVO sind vorgeschriebene Sicherheitsgurte während der Fahrt anzulegen. Sitzplätze dürfen nur kurzzeitig verlassen werden. Jeder Fahrgast ist verpflichtet, sich im Fahrzeug stets einen festen Halt zu verschaffen, insbesondere beim kurzzeitigen Verlassen des Sitzplatzes. Der AG hat, insbesondere durch entsprechende ausdrückliche\nschriftliche oder mündliche Informationen an seine Fahrgäste und durch entsprechende Instruktion\nseiner Reiseleiter oder sonstigen Beauftragten, die Einhaltung dieser\nSicherheitsvorschriften durch die Fahrgäste sicherzustellen.\n\n10.5. Fahrgäste, die trotz Ermahnung den sachlich – insbesondere nach den vorliegenden Bestimmungen – begründeten Anweisungen des Fahrers oder sonstigen Beauftragten von FB nicht nachkommen, können von der Beförderung ausgeschlossen und aus dem Bus gewiesen werden, wenn\ndurch die Nichtbefolgung der Anweisungen\n\na) eine Verletzung gesetzlicher Vorschriften im Inland oder im Ausland eintritt oder andauert,\n\nb) Sicherheitsvorschriften verletzt werden,\n\nc) die Sicherheit der Fahrgäste auch ohne eine Verletzung von Sicherheitsvorschriften objektiv gefährdet oder beeinträchtigt wird,\n\nd) eine ordnungsgemäße Durchführung der Fahrt objektiv erheblich erschwert, gefährdet oder beeinträchtigt wird,\n\ne) die Fahrgäste erheblich in unzumutbarer Weise beeinträchtigt werden\n\nf) aus anderen erheblichen Gründen die Weiterbeförderung für FB auch unter Berücksichtigung der Interessen des betroffenen Fahrgastes an der Weiterbeförderung objektiv unzumutbar ist.\n\n10.6. Im Falle eines berechtigten Ausschlusses von der Beförderung besteht ein Anspruch auf Rückbeförderung oder Rückgriffsansprüche des AG gegenüber von FB nicht.\n\n10.7. Mängelrügen (Beschwerden) über die Art und Weise der Durchführung der Fahrt und/oder das eingesetzte Fahrzeug und/oder die Fahrweise oder das Verhalten des Fahrers oder sonstiger Beauftragter sowie\nüber die Mängel sonstiger vertraglicher Leistungen von FB sind zunächst an den Fahrer oder die\nsonstigen Beauftragten\n\ndes FB zu richten. Der AG hat seine Reiseleiter oder sonstigen verantwortlichen Beauftragten anzuhalten, unabhängig davon, ob entsprechende Beschwerden durch die Fahrgäste selbst erfolgen oder bereits erfolgt sind, entsprechende Mängelrügen gegenüber dem Fahrer oder\nsonstigen Beauftragten des AG vorzunehmen.\n\n10.8. Der Fahrer oder sonstige Beauftragte von FB sind angehalten und berechtigt, begründeten Mängelrügen abzuhelfen. Sie sind berechtigt, die Abhilfe zu verweigern, wenn diese Abhilfe nicht oder nur mit unverhältnismäßigem Aufwand möglich ist. Im Falle einer solchen Verweigerung der Abhilfe bleiben Ansprüche des AG, insbesondere\n\nauf Minderung des Preises oder auf Schadensersatz unberührt. Der AG ist verpflichtet, bei der Behebung von Leistungsstörungen im Rahmen des ihm Zumutbaren mitzuwirken, um eventuelle Schäden zu\nvermeiden oder so gering wie möglich zu halten. Er hat seine Reiseleiter oder sonstigen\nBeauftragten vor Beginn der Fahrt zu einem\n\nentsprechenden Verhalten anzuhalten.\n\n10.9 FB nimmt nicht an einer freiwilligen Verbraucherstreitbeilegung teil. Sofern eine Verbraucherstreitbeilegung nach Drucklegung dieser Reisebedingungen für FB verpflichtend würde, informiert FB die Verbraucher hierüber in geeigneter Form. FB weist für alle Reiseverträge, die\nnach Ziffer 2.4 im elektronischen\n\nRechtsverkehr geschlossen wurden, auf das Verbraucher Streitbeilegungsgesetzt (VSBG) hin.\n\n11. Verjährung\n\n11.1. Vertragliche Ansprüche des AG aus der Verletzung des Lebens, des Körpers oder der Gesundheit, die auf einer vorsätzlichen oder fahrlässigen Pflichtverletzung von FB oder eines gesetzlichen Vertreters oder Erfüllungsgehilfen von FB beruhen, verjähren in drei Jahren. Dies gilt auch für Ansprüche auf den Ersatz sonstiger Schäden,\n\ndie auf einer vorsätzlichen oder grob fahrlässigen Pflichtverletzung von FB oder eines gesetzlichen Vertreters oder Erfüllungsgehilfen von FB beruhen.\n\n11.2. Alle übrigen vertraglichen Ansprüche verjähren in einem Jahr.\n\n11.3. Die Verjährung nach Ziff. 11.1 und 11.2 beginnt mit dem Schluss des Kalenderjahres, in dem der Anspruch entstanden ist, jedoch nicht früher als zu dem Zeitpunkt, zu dem der AG vom Anspruchsgrund und FB als Anspruchsgegner Kenntnis erlangt oder ohne grobe Fahrlässigkeit\nKenntnis erlangt haben müsste. Fällt der letzte\n\nTag der Frist auf einen Sonntag, einen staatlich anerkannten allgemeinen Feiertag oder einen Sonnabend, so tritt an die Stelle eines solchen Tages der nächste Werktag.\n\n11.4. Schweben zwischen dem AG und FB Verhandlungen über den Anspruch oder die den Anspruch begründenden Umstände, so ist die Verjährung gehemmt, bis der AG oder FB die Fortsetzung der Verhandlungen verweigert. Die Verjährung tritt frühestens drei Monate nach dem Ende der Hemmung\nein.\n\n11.5. Durch die vorstehenden Bestimmungen bleiben zwingende gesetzliche Verjährungsregelungen, insbesondere aus der Haftung von FB oder seiner Erfüllungs- und Verrichtungsgehilfen (insbesondere der Fahrer)\nnach Haftungsbestimmungen des Straßenverkehrs-, des Kraftfahrzeug- und des\nPersonenbeförderungsrechts, unberührt.\n\nGegenüber AG, die Unternehmer sind, gilt dies nur insoweit, als auch mit diesen abweichenden Vereinbarungen nicht zulässig sind.\n\n12. Besondere Regelungen im Zusammenhang mit Pandemien (insbesondere dem Corona-Virus)\n\n12.1. Die Parteien sind sich einig, dass die vereinbarten Mietomnibusleistungen durch FB stets unter Einhaltung und nach Maßgabe der zum jeweiligen Leistungszeitpunkt geltenden behördlichen Vorgaben und\nAuflagen erbracht werden.\n\n12.2. Die Parteien vereinbaren ausdrücklich, dass im Rahmen dieser Vereinbarung ein Kündigungsrecht aufgrund höherer Gewalt oder unzumutbarer Leistungsänderungen aufgrund behördlicher Auflagen zur\nDurchführung von Reisen ausgeschlossen ist.\n\n12.3. Der Kunde erklärt sich einverstanden, angemessene Nutzungsregelungen oder -beschränkungen von FB bei der Inanspruchnahme von Leistungen zu beachten und alle Fahrgäste anzuweisen, im Falle von auftretenden typischen Krankheitssymptomen die Geschäftsstelle von FB und den\nFahrer unverzüglich zu verständigen.\n\n12.4. Der Vertrag wird ausdrücklich unter dem Rücktrittsvorbehalt des BU vereinbart, dass die Beförderung der vertraglich vereinbarten maximalen Personenanzahl (ohne ausdrückliche Vereinbarung gilt die zugelassenen Maximalkapazität an Reisegästen des vereinbarten Busses) zum\nZeitpunkt der Leistungserbringung nach denen\n\nfür die Mietomnibusfahrt geltenden behördlichen Auflagen jederzeit zulässig ist.\n\n13. Rechtswahl und Gerichtsstand\n\n13.1. Auf das Vertragsverhältnis zwischen dem AG und FB findet ausschließlich deutsches Recht Anwendung. Dies gilt auch für das gesamte Rechtsverhältnis.\n\n13.2. Soweit bei Klagen des AG gegen FB im Ausland für die Haftung von FB dem Grunde nach nicht deutsches Recht angewendet wird, findet bezüglich der Rechtsfolgen, insbesondere hinsichtlich Art, Umfang und Höhe von Ansprüchen des AG, ausschließlich deutsches Recht\nAnwendung.\n\n13.3. Der AG kann FB nur an dessen Sitz verklagen.\n\n13.4. Für Klagen von FB gegen den AG ist der Wohn-/Geschäftssitz des AG maßgebend. Für Klagen gegen AG, die Kaufleute, juristische\n\nPersonen des öffentlichen oder privaten Rechts oder Personen oder Unternehmen sind, die ihren Wohn-/Geschäftssitz oder gewöhnlichen Aufenthaltsort im Ausland haben, oder deren Wohn-/ Geschäftssitz oder gewöhnlicher Aufenthalt im Zeitpunkt der Klageerhebung nicht\nbekannt ist, wird als Gerichtsstand der Sitz von FB vereinbart.\n\n13.5. Die vorstehenden Bestimmungen gelten nicht,\n\na) wenn und insoweit sich aus vertraglich nicht abdingbaren Bestimmungen internationaler Abkommen, die auf den Vertrag zwischen dem AG und FB anzuwenden sind, etwas anderes zugunsten des AG\nergibt oder\n\nb) wenn und insoweit auf den Vertrag anwendbare, nicht abdingbare Bestimmungen im Mitgliedstaat der EU, dem der AG angehört, für den AG günstiger sind als die nachfolgenden Bestimmungen oder die\nentsprechenden deutschen Vorschriften.\n\n\\_\\_\\_\\_\\_\\_\\_\\_\\_\\_\\_\\_\\_\\_\\_\\_\\_\\_\\_\\_\\_\\_\\_\\_\\_\\_\\_\\_\\_\\_\\_\\_\\_\\_\\_\\_\\_\\_\\_\\_\\_\\_\\_\\_\\_\\_\\_\\_\\_\\_\\_\\_\\_\\_\\_\\_\\_\\_\\_\\_\\_\\_\\_\\_\\_\\_\\_\\_\n\n© Urheberrechtlich geschützt;\n\nNoll | Hütten | Dukic Rechtsanwälte, München | Stuttgart, 2020\n\n\\_\\_\\_\\_\\_\\_\\_\\_\\_\\_\\_\\_\\_\\_\\_\\_\\_\\_\\_\\_\\_\\_\\_\\_\\_\\_\\_\\_\\_\\_\\_\\_\\_\\_\\_\\_\\_\\_\\_\\_\\_\\_\\_\\_\\_\\_\\_\\_\\_\\_\\_\\_\\_\\_\\_\\_\\_\\_\\_\\_\\_\\_\\_\\_\\_\\_\\_\\_  \n\n**Reisebedingungen für Pauschalangebote (nicht für den Mietomnibusverkehr)**\n\n1. Abschluss des Reisevertrages a) Der Reisevertrag soll schriftlich mit den Formularen des Reiseveranstalters (Reiseanmeldung und Reisebestätigung) abgeschlossen werden. Sämtliche Abreden,\nNebenabreden und Sonderwünsche sollen schriftlich erfasst werden. Bei Vertragsschluss oder unverzüglich danach wird dem Reisenden die vollständige Reisebestätigung ausgehändigt. Dazu ist der\nReiseveranstalter nicht verpflichtet, wenn es sich um eine kurzfristige Buchung weniger als sieben Werktage vor Reisebeginn handelt. b) An die Reiseanmeldung ist der Reisende zwei Wochen\ngebunden. Innerhalb dieser Frist wird die Reise durch den Veranstalter bestätigt. Kurzfristige Buchungen zwei Wochen vor Reisebeginn und kürzer führen durch die sofortige Bestätigung bzw. durch\ndie Zulassung zur Reise zum Vertragsschluss. c) Telefonisch nimmt der Reiseveranstalter, worauf der Reisende ausdrücklich hinzuweisen ist,  lediglich verbindliche Reservierungen vor, auf die\nhin der Reisevertrag durch die schriftliche Reiseanmeldung, die der Reisende unverzüglich unterschrieben an den Veranstalter zurückzuleiten hat, und die Reisebestätigung geschlossen wird. Sendet\nder Reisende die unterschriebene Reiseanmeldung nicht innerhalb einer Frist von 7 Tagen nach Zugang der Reiseanmeldung zurück, so kann der Reiseveranstalter  von der Reservierung Abstand\nnehmen, sofern es der Reisende nach Aufforderung wiederum unterlässt, die Reiseanmeldung unterschrieben an ihn weiterzuleiten. Schadensersatzansprüche wegen Nichteinhaltung der\nReservierungsabrede bleiben hiervon unberührt. Für Buchungen mittels T-Online, Internet etc. gilt das unter Ziffer 1.c) Ausgeführte entsprechend.  d) Weicht die Reisebestätigung von der\nReiseanmeldung des Reisenden ab, so liegt in der Reisebestätigung ein neuer Vertragsantrag, an den der Veranstalter 10 Tage gebunden ist und den der Reisende innerhalb dieser Frist annehmen kann.\nFür die Annahme wird die rechtzeitige Rücksendung der unterschriebenen Reiseanmeldung empfohlen.  e) Bei ausdrücklich und eindeutig im Prospekt, den Reiseunterlagen und in den sonstigen\nErklärungen als vermittelt bezeichneten Fremdleistungen ist der  Reiseveranstalter lediglich Reisevermittler. Bei diesen Reisevermittlungen ist eine vertragliche Haftung als Vermittler\nausgeschlossen, soweit nicht Vorsatz oder grobe Fahrlässigkeit vorliegen,  Hauptpflichten aus dem Reisevermittlervertrag betroffen sind, eine zumutbare Möglichkeit zum Abschluss einer\nVersicherung besteht oder zugesicherte Eigenschaften fehlen. Der Veranstalter haftet insofern grundsätzlich nur für die Vermittlung, nicht jedoch für die vermittelten Leistungen selbst (vgl. §§\n675, 631 BGB). Für den Vertragsschluss gelten die Bestimmungen der Ziffer 1. sinngemäß.\n\n2. Zahlung a) Sämtliche Zahlungen (Anzahlung bzw. Restzahlung) des Reisenden sind nur nach Aushändigung des Sicherungsscheines unter Beachtung der nachfolgenden Bestimmungen zu leisten. b) Nach\nAbschluss des Reisevertrages sind 25 % des Reisepreises zu zahlen.  c) Der Restbetrag ist auf Anforderung frühestens drei Wochen vor Reisebeginn Zug um Zug gegen Aushändigung der\nvollständigen Reiseunterlagen, soweit für die Reise erforderlich und/oder vorgesehen (z.B. Hotelgutschein oder Beförderungsschein) zu zahlen.  d) Vertragsabschlüsse innerhalb von zwei Wochen\nvor Reisebeginn verpflichten den Reisenden zur sofortigen Zahlung des gesamten Reisepreises Zug um Zug gegen Aushändigung der vollständigen Reiseunterlagen, soweit für die Reise erforderlich\nund/oder vorgesehen (z.B. Hotelgutschein oder Beförderungsschein).  e) Die Verpflichtung zur Aushändigung eines Sicherungsscheines besteht nicht, wenn die Reise nicht länger als 24 Stunden\ndauert, keine Übernachtung einschließt und der Reisepreis 75 Euro nicht übersteigt.\n\n3. Leistungen  a) Prospekt- und Katalogangaben sind für den Reiseveranstalter bindend. Der Reiseveranstalter behält sich jedoch ausdrücklich vor, aus sachlich berechtigten, erheblichen und\nnicht vorhersehbaren Gründen vor Vertragsschluss eine konkrete Änderung der Prospekt- und Preisangaben zu erklären, über die der Reisende vor Buchung selbstverständlich informiert wird. b) Die\nvertraglichen Leistungen richten sich nach der im Zeitpunkt des Vertragsschlusses maßgeblichen Leistungsbeschreibung (Prospekt/Katalog) sowie den weiteren Vereinbarungen, insbesondere nach der\nReiseanmeldung und der Reisebestätigung. Ziffer 3. c) ist zu beachten. c) Zusätzliche Zusicherungen, Nebenabreden, besondere Vereinbarungen oder vereinbarte Sonderwünsche des Reisenden sollen in\ndie Reiseanmeldung und insbesondere in die Reisebestätigung aufgenommen werden. Auf Ziffer 1. a) dieser Bedingungen wird Bezug genommen.\n\n4. Preisänderungen a) Der Reiseveranstalter kann vier Monate nach Vertragsschluss Preiserhöhungen bis zu 5 %  des Gesamtreisepreises verlangen, wenn nachweisbar und erst nach\nVertragsabschluss konkret eintretend einer Erhöhung der Beförderungskosten, der Abgaben für bestimmte Leistungen, wie Hafen- oder Flughafengebühren, oder einer Änderung der für die betreffende\nReise geltenden Wechselkurse Rechnung getragen wird. Auf den genannten Umständen beruhende Preiserhöhungen sind nur insoweit zulässig, wie sich die Erhöhung ausgehend vom Beförderungs-, Abgaben-\nund Wechselkursanteil konkret berechnet auf den Reisepreis auswirkt.  b) Eine Preiserhöhung kann nur bis zum 21. Tag vor dem vereinbarten Abreisetermin verlangt werden. Eine nach Ziffer 4.\na) zulässige Preisänderung hat der Reiseveranstalter dem Reisenden unverzüglich nach Kenntnis vom Preiserhöhungsgrund zu erklären. c) Bei Preiserhöhungen nach Vertragsschluss um mehr als 5 % des\nGesamtreisepreises kann der Reisende kosten-los zurücktreten oder stattdessen die Teilnahme an einer anderen mindestens gleichwertigen Reise verlangen, wenn der Veranstalter in der Lage ist, eine\nsolche Reise ohne Mehrpreis für den Reisenden aus seinem Angebot anzubieten.  d) Die Rechte nach Ziffer 4.c) hat der Reisende unverzüglich nach der Erklärung des Reiseveranstalters diesem\ngegenüber geltend zu machen.\n\n5. Leistungsänderungen  a) Änderungen und Abweichungen einzelner Reiseleistungen vom vereinbarten Inhalt des Reisevertrages, die nach Vertragsabschluss notwendig werden und vom\nReiseveranstalter nicht wider Treu und Glauben herbeigeführt wurden, sind nur gestattet, soweit die Änderungen oder Abweichungen nicht erheblich sind und den Gesamtzuschnitt der gebuchten Reise\nnicht beeinträchtigen. b) Eine zulässige Änderung einer wesentlichen Reiseleistung hat der Reiseveranstalter dem Reisenden unverzüglich nach Kenntnis vom Änderungsgrund zu erklären. c) Im Fall\nder erheblichen Änderung einer wesentlichen Reiseleistung kann der Reisende vom Vertrag zurücktreten oder stattdessen die Teilnahme an einer mindestens gleichwertigen anderen Reise verlangen,\nwenn der Veranstalter in der Lage ist, eine solche Reise ohne Mehrpreis für den Reisenden aus seinem Angebot anzubieten. Ziffer 4.c) gilt entsprechend.  d) Für den Fall einer zulässigen\nÄnderung bleiben die übrigen Rechte (insbesondere Minderung, Schadensersatz) unberührt.\n\n6. Rücktritt des Kunden a) Nach dem jederzeit möglichen Rücktritt ist der Reisende verpflichtet, grundsätzlich pauschal folgende Entschädigungen zu zahlen:  bis 30. Tag vor Reisebeginn \n5 % des Gesamtreisepreises, mind. 15,00€ 29. bis 15. Tag vor Reisebeginn  15 % des Gesamtreisepreises, mind. 15,00€ 14. bis 8. Tag vor Reisebeginn  50 % des Gesamtreisepreises, mind.\n40,00€ ab 7. Tag vor Reisebeginn  70 % des Gesamtreisepreises am Abfahrtstag 90 % des Gesamtpreises b) Maßgeblich für den Lauf der Fristen ist der Zugang der Rücktrittserklärung beim\nReiseveranstalter oder bei der Buchungsstelle. Dem Reisenden wird der schriftliche Rücktritt empfohlen. c) Dem Reisenden wird ausdrücklich der Nachweis gestattet, ein Anspruch auf Entschädigung\nsei überhaupt nicht entstanden oder die Entschädigung sei wesentlich niedriger als die Pauschale.\n\n7. Änderungen auf Verlangen des Reisenden Verlangt der Reisende nach Vertragsschluss Änderungen oder Umbuchungen, so kann der Reiseveranstalter bei Vornahme entsprechender Umbuchungen ein\nBearbeitungsentgelt von 15 Euro verlangen, soweit er nach entsprechender Information des Reisenden nicht eine höhere Entschädigung nachweist, deren Höhe sich nach dem Reisepreis unter Abzug des\nWertes der vom Reiseveranstalter ersparten Aufwendungen sowie dessen bestimmt, was der Reiseveranstalter durch anderweitige Verwendung der Reiseleistung erwerben kann.\n\n8. Ersatzreisende  a) Der Reisende kann sich bis zum Reisebeginn durch einen Dritten ersetzen lassen, sofern dieser den besonderen Reiseerfordernissen genügt und seiner Teilnahme nicht\ngesetzliche Vorschriften oder behördliche Anordnungen entgegen-stehen und der Reiseveranstalter der Teilnahme nicht aus diesen Gründen widerspricht. b) Der Reisende und der Dritte haften dem\nReiseveranstalter als Gesamtschuldner für den Reisepreis. c) Der Reisende und der Dritte haften dem Reiseveranstalter als Gesamtschuldner für die durch die Teilnahme des Dritten entstehenden\nMehrkosten, regelmäßig pauschaliert auf 15 Euro.\n\n9. Reiseabbruch Wird die Reise infolge eines Umstandes abgebrochen, der in der Sphäre des Reisenden liegt (z.B. Krankheit), so ist der Reiseveranstalter verpflichtet, bei den Leistungsträgern die\nErstattung ersparter Aufwendungen sowie erzielter Erlöse aus der Verwertung der nicht in Anspruch genommener Leistungen zu erreichen. Das gilt nicht, wenn völlig unerhebliche Leistungen betroffen\nsind oder wenn einer Erstattung gesetzliche oder behördliche Bestimmungen entgegenstehen.\n\n10. Störung durch den Reisenden Der Reiseveranstalter kann den Reisevertrag fristlos kündigen, wenn der Reisende trotz Abmahnung erheblich weiter stört, so dass seine weitere Teilnahme für den\nReiseveranstalter und/oder die Reiseteilnehmer nicht mehr zumutbar ist. Dies gilt auch, wenn der Reisende sich nicht an sachlich begründete Hinweise hält. Dem Reiseveranstalter steht in diesem\nFall der Reisepreis weiter zu, soweit sich nicht ersparte Aufwendungen und Vorteile aus einer anderweitigen Verwertung der Reiseleistung(en) ergeben. Schadensersatzansprüche im übrigen bleiben\nunberührt.     11. Mindestteilnehmerzahl a) Ist in der Beschreibung der Reise (Prospekt/Katalog) ausdrücklich und in der Reisebestätigung auf eine bestimmte Mindestteilnehmerzahl und\ndie Rücktrittserklärungsfrist (spätestens bis zwei Wochen vor Reisebeginn) hingewiesen, so kann der Reiseveranstalter erklären, dass die Mindestteilnehmerzahl nicht erreicht und die Reise nicht\ndurchgeführt wird. b) Der Reiseveranstalter wird dem Reisenden die Erklärung nach Ziffer 11. a) unverzüglich nach Kenntnis der nicht erreichten Teilnehmerzahl, spätestens bis zwei Wochen vor\nReisebeginn zugehen lassen. c) Der Reisende kann die Teilnahme an einer mindestens gleichwertigen anderen Reise verlangen, wenn der Veranstalter in der Lage ist, eine solche Reise ohne Mehrpreis\nfür den Reisenden aus seinem Angebot anzubieten. d) Der Reisende hat sein Recht nach Ziffer 11.c) unverzüglich nach Zugang der Erklärung des Reiseveranstalters diesem gegenüber geltend zu machen.\ne) Macht der Reisende nicht von seinem Recht nach Ziffer 11. c) Gebrauch, so ist der vom Reisenden gezahlte Betrag unverzüglich zurückzuerstatten.\n\n12. Kündigung infolge höherer Gewalt a) Erschwerung, Gefährdung oder Beeinträchtigung erheblicher Art durch nicht vorhersehbare Umstände wie Krieg, innere Unruhen, Epidemien, hoheitliche\nAnordnungen (Entzug der Landerechte, Grenzschließungen), Naturkatastrophen, Havarien, Zerstörung von Unterkünften oder gleichgewichtige Fälle berechtigen beide Teile zur Kündigung des\nReisevertrages. b) Im Fall der Kündigung kann der Reiseveranstalter für erbrachte oder noch zu erbringende Reiseleistungen eine nach § 638 Abs. 3 BGB zu bemessende Entschädigung verlangen. c) Der\nReiseveranstalter ist im Kündigungsfall zur Rückbeförderung verpflichtet, falls der Vertrag die Beförderung mit umfasst. In jedem Fall hat er die zur Vertragsaufhebung erforderlichen Maßnahmen zu\nergreifen. d) Die Mehrkosten der Rückbeförderung tragen die Parteien je zur Hälfte, die übrigen Mehrkosten hat der Reisende zu tragen.\n\n13. Gewährleistung und Abhilfe a) Sind die Reiseleistungen nicht vertragsgemäß, so kann der Reisende Abhilfe verlangen, sofern diese nicht einen unverhältnismäßigen Aufwand erfordert. Die Abhilfe\nbesteht in der Beseitigung des Reisemangels bzw. einer gleichwertigen Ersatzleistung.  b) Der Reisende kann die Herabsetzung des Reisepreises nach § 638 Abs. 3 BGB verlangen, wenn er den\noder die Reisemängel beim Reiseleiter, oder falls dieser nicht erreichbar ist, beim Reiseveranstalter direkt anzeigt, soweit nicht erhebliche Schwierigkeiten die Mängelanzeige gegenüber dem\nReiseveranstalter unzumutbar machen. Die Telefon- und Telefaxnummern ergeben sich aus den Reiseunterlagen. Unterlässt der Reisende schuldhaft die Mängelanzeige, so stehen ihm keine Ansprüche auf\nHerabsetzung des Reisepreises zu. Hat der Reisende mehr als die geminderte Vergütung gezahlt, so ist der Mehrbetrag vom Unternehmer zu erstatten. Die §§ 346 Abs. 1, 347 Abs. 1 des Bürgerlichen\nGesetzbuches finden entsprechende Anwendung. c) Ist die Reise mangelhaft und leistet der Veranstalter nicht innerhalb der vom Reisenden bestimmten angemessenen Frist Abhilfe, so kann der Reisende\nauch selbst Abhilfe schaffen und den Ersatz der erforderlichen Aufwendungen verlangen. Einer Fristsetzung bedarf es nicht, wenn der Reiseveranstalter die Abhilfe verweigert oder ein besonderes\nInteresse des Reisenden die sofortige Selbsthilfe rechtfertigt. d) Wird die Reise durch einen Mangel erheblich beeinträchtigt, so kann der Reisende eine angemessene Frist zur Abhilfe setzen.\nVerstreicht die Frist nutzlos, kann der Reisende den Reisevertrag kündigen. Die Fristsetzung ist entbehrlich, wenn die Abhilfe unmöglich ist, verweigert wird oder die sofortige Kündigung durch\nein besonderes Interesse des Reisenden gerechtfertigt ist. Das gilt entsprechend, wenn dem Reisenden die Reise infolge eines Mangels aus wichtigem und für den Reiseveranstalter erkennbarem Grund\nnicht zuzumuten ist. e) Bei berechtigter Kündigung kann der Reiseveranstalter für erbrachte oder zur Beendigung der Reise noch zu erbringende Reiseleistungen eine Entschädigung verlangen. Für\nderen Berechnung sind der Wert der erbrachten Reiseleistungen sowie der Gesamtpreis und der Wert der vertraglich vereinbarten Reiseleistungen maßgeblich (vgl. § 638 Abs. 3 BGB ). Das gilt nicht,\nsofern die erbrachten oder zu erbringenden Reiseleistungen für den Reisenden kein Interesse haben. Der Reiseveranstalter hat die erforderlichen Maßnahmen zu treffen, die infolge der\nVertragsaufhebung notwendig sind. Ist die Rückbeförderung vom Reisevertrag mit umfasst, so hat der Reiseveranstalter auch für diese zu sorgen und die Mehrkosten     zu tragen. f) Der\nReisende kann unbeschadet der Minderung oder der Kündigung Schadensersatz wegen Nichterfüllung verlangen, es sei denn, der Mangel beruht auf einem Umstand, den der Reiseveranstalter nicht zu\nvertreten hat.\n\n14. Mitwirkungspflicht Der Reisende ist verpflichtet, die ihm zumutbaren Schritte zu unternehmen, um eventuelle Schäden gering zu halten. Auf die Ziffern 10. und 13. wird Bezug genommen.\n\n15. Haftungsbeschränkung a) Die vertragliche Haftung des Reiseveranstalters für Schäden, die nicht Körperschäden sind, ist auf den dreifachen Reisepreis beschränkt,  aa) soweit ein Schaden\ndes Reisenden weder vorsätzlich noch grob fahrlässig herbeigeführt wird, oder bb) soweit der Reiseveranstalter für einen dem Reisenden entstehenden Schaden allein wegen eines Verschuldens eines\nLeistungsträgers verantwortlich ist. b) Gelten für eine von einem Leistungsträger zu erbringende Reiseleistung internationale Übereinkommen oder auf diesen beruhende gesetzliche Bestimmungen,\nnach denen ein Anspruch auf Schadensersatz nur unter bestimmten Voraussetzungen oder Beschränkungen geltend gemacht werden kann, so kann sich der Reiseveranstalter gegenüber dem Reisenden auf\ndiese Übereinkommen und die darauf beruhenden gesetzlichen Bestimmungen berufen.  c) Bei eindeutig und ausdrücklich als vermittelt bezeichneten Leistungen ist Ziffer 1.e) dieser Bedingungen\nzu beachten.  d) Für alle gegen den Reiseveranstalter gerichteten Schadensersatzansprüche aus unerlaubter Handlung, die nicht auf Vorsatz oder grober Fahrlässigkeit beruhen, haftet der\nReiseveranstalter bei Sachschäden bis 4000 Euro. Über-steigt der dreifache Reisepreis diese Summe, ist die Haftung für Sachschäden auf die Höhe des dreifachen Reisepreises beschränkt. Diese\nHaftungshöchstsummen gelten jeweils je Reisendem und Reise. Dem Reisenden wird in diesem Zusammenhang im eigenen Interesse der Abschluss einer Reiseunfall- oder Reisegepäckversicherung\nempfohlen.\n\n16. Ausschlussfrist und Verjährung a) Ansprüche wegen mangelhafter Reiseleistung nach den §§ 651 c bis 651 f BGB hat der Reisende innerhalb eines Monats nach der vertraglich vorgesehenen\nBeendigung der Reise gegenüber dem Reiseveranstalter geltend zu machen. Nach Ablauf dieser Frist können Ansprüche nur geltend gemacht werden, wenn der Reisende die genannte Frist ohne eigenes\nVerschulden nicht einhalten konnte.  b) Ansprüche des Reisenden im Sinne der Ziffer 16. a) verjähren grundsätzlich in einem Jahr nach dem vertraglich vorgesehenen Reiseende, jedoch mit der\nEinschränkung, dass diese Verjährungsfrist von einem Jahr nicht vor Mitteilung eines Mangels an den Reiseveranstalter durch den Reisenden beginnt. Bei grobem Verschulden verjähren die in Ziffer\n16. a) betroffenen Ansprüche in zwei Jahren.  c) Im übrigen gilt, insbesondere auch bei arglistigem Verschweigen des Mangels, die regelmäßige Verjährungsfrist von drei Jahren.\n\n17. Pass-, Visa- und gesundheitspolizeiliche Formalitäten a) Der Reiseveranstalter weist auf Pass-, Visumerfordernisse einschließlich der     Fristen zur Erlangung dieser Dokumente und\ngesundheitspolizeiliche Formalitäten in dem von ihm herausgegebenen und dem Reisenden zur Verfügung gestellten Prospekt oder durch Unterrichtung vor der Buchung einschließlich zwischenzeitlicher\nÄnderungen insbesondere vor Vertragsschluss und vor Reisebeginn hin, die für das jeweilige Reiseland für deutsche Staatsbürger ohne Besonderheiten wie Doppelstaatsbürgerschaft etc. gelten. \nb) Bei pflichtgemäßer Erfüllung der Informationspflicht durch den Reiseveranstalter hat der Reisende die Voraussetzungen für die Reise zu schaffen, sofern sich nicht der Reiseveranstalter\nausdrücklich zur Beschaffung der Visa oder Bescheinigungen etc. verpflichtet hat.  c) Entstehen z.B. infolge fehlender persönlicher Voraussetzungen für die Reise Schwierigkeiten, die allein\nauf das Verhalten des Reisenden zurückzuführen sind (z.B. keine Beschaffung des erforderlichen Visums), so kann der Reisende nicht kostenfrei zurücktreten oder einzelne Reiseleistungen folgenlos\nin Anspruch nehmen. Insofern gelten die Ziffern 6. (Rücktritt des Kunden) und 9. (Reiseabbruch) entsprechend.\n\n18. Gerichtsstand a) Der Reisende kann den Reiseveranstalter an dessen Sitz verklagen. b) Für Klagen des Reiseveranstalters gegen den Reisenden ist dessen Wohnsitz maßgeblich, sofern es sich\nnicht um Vollkaufleute oder Personen handelt, die ihren Wohnsitz oder gewöhnlichen Aufenthaltsort nach Vertragsschluss ins Ausland verlegt haben oder deren Wohnsitz oder Aufenthaltsort im\nZeitpunkt der Klageerhebung nicht bekannt ist. In diesen Fällen ist der Sitz des Reiseveranstalters maßgeblich.\n\n19. Unwirksamkeit einzelner Bestimmungen Die Unwirksamkeit einzelner Bestimmungen begründet nicht die Unwirksamkeit des Reisevertrages im übrigen.\n\nReiseveranstalter:\n\nFecht Omnibus GmbH\n\nIndustriestr. 8\n\n88605 Meßkirch\n\nTel: 07575 858\n\nFax: 07575 4715\n\n**Stand: Januar 2012**\n\n\n\n\n### Lob, Kritik oder Anmerkungen?\n\n**Rufen Sie uns an unter****Tel. +49 7575 858 oder +49 7771 929753****oder schreiben Sie\nuns eine [E-Mail](mailto:info@fecht-reisen.de \"info@fecht-reisen.de\").**\n\n![](https://image.jimcdn.com/app/cms/image/transf/dimension=125x10000:format=png/path/sd9321033bd9c06f1/image/i3b6fa4ca9ba2717b/version/1505838920/image.png)\n\n**Fecht Omnibus GmbH**\n\nIndustriestraße 8\n\nD-88605 Meßkirch\n\n[Impressum](/about/) | [Datenschutz](//www.bus-fecht.de/j/privacy) | [Cookie-Richtlinie](javascript:window.CookieControl.showCookieSettings();) | [Sitemap](/sitemap/)\n\n[Anmelden](/login)\n\n[Abmelden](https://cms.e.jimdo.com/app/cms/logout.php) \n|\n[Bearbeiten](https://a.jimdo.com/app/auth/signin/jumpcms/?page=1541934150)\n\n* [Nach oben scrollen](javascript:void(0); \"Nach oben scrollen\")\n\n[zuklappen](# \"Dieses Element zuklappen\")"
}