{
  "timestamp": "20250722_103402",
  "processing_info": {
    "date": "2025-07-22",
    "time": "10:34:13",
    "timezone": "WEST"
  },
  "url": "http://www.auto-mann.com",
  "imprint_url": "http://www.auto-mann.com/impressum",
  "imprint_data": {
    "company_name": "Auto Mann GmbH & Co",
    "managing_directors": [
      "Christian Mann M.Sc.",
      "Doris Mann"
    ],
    "business_address": {
      "street": "Steingrubenstraße 13",
      "city": "Blaubeuren",
      "postal_code": "89143",
      "country": "Germany"
    },
    "phone_numbers": [
      "+49 73 44 / 96 30 - 0",
      "+49 73 44 / 96 30 - 33"
    ],
    "email_addresses": [],
    "website_url": "http://www.auto-mann-logistik.de",
    "registration_details": {
      "trade_register": "Amtsgericht Ulm",
      "registration_number": "HRA 1348",
      "court": "Amtsgericht Ulm"
    },
    "vat_id": "DE 1470 40 537",
    "tax_id": null,
    "professional_liability_insurance": null,
    "other_legal_info": {
      "copyright": "© Auto Mann GmbH. Alle Rechte vorbehalten."
    }
  },
  "markdown_content": "﻿\n\n\n\n\n\n\n\n\nImpressum\n\n\n\n\n\n[![](/templates/automanntemplate/img/logo.jpg)](/)\n\nToggle navigation\n\n* [![Startseite](/images/headers/Haus.png)](/)\n* [Touristik](#)\n  + [Bähnle](/touristik/baehnle)\n  + [Schul-/ Jugend-/ Gruppen- und Vereinsfahrten](/touristik/schul-jugend-gruppen-und-vereinsfahrten)\n  + [Geschäftskunden / Großevents](/touristik/geschaeftskunden-grossevents)\n* [Logistik](#)\n  + [Silozüge](/logistik/silozuege)\n  + [Planen- / Schiebeboden- / Kippertransporte](/logistik/planen-schiebeboden-kippertransporte)\n  + [Schüttgut-/ Lose-/ Palettenlager](/logistik/schuettgut-lose-palettenlager)\n  + [Verpacken und Umpacken](/logistik/verpacken-und-umpacken)\n  + [Mischen/ Mengen und Sieben](/logistik/mischen-mengen-und-sieben)\n  + [Gleisumschlag](/logistik/gleisumschlag)\n  + [Qualität und Umwelt](/logistik/qualitaet-und-umwelt)\n* [Linienverkehr](#)\n  + [ÖPNV](/linienverkehr/oepnv)\n* [Kontakt](#)\n  + [Kontakt](/kontakt-col/kontakt-top)\n  + [Karriere](/kontakt-col/karriere)\n\nÜberzeugen Sie sich von  \n unseren Dienstleistungen unsere Produktvielfalt überrascht! Buchen Sie  \ndirekt online eine Tour mit dem Bähnle\n\n\n\n## Impressum\n\n## Rechtliches der Internetseite\n\n  \n  \nAuto Mann GmbH & Co   \nSteingrubenstraße 13  \n89143 Blaubeuren  \n   \nTelefon: +49 73 44 / 96 30 - 0  \nTelefax: +49 73 44 / 96 30 - 33  \nE-Mail: Diese E-Mail-Adresse ist vor Spambots geschützt! Zur Anzeige muss JavaScript eingeschaltet sein!   \n  \n**Vertretungsberechtigter Geschäftsführer/in:**   \nChristian Mann M.Sc.   \nDoris Mann  \n  \nRegistergericht: Amtsgericht Ulm  \nRegisternummer: HRA 1348  \n   \nUmsatzsteuer-Identifikationsnummer gemäß § 27a Umsatzsteuergesetz: DE 1470 40 537  \n  \n**Auto Mann ist erreichbar unter folgenden Domains:**  \n[http://www.auto-mann-logistik.de](http://www.auto-mann-logistik.de/)   \n[http://www.auto-mann.com](/undefined/)  \n[http://www.auto-mann.eu](http://www.auto-mann.com/)  \n  \n  \n   \n**Haftungsausschluss:**  \n*1. Inhalt des Onlineangebotes*   \nDer Autor übernimmt keinerlei Gewähr für die Aktualität, Korrektheit, Vollständigkeit oder Qualität der bereitgestellten Informationen. Haftungsansprüche gegen den Autor, welche sich auf Schäden materieller oder ideeller Art beziehen, die durch die Nutzung oder Nichtnutzung der dargebotenen Informationen bzw. durch die Nutzung fehlerhafter und unvollständiger Informationen verursacht wurden, sind grundsätzlich ausgeschlossen, sofern seitens des Autors kein nachweislich vorsätzliches oder grob fahrlässiges Verschulden vorliegt. Alle Angebote sind freibleibend und unverbindlich. Der Autor behält es sich ausdrücklich vor, Teile der Seiten oder das gesamte Angebot ohne gesonderte Ankündigung zu verändern, zu ergänzen, zu löschen oder die Veröffentlichung zeitweise oder endgültig einzustellen.    \n  \n*2. Verweise und Links*   \nBei direkten oder indirekten Verweisen auf fremde Webseiten (Hyperlinks), die außerhalb des Verantwortungsbereiches des Autors liegen, würde eine Haftungsverpflichtung ausschließlich in dem Fall in Kraft treten, in dem der Autor von den Inhalten Kenntnis hat und es ihm technisch möglich und zumutbar wäre, die Nutzung im Falle rechtswidriger Inhalte zu verhindern. Der Autor erklärt hiermit ausdrücklich, dass zum Zeitpunkt der Linksetzung keine illegalen Inhalte auf den zu verlinkenden Seiten erkennbar waren. Auf die aktuelle und zukünftige Gestaltung, die Inhalte oder die Urheberschaft der verlinkten/verknüpften Seiten hat der Autor keinerlei Einfluss. Deshalb distanziert er sich hiermit ausdrücklich von allen Inhalten aller verlinkten /verknüpften Seiten, die nach der Linksetzung verändert wurden. Diese Feststellung gilt für alle innerhalb des eigenen Internetangebotes gesetzten Links und Verweise sowie für Fremdeinträge in vom Autor eingerichteten Gästebüchern, Diskussionsforen, Linkverzeichnissen, Mailinglisten und in allen anderen Formen von Datenbanken, auf deren Inhalt externe Schreibzugriffe möglich sind. Für illegale, fehlerhafte oder unvollständige Inhalte und insbesondere für Schäden, die aus der Nutzung oder Nichtnutzung solcherart dargebotener Informationen entstehen, haftet allein der Anbieter der Seite, auf welche verwiesen wurde, nicht derjenige, der über Links auf die jeweilige Veröffentlichung lediglich verweist.    \n  \n*3. Urheber- und Kennzeichenrecht*   \nDer Autor ist bestrebt, in allen Publikationen die Urheberrechte der verwendeten Grafiken, Tondokumente, Videosequenzen und Texte zu beachten, von ihm selbst erstellte Grafiken, Tondokumente, Videosequenzen und Texte zu nutzen oder auf lizenzfreie Grafiken, Tondokumente, Videosequenzen und Texte zurückzugreifen. Alle innerhalb des Internetangebotes genannten und ggf. durch Dritte geschützten Marken- und Warenzeichen unterliegen uneingeschränkt den Bestimmungen des jeweils gültigen Kennzeichenrechts und den Besitzrechten der jeweiligen eingetragenen Eigentümer. Allein aufgrund der bloßen Nennung ist nicht der Schluss zu ziehen, dass Markenzeichen nicht durch Rechte Dritter geschützt sind! Das Copyright für veröffentlichte, vom Autor selbst erstellte Objekte bleibt allein beim Autor der Seiten. Eine Vervielfältigung oder Verwendung solcher Grafiken, Tondokumente, Videosequenzen und Texte in anderen elektronischen oder gedruckten Publikationen ist ohne ausdrückliche Zustimmung des Autors nicht gestattet.    \n  \n*4. Datenschutz*   \nSofern innerhalb des Internetangebotes die Möglichkeit zur Eingabe persönlicher oder geschäftlicher Daten (Emailadressen, Namen, Anschriften) besteht, so erfolgt die Preisgabe dieser Daten seitens des Nutzers auf ausdrücklich freiwilliger Basis. Die Inanspruchnahme und Bezahlung aller angebotenen Dienste ist - soweit technisch möglich und zumutbar - auch ohne Angabe solcher Daten bzw. unter Angabe anonymisierter Daten oder eines Pseudonyms gestattet. Die Nutzung der im Rahmen des Impressums oder vergleichbarer Angaben veröffentlichten Kontaktdaten wie Postanschriften, Telefon- und Faxnummern sowie Emailadressen durch Dritte zur Übersendung von nicht ausdrücklich angeforderten Informationen ist nicht gestattet. Rechtliche Schritte gegen die Versender von sogenannten Spam-Mails bei Verstössen gegen dieses Verbot sind ausdrücklich vorbehalten.    \n  \n*5.Registrierung der Zugriffe*   \nAlle Zugriffe auf unsere Server werden registriert. Es werden Datum, Rechneradresse und gelesenes Dokument gespeichert. Diese Daten werden unter Umständen für statistische Zwecke ausgewertet und ggf. anonymisiert veröffentlicht. Der Autor setzt Google Analytics zur Besucherauswertung ein. Mit der Benutzung unserer Server erklären Sie sich hiermit einverstanden. Sollten Sie mit dieser Vorgehensweise nicht einverstanden sein, so steht es Ihnen frei, unser Internet-Angebot nicht zu nutzen.   \n  \n*6. Rechtswirksamkeit dieses Haftungsausschlusses*   \nDieser Haftungsausschluss ist als Teil des Internetangebotes zu betrachten, von dem aus auf diese Seite verwiesen wurde. Sofern Teile oder einzelne Formulierungen dieses Textes der geltenden Rechtslage nicht, nicht mehr oder nicht vollständig entsprechen sollten, bleiben die übrigen Teile des Dokumentes in ihrem Inhalt und ihrer Gültigkeit davon unberührt.    \n  \n**Haftungshinweis**   \nTrotz sorgfältiger inhaltlicher Kontrolle übernehmen wir keine Haftung für die Inhalte externer Links. Für den Inhalt der verlinkten Seiten sind ausschließlich deren Betreiber verantwortlich.\n\n© Auto Mann GmbH. Alle Rechte vorbehalten.\n\n* [Kontakt](/kontakt)\n* [Datenschutz](/datenschutz)\n* [Impressum](/impressum)"
}