{
  "timestamp": "20250722_102709",
  "processing_info": {
    "date": "2025-07-22",
    "time": "10:27:22",
    "timezone": "WEST"
  },
  "url": "http://www.merkle-reisen.de",
  "imprint_url": "http://www.merkle-reisen.de/Impressum.aspx",
  "imprint_data": {
    "company_name": "Merkle GmbH Omnibusverkehr",
    "managing_directors": [
      "Thomas Merkle"
    ],
    "business_address": {
      "street": "Ulmer Weg 28",
      "city": "Böhmenkirch",
      "postal_code": "89558",
      "country": null
    },
    "phone_numbers": [
      "07332 / 922133",
      "07332 / 922134"
    ],
    "email_addresses": [
      "info@merkle-reisen.de"
    ],
    "website_url": "https://www.merkle-reisen.de",
    "registration_details": {
      "trade_register": "Handelsregister",
      "registration_number": "HRB 540 399GEI",
      "court": null
    },
    "vat_id": "DE811508597",
    "tax_id": null,
    "professional_liability_insurance": null,
    "other_legal_info": {
      "eu_odr_platform_url": "http://ec.europa.eu/consumers/odr/"
    }
  },
  "markdown_content": "Merkle - Impressum\n\n\n\n* [START](/Default.aspx)\n* [FIRMA](/Firma.aspx)\n* [LINIENVERKEHR](/Linienverkehr.aspx)\n* [BUS+FAHRER MIETEN](/BusFahrerMiete.aspx)\n* [KONTAKT](/Kontakt.aspx)\n\n[![](Bilder/Facebook.jpg)](https://www.facebook.com/pages/Merkle-Reisen/113972788666847)\n\n* IMPRESSUM\n* [AGBs](#)\n\n* [MIETWAGEN](/PDF/Mietwagen.pdf)\n\nIMPRESSUM\n\nMerkle GmbH Omnibusverkehr  \nUlmer Weg 28   \n89558 Böhmenkirch   \nTel.: 07332 / 922133  \nFax.: 07332 / 922134  \nE-Mail: [**info@merkle-reisen.de**](mailto:info@merkle-reisen.de)  \nGeschäftsführer: Thomas Merkle  \nHandelsregister: HRB 540 399GEI  \nUSt. ID: DE811508597  \nDie EU-Kommission hat eine Internetplattform zur Online-Beilegung von Streitigkeiten („OS-Plattform“) zwischen Unternehmern und Verbrauchern eingerichtet. Die OS-Plattform ist erreichbar unter [OS-Plattform](http://ec.europa.eu/consumers/odr/).\n  \n  \n**Seitendesign & Programmierung**  \nSeitendesign:  [Werbeagentur anyGraphics Annika Lang](http://www.anygraphics.de/)  \nProgrammierung: [CTL Computertechnik Michael Lang](http://www.ctl.de/)  \n  \n**Aus gegebenem Anlass möchten wir jeden Besucher der Website auf die   \nfolgenden Gegebenheiten hinweisen:****Haftungsausschluss (Disclaimer)****1. Inhalt des Onlineangebotes**Der Autor übernimmt keinerlei Gewähr für die Aktualität, Korrektheit, Vollständigkeit oder Qualität der bereitgestellten Informationen. Haftungsansprüche gegen den Autor,\nwelche sich auf Schäden materieller oder ideeller Art beziehen, die durch die Nutzung oder Nichtnutzung der dargebotenen Informationen bzw. durch die Nutzung fehlerhafter\nund unvollständiger Informationen verursacht wurden sind grundsätzlich ausgeschlossen, sofern seitens des Autors kein nachweislich vorsätzliches oder grob fahrlässiges Verschulden vorliegt.\nAlle Angebote sind freibleibend und unverbindlich. Der Autor behält es sich ausdrücklich vor, Teile der Seiten oder das gesamte Angebot ohne gesonderte Ankündigung zu verändern, zu ergänzen,\nzu löschen oder die Veröffentlichung zeitweise oder endgültig einzustellen.**2. Verweise und Links**Bei direkten oder indirekten Verweisen auf fremde Internetseiten (Links), die außerhalb des Verantwortungsbereiches des Autors liegen, würde eine Haftungsverpflichtung ausschließlich in dem Fall\nin Kraft treten, in dem der Autor von den Inhalten Kenntnis hat und es ihm technisch möglich und zumutbar wäre, die Nutzung im Falle rechtswidriger Inhalte zu verhindern.\nDer Autor erklärt daher ausdrücklich, dass zum Zeitpunkt der Linksetzung die entsprechenden verlinkten Seiten frei von illegalen Inhalten waren. Der Autor hat keinerlei Einfluss auf die\naktuelle und zukünftige Gestaltung und auf die Inhalte der gelinkten/verknüpften Seiten. Deshalb distanziert er sich hiermit ausdrücklich von allen Inhalten aller gelinkten /verknüpften Seiten,\ndie nach der Linksetzung verändert wurden. Diese Feststellung gilt für alle innerhalb des eigenen Internetangebotes gesetzten Links und Verweise sowie für Fremdeinträge in\nvom Autor eingerichteten Gästebüchern, Diskussionsforen und Mailinglisten. Für illegale, fehlerhafte oder unvollständige Inhalte und insbesondere für Schäden, die aus der Nutzung oder\nNichtnutzung solcherart dargebotener Informationen entstehen, haftet allein der Anbieter der Seite, auf welche verwiesen wurde,\nnicht derjenige, der über Links auf die jeweilige Veröffentlichung lediglich verweist.**3. Urheber- und Kennzeichenrecht**Der Autor ist bestrebt, in allen Publikationen die Urheberrechte der verwendeten Grafiken, Tondokumente, Videosequenzen und Texte zu beachten, von ihm selbst erstellte Grafiken, Tondokumente,\nVideosequenzen und Texte zu nutzen oder auf lizenzfreie Grafiken, Tondokumente, Videosequenzen und Texte zurückzugreifen.\nAlle innerhalb des Internetangebotes genannten und ggf. durch Dritte geschützten Marken- und Warenzeichen unterliegen uneingeschränkt den Bestimmungen des jeweils gültigen Kennzeichenrechts\nund den Besitzrechten der jeweiligen eingetragenen Eigentümer. Allein aufgrund der bloßen Nennung ist nicht der Schluss zu ziehen, dass Markenzeichen nicht durch Rechte Dritter geschützt sind!\nDas Copyright für veröffentlichte, vom Autor selbst erstellte Objekte bleibt allein beim Autor der Seiten. Eine Vervielfältigung oder Verwendung solcher Grafiken, Tondokumente,\nVideosequenzen und Texte in anderen elektronischen oder gedruckten Publikationen ist ohne ausdrückliche Zustimmung des Autors nicht gestattet.**4. Rechtswirksamkeit dieses Haftungsausschlusses**Dieser Haftungsausschluss ist als Teil des Internetangebotes zu betrachten, von dem aus auf diese Seite verwiesen wurde. Sofern Teile oder einzelne Formulierungen\ndieses Textes der geltenden Rechtslage nicht, nicht mehr oder nicht vollständig entsprechen sollten, bleiben die übrigen Teile des Dokumentes in ihrem Inhalt und ihrer Gültigkeit davon unberührt."
}