{
  "timestamp": "20250722_103228",
  "processing_info": {
    "date": "2025-07-22",
    "time": "10:32:43",
    "timezone": "WEST"
  },
  "url": "http://www.petrolli.de",
  "imprint_url": "http://www.petrolli.de/impressum/",
  "imprint_data": {
    "company_name": "Petrolli Reisen GmbH & Co. KG",
    "managing_directors": [
      "Dieter Petrolli"
    ],
    "business_address": {
      "street": "Schramberger Str. 15",
      "city": "Niedereschach-Fischbach",
      "postal_code": "78078",
      "country": "Germany"
    },
    "phone_numbers": [
      "+49 (0) 7725 9165-0"
    ],
    "email_addresses": [
      "info@petrolli.de"
    ],
    "website_url": "https://petrolli.de",
    "registration_details": {
      "trade_register": "Handelsregister",
      "registration_number": "HRA 602 433",
      "court": "Amtsgericht Freiburg"
    },
    "vat_id": "DE 191 741 805",
    "tax_id": null,
    "professional_liability_insurance": null,
    "other_legal_info": {
      "legal_basis_imprint": "Angaben gemäß § 5 TMG",
      "disclaimer_info": "Haftungsausschluss: Haftung für Inhalte, Haftung für Links",
      "copyright_info": "Urheberrecht",
      "data_protection_info": "Datenschutz",
      "web_analytics_tool": "Google Analytics",
      "imprint_generated_by": "impressum-generator.de von der Kanzlei Hasselbach, Frankfurt",
      "copyright_holder": "Petrolli Reisen GmbH & Co. KG",
      "copyright_year": "2023",
      "website_powered_by": "Easytourist"
    }
  },
  "markdown_content": "Impressum\n\n\n\n\n[![Petrolli-Reisen]()](/)\n[![Bus dich weg]()](https://petrolli.busdichweg.com)\n\n[+49 (0) 7725 9165-0](tel:+49772591650)\n [info@petrolli.de](mailto:info@petrolli.de)\n\n[0\n\ngemerkte Reisen\n\nMerkliste](/merkliste/#c37)\n\n* [Home](/)\n* [Reisen](/reisen/reiseuebersicht/)\n\n  + [Wellness- & Badereisen](https://petrolli.busdichweg.com/busreisen/wellness-badereisen/)\n  + [Tagesfahrten](https://petrolli.busdichweg.com/busreisen/tagesfahrten/)\n  + [Sport- & Aktivreisen](https://petrolli.busdichweg.com/busreisen/sport-aktivreisen/)\n  + [Flusskreuzfahrten](/reisen/flusskreuzfahrten/)\n  + [Erlebnis- & Kulturreisen](https://petrolli.busdichweg.com/busreisen/erlebnis-kultur/)\n  + [Advent, Weihnachten & Silvester](https://petrolli.busdichweg.com/busreisen/advent-weihnachten-silvester/)\n* [Gruppenreisen](/gruppenreisen/)\n\n  + [Unsere Geburtstags-Gruppenreisen 2026](/gruppenreisen/unsere-geburtstags-gruppenreisen-2026/)\n  + [Aktuelle Gruppenspecials](/gruppenreisen/aktuelle-schnaeppchenreisen-1/)\n  + [Gruppenleiterreisen](/gruppenreisen/gruppenleiter-informationsreisen/)\n  + [Gruppenprogramme](/gruppenreisen/vorschlaege-fuer-1-tag/)\n\n    - [Gruppenprogramme für 1 Tag](/gruppenreisen/vorschlaege-fuer-1-tag/)\n    - [Gruppenprogramme für 2 Tage](/gruppenreisen/vorschlaege-fuer-2-tage/)\n    - [Gruppenprogramme für 3 Tage](/gruppenreisen/vorschlaege-fuer-3-tage/)\n    - [Gruppenprogramme für 4 und mehr Tage](/gruppenreisen/vorschlaege-fuer-5-tage/)\n  + [Klassenfahrten](/gruppenreisen/klassenfahrten/)\n  + [Oldtimer-Touren](/gruppenreisen/oldtimer-ausfluege/)\n  + [Action, Abenteuer & Adrenalin](/gruppenreisen/action-bausteine/)\n  + [Gruppenreiseanfrage](/gruppenreisen/gruppenreiseanfrage/)\n* [Linienverkehr](/fahrplanauskunft/)\n* [Über uns](/ueber-uns/)\n\n  + [Petrolli-Blog](/ueber-uns/petrolli-blog-1/)\n  + [Geschichte](/ueber-uns/geschichte/)\n  + [Stellenangebote](/ueber-uns/stellenangebote/)\n  + [Team](/ueber-uns/team/)\n  + [Unsere Flotte](/ueber-uns/unsere-flotte/)\n* [Service](/service/)\n\n  + [Allgemeine Reisebedingungen](/service/allgemeine-reisebedingungen/)\n  + [Anfahrt](/service/anfahrt/)\n  + [Anfrage für Gruppenreisen](/gruppenreisen/gruppenreiseanfrage/)\n  + [Beförderungsbestimmungen](/service/befoerderungsbestimmungen/)\n  + [Fahrplanauskunft](/fahrplanauskunft/)\n  + [Fundsachen](/service/fundsachen/)\n  + [Gutscheinbestellung](/service/gutscheinbestellung/)\n  + [Kataloganforderung](/service/kataloganforderung/)\n  + [Kataloge](/service/kataloge/)\n  + [Kofferpackhilfe](/service/kofferpackhilfe/)\n  + [Newsletter](/newsletter-1/)\n* [Kontakt](/kontakt/)\n\n\n\n# Impressum\n\nAngaben gemäß § 5 TMG\n\nPetrolli Reisen GmbH & Co. KG   \nSchramberger Str. 15  \n78078 Niedereschach-Fischbach\n\n**Vertreten durch:**   \nDieter Petrolli\n\n**Registereintrag:**   \nEintragung im Handelsregister.  \nRegistergericht: Amtsgericht Freiburg  \nRegisternummer: HRA 602 433\n\n**Umsatzsteuer-ID:**   \nUmsatzsteuer-Identifikationsnummer gemäß §27a Umsatzsteuergesetz: DE 191 741 805\n\n**Haftungsausschluss:**   \n  \n**Haftung für Inhalte**  \n  \nDie Inhalte unserer Seiten wurden mit größter Sorgfalt erstellt. Für die Richtigkeit, Vollständigkeit und Aktualität der Inhalte können wir jedoch keine Gewähr übernehmen. Als Diensteanbieter sind wir gemäß § 7 Abs.1 TMG für eigene Inhalte auf diesen Seiten nach den allgemeinen Gesetzen verantwortlich. Nach §§ 8 bis 10 TMG sind wir als Diensteanbieter jedoch nicht verpflichtet, übermittelte oder gespeicherte fremde Informationen zu überwachen oder nach Umständen zu forschen, die auf eine rechtswidrige Tätigkeit hinweisen. Verpflichtungen zur Entfernung oder Sperrung der Nutzung von Informationen nach den allgemeinen Gesetzen bleiben hiervon unberührt. Eine diesbezügliche Haftung ist jedoch erst ab dem Zeitpunkt der Kenntnis einer konkreten Rechtsverletzung möglich. Bei Bekanntwerden von entsprechenden Rechtsverletzungen werden wir diese Inhalte umgehend entfernen.  \n  \n**Haftung für Links**  \n  \nUnser Angebot enthält Links zu externen Webseiten Dritter, auf deren Inhalte wir keinen Einfluss haben. Deshalb können wir für diese fremden Inhalte auch keine Gewähr übernehmen. Für die Inhalte der verlinkten Seiten ist stets der jeweilige Anbieter oder Betreiber der Seiten verantwortlich. Die verlinkten Seiten wurden zum Zeitpunkt der Verlinkung auf mögliche Rechtsverstöße überprüft. Rechtswidrige Inhalte waren zum Zeitpunkt der Verlinkung nicht erkennbar. Eine permanente inhaltliche Kontrolle der verlinkten Seiten ist jedoch ohne konkrete Anhaltspunkte einer Rechtsverletzung nicht zumutbar. Bei Bekanntwerden von Rechtsverletzungen werden wir derartige Links umgehend entfernen.  \n  \n**Urheberrecht**  \n  \nDie durch die Seitenbetreiber erstellten Inhalte und Werke auf diesen Seiten unterliegen dem deutschen Urheberrecht. Die Vervielfältigung, Bearbeitung, Verbreitung und jede Art der Verwertung außerhalb der Grenzen des Urheberrechtes bedürfen der schriftlichen Zustimmung des jeweiligen Autors bzw. Erstellers. Downloads und Kopien dieser Seite sind nur für den privaten, nicht kommerziellen Gebrauch gestattet. Soweit die Inhalte auf dieser Seite nicht vom Betreiber erstellt wurden, werden die Urheberrechte Dritter beachtet. Insbesondere werden Inhalte Dritter als solche gekennzeichnet. Sollten Sie trotzdem auf eine Urheberrechtsverletzung aufmerksam werden, bitten wir um einen entsprechenden Hinweis. Bei Bekanntwerden von Rechtsverletzungen werden wir derartige Inhalte umgehend entfernen.  \n  \n**Datenschutz**  \n  \nDie Nutzung unserer Webseite ist in der Regel ohne Angabe personenbezogener Daten möglich. Soweit auf unseren Seiten personenbezogene Daten (beispielsweise Name, Anschrift oder eMail-Adressen) erhoben werden, erfolgt dies, soweit möglich, stets auf freiwilliger Basis. Diese Daten werden ohne Ihre ausdrückliche Zustimmung nicht an Dritte weitergegeben.   \nWir weisen darauf hin, dass die Datenübertragung im Internet (z.B. bei der Kommunikation per E-Mail) Sicherheitslücken aufweisen kann. Ein lückenloser Schutz der Daten vor dem Zugriff durch Dritte ist nicht möglich.   \nDer Nutzung von im Rahmen der Impressumspflicht veröffentlichten Kontaktdaten durch Dritte zur Übersendung von nicht ausdrücklich angeforderter Werbung und Informationsmaterialien wird hiermit ausdrücklich widersprochen. Die Betreiber der Seiten behalten sich ausdrücklich rechtliche Schritte im Falle der unverlangten Zusendung von Werbeinformationen, etwa durch Spam-Mails, vor.  \n  \n  \n**Google Analytics**  \n  \nDiese Website benutzt Google Analytics, einen Webanalysedienst der Google Inc. (''Google''). Google Analytics verwendet sog. ''Cookies'', Textdateien, die auf Ihrem Computer gespeichert werden und die eine Analyse der Benutzung der Website durch Sie ermöglicht. Die durch den Cookie erzeugten Informationen über Ihre Benutzung diese Website (einschließlich Ihrer IP-Adresse) wird an einen Server von Google in den USA übertragen und dort gespeichert. Google wird diese Informationen benutzen, um Ihre Nutzung der Website auszuwerten, um Reports über die Websiteaktivitäten für die Websitebetreiber zusammenzustellen und um weitere mit der Websitenutzung und der Internetnutzung verbundene Dienstleistungen zu erbringen. Auch wird Google diese Informationen gegebenenfalls an Dritte übertragen, sofern dies gesetzlich vorgeschrieben oder soweit Dritte diese Daten im Auftrag von Google verarbeiten. Google wird in keinem Fall Ihre IP-Adresse mit anderen Daten der Google in Verbindung bringen. Sie können die Installation der Cookies durch eine entsprechende Einstellung Ihrer Browser Software verhindern; wir weisen Sie jedoch darauf hin, dass Sie in diesem Fall gegebenenfalls nicht sämtliche Funktionen dieser Website voll umfänglich nutzen können. Durch die Nutzung dieser Website erklären Sie sich mit der Bearbeitung der über Sie erhobenen Daten durch Google in der zuvor beschriebenen Art und Weise und zu dem zuvor benannten Zweck einverstanden.\n\n  \n\n**Website Impressum erstellt durch [impressum-generator.de](http://www.impressum-generator.de) von der [Kanzlei Hasselbach, Frankfurt](http://www.kanzlei-hasselbach.de/rechtsanwalt-frankfurt/)**\n\n\n\n![Petrolli-Reisen]()\n\n**Petrolli Reisen GmbH & Co. KG**\n\n**Öffnungszeiten**\n\n**Service**\n\n**Reiseangebot**\n\n**Folgen Sie Uns**\n\n(c) 2023 Petrolli Reisen GmbH & Co. KG - powered by[Easytourist](https://www.easytourist.de)\n\n\n[Mehr Infos](https://www.provenexpert.com/petrolli-reisen-gmbh-co-kg/?utm_source=seals&utm_campaign=proseal&utm_medium=profile&utm_content=c75b84ce-fccb-44d0-825f-b4d352a33f4e \"Kundenbewertungen & Erfahrungen zu Petrolli Reisen GmbH & Co. KG\")\n\nDiese Webseite verwendet Cookies. Durch die Nutzung der Webseite akzeptieren Sie die Verwendung von Cookies.[Mehr Infos](/datenschutz/)Ok"
}