{
  "timestamp": "20250722_103325",
  "processing_info": {
    "date": "2025-07-22",
    "time": "10:33:45",
    "timezone": "WEST"
  },
  "url": "http://www.herzobuv.de",
  "imprint_url": "http://www.herzobuv.de/de/impressum/",
  "imprint_data": {
    "company_name": "Herzo Bäder- und Verkehrs- GmbH",
    "managing_directors": [
      "Dietmar Klenk"
    ],
    "business_address": {
      "street": "Schießhausstraße 9",
      "city": "Herzogenaurach",
      "postal_code": "91074",
      "country": "Germany"
    },
    "phone_numbers": [
      "09132 904 - 700",
      "09132 904 - 750",
      "09132 904 - 710"
    ],
    "email_addresses": [
      "info@atlantis-bad.de",
      "info@freibad-herzogenaurach.de",
      "info@herzobus.de"
    ],
    "website_url": "https://www.herzobuv.de",
    "registration_details": {
      "trade_register": "Amtsgericht Fürth",
      "registration_number": "HRB 7587",
      "court": "Amtsgericht Fürth"
    },
    "vat_id": "DE 208248018",
    "tax_id": null,
    "professional_liability_insurance": null,
    "other_legal_info": {
      "responsible_for_content_MStV": "Dietmar Klenk",
      "chairman_of_supervisory_board": "Dr. German Hacker",
      "online_dispute_resolution_platform": "https://ec.europa.eu/consumers/odr/main/index.cfm?event=main.home.chooseLanguage"
    }
  },
  "markdown_content": "Impressum Herzo Bäder- und Verkehrs- GmbH - HerzoBus\n\n\n\n\n\n\n\n\n\n\n\n\n\n \n\n\n\n\n[![Herzobuv](files/layout_herzowerke/img/logo_herzobuv.svg \"Herzobuv\")](/)\n\n[Navigation überspringen](de/impressum/#skipNavigation136)\n\n\n\n\n\n\n\n\n* [Bäder](de/ \"Bäder\")\n  + [Atlantis](https://www.atlantis-bad.de/ \"Bäder\")\n  + [Freibad](https://www.freibad-herzogenaurach.de/ \"Bäder\")\n* [Herzobus](de/Herzobus-Personennahverkehr-fuer-Herzogenaurach/ \"Personennahverkehr in Herzogenaurach\")\n  + [Verkehrsinformationen](de/Herzobus-Personennahverkehr-fuer-Herzogenaurach/verkehrsinformationen/ \"Aktuelles und Verkehrshinweise\")\n  + [Herzobus Linien](de/Herzobus-Personennahverkehr-fuer-Herzogenaurach/herzobus-linien/ \"Übersicht Herzobus Linien\")\n  + [Regionalbuslinien](de/Herzobus-Personennahverkehr-fuer-Herzogenaurach/regionalbuslinien/ \"Informationen zu den Regionalbuslinien\")\n  + [Plan Busbahnhof](de/Herzobus-Personennahverkehr-fuer-Herzogenaurach/lageplan/ \"Übersichtsplan der Bushaltestellen An der Schütt und Badgasse\")\n  + [Fahrscheine](de/Herzobus-Personennahverkehr-fuer-Herzogenaurach/herzobus-fahrscheine/ \"Informationen zu Fahrscheinen\")\n  + [Deutschlandticket](de/Herzobus-Personennahverkehr-fuer-Herzogenaurach/vgn/ \"Das Deutschlandticket - VGN\")\n* [Kontakt](de/kontakt/ \"Kontakt\")\n\n![Lettern einer Druckplatte](assets/images/6/Impressum%20Header%20%23332846459-72880923.jpg \"Lettern einer Druckplatte\")\n\n1. [HerzoBus](de/ \"Home\")\n2. **Impressum**\n\n# Impressum\n\n## **Verantwortlicher im Sinne von § 5 DDG**\n\nHerzo Bäder- und Verkehrs-GmbH  \nSchießhausstraße 9  \n91074 Herzogenaurach\n\nGeschäftsführer\n\nDietmar Klenk\n\nVorsitzender des Aufsichtsrates  \nDr. German Hacker\n\n**Kontakt Freizeitbad Atlantis**\n\nWürzburger Straße 35  \n91074 Herzogenaurach\n\nTelefon: 09132 904 - 700  \nTelefax: 09132 904- 719  \nE-Mail: [info@atlantis-bad.de](mailto:info@atlantis-bad.de)\n\n**Kontakt Freibad**\n\nTuchmachergasse 1  \n91074 Herzogenaurach\n\nTelefon: 09132 904 - 750  \nTelefax: 09132 904 – 719  \nE-Mail: [info@freibad-herzogenaurach.de](mailto:info@freibad-herzogenaurach.de)\n\n**Kontakt Verkehr**\n\nWürzburger Straße 35  \n91074 Herzogenaurach\n\nTelefon: 09132 904 - 710  \nTelefax: 09132 904 - 719  \nE-Mail: [info@herzobus.de](mailto:info@herzobus.de)\n\n**Kontakt Gastronomie**\n\nWürzburger Straße 35  \n91074 Herzogenaurach\n\nTelefon: 09132 904 - 700  \nTelefax: 09132 904 - 719  \nE-Mail: [info@atlantis-bad.de](mailto:info@atlantis-bad.de)\n\n**Handelsregister**\n\nAmtsgericht Fürth HRB 7587\n\n**Angaben nach § 27 a Umsatzsteuergesetz**\n\nUSt-Ident-Nr.: DE 208248018\n\n**Inhaltlich Verantwortlicher gemäß § 18 MStV**\n\nDietmar Klenk (Anschrift wie oben)\n\n### **Online-Streitbeilegung**\n\nDie Europäische Kommission stellt eine Plattform zur Online-Streitbeilegung bereit, die Sie im Internet unter [www.ec.europa.eu/consumers/odr/](https://ec.europa.eu/consumers/odr/main/index.cfm?event=main.home.chooseLanguage) finden. Verbraucher haben die Möglichkeit, diese Plattform für die Beilegung ihrer Streitigkeiten aus Online-Kaufverträgen oder Online-Dienstleistungsverträgen zu nutzen.\n\n### **Rechtliche Hinweise**\n\n#### Haftung für Inhalte\n\nDie Inhalte unserer Seiten wurden mit größter Sorgfalt erstellt. Für die Richtigkeit, Vollständigkeit und Aktualität der Inhalte können wir jedoch keine Gewähr übernehmen. Als Diensteanbieter sind wir gemäß § 7 Abs. 1 DDG für eigene Inhalte auf diesen Seiten nach den allgemeinen Gesetzen verantwortlich. Nach §§ 8 bis 10 DDG sind wir als Diensteanbieter jedoch nicht verpflichtet, übermittelte oder gespeicherte fremde Informationen zu überwachen oder nach Umständen zu forschen, die auf eine rechtswidrige Tätigkeit hinweisen. Verpflichtungen zur Entfernung oder Sperrung der Nutzung von Informationen nach den allgemeinen Gesetzen bleiben hiervon unberührt. Eine diesbezügliche Haftung ist jedoch erst ab dem Zeitpunkt der Kenntnis einer konkreten Rechtsverletzung möglich. Bei Bekanntwerden von entsprechenden Rechtsverletzungen werden wir diese Inhalte umgehend entfernen.\n\n#### Haftung für Links\n\nUnser Angebot enthält Links zu externen Webseiten Dritter, auf deren Inhalte wir keinen Einfluss haben. Deshalb können wir für diese fremden Inhalte auch keine Gewähr übernehmen. Für die Inhalte der verlinkten Seiten ist stets der jeweilige Anbieter oder Betreiber der Seiten verantwortlich. Die verlinkten Seiten wurden zum Zeitpunkt der Verlinkung auf mögliche Rechtsverstöße überprüft. Rechtswidrige Inhalte waren zum Zeitpunkt der Verlinkung nicht erkennbar. Eine permanente inhaltliche Kontrolle der verlinkten Seiten ist jedoch ohne konkrete Anhaltspunkte einer Rechtsverletzung nicht zumutbar. Bei Bekanntwerden von Rechtsverletzungen werden wir derartige Links umgehend entfernen.\n\n**Urheberrecht**\n\nDie durch die Seitenbetreiber erstellten Inhalte und Werke auf diesen Seiten unterliegen dem deutschen Urheberrecht. Die Vervielfältigung, Bearbeitung, Verbreitung und jede Art der Verwertung außerhalb der Grenzen des Urheberrechtes bedürfen der schriftlichen Zustimmung des jeweiligen Autors bzw. Erstellers. Downloads und Kopien dieser Seite sind nur für den privaten, nicht kommerziellen Gebrauch gestattet. Soweit die Inhalte auf dieser Seite nicht vom Betreiber erstellt wurden, werden die Urheberrechte Dritter beachtet. Insbesondere werden Inhalte Dritter als solche gekennzeichnet. Sollten Sie trotzdem auf eine Urheberrechtsverletzung aufmerksam werden, bitten wir um einen entsprechenden Hinweis. Bei Bekanntwerden von Rechtsverletzungen werden wir derartige Inhalte umgehend entfernen.\n\n**Bildnachweis**\n\n|  |  |  |\n| --- | --- | --- |\n| **Plattform** | **Nummer** | **Autor** |\n| Shutterstock | 79552777 | Roman Sigaev |\n| Shutterstock | 1066476131 | lunopark |\n| Shutterstock | 674549569 | YanLev |\n| Shutterstock | 1158953803 | Andrey Popov |\n| Shutterstock | 1105069232 | romma |\n| VGN |  |  |\n| Landratsamt ERH |  |  |\n\nDie Veröffentlichung von Bildern dieser Internetpräsenz findet mit Einverständnis der Urheber/Fotografen oder mit Besitz der entsprechenden Lizenz statt. Sollten Sie trotzdem der Meinung sein, dass wir ein oder Ihr Bild- oder Lizenzrecht verletzen, können Sie uns natürlich unter folgender Mailadresse kontaktieren: [info@herzobus.de](mailto:info@herzobus.de)\n\n[Konzeption, Umsetzung und Hosting: 1601.communication, Erlangen](https://www.1601.com/?utm_source=www.herzobuv.de&utm_medium=Website-Impressum&utm_campaign=Kunden-Backlink \"1601.com Werbeagentur / Kommunikationsagentur / Internetagentur\")\n\n[Navigation überspringen](de/impressum/#skipNavigation139)\n\n\n\n\n\n\n\n\n* [Bäder](de/ \"Bäder\")\n  + [Atlantis](https://www.atlantis-bad.de/ \"Bäder\")\n  + [Freibad](https://www.freibad-herzogenaurach.de/ \"Bäder\")\n* [Herzobus](de/Herzobus-Personennahverkehr-fuer-Herzogenaurach/ \"Personennahverkehr in Herzogenaurach\")\n  + [Verkehrsinformationen](de/Herzobus-Personennahverkehr-fuer-Herzogenaurach/verkehrsinformationen/ \"Aktuelles und Verkehrshinweise\")\n  + [Herzobus Linien](de/Herzobus-Personennahverkehr-fuer-Herzogenaurach/herzobus-linien/ \"Übersicht Herzobus Linien\")\n  + [Regionalbuslinien](de/Herzobus-Personennahverkehr-fuer-Herzogenaurach/regionalbuslinien/ \"Informationen zu den Regionalbuslinien\")\n  + [Plan Busbahnhof](de/Herzobus-Personennahverkehr-fuer-Herzogenaurach/lageplan/ \"Übersichtsplan der Bushaltestellen An der Schütt und Badgasse\")\n  + [Fahrscheine](de/Herzobus-Personennahverkehr-fuer-Herzogenaurach/herzobus-fahrscheine/ \"Informationen zu Fahrscheinen\")\n  + [Deutschlandticket](de/Herzobus-Personennahverkehr-fuer-Herzogenaurach/vgn/ \"Das Deutschlandticket - VGN\")\n* [Kontakt](de/kontakt/ \"Kontakt\")\n\n#### Herzobus\n\nKontakt Verkehr\n\nWürzburger Straße 35  \n91074 Herzogenaurach\n\nTelefon: 09132 904 - 710\n\n[Navigation überspringen](de/impressum/#skipNavigation131)\n\n* [Datenschutz](de/datenschutz/ \"Datenschutzerklärung\")\n* [Impressum](de/impressum/ \"Impressum Herzo Bäder- und Verkehrs- GmbH\")\n* [Hinweisgeberportal](de/meta/hinweisgeberportal/ \"Hinweisgeberportal\")\n\n\n\n© 2025 - Herzo Bäder- und Verkehrs- GmbH | [Hosting: 1601.communication, Erlangen](https://www.1601.com/?utm_source=www.herzobuv.de&utm_medium=Website-Footer&utm_campaign=Kunden-Backlink \"1601.com Werbeagentur / Kommunikationsagentur / Internetagentur\")\n\n\n\n\n\nCookie Einstellungen\n\n### Wir verwenden Cookies.\n\nEinige von ihnen sind essenziell und werden zum Betrieb der Webseite benötigt. Andere dienen der Verbesserung Ihres Nutzererlebnisses und können nach Belieben aktiviert oder deaktiviert werden.\n\n* Essenziell\n* Externe Medien\n\nAlle akzeptieren\nAuswahl speichern & schließen\n\n[Cookie-Informationen](#)|\n[Datenschutz](de/datenschutz/) |\n[Impressum](de/impressum/)\n\n### Essenziell\n\nEssenzielle Cookies sind für den Betrieb der Webseite unbedingt erforderlich und können daher nicht deaktiviert werden.\n\n[Cookie-Informationen](#)\n\nCookie-Consent-Cookie\n\nZweck\n\nDieser Cookie wird benötigt, um die von Ihnen getroffene Auswahl der erlaubten Cookies zu speichern.\n\nName\n\ncc1601\n\nDauer\n\n1 Jahr\n\nSession-Cookie\n\nZweck\n\nDieser Cookie ist für die Funktionalität der Webseite erforderlich.\n\nName\n\nPHPSESSID\n\nDauer\n\nSessiondauer\n\n### Externe Medien\n\nExterne Medien-Cookies erlauben das Laden von Medieninhalten aus externen Quellen. Sie können auch während des Besuchs der Webseite aktiviert werden, wenn Sie auf blockierte Medieninhalte stoßen.\n\n[Cookie-Informationen](#)\n\nExterne Medien\n\nVGN\n\nZweck\n\nDieser Cookie speichert, ob Sie dem Laden von Inhalten des VGN zugestimmt haben.\n\nName\n\ncc\\_vgn\n\nDauer\n\n1 Jahr\n\n\n "
}