{
  "timestamp": "20250722_095937",
  "processing_info": {
    "date": "2025-07-22",
    "time": "09:59:57",
    "timezone": "WEST"
  },
  "url": "https://www.wbg-bus.de",
  "imprint_url": "https://www.wbg-bus.de/de/impressum",
  "imprint_data": {
    "company_info": {
      "name": "Württembergische Bus-Gesellschaft mbH",
      "managing_directors": [
        "Mark Hogenmüller"
      ],
      "address": {
        "street": "Seewiesenstraße 19-23",
        "city": "Waiblingen",
        "postal_code": "71334",
        "country": "Germany"
      },
      "phone_numbers": [
        "07151 303800"
      ],
      "fax_numbers": [
        "07151 3038029"
      ],
      "email_addresses": [
        "info@wbg-bus.de"
      ],
      "website_url": null,
      "registration_details": {
        "trade_register": "Amtsgericht Stuttgart",
        "registration_number": "HRB 755996",
        "registered_office": "Waiblingen"
      },
      "vat_id": "DE 306247199",
      "professional_liability_insurance": null
    },
    "other_legal_and_contact_information": {
      "online_dispute_resolution": {
        "platform_url": "http://ec.europa.eu/consumers/odr/"
      },
      "consumer_dispute_resolution_body": {
        "name": "Reise & Verkehr e.V.",
        "address": {
          "street": "Fasanenstraße 81",
          "city": "Berlin",
          "postal_code": "10623",
          "country": "Germany"
        },
        "website_url": "http://schlichtung-reise-und-verkehr.de"
      },
      "national_enforcement_body_passenger_rights": {
        "name": "Eisenbahnbundesamt",
        "address": {
          "street": "Heinemannstraße 6",
          "city": "Bonn",
          "postal_code": "53175",
          "country": "Germany"
        },
        "phone_numbers": [
          "0228 30795400"
        ],
        "fax_numbers": [
          "0228-30795-499"
        ],
        "email_addresses": [
          "fahrgastrechte@eba.bund.de"
        ]
      },
      "website_design_and_realization": {
        "company_name": "TPWD AG",
        "address": {
          "street": "Chausseestraße 13",
          "city": "Berlin",
          "postal_code": "10115",
          "country": "Germany"
        },
        "website_url": "https://tpwd.de"
      }
    }
  },
  "markdown_content": " Impressum - Württembergische Bus-Gesellschaft mbH\n\n[Direkt zum Hauptinhalt springen](#main)\n\n[Direkt zur Navigation springen](#main-nav)\n\n[Direkt zum Footer springen](#footer)\n\nHoher Kontrast\n\nSuchen\n\nMenü öffnen\n\n* [Strecken](/de/strecken)\n* [Tickets](/de/tickets)\n* [Service](/de/service)\n* [Über uns](/de/ueber-uns)\n* [Kontakt](/de/ueber-uns/kontakt)\n\nHoher Kontrast\n\nSuche starten\n\n* [Strecken](/de/strecken)\n* [Tickets](/de/tickets)\n* [Service](/de/service)\n* [Über uns](/de/ueber-uns)\n* [Kontakt](/de/ueber-uns/kontakt)\n\nVerbindung suchen\n\nVerkehrsmeldungen\n\nBaumaßnahmen\n\n1. [Württembergische Bus-Gesellschaft mbH](/)\n2. Impressum\n\n# Impressum\n\n**Württembergische Bus-Gesellschaft mbH**\n\nSitz: Waiblingen   \nAmtsgericht Stuttgart   \nHRB 755996   \nUSt-IdNr. DE 306247199\n\nSeewiesenstraße 19-23   \n71334 Waiblingen\n\nTelefon: 07151 303800   \nFax: 07151 3038029   \nE-Mail: [info@wbg-bus.de](mailto:info@wbg-bus.de)\n\nGeschäftsführer:  \nMark Hogenmüller\n\n### Rechtliche Hinweise zur Haftung / Disclaimer:\n\nDie Württembergische-Bus-Gesellschaft mbH ist um Richtigkeit und Aktualität der auf dieser Internetpräsenz bereitgestellten Informationen bemüht. Trotzdem können Fehler und Unklarheiten nicht vollständig ausgeschlossen werden. Die Württembergische-Bus-Gesellschaft mbH übernimmt deshalb keine Gewähr für die Aktualität, Richtigkeit, Vollständigkeit oder Qualität der Inhalte.\n\nFür Schäden materieller oder immaterieller Art, die durch die Nutzung oder Nichtnutzung der dargebotenen Informationen bzw. durch die Nutzung fehlerhafter und unvollständiger Informationen unmittelbar oder mittelbar verursacht werden, haftet die Württembergische-Bus-Gesellschaft mbH nicht, sofern ihr nicht nachweislich vorsätzliches oder grob fahrlässiges Verschulden zur Last fällt.\n\nDie Württembergische-Bus-Gesellschaft mbH behält es sich vor, Teile des Internetangebots oder das gesamte Angebot ohne gesonderte Ankündigung zu verändern, zu ergänzen, zu löschen oder die Veröffentlichung zeitweise oder endgültig einzustellen.\n\nDie Verantwortlichkeit für “fremde Inhalte”, die beispielsweise durch direkte oder indirekte Verknüpfungen (z.B. sogenannte “Links”) zu anderen Anbietern bereitgehalten werden, setzt unter anderem die Kenntnis des rechtswidrigen bzw. strafbaren Inhaltes voraus. Die Württembergische-Bus-Gesellschaft mbH hat auf “fremde Inhalte” keinerlei Einfluss und macht sich diese Inhalte auch nicht zu eigen.\n\nDie Württembergische-Bus-Gesellschaft mbH hat keine positive Kenntnis über rechtswidrige oder anstößige Inhalte auf den verknüpften Seiten fremder Anbieter. Sollten auf den verknüpften Seiten fremder Anbieter dennoch rechtswidrige oder anstößige Inhalte enthalten sein, so distanziert sich die Württembergische-Bus-Gesellschaft mbH von diesen Inhalten ausdrücklich.\n\nQuellen Bildmaterial:  \n- Tilman Weishart, Anne Hoffmann, Syrian Gropius, Tom Schulze  \n- Transdev GmbH  \n- Pixabay (Bühnenbilder)\n\nHinweis: Online-Streitbeilegung gemäß Art. 14 Abs. 1 ODR-VO\nDie EU-Kommission bietet die Möglichkeit zur Online-Streitbeilegung auf einer von ihr betriebenen Online-Plattform. Diese Plattform ist über den externen Link <http://ec.europa.eu/consumers/odr/> zu erreichen.\n\nHinweis: Streitbeilegung gem. § 36 VSBG  \nZur Beilegung von Streitigkeiten aus der Beförderung im Kraftomnibusverkehr haben wir uns zur Teilnahme an einem Streitbeilegungsverfahren vor einer Verbraucherschlichtungsstelle freiwillig bereiterklärt und verpflichtet. Die zuständige Verbraucherschlichtungsstelle ist Reise & Verkehr e.V., Fasanenstraße 81, 10623 Berlin unter http://schlichtung-reise-und-verkehr.de. Im Übrigen, insbesondere bei Streitigkeiten aus Ticketabonnements, besteht hierzu weder die Bereitschaft noch Verpflichtung. #\n\nNationale Durchsetzungsstellen für die neuen Fahrgastrechte sind die Eisenbahnaufsichtsbehörden der Bundesländer sowie das Eisenbahnbundesamt.\n\nEisenbahnbundesamt  \nHeinemannstraße 6  \n53175 Bonn  \nTelefon: 0228 30795400  \nFax: 0228-30795-499  \nE-Mail: [fahrgastrechte@eba.bund.de](mailto:fahrgastrechte@eba.bund.de)\n\n#### Gestaltung und Realisierung\n\nTPWD AG  \n Chausseestraße 13  \n 10115 Berlin  \n [tpwd.de](https://tpwd.de)\n\n## Tickets\n\n* [Verkaufsstellen](/de/tickets/verkaufsstelle-neuffen)\n\n## Service\n\n* [Fundbüro](/de/service/fundbuero)\n\n## Über uns\n\n* [Kontaktformular](/de/ueber-uns/kontakt)\n* [Stellenangebote](/de/ueber-uns/stellenangebote)\n\n## Strecken\n\n* [Fahrplanabweichungen](/de/strecken/fahrplan-abweichungen)\n\n## Allgemeines\n\n* [Beförderungsbedingungen](/de/befoerderungsbedingungen)\n* [Tarifbestimmungen](/de/tarifbestimmungen)\n* [Datenschutz](/de/datenschutz)\n* [Cookie-Richtlinie](/de/cookie_policy)\n* [Erklärung zur Barrierefreiheit](/de/erklaerung-zur-barrierefreiheit)\n* [Impressum](/de/impressum)\n* [Transdev Deutschland](http://www.transdev.de)\n* [Transdev weltweit](http://www.transdev.com/en/)\n* [Hinweisgebersystem](https://www.transdev.de/de/ueber-uns/compliance/hinweisgebersystem)\n\n## Cookies\n\nUm unsere Webseite nutzerfreundlich zu gestalten und fortlaufend zu verbessern, setzen wir Cookies ein. Bitte wählen Sie, welche Cookies wir verwenden dürfen. Sie können Ihre Einwilligung in unserer [Cookie-Richtlinie](/de/cookie_policy) jederzeit ändern. Weitere Informationen finden Sie unserer [Datenschutzerklärung](/de/datenschutz).\n\nAkzeptierenAblehnenEinstellungen"
}