{
  "timestamp": "20250722_103436",
  "processing_info": {
    "date": "2025-07-22",
    "time": "10:34:50",
    "timezone": "WEST"
  },
  "url": "https://www.busverkehr-moerlein.de",
  "imprint_url": "https://www.busverkehr-moerlein.de/information/impressum.html",
  "imprint_data": {
    "company_name": "Busverkehr Mörlein",
    "managing_directors": [
      "Bernd Mörlein"
    ],
    "business_address": {
      "street": "Unterrüsselbach 29",
      "city": "Igensdorf",
      "postal_code": "91338",
      "country": "Germany"
    },
    "phone_numbers": [
      "0 91 92/83 34",
      "0 91 92/67 49"
    ],
    "email_addresses": [
      "info@busverkehr-moerlein.de"
    ],
    "website_url": "http://www.busverkehr-moerlein.de",
    "registration_details": {
      "trade_register": null,
      "registration_number": null,
      "court": null
    },
    "vat_id": "DE 365 384 544",
    "tax_id": "217/252/21158",
    "professional_liability_insurance": null,
    "other_legal_info": {
      "legal_basis_imprint": "Angaben gemäß § 5 TMG",
      "tax_authority": "Finanzamt Forchheim"
    }
  },
  "markdown_content": "Impressum – Busverkehr Mörlein\n\n\n\n[![busverkehr mörlein logo](https://www.busverkehr-moerlein.de/images/moerlein-logo_neu3.png)\n![busverkehr mörlein logo](https://www.busverkehr-moerlein.de/images/moerlein-logo_neu3.png)](/)\n\n* [Wir über Uns](/wir-ueber-uns.html)\n\n  + [Unser Team](/wir-ueber-uns/unser-team.html)\n  + [Unser Fuhrpark](/wir-ueber-uns/unser-fuhrpark.html)\n* [Anfrage](/anfrage.html)\n* [Reiseangebote](/reiseangebote.html)\n\n  + [Tagesskifahrten](/reiseangebote/tagesskifahrten.html)\n  + [Alle Reisen](/reiseangebote/alle-reisen.html)\n* [Kontakt](/kontakt.html)\n* [Information](/information.html)\n\n  + [AGB](/information/agb.html)\n  + [Impressum](/information/impressum.html)\n  + [Datenschutz](/information/datenschutz.html)\n\n# Impressum\n\n### Anbieterkennzeichnung\n\nAngaben gemäß § 5 TMG\n\n### Anschrift\n\nBusverkehr Mörlein  \nBernd Mörlein  \nUnterrüsselbach 29  \n91338 Igensdorf\n\n### Kontakt\n\nTelefon: 0 91 92/83 34  \nTelefax: 0 91 92/67 49  \nE-Mail: [info@busverkehr-moerlein.de](mailto:info@busverkehr-moerlein.de)  \nWeb: [http://www.busverkehr-moerlein.de](http://www.busverkehr-moerlein.de/)\n\n### Umsatzsteuer-ID\n\nUmsatzsteuer-Identifikationsnummer gemäß §27 a Umsatzsteuergesetz\n\nDE 365 384 544\n\nFinanzamt Forchheim, Steuernummer: 217/252/21158\n\n### Haftungsausschluss\n\n**Haftung für Inhalte**\n\nAls Diensteanbieter sind wir gemäß § 7 Abs.1 TMG für eigene Inhalte auf diesen Seiten nach den allgemeinen Gesetzen verantwortlich. Nach §§ 8 bis 10 TMG sind wir als Diensteanbieter jedoch nicht verpflichtet, übermittelte oder gespeicherte fremde Informationen zu überwachen oder nach Umständen zu forschen, die auf eine rechtswidrige Tätigkeit hinweisen. Verpflichtungen zur Entfernung oder Sperrung der Nutzung von Informationen nach den allgemeinen Gesetzen bleiben hiervon unberührt. Eine diesbezügliche Haftung ist jedoch erst ab dem Zeitpunkt der Kenntnis einer konkreten Rechtsverletzung möglich. Bei Bekanntwerden von entsprechenden Rechtsverletzungen werden wir diese Inhalte umgehend entfernen.\n\n**Haftung für Links**\n\nUnser Angebot enthält Links zu externen Webseiten Dritter, auf deren Inhalte wir keinen Einfluss haben. Deshalb können wir für diese fremden Inhalte auch keine Gewähr übernehmen. Für die Inhalte der verlinkten Seiten ist stets der jeweilige Anbieter oder Betreiber der Seiten verantwortlich. Die verlinkten Seiten wurden zum Zeitpunkt der Verlinkung auf mögliche Rechtsverstöße überprüft. Rechtswidrige Inhalte waren zum Zeitpunkt der Verlinkung nicht erkennbar. Eine permanente inhaltliche Kontrolle der verlinkten Seiten ist jedoch ohne konkrete Anhaltspunkte einer Rechtsverletzung nicht zumutbar. Bei Bekanntwerden von Rechtsverletzungen werden wir derartige Links umgehend entfernen.\n\n**Urheberrecht**\n\nDie durch die Seitenbetreiber erstellten Inhalte und Werke auf diesen Seiten unterliegen dem deutschen Urheberrecht. Die Vervielfältigung, Bearbeitung, Verbreitung und jede Art der Verwertung außerhalb der Grenzen des Urheberrechtes bedürfen der schriftlichen Zustimmung des jeweiligen Autors bzw. Erstellers. Downloads und Kopien dieser Seite sind nur für den privaten, nicht kommerziellen Gebrauch gestattet. Soweit die Inhalte auf dieser Seite nicht vom Betreiber erstellt wurden, werden die Urheberrechte Dritter beachtet. Insbesondere werden Inhalte Dritter als solche gekennzeichnet. Sollten Sie trotzdem auf eine Urheberrechtsverletzung aufmerksam werden, bitten wir um einen entsprechenden Hinweis. Bei Bekanntwerden von Rechtsverletzungen werden wir derartige Inhalte umgehend entfernen.\n\nAdresse\n\nUnterrüsselbach 29  \n91338 Igensdorf\n\n09192 / 8334\n\nCopyright © 2025 Busverkehr Mörlein\n\nDesigned and developed by [michler-solutions.de](http://michler-solutions.de/)\n\n\n\n\n* [Startseite](/)\n* [Wir über Uns](/wir-ueber-uns.html)\n  + [Unser Team](/wir-ueber-uns/unser-team.html)\n  + [Unser Fuhrpark](/wir-ueber-uns/unser-fuhrpark.html)\n* [Anfrage](/anfrage.html)\n* [Reiseangebote](/reiseangebote.html)\n  + [Tagesskifahrten](/reiseangebote/tagesskifahrten.html)\n  + [Alle Reisen](/reiseangebote/alle-reisen.html)\n* [Kontakt](/kontakt.html)\n* [Information](/information.html)\n  + [AGB](/information/agb.html)\n  + [Impressum](/information/impressum.html)\n  + [Datenschutz](/information/datenschutz.html)"
}