{
  "timestamp": "20250722_102554",
  "processing_info": {
    "date": "2025-07-22",
    "time": "10:26:07",
    "timezone": "WEST"
  },
  "url": "https://www.bodo-ecard.de",
  "imprint_url": "https://www.bodo-ecard.de/impressum.html",
  "imprint_data": {
    "company_name": "Bodensee-Oberschwaben Verkehrsverbund GmbH",
    "managing_directors": [
      "Bernd Hasenfratz"
    ],
    "business_address": {
      "street": "Bahnhofplatz 5",
      "city": "Ravensburg",
      "postal_code": "88214",
      "country": "Germany"
    },
    "phone_numbers": [
      "0751/3614141",
      "0751/3614151"
    ],
    "email_addresses": [
      "info@bodo.de"
    ],
    "website_url": "https://www.bodo.de",
    "registration_details": {
      "trade_register": "Amtsgericht Ulm",
      "registration_number": "HRB 552545",
      "court": "Amtsgericht Ulm"
    },
    "vat_id": "DE 231028054",
    "tax_id": null,
    "professional_liability_insurance": null,
    "other_legal_info": {
      "chairman_of_supervisory_board": "Landrat Luca Wilhelm Prayon",
      "editorial_content_contact": "Felix Löffelholz, Anne Hackert"
    }
  },
  "markdown_content": "bodo - Mobil mit Bus und Bahn: Impressum\n\n# Impressum\n\n**Bodensee-Oberschwaben  \n Verkehrsverbund GmbH**  \n Bahnhofplatz 5  \n D-88214 Ravensburg  \n Germany  \n Telefon: 0751/3614141  \n Telefax: 0751/3614151  \n E-Mail: info@bodo.de  \n Web: [www.bodo.de](https://www.bodo.de/) \n\n**Vorsitzender des Aufsichtsrats**  \n Landrat Luca Wilhelm Prayon\n\n**Geschäftsführer**  \n Bernd Hasenfratz\n\n**Handelsregister**  \n Amtsgericht Ulm HRB 552545\n\n**Umsatzsteuer-Identifikationsnummer**  \n DE 231028054\n\n**Redaktioneller Inhalt**  \n Felix Löffelholz, Anne Hackert  \n Telefon: 0751/ 3614141  \n info@bodo.de\n\n \n\n## Konzeption, Gestaltung und Programmierung\n\nwebsedit AG  \n Seestraße 35, 88214 Ravensburg  \n Telefon: 0751/354104-0  \n[www.websedit.de](https://www.websedit.de/)\n\n \n\n## Haftungshinweise\n\n**1. Inhalt des Onlineangebotes**  \n Der Betreiber dieser Internetpräsenz übernimmt keinerlei Gewähr für die Aktualität, Korrektheit, Vollständigkeit oder Qualität der bereitgestellten Informationen. Haftungsansprüche gegen den Betreiber, die sich auf Schäden materieller oder ideeller Art beziehen, welche durch die Nutzung oder Nichtnutzung der dargebotenen Informationen bzw. durch die Nutzung fehlerhafter und unvollständiger Informationen verursacht wurden sind grundsätzlich ausgeschlossen. Alle Angebote sind freibleibend und unverbindlich.  \n Der Betreiber behält es sich ausdrücklich vor, Teile der Seiten oder das gesamte Angebot ohne gesonderte Ankündigung zu verändern, zu ergänzen, zu löschen oder die Veröffentlichung zeitweise oder endgültig einzustellen.\n\n**2. Verweise und Links**  \n Bei direkten oder indirekten Links auf fremde Internetseiten, die außerhalb des Verantwortungs-  \n bereiches des Betreibers liegen, haftet dieser nur dann, wenn er von den Inhalten Kenntnis hat und es ihm technisch möglich und zumutbar wäre, die Nutzung im Falle rechtswidriger Inhalte zu verhindern. Der Betreiber erklärt daher ausdrücklich, dass zum Zeitpunkt der Linksetzung die entsprechenden verlinkten Seiten frei von illegalen Inhalten waren.  \n Der Betreiber hat keinerlei Einfluss auf die aktuelle und zukünftige Gestaltung und die Inhalte der gelinkten Seiten. Deshalb distanziert er sich hiermit ausdrücklich von allen Inhalten aller gelinkten Seiten inklusive aller Unterseiten und macht sich ihre Inhalte nicht zu eigen. Diese Erklärung gilt für alle innerhalb des eigenen Internetangebotes angebrachten Links. Für illegale, fehlerhafte oder unvollständige Inhalte und insbesondere für Schäden, die aus der Nutzung oder Nichtnutzung solcher dargebotener Informationen entstehen, haftet allein der Anbieter der Seite, auf welche verwiesen wurde, nicht derjenige, der über Links auf die jeweilige Veröffentlichung lediglich verweist. Diese Erklärung gilt auch für Fremdeinträge in vom Betreiber eingerichteten Gästebüchern, Diskussionsforen und Mailinglisten.\n\n**3. Urheberrecht**  \n Der Betreiber ist bestrebt, in allen Publikationen die Urheberrechte der verwendeten Grafiken, Tondokumente, Videosequenzen und Texte zu beachten, von ihm selbst erstellte Grafiken, Tondokumente, Videosequenzen und Texte zu nutzen oder auf lizenzfreie Grafiken, Tondokumente, Videosequenzen und Texte zurückzugreifen. Die hier veröffentlichten Texte, Grafiken, Bilder und andere Seiten stammen, soweit nicht anders gekennzeichnet, aus seiner Sammlung.  \n Alle innerhalb des Internetangebotes genannten und ggf. durch Dritte geschützten Marken- und Warenzeichen unterliegen uneingeschränkt den Bestimmungen des jeweils gültigen Kennzeichenrechts und den Besitzrechten der jeweiligen eingetragenen Eigentümer. Allein aufgrund der bloßen Nennung ist nicht der Schluss zu ziehen, dass Markenzeichen nicht durch Rechte Dritter geschützt sind.  \n Das Copyright für veröffentlichte, vom Betreiber selbst erstellte Objekte bleibt allein beim Betreiber der Seiten. Eine Vervielfältigung oder Verwendung solcher Grafiken, Tondokumente, Videosequenzen und Texte in anderen elektronischen oder gedruckten Publikationen ist ohne ausdrückliche Zustimmung des Betreibers nicht gestattet.\n\n**4. Datenschutz**  \n a)Wir wissen, dass Ihnen der sorgfältige Umgang mit Ihren personenbezogenen Daten sehr wichtig ist. Bei uns steht deshalb der Datenschutz an erster Stelle. Wir halten uns bei der Erhebung, Verarbeitung und Nutzung streng an die gesetzlichen Bestimmungen des Bundesdatenschutzgesetzes und des Teledienstsdatenschutzgesetzes. Persönliche Daten werden nur dann erhoben und verarbeitet, wenn Sie uns diese freiwillig zur Verfügung stellen. Zum Beispiel, wenn Sie eine Bestellung im Online-Shop tätigen oder ein Abo online abschließen.  \n In diesen Fällen werden die Informationen in verschlüsselter Form übertragen, um einem Missbrauch der Daten durch Dritte vorzubeugen. Die Verschlüsselung erfolgt mit SSL (Secure Socket Layer). Diese Verbindung sorgt für ein Höchstmaß an Sicherheit bei der Datenübertragung. Die geschützten Bereiche erkennen Sie an dem Siegel auf den jeweiligen Seiten oder an dem Schloss-Piktogramm in Ihrem Browser.  \n Die Inanspruchnahme aller angebotenen Dienste ist, soweit technisch möglich und zumutbar, auch ohne Angabe solcher Daten bzw. unter Angabe anonymisierter Daten oder eines Pseudonyms gestattet.\n\n**b) Google Analytics**  \n “Diese Website benutzt Google Analytics, einen Webanalysedienst der Google Inc. (”Google”) Google Analytics verwendet sog. “Cookies”, Textdateien, die auf Ihrem Computer gespeichert werden und die eine Analyse der Benutzung der Website durch Sie ermöglicht. Die durch den Cookie erzeugten Informationen über Ihre Benutzung diese Website (einschließlich Ihrer IP-Adresse) wird an einen Server der Google in den USA übertragen und dort gespeichert. Google wird diese Informationen benutzen, um Ihre Nutzung der Website auszuwerten, um Reports über die Websiteaktivitäten für die Websitebetreiber zusammenzustellen und um weitere mit der Websitenutzung und der Internetnutzung verbundene Dienstleistungen zu erbringen. Auch wird Google diese Informationen gegebenenfalls an Dritte übertragen, sofern dies gesetzlich vorgeschrieben oder soweit Dritte diese Daten im Auftrag von Google verarbeiten. Google wird in keinem Fall Ihre IP-Adresse mit anderen Daten der Google in Verbindung bringen. Sie können die Installation der Cookies durch eine entsprechende Einstellung Ihrer Browser Software verhindern; wir weisen Sie jedoch darauf hin, dass Sie in diesem Fall gegebenenfalls nicht sämtliche Funktionen dieser Website voll umfänglich nutzen können. Durch die Nutzung dieser Website erklären Sie sich mit der Bearbeitung der über Sie erhobenen Daten durch Google in der zuvor beschriebenen Art und Weise und zu dem zuvor benannten Zweck einverstanden.”   \n Der Datenerhebung und -speicherung kann jederzeit mit Wirkung für die Zukunft [widersprochen](http://tools.google.com/dlpage/gaoptout?hl=de \"Externer Link auf die Seiten von Google\") werden.  \n Angesichts der Diskussion um den Einsatz von Analysetools mit vollständigen IP-Adressen möchten wir darauf hinweisen, dass diese Website Google Analytics mit der Erweiterung „\\_anonymizeIp()“ verwendet und daher IP-Adressen nur gekürzt weiterverarbeitet werden, um eine direkte Personenbeziehbarkeit auszuschließen.\n\n5. Rechtswirksamkeit dieses Haftungsausschlusses  \n Dieser Haftungsausschluss ist als Teil des Internetangebotes zu betrachten, von dem aus auf diese Seite verwiesen wurde. Sofern Teile oder einzelne Formulierungen dieses Textes der geltenden Rechtslage nicht, nicht mehr oder nicht vollständig entsprechen sollten, bleiben die übrigen Teile des Dokumentes in ihrem Inhalt und ihrer Gültigkeit davon unberührt.\n\n \n\nKundenportal Login\n\n* [Portal eCard Schule](https://antrag.slv-bw.de/SLV.Portal/?vu=bodo)\n* [Portal eCard](https://webportal.bodo-ecard.de/WebClientBodoUserUi/userauthorization/login/login.xhtml?Mandant=bodo&KTNR=0)\n\n[![Logo Bodensee-Oberschwaben Verkehrsverbund GmbH](/typo3conf/ext/we_template/Resources/Public/Images/logo.svg)](/index.html \"Zur Startseite\")\n\n \n\n* [eCard](# \"eCard\")\n\n  **eCard**\n  + [Login / Bestellung](/ecard-ebc-home/login-bestellung.html \"Login / Bestellung\")\n  + [So funktioniert's](/ecard-ebc-home/so-funktionierts.html \"So funktioniert's\")\n  + [Hier gilt die eCard](/ecard-ebc-home/hier-gilt-die-ecard.html \"Hier gilt die eCard\")\n  + [Fahrten nach Konstanz: Preistabellen](/ecard-ebc-home/ecard-preistabellen.html \"Fahrten nach Konstanz: Preistabellen\")\n  + [Kurzstreckentarif](/ecard-ebc-home/kurzstreckentarif.html \"Kurzstreckentarif\")\n  + [Aktuelles](/ecard-ebc-home/aktuelles.html \"Aktuelles\")\n  + [FAQ](/ecard-ebc-home/faq.html \"FAQ\")Kundenportal Login\n\n  + [Portal eCard Schule](https://antrag.slv-bw.de/SLV.Portal/?vu=bodo)\n  + [Portal eCard](https://webportal.bodo-ecard.de/WebClientBodoUserUi/userauthorization/login/login.xhtml?Mandant=bodo&KTNR=0)\n\n  + [bodo Serviceportal](https://serviceportal.bodo.de/)\n  + [bobo Website](https://www.bodo.de/)\n* [EBC Home](# \"EBC Home\")\n\n  **EBC Home**\n  + [Was ist die ECHT BODENSEE CARD HOME?](/ecard-ebc-home/ebc-home-1.html \"Was ist die ECHT BODENSEE CARD HOME?\")\n  + [Login / Bestellung](/ebc-home/login-/-bestellung.html \"Login / Bestellung\")\n  + [So funktioniert's](/ecard-ebc-home/so-funktionierts-1.html \"So funktioniert's\")\n  + [Hier gilt die EBC Home](/ecard-1/hier-gilt-die-ebc-home.html \"Hier gilt die EBC Home\")Kundenportal Login\n\n  + [Portal eCard Schule](https://antrag.slv-bw.de/SLV.Portal/?vu=bodo)\n  + [Portal eCard](https://webportal.bodo-ecard.de/WebClientBodoUserUi/userauthorization/login/login.xhtml?Mandant=bodo&KTNR=0)\n\n  + [bodo Serviceportal](https://serviceportal.bodo.de/)\n  + [bobo Website](https://www.bodo.de/)\n* [eCard Schule](# \"eCard Schule\")\n\n  **eCard Schule**\n  + [Jetzt bestellen](/ecard-schule/jetzt-bestellen.html \"Jetzt bestellen\")\n  + [So funktioniert's](/ecard-schule/so-funktionierts.html \"So funktioniert's\")\n  + [Freizeitregelung](/ecard-schule/freizeitregelung.html \"Freizeitregelung\")\n  + [Downloads](/ecard-schule/downloads.html \"Downloads\")\n  + [FAQ](/ecard-schule/faq.html \"FAQ\")\n  + [Ansprechpartner](/ecard-schule/ansprechpartner.html \"Ansprechpartner\")\n  + [Datenschutz](/ecard-schule/datenschutz.html \"Datenschutz\")Kundenportal Login\n\n  + [Portal eCard Schule](https://antrag.slv-bw.de/SLV.Portal/?vu=bodo)\n  + [Portal eCard](https://webportal.bodo-ecard.de/WebClientBodoUserUi/userauthorization/login/login.xhtml?Mandant=bodo&KTNR=0)\n\n  + [bodo Serviceportal](https://serviceportal.bodo.de/)\n  + [bobo Website](https://www.bodo.de/)\n\n \n\nBodensee-Oberschwaben Verkehrsverbund\n\n* [Datenschutz](/datenschutz.html \"Datenschutz\")\n* [Impressum](/impressum.html \"Impressum\")\n\n   "
}