{
  "timestamp": "20250722_103114",
  "processing_info": {
    "date": "2025-07-22",
    "time": "10:31:39",
    "timezone": "WEST"
  },
  "url": "http://www.kirchgaessner-reisen.de",
  "imprint_url": "http://www.kirchgaessner-reisen.de/impressum/",
  "imprint_data": {
    "company_name": "KIRCHGÄSSNER-Reisen GmbH",
    "managing_directors": [
      "Eduard Kirchgäßner",
      "Markus Kirchgäßner"
    ],
    "business_address": {
      "street": "Hauptstr.7",
      "city": "Weilbach/Ufr.",
      "postal_code": "63937",
      "country": "Germany"
    },
    "phone_numbers": [
      "093 73 / 43 71",
      "09373 / 2056960"
    ],
    "email_addresses": [
      "info@Kirchgaessner-Reisen.de",
      "Reisebuero@Kirchgaessner-Reisen.de"
    ],
    "website_url": "https://www.Kirchgaessner-Reisen.de",
    "registration_details": {
      "trade_register": "Handelsregister",
      "registration_number": "HRB 1762",
      "court": "Aschaffenburg"
    },
    "vat_id": "DE 811758870",
    "tax_id": null,
    "professional_liability_insurance": null,
    "other_legal_info": {
      "online_dispute_resolution_platform_url": "http://ec.europa.eu/consumers/odr/",
      "responsible_for_content_according_to_mdstv": "Markus Kirchgässner",
      "legal_status_insurance_brokerage": "Permitted annex intermediary according to § 34d Abs. 8 Nr. 1 Gewerbeordnung (GewO)",
      "complaint_body_for_insurance_brokers": "Versicherungsombudsmann e.V., Postfach 08 06 32, 10006 Berlin, www.verischerungsombudsmann.de",
      "copyright_notice": "Copyright © 2025 Kirchgässner",
      "cookie_usage_statement": "This website uses cookies. By using the website you accept the use of cookies."
    }
  },
  "markdown_content": "Impressum | Kirchgaessner\n\n\n\n* [Busreisen](http://www.kirchgaessner-reisen.de/busreisen/ \"Busreisen\")\n* [Katalog](http://www.kirchgaessner-reisen.de/katalog/ \"Katalog\")\n* [Gruppenreisen](http://www.kirchgaessner-reisen.de/gruppenreisen/ \"Gruppenreisen\")\n* [Busvermietung](http://www.kirchgaessner-reisen.de/busvermietung/ \"Busvermietung\")\n  + [Fuhrpark](http://www.kirchgaessner-reisen.de/busvermietung/fuhrpark/ \"Fuhrpark\")\n* [Linienverkehr](http://www.kirchgaessner-reisen.de/linienverkehr/ \"Linienverkehr\")\n* [Reisebüro](http://www.kirchgaessner-reisen.de/reisebuero/ \"Reisebüro\")\n* [Wir über uns](http://www.kirchgaessner-reisen.de/wir-ueber-uns/ \"Wir über uns\")\n* [Aktuelles](http://www.kirchgaessner-reisen.de/aktuelles/ \"Aktuelles\")\n* [Service](http://www.kirchgaessner-reisen.de/service/ \"Service\")\n\n### Kirchgässner\n\nBusreisen seit 1927\n\n### Buchungshotline\n\nTel.: 09373 - 4371\n\n### Unser Angebot\n\n* [Aktuelles](http://www.kirchgaessner-reisen.de/aktuelles/)\n* [Busreisen](http://www.kirchgaessner-reisen.de/busreisen/)\n* [Busvermietung](http://www.kirchgaessner-reisen.de/busvermietung/)\n  + [Fuhrpark](http://www.kirchgaessner-reisen.de/busvermietung/fuhrpark/)\n* [Gruppenreisen](http://www.kirchgaessner-reisen.de/gruppenreisen/)\n* [Katalog](http://www.kirchgaessner-reisen.de/katalog/)\n* [Linienverkehr](http://www.kirchgaessner-reisen.de/linienverkehr/)\n* [Reisebüro](http://www.kirchgaessner-reisen.de/reisebuero/)\n* [Service](http://www.kirchgaessner-reisen.de/service/)\n* [Wir über uns](http://www.kirchgaessner-reisen.de/wir-ueber-uns/)\n\n* [AGB](http://www.kirchgaessner-reisen.de/agb/)\n* [Kontakt](http://www.kirchgaessner-reisen.de/kontakt/)\n* [Impressum](http://www.kirchgaessner-reisen.de/impressum/)\n* [Datenschutz](http://www.kirchgaessner-reisen.de/datenschutz/)\n\n### Newsletter\n\n## Impressum\n\nBeratung und Buchung:\n\nKIRCHGÄSSNER-Reisen GmbH  \nHauptstr.7  \n63937 Weilbach/Ufr.\n\nTelefon: 093 73 / 43 71  \nTelefax: 093 73 / 42 71\n\ne-mail: info@Kirchgaessner-Reisen.de\n\nInternet: www.Kirchgaessner-Reisen.de\n\nReisebüro KIRCHGÄSSNER  \nHauptstr.7  \n63937 Weilbach  \nTelefon: 09373 / 2056960  \nTelefax: 09373 / 2056961  \ne-mail: Reisebuero@Kirchgaessner-Reisen.de\n\nGeschäftsführer:  \nEduard Kirchgäßner,  \nMarkus Kirchgäßner\n\nRegistergericht Aschaffenburg:  \nHRB 1762\n\nUmsatzsteuer-Identifikationsnummer gemäß § 27 a Umsatzsteuergesetz:  \nDE 811758870\n\nHaftungshinweis:\n\nTrotz sorgfältiger inhaltlicher Kontrolle übernehmen wir keine Haftung für die Inhalte externer Links. Für den Inhalt der verlinkten Seiten sind ausschließlich deren Betreiber verantwortlich.\n\nHinweis zur Online-Streitbeilegung gemäß Art. 14 Abs. 1 ODR-VO: Die Europäische Kommission stellt eine Plattform zur Online-Streitbeilegung (OS) bereit, die Sie unter http://ec.europa.eu/consumers/odr/ finden; die Plattform wird voraussichtlich ab dem 15.02.2016 ihren Betrieb aufnehmen.\n\nWir vermitteln Reiseversicherung im Status eines erlaubnisfreien Annexvermittlers gemäß § 34d Abs. 8 Nr. 1 Gewerbeordnung (GewO)\n\n**Beschwerdestelle bei Streitigkeiten mit Versicherungsvermittlern:**\n\nVersicherungsombudsmann e.V.  \nPostfach 08 06 32  \n10006 Berlin\n\nwww.verischerungsombudsmann.de\n\nHaftungsausschluss\n\nInhaltlich Verantwortlicher gemäß §10 Abs. 3 MDStV: Markus Kirchgässner (Anschrift unter Kontakt)\n\nInhalt des Onlineangebotes\n\nDer Autor übernimmt keinerlei Gewähr für die Aktualität, Korrektheit, Vollständigkeit oder Qualität der bereitgestellten Informationen. Haftungsansprüche gegen den Autor, welche sich auf Schäden materieller oder ideeller Art beziehen, die durch die Nutzung oder Nichtnutzung der dargebotenen Informationen bzw. durch die Nutzung fehlerhafter und unvollständiger Informationen verursacht wurden sind grundsätzlich ausgeschlossen, sofern seitens des Autors kein nachweislich vorsätzliches oder grob fahrlässiges Verschulden vorliegt. Alle Angebote sind freibleibend und unverbindlich. Der Autor behält es sich ausdrücklich vor, Teile der Seiten oder das gesamte Angebot ohne gesonderte Ankündigung zu verändern, zu ergänzen, zu löschen oder die Veröffentlichung zeitweise oder endgültig einzustellen.\n\nVerweise und Links\n\nBei direkten oder indirekten Verweisen auf fremde Internetseiten (“Links”), die außerhalb des Verantwortungsbereiches des Autors liegen, würde eine Haftungsverpflichtung ausschließlich in dem Fall in Kraft treten, in dem der Autor von den Inhalten Kenntnis hat und es ihm technisch möglich und zumutbar wäre, die Nutzung im Falle rechtswidriger Inhalte zu verhindern. Der Autor erklärt daher ausdrücklich, dass zum Zeitpunkt der Linksetzung die entsprechenden verlinkten Seiten frei von illegalen Inhalten waren. Der Autor hat keinerlei Einfluss auf die aktuelle und zukünftige Gestaltung und auf die Inhalte der gelinkten/verknüpften Seiten. Deshalb distanziert er sich hiermit ausdrücklich von allen Inhalten aller gelinkten /verknüpften Seiten, die nach der Linksetzung verändert wurden. Diese Feststellung gilt für alle innerhalb des eigenen Internetangebotes gesetzten Links und Verweise sowie für Fremdeinträge in vom Autor eingerichteten Gästebüchern, Diskussionsforen und Mailinglisten. Für illegale, fehlerhafte oder unvollständige Inhalte und insbesondere für Schäden, die aus der Nutzung oder Nichtnutzung solcherart dargebotener Informationen entstehen, haftet allein der Anbieter der Seite, auf welche verwiesen wurde, nicht derjenige, der über Links auf die jeweilige Veröffentlichung lediglich verweist.\n\nUrheber- und Kennzeichenrecht\n\nDer Autor ist bestrebt, in allen Publikationen die Urheberrechte der verwendeten Grafiken, Tondokumente, Videosequenzen und Texte zu beachten, von ihm selbst erstellte Grafiken, Tondokumente, Videosequenzen und Texte zu nutzen oder auf lizenzfreie Grafiken, Tondokumente, Videosequenzen und Texte zurückzugreifen. Alle innerhalb des Internetangebotes genannten und ggf. durch Dritte geschützten Marken- und Warenzeichen unterliegen uneingeschränkt den Bestimmungen des jeweils gültigen Kennzeichenrechts und den Besitzrechten der jeweiligen eingetragenen Eigentümer. Allein aufgrund der bloßen Nennung ist nicht der Schluss zu ziehen, dass Markenzeichen nicht durch Rechte Dritter geschützt sind! Das Copyright für veröffentlichte, vom Autor selbst erstellte Objekte bleibt allein beim Autor der Seiten. Eine Vervielfältigung oder Verwendung solcher Grafiken, Tondokumente, Videosequenzen und Texte in anderen elektronischen oder gedruckten Publikationen ist ohne ausdrückliche Zustimmung des Autors nicht gestattet.\n\nRechtswirksamkeit des Haftungsausschlusses\n\nDieser Haftungsausschluss ist als Teil des Internetangebotes zu betrachten, von dem aus auf diese Seite verwiesen wurde. Sofern Teile oder einzelne Formulierungen dieses Textes der geltenden Rechtslage nicht, nicht mehr oder nicht vollständig entsprechen sollten, bleiben die übrigen Teile des Dokumentes in ihrem Inhalt und ihrer Gültigkeit davon unberührt.\n\n \n\nDiese Webseite verwendet Cookies. Durch die Nutzung der Webseite akzeptieren Sie die Verwendung von Cookies. [Mehr Infos](http://www.schweizer-reisen.de/reisebuero-welt/pauschalreisen/)\n\n[Impressum](http://www.kirchgaessner-reisen.de/impressum/) | [AGB](http://www.kirchgaessner-reisen.de/agb/) | [Kontakt](http://www.kirchgaessner-reisen.de/kontakt/)\n\nCopyright © 2025 Kirchgässner\n\nPowered by [Sir-FlashAlot](http://www.flashalot.com)."
}