{
  "timestamp": "20250722_103118",
  "processing_info": {
    "date": "2025-07-22",
    "time": "10:31:39",
    "timezone": "WEST"
  },
  "url": "https://www.dbregiobus-bayern.de",
  "imprint_url": "https://www.dbregiobus-bayern.de/home/impressum",
  "imprint_data": {
    "company_name": "DB Regio Bus Bayern GmbH",
    "managing_directors": [
      "Sebastian Heilek",
      "Stefan Kühn"
    ],
    "business_address": {
      "street": "Elisabethstraße 16",
      "city": "Ingolstadt",
      "postal_code": "85051",
      "country": "Germany"
    },
    "phone_numbers": [
      "0841 9376-7339"
    ],
    "email_addresses": [
      "Kundendialog.RegioBusBayern@deutschebahn.com"
    ],
    "website_url": "https://www.dbregiobus-bayern.de",
    "registration_details": {
      "trade_register": null,
      "registration_number": "HRB 7791",
      "court": "Ingolstadt"
    },
    "vat_id": "DE265484631",
    "tax_id": null,
    "professional_liability_insurance": null,
    "other_legal_info": {
      "Datenschutzbeauftragte": "Dr. Marein Müller",
      "Email_Datenschutzbeauftragte": "datenschutz.regio@deutschebahn.com"
    }
  },
  "markdown_content": "Impressum der Busgesellschaften von DB Regio Bus Bayern\n\n\n\n\n\n* [Zu den Hauptinhalten springen](/home/impressum#content)\n\n\n[![Startseite](https://assets.static-bahn.de/dam/jcr:eb79fa88-9673-46d6-b515-32e2c1bce96d/SI_Regio-Bus-Bayern.svg)](/)\n\n* [Startseite\n  Weitere Informationen: Startseite](/)\n* [Kontakt\n  Weitere Informationen: Kontakt](/service/kontakt)\n* [Aboportal\n  Weitere Informationen: Aboportal](https://oid-dbr.highq-systems.de/auth/realms/AboOnline/protocol/openid-connect/auth?client_id=portal&redirect_uri=https%3A%2F%2Faboportal.dbregiobus-bayern.de%2Faboonline-portal-dbregio%2F&state=cd1363be-6382-4b76-95ac-d881f75e6b4d&response_mode=fragment&response_type=code&scope=openid&nonce=dd08a0fb-1e9d-43be-9802-f7c7ed1e9f19&code_challenge=OEw98CTKzR7n3FoKQ3QmaXWsCjwh1rYShCrX8w3SjQc&code_challenge_method=S256)\n\nSuchbegriff\n\nHauptnavigation\n\n\n[![Startseite](https://assets.static-bahn.de/dam/jcr:eb79fa88-9673-46d6-b515-32e2c1bce96d/SI_Regio-Bus-Bayern.svg)](/)\n\nSuchbegriff\n\n* [Fahrplan](/fahrplan)\n* [Angebot](/angebot)\n* [Tickets](/tickets)\n* [Service](/service)\n* [Aktuell](/aktuell)\n* [Über uns](/ueber-uns)\n\nSuchbegriff\n\n\n\n# Impressum\n\n\n\n1. [StartseiteStartseite](/)\n2. [Informationen](/home)\n3. Impressum\n\nImpressum\n\n### Verkehrsgesellschaft mbH Untermain - VU -\n\nLudwigstraße 8  \n63739 Aschaffenburg\n\nAmtsgericht Aschaffenburg  \nHandelsregister-Nr. HRB 9613  \nUst-IdNr.: DE 114110345  \n  \nDie Verkehrsgesellschaft mbH Untermain (VU) wird vertreten durch die Geschäftsführer:  \nMario Barth und Judith Koch\n\nFax: 06021 3392-40\n\n* [E-Mail: VU.Aschaffenburg@deutschebahn.com\n  Weitere Informationen: E-Mail: VU.Aschaffenburg@deutschebahn.com](mailto:VU.Aschaffenburg@deutschebahn.com)\n* [Telefon: 06021 3392-0\n  Weitere Informationen: Telefon: 06021 3392-0](tel:+49602133920)\n\n### Omnibusverkehr Franken GmbH\n\n#### Impressum OVF\n\nBreslauer Str. 376  \n90471 Nürnberg\n\nAmtsgericht Nürnberg  \nHandelsregister-Nr.HRB 8616  \nUst-IdNr.:DE 133531126  \n  \nDie Omnibusverkehr Franken GmbH (OVF) wird vertreten durch die Geschäftsführer:  \nMario Barth und Stefan Kühn  \n  \nVorsitzender des Aufsichtsrates: Dr. Matthias Walter\n\nE-Mail: [Kundendialog.RegioBusBayern@deutschebahn.com](mailto:Kundendialog.RegioBusBayern@deutschebahn.com)  \nTelefon [0911 989781-0](tel:0911 989781-0)\n\n### DB Regio Bus Bayern GmbH\n\nElisabethstraße 16  \n85051 Ingolstadt\n\nGerichtsstand: Ingolstadt  \nHRB 7791  \nUSt-ID: DE265484631  \n  \nDie DB Regio Bus Bayern GmbH (DRB) wird vertreten durch die Geschäftsführer:  \nSebastian Heilek, Stefan Kühn\n\n* [E-Mail: Kundendialog.RegioBusBayern@deutschebahn.com\n  Weitere Informationen: E-Mail: Kundendialog.RegioBusBayern@deutschebahn.com](mailto:Kundendialog.RegioBusBayern@deutschebahn.com)\n* [Telefon: 0841 9376-7339\n  Weitere Informationen: Telefon: 0841 9376-7339](tel:+4984193767339)\n\n### RBO Regionalbus Ostbayern GmbH\n\nVon-Donle-Str. 7  \n93055 Regensburg  \n  \nRegistergericht: Regensburg  \nHRB-Nr.: 4030  \nUSt.-ID: DE 133707328  \n  \nDie Regionalbus Ostbayern GmbH (RBO) wird vertreten durch die Geschäftsführer:  \nMario Barth, Jörg Konrad und Stefan Kühn.\n\nFax: 0941 6000-400\n\n* [E-Mail: RBO.Regensburg@deutschebahn.com\n  Weitere Informationen: E-Mail: RBO.Regensburg@deutschebahn.com](mailto:RBO.Regensburg@deutschebahn.com)\n* [Telefon: 0941 6000-0\n  Weitere Informationen: Telefon: 0941 6000-0](tel:+4994160000)\n\n### Regionalverkehr Oberbayern GmbH\n\n#### Impressum RVO\n\nHirtenstraße 24  \n80335 München\n\nGerichtsstand: München  \nHRB 50357  \nUSt-ID: DE 811550190  \n  \nDie Regionalverkehr Oberbayern GmbH (RVO) wird vertreten durch die Geschäftsführer:  \nMario Barth und Stefan Kühn.  \n  \nVorsitzender des Aufsichtsrates: Dr. Matthias Walter\n\nE-Mail: [Kundendialog.RegioBusBayern@deutschebahn.com](mailto:Kundendialog.RegioBusBayern@deutschebahn.com)  \nTelefon [089 55164-0](tel:+4989551640)\n\n### Regionalverkehr Allgäu GmbH (RVA)\n\nIm Steinach 4  \n87561 Oberstdorf\n\nGerichtsstand: Kempten  \nHRB 3147  \nUSt-ID: DE 811740505  \n  \nDie Regionalverkehr Allgäu GmbH (RVA) wird vertreten durch die Geschäftsführer:  \nMario Barth und Christiane Jentsch  \n  \nVorsitzender des Aufsichtsrates: Stefan Kühn\n\n* [E-Mail: RVA.Oberstdorf@deutschebahn.com\n  Weitere Informationen: E-Mail: RVA.Oberstdorf@deutschebahn.com](mailto:RVA.Oberstdorf@deutschebahn.com)\n* [Telefon: 08322 9677-0\n  Weitere Informationen: Telefon: 08322 9677-0](tel:+49832296770)\n\n## Haftungsausschluss\n\n**1. Inhalt des Onlineangebotes**\n\nDB Regio Bus Bayern (im Folgenden \"der Autor\" genannt) übernimmt keinerlei Gewähr für die Aktualität, Korrektheit, Vollständigkeit oder Qualität der bereitgestellten Informationen. Haftungsansprüche gegen den Autor, welche sich auf Schäden materieller oder ideeller Art beziehen, die durch die Nutzung oder Nichtnutzung der dargebotenen Informationen bzw. durch die Nutzung fehlerhafter und unvollständiger Informationen verursacht wurden, sind grundsätzlich ausgeschlossen, sofern seitens des Autors kein nachweislich vorsätzliches oder grob fahrlässiges Verschulden vorliegt.  \nAlle Angebote sind freibleibend und unverbindlich. Der Autor behält es sich ausdrücklich vor, Teile der Seiten oder das gesamte Angebot ohne gesonderte Ankündigung zu verändern, zu ergänzen, zu löschen oder die Veröffentlichung zeitweise oder endgültig einzustellen.\n\n**2. Verweise und Links**\n\nBei direkten oder indirekten Verweisen auf fremde Webseiten (\"Hyperlinks\"), die außerhalb des Verantwortungsbereiches des Autors liegen, würde eine Haftungsverpflichtung ausschließlich in dem Fall in Kraft treten, in dem der Autor von den Inhalten Kenntnis hat und es ihm technisch möglich und zumutbar wäre, die Nutzung im Falle rechtswidriger Inhalte zu verhindern.  \nDer Autor erklärt hiermit ausdrücklich, dass zum Zeitpunkt der Linksetzung keine illegalen Inhalte auf den zu verlinkenden Seiten erkennbar waren. Auf die aktuelle und zukünftige Gestaltung, die Inhalte oder die Urheberschaft der verlinkten/verknüpften Seiten hat der Autor keinerlei Einfluss. Deshalb distanziert er sich hiermit ausdrücklich von allen Inhalten aller verlinkten /verknüpften Seiten, die nach der Linksetzung verändert wurden. Diese Feststellung gilt für alle innerhalb des eigenen Internetangebotes gesetzten Links und Verweise sowie für Fremdeinträge in vom Autor eingerichteten Gästebüchern, Diskussionsforen, Linkverzeichnissen, Mailinglisten und in allen anderen Formen von Datenbanken, auf deren Inhalt externe Schreibzugriffe möglich sind. Für illegale, fehlerhafte oder unvollständige Inhalte und insbesondere für Schäden, die aus der Nutzung oder Nichtnutzung solcherart dargebotener Informationen entstehen, haftet allein der Anbieter der Seite, auf welche verwiesen wurde, nicht derjenige, der über Links auf die jeweilige Veröffentlichung lediglich verweist.\n\n**3. Urheber- und Kennzeichenrecht**\n\nDer Autor ist bestrebt, in allen Publikationen die Urheberrechte der verwendeten Bilder, Grafiken, Tondokumente, Videosequenzen und Texte zu beachten, von ihm selbst erstellte Bilder, Grafiken, Tondokumente, Videosequenzen und Texte zu nutzen oder auf lizenzfreie Grafiken, Tondokumente, Videosequenzen und Texte zurückzugreifen.  \nAlle innerhalb des Internetangebotes genannten und ggf. durch Dritte geschützten Marken- und Warenzeichen unterliegen uneingeschränkt den Bestimmungen des jeweils gültigen Kennzeichenrechts und den Besitzrechten der jeweiligen eingetragenen Eigentümer. Allein aufgrund der bloßen Nennung ist nicht der Schluss zu ziehen, dass Markenzeichen nicht durch Rechte Dritter geschützt sind!  \nDas Copyright für veröffentlichte, vom Autor selbst erstellte Objekte bleibt allein beim Autor der Seiten. Eine Vervielfältigung oder Verwendung solcher Grafiken, Tondokumente, Videosequenzen und Texte in anderen elektronischen oder gedruckten Publikationen ist ohne ausdrückliche Zustimmung des Autors nicht gestattet.\n\n**4. Datenschutz**  \n  \nSofern innerhalb des Internetangebotes die Möglichkeit zur Eingabe persönlicher oder geschäftlicher Daten (Emailadressen, Namen, Anschriften) besteht, so erfolgt die Preisgabe dieser Daten seitens des Nutzers auf ausdrücklich freiwilliger Basis. Die Inanspruchnahme und Bezahlung aller angebotenen Dienste ist - soweit technisch möglich und zumutbar - auch ohne Angabe solcher Daten bzw. unter Angabe anonymisierter Daten oder eines Pseudonyms gestattet. Die Nutzung der im Rahmen des Impressums oder vergleichbarer Angaben veröffentlichten Kontaktdaten wie Postanschriften, Telefon- und Faxnummern sowie Emailadressen durch Dritte zur Übersendung von nicht ausdrücklich angeforderten Informationen ist nicht gestattet. Rechtliche Schritte gegen die Versender von sogenannten Spam-Mails bei Verstössen gegen dieses Verbot sind ausdrücklich vorbehalten.  \n  \nDatenschutzbeauftragte:  \nDr. Marein Müller\n\n* [datenschutz.regio@deutschebahn.com\n  Weitere Informationen: datenschutz.regio@deutschebahn.com](mailto:datenschutz.regio@deutschebahn.com)\n\n**5. Rechtswirksamkeit dieses Haftungsausschlusses**\n\nDieser Haftungsausschluss ist als Teil des Internetangebotes zu betrachten, von dem aus auf diese Seite verwiesen wurde. Sofern Teile oder einzelne Formulierungen dieses Textes der geltenden Rechtslage nicht, nicht mehr oder nicht vollständig entsprechen sollten, bleiben die übrigen Teile des Dokumentes in ihrem Inhalt und ihrer Gültigkeit davon unberührt.\n\n## Weiterführende Informationen\n\n### Übersicht Datenschutz\n\n* [Datenschutzhinweise\n  Weitere Informationen: Datenschutzhinweise](/home/datenschutzhinweise)\n* [Datenschutzhinweise Videoüberwachung\n  Weitere Informationen: Datenschutzhinweise Videoüberwachung](/home/datenschutz-video)\n\n* [Impressum\n  Weitere Informationen: Impressum](/home/impressum)\n* [Tarifbestimmungen\n  Weitere Informationen: Tarifbestimmungen](/tickets/haustarife)\n* [Datenschutzhinweise\n  Weitere Informationen: Datenschutzhinweise](/home/datenschutzhinweise)\n* [Vertrag kündigen\n  Weitere Informationen: Vertrag kündigen](/tickets/kuendigungsformular)"
}