{
  "timestamp": "20250722_102534",
  "processing_info": {
    "date": "2025-07-22",
    "time": "10:25:49",
    "timezone": "WEST"
  },
  "url": "http://www.lvl-jaeger.de",
  "imprint_url": "http://www.lvl-jaeger.de/impressum",
  "imprint_data": {
    "company_name": "LVL Jäger GmbH",
    "managing_directors": [
      "Carry Greiner"
    ],
    "business_address": {
      "street": "Hermann-Hagenmeyer-Straße 4",
      "city": "Ludwigsburg",
      "postal_code": "71636",
      "country": "Deutschland"
    },
    "phone_numbers": [
      "+49 (0) 7141 94 90 - 0"
    ],
    "email_addresses": [
      "info@lvl-jaeger.de",
      "datenschutz@lvl-jaeger.de"
    ],
    "website_url": "https://www.lvl-jaeger.de",
    "registration_details": {
      "trade_register": null,
      "registration_number": "HRB 1283",
      "court": "Amtsgericht Ludwigsburg"
    },
    "vat_id": "DE 146 188 968",
    "tax_id": null,
    "professional_liability_insurance": null,
    "other_legal_info": {
      "Legal Form": "Gesellschaft mit beschränkter Haftung (GmbH)",
      "Applicable Law": "Recht der Bundesrepublik Deutschland (BRD)",
      "Tax Authority": "Finanzamt Ludwigsburg",
      "Responsible for journalistic content (MStV)": "Carry Greiner",
      "External Data Protection Officer": "Sven Lenz",
      "Company Purpose": "Busunternehmen des ÖPNV",
      "Online Dispute Resolution Platform URL": "https://ec.europa.eu/odr",
      "Consumer Arbitration Willingness": "Not obligated/willing to participate in consumer arbitration."
    }
  },
  "markdown_content": "Impressum | LVL - Ludwigsburger Verkehrslinien \n\n\n\n\n###### In Ihrem Browser ist JavaScript deaktiviert\n\nSie müssen JavaScript aktivieren um die Funktionen dieser Seite in vollem Umfang nutzen zu können.\n\n\n\n[![](fileadmin/template/main/images/logo.svg)](/)\n\n#### Ihr Partner im Personennahverkehr\n\n#### Ihr Partner im Personennahverkehr\n\nMenü\n\n* [Verkehrshinweise](/verkehrshinweise)\n* [Linien](/linien)\n* [Service](/service)\n* [Aktuelles](/aktuelles)\n* [Unternehmen](/unternehmen)\n* [Karriere](/karriere)\n* [Kontakt](/kontakt)\n* [Datenschutz](/datenschutz)\n* [Impressum](/impressum)\n\nSuche\n\nService\n\nWie können wir Ihnen weiterhelfen?\n\n# Impressum\n\n**Kombinationsimpressum (Anbieterkennzeichnung)**\n\nAnbieter und somit verantwortlich für die kommerzielle und geschäftsmäßige Website ist die LVL Jäger GmbH, vertreten durch die Geschäftsführerin Carry Greiner.\n\nDiese Website ist ein Informationsangebot der\n\nLVL Jäger GmbH\n\nHermann-Hagenmeyer-Straße 4\n\n71636 Ludwigsburg\n\nDeutschland\n\nTelefon: +49 (0) 7141 94 90 - 0\n\nE-Mail: [info@lvl-jaeger.de](mailto:info@lvl-jaeger.de \"mailto:info@lvl-jaeger.de\")\n\nWeb: [www.lvl-jaeger.de](https://www.lvl-jaeger.de)\n\nSitz der LVL Jäger GmbH: 71636 Ludwigsburg, Deutschland\n\nAmtsgericht Ludwigsburg, HRB 1283\n\nRechtsform: Gesellschaft mit beschränkter Haftung (GmbH)\n\nAnwendbares Recht: Recht der Bundesrepublik Deutschland (BRD)\n\nFinanzamt Ludwigsburg\n\nUmsatzsteuer-Identifikationsnummer: DE 146 188 968\n\nVertretungsberechtigte Geschäftsführerin: Carry Greiner\n\n**Informationen zur Online-Streitbeilegung gemäß Art. 14 Abs. 1 ODR-VO:**\n\nDie EU-Kommission stellt eine Plattform zur Online-Streitbeilegung (OS) bereit, welche Sie unter [https://ec.europa.eu/odr](https://ec.europa.eu/odr \"https://ec.europa.eu/odr\") finden. Die OS-Plattform dient als Anlaufstelle zur außergerichtlichen Beilegung von Streitigkeiten bei vertraglichen Verpflichtungen, welche aus Online-Kaufverträgen erwachsen.\n\nWir sind zur Teilnahme an einem Streitbeilegungsverfahren vor einer Verbraucherschlichtungsstelle weder verpflichtet noch bereit.\n\nEs ist uns wichtig, mögliche Meinungsverschiedenheiten aus unserer Vertragsbeziehung einvernehmlich zu lösen. Um dies umzusetzen, bitten wir Sie, auf unser per E-Mail zuzukommen. Die E-Mail-Adresse lautet wie folgt: [info@lvl-jaeger.de](mailto:info@lvl-jaeger.de)\n\n**Verantwortlicher für journalistisch redaktionelle Beiträge gemäß § 18 Abs. 2 MStV:**\n\nCarry Greiner, Geschäftsführerin\n\n**Externer Datenschutzbeauftragter:**\n\nSven Lenz\n\nDeutsche Datenschutzkanzlei – Datenschutzkanzlei Lenz GmbH & Co. KG\n\nBahnhofstraße 50\n\n87435 Kempten\n\nDeutschland\n\nBei Fragen zum Datenschutz oder weiteren datenschutzrechtlichen Anliegen können Sie gerne eine E-Mail an folgende E-Mail-Adresse senden: [datenschutz@lvl-jaeger.de](mailto:datenschutz@lvl-jaeger.de \"mailto:datenschutz@lvl-jaeger.de\")\n\n**Technische Betreuung und Konzeption dieser Website:**\n\nmpc networks GmbH, Max-Planck-Straße 22, D-70806 Kornwestheim\n\nTelefon: +49 (0)7154 1786-0, E-Mail: [info@mpcnet.de](mailto:info@mpcnet.de \"mailto:info@mpcnet.de\")\n\n**Gegenstand des Unternehmens der LVL Jäger GmbH:**\n\nBusunternehmen des ÖPNV\n\n**Preisangaben gemäß § 4 Dienstleistungs-Informationspflichten-Verordnung (DL-InfoV) und Preisangabenverordnung (PAngV)**\n\nInformationen zu den Preisen sind unserer Website zu entnehmen.\n\nDie LVL Jäger GmbH erstellt Ihnen auf Anfrage gerne ein Angebot im Rahmen der Möglichkeiten des Busunternehmens.\n\n**Haftung**\n\nWir können diese Website nach eigenem Ermessen und ohne Übernahme einer Haftung jederzeit ohne Ankündigung ganz oder teilweise verändern und deren Betrieb einstellen. Durch das Setzen eines Links zu fremden Websites (\"Hyperlinks\") machen wir uns weder dieser Website noch deren Inhalt zu Eigen. Ferner sind wir nicht verantwortlich für die Verfügbarkeit dieser Websites oder von deren Inhalten.\n\n**© Copyright**\n\nAlle Rechte vorbehalten. Text, Bilder und Grafiken sowie deren Anordnung in der Website unterliegen dem Schutz des Urheberrechts und anderer Schutzgesetze. Der Inhalt dieser Website darf nicht zu kommerziellen Zwecken kopiert, verbreitet, verändert oder Dritten zugänglich gemacht werden.\n\n**© Copyright Bildquellen:** istockphoto.com/ LVL Jäger GmbH\n\n**Hinweis: Allgemeines Gleichbehandlungsgesetz (AGG)**\n\nAus Gründen der leichteren Lesbarkeit wird auf eine geschlechterspezifische Differenzierung verzichtet. Entsprechende Begriffe gelten im Sinne der Gleichbehandlung für alle Geschlechter.\n\nService\n\nWie können wir Ihnen weiterhelfen?\n\n© LVL Jäger GmbH 2025, alle Rechte vorbehalten"
}