{
  "timestamp": "20250722_103312",
  "processing_info": {
    "date": "2025-07-22",
    "time": "10:33:25",
    "timezone": "WEST"
  },
  "url": "https://www.medenbach-traffic.de",
  "imprint_url": "https://www.medenbach-traffic.de/impressum/",
  "imprint_data": {
    "company_name": "Medenbach Traffic GmbH",
    "managing_directors": [
      "Timo Medenbach"
    ],
    "business_address": {
      "street": "Am Pfingstborn 3",
      "city": "Weilburg-Hirschhausen",
      "postal_code": "35781",
      "country": "Germany"
    },
    "phone_numbers": [
      "+49 6471-9861-0",
      "+49 6471-9861-44"
    ],
    "email_addresses": [
      "info@medenbach.de"
    ],
    "website_url": "https://www.medenbach-traffic.de/",
    "registration_details": {
      "trade_register": "Handelsregister",
      "registration_number": "HRB 4445",
      "court": "Amtsgericht Limburg"
    },
    "vat_id": "DE 267 649 557",
    "tax_id": null,
    "professional_liability_insurance": null,
    "other_legal_info": {
      "supervisory_authority": "Regierungspräsidium Gießen, Landgraf-Philipp-Platz 1-7, 35390 Gießen, https://rp-giessen.hessen.de/",
      "online_dispute_resolution": "The European Commission provides a platform for online dispute resolution (OS): https://ec.europa.eu/consumers/odr. Not willing or obligated to participate in dispute resolution procedures before a consumer arbitration board."
    }
  },
  "markdown_content": "Impressum - Medenbach Traffic\n\n\n\n\n[Medenbach Traffic](https://www.medenbach.de/)\n\n[![](https://www.medenbach-traffic.de/wp-content/uploads/2020/04/logo-medenbach-traffic.png)](https://www.medenbach-traffic.de/)\n\n[info@medenbach.de](mailto:info@medenbach.de)\n\n06471-9861-0\n\n* [Medenbach Traffic](https://www.medenbach-traffic.de/)\n* [Nahverkehr](https://www.medenbach-traffic.de/nahverkehr/)\n  + [Tarif & Pünktlichkeit](https://www.medenbach-traffic.de/nahverkehr/tarif-puenktlichkeit/)\n* [Fahrzeuge](https://www.medenbach-traffic.de/fahrzeuge/)\n  + [Ausstattung](https://www.medenbach-traffic.de/fahrzeuge/ausstattung/)\n  + [Pflege und Service](https://www.medenbach-traffic.de/fahrzeuge/pflege-und-service/)\n  + [Fahrzeug-Typen](https://www.medenbach-traffic.de/fahrzeuge/fahrzeug-typen/)\n* [Unternehmen](https://www.medenbach-traffic.de/unternehmen/)\n  + [Firmenchronik](https://www.medenbach-traffic.de/unternehmen/firmenchronik/)\n  + [Stellenangebote](https://www.medenbach-traffic.de/unternehmen/stellenangebote/)\n  + [Fundsachen](https://www.medenbach-traffic.de/unternehmen/fundsachen/)\n* [Kontakt](https://www.medenbach-traffic.de/kontakt/)\n\nclose\n\n![](https://www.medenbach-traffic.de/wp-content/uploads/2020/04/medenbach-traffic-unternehmen.jpg)\n\n# Impressum\n\n### Angaben gemäß § 5 DDG\n\nMedenbach Traffic GmbH  \nAm Pfingstborn 3  \n35781 Weilburg-Hirschhausen\n\n### Vertreten durch\n\nGeschäftsführer Timo Medenbach\n\nInhaltlich verantwortlich i.S.d. § 18 Abs. 2 Medienstaatsvertrag (MStV):  \nTimo Medenbach  \n(Adresse s. o.)\n\n### Kontakt\n\nTelefon: 06471 9861-0  \nTelefax: 06471 9861-44  \nE-Mail: [info@medenbach.de](mailto:info@medenbach.de)\n\n### Webdesign & Programmierung\n\nideegrafik kreativagentur GmbH  \nKalkwerk 6  \n35756 Mittenaar-Offenbach\n\nTel.: 02778 69680  \nE-Mail: [info@ideegrafik.de](mailto:info@ideegrafik.de)  \nWeb: [www.ideegrafik.de](http://www.ideegrafik.de/)\n\n### Registereintrag\n\nEintragung im Handelsregister.  \nRegistergericht: Amtsgericht Limburg  \nRegisternummer: HRB 4445\n\n### Umsatzsteuer\n\nUmsatzsteuer-Identifikationsnummer gemäß §27 a Umsatzsteuergesetz:  \nDE 267 649 557\n\n### Aufsichtsbehörde\n\nRegierungspräsidium Gießen  \nLandgraf-Philipp-Platz 1-7  \n35390 Gießen\n\n<https://rp-giessen.hessen.de/>\n\n### Streitschlichtung\n\nDie Europäische Kommission stellt eine Plattform zur Online-Streitbeilegung (OS) bereit: <https://ec.europa.eu/consumers/odr>.  \nUnsere E-Mail-Adresse finden Sie oben im Impressum.\n\nWir sind nicht bereit oder verpflichtet, an Streitbeilegungsverfahren vor einer Verbraucherschlichtungsstelle teilzunehmen.\n\n#### Haftung für Inhalte\n\nAls Diensteanbieter sind wir gemäß § 7 Abs. 1 DDG für eigene Inhalte auf diesen Seiten nach den allgemeinen Gesetzen verantwortlich. Nach § 7 Abs. 2 DDG sind wir als Diensteanbieter jedoch nicht verpflichtet, übermittelte oder gespeicherte fremde Informationen zu überwachen oder nach Umständen zu forschen, die auf eine rechtswidrige Tätigkeit hinweisen. Verpflichtungen zur Entfernung oder Sperrung der Nutzung von Informationen nach den allgemeinen Gesetzen bleiben hiervon unberührt. Eine diesbezügliche Haftung ist jedoch erst ab dem Zeitpunkt der Kenntnis einer konkreten Rechtsverletzung möglich. Bei Bekanntwerden von entsprechenden Rechtsverletzungen werden wir diese Inhalte umgehend entfernen.\n\n#### Haftung für Links\n\nUnser Angebot enthält Links zu externen Websites Dritter, auf deren Inhalte wir keinen Einfluss haben. Deshalb können wir für diese fremden Inhalte auch keine Gewähr übernehmen. Für die Inhalte der verlinkten Seiten ist stets der jeweilige Anbieter oder Betreiber der Seiten verantwortlich. Die verlinkten Seiten wurden zum Zeitpunkt der Verlinkung auf mögliche Rechtsverstöße überprüft. Rechtswidrige Inhalte waren zum Zeitpunkt der Verlinkung nicht erkennbar.\n\nEine permanente inhaltliche Kontrolle der verlinkten Seiten ist jedoch ohne konkrete Anhaltspunkte einer Rechtsverletzung nicht zumutbar. Bei Bekanntwerden von Rechtsverletzungen werden wir derartige Links umgehend entfernen.\n\n#### Urheberrecht\n\nDie durch die Seitenbetreiber erstellten Inhalte und Werke auf diesen Seiten unterliegen dem deutschen Urheberrecht. Die Vervielfältigung, Bearbeitung, Verbreitung und jede Art der Verwertung außerhalb der Grenzen des Urheberrechtes bedürfen der schriftlichen Zustimmung des jeweiligen Autors bzw. Erstellers. Downloads und Kopien dieser Seite sind nur für den privaten, nicht kommerziellen Gebrauch gestattet.\n\nSoweit die Inhalte auf dieser Seite nicht vom Betreiber erstellt wurden, werden die Urheberrechte Dritter beachtet. Insbesondere werden Inhalte Dritter als solche gekennzeichnet. Sollten Sie trotzdem auf eine Urheberrechtsverletzung aufmerksam werden, bitten wir um einen entsprechenden Hinweis. Bei Bekanntwerden von Rechtsverletzungen werden wir derartige Inhalte umgehend entfernen.\n\n### Das Unternehmen\n\n[Unsere Busse](https://www.medenbach-traffic.de/fahrzeuge/fahrzeug-typen/)[Stellenangebote](https://www.medenbach-traffic.de/unternehmen/stellenangebote/)[Team](https://www.medenbach-traffic.de/unternehmen/team/)\n\n### Medenbach Service\n\n[Kontakt](https://www.medenbach-traffic.de/kontakt/)[Impressum](https://www.medenbach-traffic.de/impressum/)[Datenschutz](https://www.medenbach-traffic.de/datenschutz/)\n\n### Kontakt\n\nAm Pfingstborn 3  \n35781 Weilburg-Hirschhausen  \nTel +49 6471-9861-0  \nFax +49 6471-9861-44  \n  \ninfo@medenbach.de  \nwww.medenbach.de\n\n© 2022 Medenbach Traffic     \nDesign und Programmierung: Ideegrafik Kreativagentur\n\n\n\n\nxml version=\"1.0\"?envelope-oclosephoneangle-downxml version=\"1.0\"?menu"
}