{
  "timestamp": "20250722_103055",
  "processing_info": {
    "date": "2025-07-22",
    "time": "10:31:08",
    "timezone": "WEST"
  },
  "url": "https://www.bad-aibling.de",
  "imprint_url": "https://www.bad-aibling.de/impressum",
  "imprint_data": {
    "company_name": "AIB-KUR - Gesellschaft für Kur & Tourismus Bad Aibling mbH & Co. KG",
    "managing_directors": [
      "Thomas Jahn"
    ],
    "business_address": {
      "street": "Wilhelm-Leibl-Platz 3",
      "city": "Bad Aibling",
      "postal_code": "83043",
      "country": "Germany"
    },
    "phone_numbers": [
      "+49 8061 90 80 0"
    ],
    "email_addresses": [
      "info@aib-kur.de"
    ],
    "website_url": "https://www.bad-aibling.de",
    "registration_details": {
      "trade_register": "Amtsgericht Traunstein",
      "registration_number": "HRA 9491",
      "court": "Amtsgericht Traunstein"
    },
    "vat_id": "DE 174199110",
    "tax_id": null,
    "professional_liability_insurance": null,
    "other_legal_info": {
      "personally_liable_partner": "AIB-KUR Gesellschaft für Kur- und Tourismus Bad Aibling mbH Beteiligungsgesellschaft",
      "technical_implementation_and_hosting_provider": "neusta destination.one GmbH",
      "dispute_resolution": "The company is willing to participate in out-of-court dispute resolution procedures. EU Online Dispute Resolution platform: www.ec.europa.eu/consumers/odr"
    }
  },
  "markdown_content": "      Impressum                        [Zum Inhalt](#pagecontent)  \n\n[Rathaus](https://rathaus-bad-aibling.de/ \"Rathaus\")    Suche    Menü    Buchen\n\nIch suche Tipps zum Thema     Suchbegriff löschen \n\nSuchvorschlag\n\n  Ergebnisse finden  \n\nEntschuldigung, wir haben leider keine Ergebnisse gefunden!\n\nTreffer\n\nFiltern \n\nFiltern\n\nWeitere Ergebnisse laden\n\n   ${filterInfo.title} (${filterInfo.count})\n\nAnreise  28.07.2025\n\nAbreise  04.08.2025\n\nErwachsene  1 2 3 4 5 6 7 8 9 10 11 12\n\nKinder  0 1 2 3 4 5 6\n\nBitte alle Felder ausfüllen\n\nJetzt buchen\n\nAlter der Kinder  Alter der Kinder am  **04.08.2025**\n\nKind 1\n\n- < 1 1 2 3 4 5 6 7 8 9 10 11 12 13 14 15 16 17\n\n* [Gesundheit](/gesundheit) \n\n  + [Alle Themen](/gesundheit)\n  + [Symptom-Checker](/symptom-checker)\n  + [Gesundheitsfinder](/gesundheitsfinder)\n  + [Digitaler Kurantrag](/digitaler-kurantrag)\n  + [Prädikate & Heilmittel](/praedikate-heilmittel)    \n    - [Zu Prädikate & Heilmittel](/praedikate-heilmittel)\n    - [Naturmoor](/naturmoor)\n    - [Thermalwasser](/thermalwasser)\n    - [Allergikerfreundlich](/allergikerfreundlichkeit)\n  + [Gesundheits-Angebote](/gesundheits-angebote)\n  + [Behandlungs-Felder](/behandlungs-felder)    \n    - [Zu Behandlungs-Felder](/behandlungs-felder)\n    - [Mentale Gesundheit](/mentale-gesundheit)\n    - [Orthopädie](/orthopaedie)\n    - [Neurologie](/neurologie)\n    - [Onkologie](/onkologie)\n    - [Adipositas](/adipositas)\n  + [Gesund durch Kur](/gesund-durch-kur)\n  + [Gesundheits-Events](/gesundheits-events)\n* [Bad Aibling erleben](/erleben) \n\n  + [Alle Themen](/erleben)\n  + [Entdecken & bewegen](/entdecken-und-bewegen)\n  + [Radfahren](/radfahren)\n  + [Wandern & Nordic Walking](/wandern-nordic-walking)\n  + [Parks & Gärten](/parks-gaerten)    \n    - [Zu Parks & Gärten](/parks-gaerten)\n    - [Sinnes-Erlebnis-Pfad](/sinnes-erlebnis-pfad)\n  + [Wasser](/wasser)\n  + [Wintersport](/wintersport)\n* [Kultur & Events](/kultur-events) \n\n  + [Alle Themen](/kultur-events)\n  + [Event-Kalender](/event-kalender)\n  + [Ticket Webshop](https://tickets.muenchenticket.net/shop/114)\n  + [Int. Gitarrenfestival Saitensprünge](https://www.saitenspruenge.com/)\n  + [Open Air Kultursommer](/open-air-kultursommer)\n  + [Bayerische Tradition](/bayerische-tradition)\n  + [Museen & Galerien](/museen-galerien)\n* [Übernachten](/uebernachten) \n\n  + [Alle Themen](/uebernachten)\n  + [Hotels](/uebernachten/hotels)\n  + [Ferienwohnungen](/uebernachten/ferienwohnungen)\n  + [Gästehäuser & Privatzimmer](/uebernachten/gaestehaeuser-privatzimmer)\n  + [Urlaubs-Angebote](/urlaubs-angebote)\n  + [Gästekarte & Bonus-Coupons](/gaestekarte)\n  + [Kurbeitrag](/kurbeitrag)\n  + [Prädikate & Siegel](/praedikate-siegel)\n  + [Gastgeber entdecken](/gastgeber-entdecken)\n* [Vor Ort](/vor-ort) \n\n  + [Alle Themen](/vor-ort)\n  + [Digitaler Gästeführer](/digitaler-gaestefuehrer)\n  + [Essen & Trinken](/essen-trinken)\n  + [Einkaufen](/einkaufen)\n  + [Mobil vor Ort](/mobil-vor-ort)\n  + [Anfahrt & Parken](/anfahrt-parken)\n  + [Stadtplan](/stadtplan)\n* [Service & Business](/service-business) \n\n  + [Alle Themen](/service-business)\n  + [MICE Bad Aibling](/mice-bad-aibling)\n  + [Urlaubsmagazin Digital](/urlaubsmagazin)\n  + [Stadt-Journal & Stadt-Journal TV](/stadt-journal)\n  + [Podcast](/podcast)\n  + [Über uns](/ueber-uns)    \n    - [Zu Über uns](/ueber-uns)\n    - [Kontakt](/kontakt-ansprechpartner)\n    - [Unser Team](/unser-team)\n    - [Jobs](/jobs)\n  + [Prospekte bestellen](/prospekte)\n\n* [Wetter](/wetter-bad-aibling)\n* [Urlaubsmagazin](/urlaubsmagazin)\n* [Kontakt](/kontakt-ansprechpartner)\n\n    \n\n© Andreas Jacob \n\n## Impressum\n\n \n\n* [Startseite](/ \"Startseite\")\n* Impressum\n\nImpressum\n\n**Herausgeber**\n\nDieses Impressum gilt für folgende Seiten: Tourismus & Gesundheit\n\n**AIB-KUR - Gesellschaft für Kur & Tourismus Bad Aibling mbH & Co. KG**  \nWilhelm-Leibl-Platz 3  \n83043 Bad Aibling  \nTel.: +49 8061 90 80 0  \nFax: +49 8061 371 56  \nEmail: info@aib-kur.de  \nInternet: www.bad-aibling.de\n\nVertretungsberechtigter Geschäftsführer: Thomas Jahn\n\n**Persönlich haftender Gesellschafter**  \nAIB-KUR Gesellschaft für Kur- und Tourismus Bad Aibling mbH Beteiligungsgesellschaft.  \nVertretungsberechtigter Geschäftsführer: Thomas Jahn  \nRegistergericht: Amtsgericht Traunstein  \nRegisternummer: HRA 9491  \nUmsatzsteuer-Identifikationsnummer gemäß § 27 a Umsatzsteuergesetz: DE 174199110  \n  \n  \n**Inhaltliche Verantwortung**  \nAIB-KUR - Gesellschaft für Kur & Tourismus Bad Aibling mbH & Co. KG  \nTel.: +49 8061 90 80 0  \nFax: +49 8061 371 56  \nEmail: info@aib-kur.de\n\n**Technische Umsetzung**  \nUnser Internetauftritt wird durch die neusta destination.one GmbH erstellt und gepflegt. Soweit die Verarbeitung von Daten im Rahmen dieser Tätigkeit notwendig ist, erfolgt diese auf Grundlage eines Auftragsdatenverarbeitungsvertrags (ADV-Vertrag).\n\n**neusta destination.one GmbH**  \nMünchener Straße 1  \nD-86899 Landsberg am Lech  \nFon +49 (0) 89 215445-61  \nFax +49 (0) 89 215445-62\n\nStandort Bremen  \nKonsul-Smidt-Str. 24  \nD-28217 Bremen  \nFon +49 (0) 421 69655-470  \nFax +49 (0) 421 206 96-99\n\nStandort Leer  \nMühlenstraße 153  \n26789 Leer  \nFon +49 (0) 491 925 82-50  \nFax +49 (0) 491 925 82-59\n\nE-Mail: info@destination.one\n\n**Hosting**  \nUnser Web-Server wird durch die neusta destination.one GmbH betrieben. Soweit die Verarbeitung von Daten im Rahmen dieser Tätigkeit notwendig ist, erfolgt diese auf Grundlage eines Auftragsdatenverarbeitungsvertrags (ADV-Vertrag).\n\n**neusta destination.one GmbH**  \nMünchener Straße 1  \nD-86899 Landsberg am Lech  \nFon +49 (0) 89 215445-61  \nFax +49 (0) 89 215445-62\n\nStandort Bremen  \nKonsul-Smidt-Str. 24  \nD-28217 Bremen  \nFon +49 (0) 421 69655-470  \nFax +49 (0) 421 206 96-99\n\nStandort Leer  \nMühlenstraße 153  \n26789 Leer  \nFon +49 (0) 491 925 82-50  \nFax +49 (0) 491 925 82-59\n\nE-Mail: info@destination.one\n\n**Nutzungsbedingungen**  \nTexte, Bilder, Grafiken sowie, die Gestaltung dieser Internetseiten, unterliegen dem Urheberrecht. Sie dürfen im Rahmen des § 53 Urheberrechtsgesetz (UrhG) nur zum privaten oder sonstigem eigenen Gebrauch verwendet werden. Eine ganz oder teilweise vorgenommene Vervielfältigung, Verwendung oder Veröffentlichung dieser Seiten in anderen elektronischen oder gedruckten Publikationen, ist nur mit unserer vorherigen Zustimmung gestattet. Diese kann auf Anfrage durch die für den Inhalt verantwortlichen Personen erteilt werden.\n\nDer Nachdruck und Auswertung von Pressemitteilungen und Reden sind allgemein mit entsprechender Quellenangabe gestattet.\n\n**Urheberrechte Dritter**  \nWeiterhin können Texte, Bilder, Grafiken und sonstige Dateien, ganz oder teilweise, dem Urheberrecht Dritter unterliegen. Wir weisen - innerhalb unserer Internetseiten - stets in unmittelbarer Nähe zum abgebildeten Werk, auf die jeweiligen Urheber- oder auf andere gleichartige Rechte hin.\n\nBildnachweis: Das jeweilige Copyright der verwendeten Bilder wird direkt am Bild angegeben. Wir versichern hiermit, dass uns für alle verwendeten Bildern das Bildrecht vorliegt.\n\n**Haftungsausschluss**  \nAlle auf dieser Internetseite bereitgestellten Informationen haben wir nach bestem Wissen und Gewissen erarbeitet und geprüft. Eine Gewähr für die jederzeitige Aktualität, Richtigkeit, Vollständigkeit und Verfügbarkeit der bereit gestellten Informationen können wir allerdings nicht übernehmen. Ein Vertragsverhältnis mit den Nutzern dieses Internetangebots kommt nicht zustande.\n\nWir haften nicht für Schäden, die durch die Nutzung dieses Internetangebots entstehen. Dieser Haftungsaus-schluss gilt nicht, soweit die Art. 34 GG i.V.m. § 839 BGB (Amtshaftungsanspruch) einschlägig sind. Für etwaige Schäden, die beim Aufrufen oder Herunterladen von Daten durch Schadsoftware oder der Installation oder Nutzung von Software verursacht werden, wird nicht gehaftet.\n\nDer Haftungsausschluss gilt nicht für Informationen, die in den Anwendungsbereich der Europäischen Dienstleistungsrichtlinie (Richtlinie 2006/123/EG – DLRL) fallen. Für diese Informationen wird die Richtigkeit und Aktualität gewährleistet.\n\n**Links**  \nVon unseren eigenen Inhalten sind Querverweise („Links“) auf Webseiten anderer Anbieter zu unterscheiden. Durch diese externen Links ermöglichen wir lediglich den Zugang zu einer Nutzung „fremder Inhalte“ nach § 8 Telemediengesetz (DDG). Wir sind für diese „fremden Inhalte“ nicht verantwortlich. Bei der erstmaligen Verknüpfung mit diesen Internetangeboten haben wir diese „fremden“ Inhalte darauf überprüft, ob durch sie eine mögliche zivilrechtliche oder strafrechtliche Verantwortlichkeit ausgelöst wird. Wir können diese fremden Inhalte aber nicht ständig auf Veränderungen überprüfen und daher auch keine Verantwortung dafür über-nehmen. Dementsprechend machen wir uns diese fremden Inhalte ausdrücklich nicht zu Eigen. Für illegale, fehlerhafte oder unvollständige Inhalte und insbesondere für Schäden, die aus der Nutzung oder Nichtnutzung von Informationen Dritter entstehen, haftet allein der jeweilige Anbieter der Seite. (Angaben zum Datenschutz bei externen Links finden Sie in unserer Datenschutzerklärung.)\n\nNamentlich gekennzeichnete Internetseiten, wurden mit Zustimmung der namentlich Genannten verlinkt und geben die Auffassungen und Erkenntnisse der genannten Personen wieder. Nur die genannten Personen haften für die Inhalte und Datenschutzvorkehrungen dieser Seiten.\n\n**Streitbeilegungsverfahren**  \nSollte einmal ein Konfliktfall eintreten möchten wir Ihnen helfen und den Konflikt schnellstmöglich beseitigen. Daher sind wir gerne bereit an Streitschlichtungsverfahren teilzunehmen.\n\nZur außergerichtlichen Beilegung von verbraucherrechtlichen Streitigkeiten stellt die EU eine Online-Streitbeilegungs-Plattform (sog. OS-Plattform) bereit: Sie ist unter www.ec.europa.eu/consumers/odr erreichbar.\n\n  \n\nInformationen & Service\n\nImmer für Sie da\n\n[Prospektmaterial\n\nInspiration für Ihren Aufenthalt](/prospekte \"Bei Klick gelangen Sie zur Prosepektbestellung\")\n\n© Andreas Jacob\n\n[Digitaler Gästeführer\n\nOptimale Orientierung vor Ort](/digitaler-gaestefuehrer \"Bei Klick gelangen Sie zu Infos rund um den Digitalen Gästeführer Bad Aibling\")\n\n© Aib-Kur\n\n[Ticket-Webshop\n\nTickets für Bad Aiblinger Veranstaltungen](https://tickets.muenchenticket.net/shop/114 \"Bei Klick öffnet sich unser Ticket-Webshop Bad Aibling\")\n\n© AIB-KUR, by Andreas Jacob\n\n[Gästebefragung\n\nIhr Feedback zu Ihrem Aufenthalt](https://www.gaeste-zufriedenheit.de/bad-aibling \"Bei Klick nehmen Sie an unserer Gästebefragung teil\")\n\n**Kur- & Touristinformation**  \n**Haus des Gastes**  \nWilhelm-Leibl-Platz 3  \n83043 Bad Aibling  \nT [0 80 61 90 80 - 0](tel:0806190800 \"Bei Klick können Sie die Telefonnummer anrufen\")  \n[info@aib-kur.de](# \"Bei Klick öffnet sich Ihr Mailprogramm\")\n\n[Radverleih Bad Aibling](/radfahren#c3682 \"Bei Klick gelangen Sie zu Informationen zum Radverleih Bad Aibling\")  \n[Anfahrt planen](/anfahrt-parken \"Bei Klick erhalten Sie Infos zu Anreise nach Bad Aibling, Parkplätzen und mehr\")  \n[Rathaus Bad Aibling](https://www.rathaus-bad-aibling.de/ \"Bei Klick gelangen Sie zur Website des Rathauses der Stadt Bad Aibling\")\n\n[Tagen in Bad Aibling](/mice-bad-aibling \"Bei Klick erhalten Sie Informationen zu Tagungsmöglichkeiten und -angeboten in Bad Aibling\")  \n[Urlaubs-Angebote](/urlaubs-angebote \"Bei Klick erhalten Sie Informationen zu Urlaubsangeboten in Bad Aibling\")  \n[Ticket-Webshop](https://tickets.muenchenticket.net/shop/114 \"Bei Klick gelangen Sie zum Ticket-Webshop für viele Events in Bad Aibling\")\n\n* [*Facebook*](https://www.facebook.com/BadAibling \"Link zu Facebook öffnen\")\n* [*Youtube*](https://www.youtube.com/channel/UCE2CaByI1WZU8FboqCXcd2g/videos \"Link zu Youtube öffnen\")\n* [*Instagram*](https://www.instagram.com/bad_aibling_tourismus/ \"Link zu Instagram öffnen\")\n\n* [Kontakt](/kontakt-ansprechpartner \"Kontakt\")\n* [Impressum](/impressum \"Impressum\")\n* [Datenschutz](/datenschutz \"Datenschutz\")\n* [Barrierefreiheitserklärung](/barrierefreiheitserklaerung \"Barrierefreiheitserklärung\")\n\n[Transkript](/impressum \"Transkript-Datei herunterladen\")\n\n                   "
}