{
  "timestamp": "20250722_101547",
  "processing_info": {
    "date": "2025-07-22",
    "time": "10:16:09",
    "timezone": "WEST"
  },
  "url": "http://www.gairing.de",
  "imprint_url": "http://www.gairing.de/impressum",
  "imprint_data": {
    "company_name": "Gairing Omnibusverkehr GmbH & Co. KG",
    "managing_directors": [
      "Dr. Sandra Schnarrenberger"
    ],
    "business_address": {
      "street": "Turmstraße 47",
      "city": "Neu-Ulm",
      "postal_code": "89231",
      "country": "Germany"
    },
    "phone_numbers": [
      "+49 731/8 38 04",
      "+49 731/8 72 11"
    ],
    "email_addresses": [
      "info@gairing.de"
    ],
    "website_url": null,
    "registration_details": {
      "trade_register": "Handelsregister",
      "registration_number": "HRA 10131",
      "court": "Amtsgericht Neu-Ulm"
    },
    "vat_id": "DE 151-160-00-609",
    "tax_id": null,
    "professional_liability_insurance": null,
    "other_legal_info": {
      "eu_dispute_resolution_platform": "https://ec.europa.eu/consumers/odr/",
      "consumer_dispute_resolution_statement": "Wir sind nicht bereit oder verpflichtet, an Streitbeilegungsverfahren vor einer Verbraucherschlichtungsstelle teilzunehmen."
    }
  },
  "markdown_content": "Omnibusverkehr Gairing\n\n\n\n\n# Impressum\n\nGairing Omnibusverkehr GmbH & Co. KG  \nTurmstraße 47  \n89231 Neu-Ulm\n\nHandelsregister: HRA 10131  \nRegistergericht: Amtsgericht Neu-Ulm\n\n**Vertreten durch:**  \nDr. Sandra Schnarrenberger  \nTurmstraße 47  \n89231 Neu-Ulm\n\nDiese vertreten durch:  \nDr. Sandra Schnarrenberger  \nTurmstraße 47  \n89231 Neu-Ulm\n\nHandelsregister: HRA 10131  \nRegistergericht: Amtsgericht Neu-Ulm\n\n## Kontakt\n\nTelefon: +49 731/8 38 04  \nTelefax: +49 731/8 72 11  \nE-Mail: info@gairing.de\n\n## Umsatzsteuer-ID\n\nUmsatzsteuer-Identifikationsnummer gemäß § 27 a Umsatzsteuergesetz:  \nDE 151-160-00-609\n\n## EU-Streitschlichtung\n\nDie Europäische Kommission stellt eine Plattform zur Online-Streitbeilegung (OS) bereit: <https://ec.europa.eu/consumers/odr/>.  \n Unsere E-Mail-Adresse finden Sie oben im Impressum.\n\n## Verbraucher­streit­beilegung/Universal­schlichtungs­stelle\n\nWir sind nicht bereit oder verpflichtet, an Streitbeilegungsverfahren vor einer Verbraucherschlichtungsstelle teilzunehmen."
}