{
  "timestamp": "20250722_103246",
  "processing_info": {
    "date": "2025-07-22",
    "time": "10:33:07",
    "timezone": "WEST"
  },
  "url": "http://www.vvs.de",
  "imprint_url": "http://www.vvs.de/impressum",
  "imprint_data": {
    "company_name": "Verkehrs- und Tarifverbund Stuttgart GmbH (VVS)",
    "managing_directors": [
      "Cornelia Christian",
      "Dr. Jan Neidhardt"
    ],
    "business_address": {
      "street": "Rotebühlstraße 121",
      "city": "Stuttgart",
      "postal_code": "70178",
      "country": "Germany"
    },
    "phone_numbers": [
      "0711 6606-0"
    ],
    "email_addresses": [
      "kontakt@vvs.de"
    ],
    "website_url": "https://www.vvs.de",
    "registration_details": {
      "trade_register": "HRB",
      "registration_number": "7357",
      "court": "Amtsgericht Stuttgart"
    },
    "vat_id": "DE 147800319",
    "tax_id": null,
    "professional_liability_insurance": null,
    "other_legal_info": {
      "copyright_notice": "Inhalt und Gestaltung dieses Internetangebots sind urheberrechtlich geschützt. Das Angebot darf nur für eigene Zwecke und nicht kommerziell genutzt werden. Eine Vervielfältigung in anderen Medien bedarf der vorherigen Zustimmung des VVS.",
      "content_liability_disclaimer": "Der VVS kann keine Gewähr für die Aktualität, Richtigkeit und Vollständigkeit der Informationen auf dieser Homepage übernehmen. Keine Haftung für technische Störungen, Computerviren oder verlinkte Inhalte Dritter.",
      "geobasis_information_copyright": [
        "2023, Landesamt für Geoinformation und Landentwicklung Baden-Württemberg, www.lgl-bw.de, Az.: 2851.2-D/6073",
        "Stadtmessungsamt Stuttgart",
        "NAVTEQ/PTV AG/Map&Guide",
        "OpenStreetMap-Mitwirkende"
      ]
    }
  },
  "markdown_content": "Impressum\n\n\n\n\n* [Zur EFA Schnellauskunft springen](#efaOrigin)\n* [Zum Hauptinhalt springen](#main-column)\n\n## Cookie Disclaimer\n\nAuf unserer Webseite verwenden wir Cookies. Zum einen handelt es sich dabei um notwendige Cookies, um die Basisfunktionen von vvs.de nutzen zu können. Zum anderen nutzen wir Cookies zu Analysezwecken, damit wir die Qualität der Webseite laufend messen und verbessern können. In unserer\n[Datenschutzerklärung](/datenschutz \"Datenschutzerklärung\")\nfinden Sie Informationen zu den verwendeten Cookies. Dort und unter „Cookie-Einstellungen“ können Sie die Zustimmung zu einzelnen Cookies setzen oder widerrufen. Weitere Informationen finden Sie im\n[Impressum](/impressum \"Impressum\").\n\n[Nur notwendigen Cookies zustimmen](#)\n\n[Zustimmen](#)\n\n[Cookie-EinstellungenWeniger anzeigen](#)\n\n[Notwendige Cookies](#)\n\nNotwendige Cookies\n\nSession-Cookies: Diese speichern eine sogenannte Session-ID, mit welcher sich verschiedene Anfragen Ihres Browsers der gemeinsamen Sitzung zuordnen lassen. Dadurch kann Ihr Rechner wiedererkannt werden, wenn Sie auf die Webseite zurückkehren. Die Session-Cookies werden gelöscht, wenn Sie sich ausloggen oder Sie den Browser schließen.\n\n[Tracking Cookies](#)\n\nTracking Cookies\n\nAuf dieser Webseite werden mit Technologien von Matomo ([www.matomo.org](https://www.matomo.org))\nDaten zu Marketing- und Optimierungszwecken gesammelt und gespeichert.\nAlle mit Matomo erhobenen Daten werden ausschließlich auf Servern des VVS erhoben und verarbeitet.\nDie Speicherdauer der jeweiligen Tracking-Cookies finden Sie in der\n[Datenschutzerklärung](/datenschutz \"Datenschutzerklärung\")\nunter Punkt 4.\n\n[Cookies von Drittanbietern](#)\n\nCookies von Drittanbietern\n\n* GPS um die Verfolgung der geografischen Position zu ermöglichen und damit die Nutzung der Fahrplanauskunft komfortabler zu machen\n* YouTube Erklärvideos und Filme/Clips zu verschiedenen Aktionen/Kampagnen\n* Eye-Able® ist eine Software der Web Inclusion GmbH, um allen Menschen einen barriere-reduzierten Zugang zu Informationen im Internet zu gewährleisten.\n\n[Gewählten Cookies zustimmen](#)\n\n* [Home](/ \"Home\")\n* [Rundum mobil](/rundum-mobil \"Rundum mobil\")\n* [Fahrplan](/fahrplan \"Fahrplan\")\n* [Tickets](/tickets \"Tickets\")\n* [Karten & Pläne](/karten-plaene \"Karten & Pläne\")\n* [Service](/service \"Service\")\n* [Barrierefrei](/barrierefrei \"Barrierefrei\")\n* [Freizeit](/freizeit \"Freizeit\")\nVisueller Assistent\n\n* [Über den VVS](/ueber-den-vvs \"Über den VVS\")\n* [Karriere](/karriere \"Karriere\")\n* [Kontakt](/service/kontaktformulare \"Kontakt\")\n* [Sicherheit](/sicherheit \"Sicherheit\")\n* [FAQ](/faq \"FAQ\")\n* [Schlagwörter](/schlagwoerter \"Schlagwörter\")\n* [Presse](/presse \"Presse\")\n* [Suche](/suche \"Suche\")\n* [English](https://en.vvs.de/ \"English\")\n\nUm den vollen Funktionsumfang dieser Webseite nutzen zu können, benötigen Sie JavaScript. Bitte aktivieren Sie dies in Ihrem Browser.  \nAuf unserer Webseite verwenden wir Cookies. Hierbei handelt es sich um notwendige Cookies, damit die Basisfunktionen von vvs.de genutzt werden können.\n\nVisueller Assistent\n\n* [Über den VVS](/ueber-den-vvs \"Über den VVS\")\n* [Karriere](/karriere \"Karriere\")\n* [Kontakt](/service/kontaktformulare \"Kontakt\")\n* [Sicherheit](/sicherheit \"Sicherheit\")\n* [FAQ](/faq \"FAQ\")\n* [Schlagwörter](/schlagwoerter \"Schlagwörter\")\n* [Presse](/presse \"Presse\")\n* [Suche](/suche \"Suche\")\n* [English](https://en.vvs.de/ \"English\")\n\n* [Home](/ \"Home\")\n* [Rundum mobil](/rundum-mobil \"Rundum mobil\")\n* [Fahrplan](/fahrplan \"Fahrplan\")\n* [Tickets](/tickets \"Tickets\")\n* [Karten & Pläne](/karten-plaene \"Karten & Pläne\")\n* [Service](/service \"Service\")\n* [Barrierefrei](/barrierefrei \"Barrierefrei\")\n* [Freizeit](/freizeit \"Freizeit\")\n\n[![VVS Logo](/vvs-redesign/components/header/assets/vvs-logo@4x.png)](/)\n\n* Aktuell: Impressum\n\n# Impressum\n\n## Urheberrecht\n\nInhalt und Gestaltung dieses Internetangebots sind urheberrechtlich geschützt. Das Angebot darf nur für eigene Zwecke und nicht kommerziell genutzt werden. Eine Vervielfältigung in anderen Medien bedarf der vorherigen Zustimmung des VVS.\n\nBei verwendeten Produkt- und Firmennamen kann es sich um eingetragene Warenzeichen ihrer rechtlichen Inhaber handeln.\n\n## Inhalt des Webangebots\n\nDie Informationen auf diesen Internet-Seiten sind nach bestem Wissen bereitgestellt worden. Bei der Fülle des verarbeiteten Materials sind trotz sorgfältiger Bearbeitung Fehler oder Unstimmigkeiten nicht immer vermeidbar. Daher kann der VVS keine Gewähr für die Aktualität, Richtigkeit und Vollständigkeit der Informationen auf dieser Homepage übernehmen.\n\nTrotz umfangreicher Sicherheitsvorkehrungen lassen sich technische Störungen nicht immer vermeiden. Für Unterbrechungen, die durch nicht fehlerfrei erfasste Daten oder nicht korrekt funktionierende Programme verursacht werden, oder anderweitige Störungen kann der VVS keine Haftung übernehmen. Dies gilt auch für Schäden, die beim Aufrufen oder Herunterladen von Daten durch Computerviren oder bei der Installation oder Nutzung von Software verursacht werden.\n\nDas Internetangebot des VVS enthält Verweise (Links) zu Webseiten anderer Anbieter. Der VVS übernimmt keine Verantwortung für die Inhalte von Webseiten, die über Links erreicht werden. Diese Links wurden sorgfältig ausgewählt und die betreffenden Inhalte bei der erstmaligen Verknüpfung überprüft. Bei Links handelt es sich allerdings stets um dynamische Verweise. Die Inhalte der verlinkten Seiten können deshalb ohne Wissen des VVS geändert worden sein. Eine kontinuierliche Prüfung der Inhalte ist weder beabsichtigt noch möglich. Der VVS macht sich diese Inhalte oder die Art der Gestaltung nicht zu eigen und distanziert sich ausdrücklich von allen Inhalten, die möglicherweise straf- oder haftungsrechtlich relevant sind oder gegen die guten Sitten verstoßen. Für Schäden aus der Nutzung oder Nichtnutzung der Webseiten anderer Anbieter haftet ausschließlich der Anbieter der Seite, auf die verwiesen wurde.\n\nDie Redaktion bittet die Nutzer, gegebenenfalls auf rechtswidrige oder fehlerhafte Inhalte Dritter, zu denen in der VVS-Internetpräsenz verwiesen wird, aufmerksam zu machen. Ebenso bittet sie um eine Nachricht, wenn eigene Inhalte nicht fehlerfrei, aktuell oder vollständig sind.\n\n## Anschrift\n\nVerkehrs- und Tarifverbund Stuttgart GmbH (VVS)  \n Rotebühlstraße 121  \n 70178 Stuttgart\n\nTel.: 0711 6606-0  \n E-Mail: [kontakt@vvs.de](mailto:kontakt@vvs.de \"Opens window for sending email\")\n\n## Geschäftsführung\n\nCornelia Christian\n\nDr. Jan Neidhardt\n\n## Registernummer\n\nAmtsgericht Stuttgart HRB 7357\n\n## UST-Ident-Nummer\n\nDE 147800319\n\n## Geobasisinformationen\n\n© 2023, Landesamt für Geoinformation und Landentwicklung Baden-Württemberg, www.lgl-bw.de, Az.: 2851.2-D/6073.  \n © Stadtmessungsamt Stuttgart  \n © NAVTEQ/PTV AG/Map&Guide  \n © OpenStreetMap-Mitwirkende\n\nvon\n\nnach\n\nAbfahrt\n\nAbfahrtAnkunft\n\nJetztIn 15In 30In 60\n\nDatum\n\nUhrzeitÜbernehmen\n\nAnfordern[Mehr Auskunft](https://www3.vvs.de/mng/#!/XSLT_TRIP_REQUEST2@init?language=de \"Mehr Auskunft\")\n\n#### Dienstleister\n\n* [Mentz Datenverarbeitung](https://www.mentz.net/ \"Mentz Datenverarbeitung\")\n* [points Internetagentur](https://www.points.de/ \"points Internetagentur\")\n\n[Ticket/Abo kaufen](/tickets/ticketskaufen)\n\n[Polygo](https://www.mypolygo.de)\n\n[Bonusbereich](/bonus)\n\n[Umwelt-rechner](/umweltrechner)\n\n[Freizeit](/freizeit)\n\n[Radrouten-planer](https://radroutenplaner.vvs.de/karte@48.78356,9.18145,z14)\n\n[Open Data & Selbermachen](/fahrplan)\n\n[Live Karte](https://livekarte.vvs.de)\n\n[Drucken](javascript:window.print(); \"Seite drucken\")\n\n[Datenschutz](/datenschutz \"Datenschutz\")\n\n[Teilnahmebedingungen Gewinnspiele](/teilnahmebedingungen \"Teilnahmebedingungen Gewinnspiele\")\n\n[Erklärung zur Barrierefreiheit](/barrierefrei/erklaerung-zur-barrierefreiheit \"Erklärung zur Barrierefreiheit\")\n\n[Abo kündigen](/abo-kuendigen \"Abo kündigen\")\n\n[AEB](/aeb \"AEB\")\n\n[Impressum](/impressum \"Impressum\")"
}