{
  "timestamp": "20250722_103246",
  "processing_info": {
    "date": "2025-07-22",
    "time": "10:33:01",
    "timezone": "WEST"
  },
  "url": "http://www.vag-freiburg.de",
  "imprint_url": "http://www.vag-freiburg.de/impressum",
  "imprint_data": {
    "company_name": "Freiburger Verkehrs AG",
    "managing_directors": [
      "Stephan Bartosch",
      "Oliver Benz"
    ],
    "business_address": {
      "street": "Besançonallee 99",
      "city": "Freiburg",
      "postal_code": "79111",
      "country": "Germany"
    },
    "phone_numbers": [
      "0761/4511-500"
    ],
    "email_addresses": [
      "info@vagfr.de"
    ],
    "website_url": "https://www.vag-freiburg.de",
    "registration_details": {
      "trade_register": "Handelsregister",
      "registration_number": "HRB 952",
      "court": "Freiburg i. Br."
    },
    "vat_id": "DE811237981",
    "tax_id": null,
    "professional_liability_insurance": null,
    "other_legal_info": {
      "chairman_supervisory_board": "OB Martin W. W. Horn",
      "responsible_for_content": "Jens Dierolf"
    }
  },
  "markdown_content": "Impressum\n\n\n\n\n\n\n\n\n\n\n\n\n\n\n\n\n\n\n\n\n\n\n\n\n\n\n\n\n\n\n\n\n\n\n\n\n\n\n\n\n\n\n\n\n\n\n\n  \n\n\n\n[Zum Menü (Enter)](#menu)[Zum Inhalt (Enter)](#page-content)\n\n* [Startseite](/ \"Startseite\")\n* [Fahrplan](/fahrplan \"Fahrplan\")\n  + [Fahrplanauskunft](/fahrplan/fahrplanauskunft \"Fahrplanauskunft\")\n  + [Aktuelle Verkehrsmeldungen](/aktuelles/aktuelle-verkehrsmeldungen \"Aktuelle Verkehrsmeldungen\")\n  + [Liniennetzpläne](/fahrplan/liniennetzplaene \"Liniennetzpläne\")\n  + [On-Demand-Angebote](/fahrplan/on-demand-angebote \"On-Demand-Angebote\")\n  + [Nachtverkehr](/fahrplan/nachtverkehr \"Nachtverkehr\")\n  + [Sonderverkehre](/fahrplan/sonderverkehre \"Sonderverkehre\")\n  + [Linienfahrpläne](/fahrplan/linien-fahrplaene \"Linienfahrpläne\")\n  + [Stadtteilfahrpläne](/fahrplan/stadtteilfahrplaene \"Stadtteilfahrpläne\")\n  + [Aushangfahrplan](/fahrplan/aushangfahrplan \"Aushangfahrplan\")\n  + [Haltestellenpläne](/fahrplan/haltestellen-plaene \"Haltestellenpläne\")\n  + [Schulfahrpläne](/fahrplan/schulfahrplaene \"Schulfahrpläne\")\n  + [Mehr Mobilität](/mehr-mobilitaet \"Mehr Mobilität\")\n* [Abos & Tickets](/tickets \"Abos & Tickets\")\n  + [Alle Abos im Überblick](/tickets/alle-abos-im-ueberblick \"Alle Abos im Überblick\")\n  + [Alle Tickets im Überblick](/tickets/alle-tickets-im-ueberblick \"Alle Tickets im Überblick\")\n  + [Tickets kaufen](/tickets/tickets-kaufen \"Tickets kaufen\")\n* [News](/aktuelles \"News\")\n  + [Presse und Öffentlichkeitsarbeit](/aktuelles/presse-und-oeffentlichkeitsarbeit \"Presse und Öffentlichkeitsarbeit\")\n  + [Aktuelle Verkehrsmeldungen](/aktuelles/aktuelle-verkehrsmeldungen \"Aktuelle Verkehrsmeldungen\")\n  + [Aktuelles aus der VAG](/aktuelles/vag-meldungen \"Aktuelles aus der VAG\")\n  + [Baustellen](/aktuelles/baustellen \"Baustellen\")\n  + [Social Media & Newsletter](/aktuelles/social-media-newsletter \"Social Media & Newsletter\")\n* [Service & Infos](/service-infos \"Service & Infos\")\n  + [Beratung und Kundenservice](/service-infos/beratung-und-kundenservice \"Beratung und Kundenservice\")\n  + [Barrierefreiheit](/service-infos/barrierefreiheit-sicherheit \"Barrierefreiheit\")\n  + [Mobilität für Unternehmen](/service-infos/mobilitaet-fuer-unternehmen \"Mobilität für Unternehmen\")\n  + [Verkehrserziehung für Kinder](/service-infos/verkehrserziehung-fuer-kinder \"Verkehrserziehung für Kinder\")\n* [Karriere](/karriere \"Karriere\")\n  + [Aktuelle Stellenangebote](/karriere/aktuelle-stellenangebote \"Aktuelle Stellenangebote\")\n  + [Ausbildung und Studium](/karriere/in-den-beruf-starten \"Ausbildung und Studium\")\n  + [Praktikum](/karriere/in-den-beruf-starten/praktikum \"Praktikum\")\n  + [Benefits](/karriere/unsere-benefits-und-vorteile \"Benefits\")\n  + [Arbeiten bei der Schauinslandbahn](/karriere/arbeiten-bei-der-schauinslandbahn \"Arbeiten bei der Schauinslandbahn\")\n* [Die VAG](/die-vag \"Die VAG\")\n  + [Über uns](/die-vag/ueber-uns \"Über uns\")\n  + [Karriere](/karriere \"Karriere\")\n  + [Nachhaltig verbunden](/nachhaltigkeit \"Nachhaltig verbunden\")\n  + [VAG kennen lernen](/die-vag/betriebsfuehrungen \"VAG kennen lernen\")\n  + [Einkauf und Lieferanten](/die-vag/einkauf-und-lieferanten \"Einkauf und Lieferanten\")\n  + [Fahrzeugwerbung](/die-vag/fahrzeugwerbung \"Fahrzeugwerbung\")\n  + [Schauinslandbahn](https://www.schauinslandbahn.de/ \"Schauinslandbahn\")\n\n* [Datenschutz](/datenschutz \"Datenschutz\")\n* [Impressum](/impressum \"Impressum\")\n* [Beförderungsbedingungen](/befoerderungsbedingungen-vag \"Beförderungsbedingungen\")\n* [Nutzungshinweise](/nutzungshinweise \"Nutzungshinweise\")\n\n[Menü schließen](# \"Menü schließen\")\n\nMenü\n\n* [Fahrplan](/fahrplan \"Fahrplan\")\n  + [Fahrplanauskunft](/fahrplan/fahrplanauskunft \"Fahrplanauskunft\")\n  + [Netzpläne](/fahrplan/liniennetzplaene \"Netzpläne\")\n  + [Linien & Fahrpläne](/fahrplan/linien-fahrplaene \"Linien & Fahrpläne\")\n  + [Mehr...](/fahrplan \"Mehr...\")\n* [Tickets](/tickets \"Tickets\")\n  + [Deutschland-Ticket](/ticket/deutschland-ticket \"Deutschland-Ticket\")\n  + [Alle Abos im Überblick](/tickets/alle-abos-im-ueberblick \"Alle Abos im Überblick\")\n  + [Alle Tickets im Überblick](/tickets/alle-tickets-im-ueberblick \"Alle Tickets im Überblick\")\n* [Kundenservice](/service-infos/beratung-und-kundenservice \"Kundenservice\")\n  + [Kundenzentrum](/kundenzentren \"Kundenzentrum\")\n  + [Fundsachen](/service-infos/beratung-und-kundenservice/fundsachen \"Fundsachen\")\n  + [FAQ](https://hilfe.vag-freiburg.de \"FAQ\")\n  + [Mehr...](/service-infos/beratung-und-kundenservice \"Mehr...\")\n* [Suche](/suche \"Suche\")\n\n[Logo der Freiburger Verkehrs AG](/ \"mbient Sitepackage\")\n\nSie sind hier:\n\n1. [Start](/ \"Start\")\n2. Impressum\n\n# Impressum\n\n## Rechtliche Hinweise der Freiburger Verkehrs AG\n\n### Anbieter des Onlineangebotes i.S.d. § 5 Telemediengesetz (TMG):\n\nFreiburger Verkehrs AG  \n Besançonallee 99, 79111 Freiburg\n\nPostfach 10 03 53, 79122 Freiburg  \n Telefon: 0761/4511-500  \n Fax: 0761/4511-139  \n E-Mail: [info@vagfr.de](mailto:info@vagfr.de)\n\nVorsitzender des Aufsichtsrates: OB Martin W. W. Horn  \n Vorstand: Stephan Bartosch, Oliver Benz\n\nRegistergericht: Freiburg i. Br.  \n Register Nr. HRB 952  \n Ust.-Ident.-Nr. DE811237981\n\n### Verantwortlich für den Inhalt nach § 55 Abs. 2 RStV:\n\n**Jens Dierolf**  \n Presse- und Öffentlichkeitsarbeit  \n Telefon: 0761/4511-286  \n E-Mail: [Jens.Dierolf@vagfr.de](mailto:Jens.Dierolf@vagfr.de)\n\n### Konzeption, Gestaltung und Programmierung der Internetseite\n\nm-bient Mediadesign, Marc Strecker  \n[www.m-bient.de](https://www.m-bient.de/)\n\nDiese Internetseite ist mit dem Content Management System [TYPO3](https://www.typo3.com/) realisiert worden.\n\nBildquellen:\n\nRalf Killian  \n VAG eigene\n\n## Haftungsausschluss\n\n### Inhalt des Onlineangebots\n\nDer Autor übernimmt keinerlei Gewähr für die Aktualität, Korrektheit, Vollständigkeit oder Qualität der bereitgestellten Informationen. Haftungsansprüche gegen den Autor, welche sich auf Schäden materieller oder ideeller Art beziehen, die durch die Nutzung oder Nichtnutzung der dargebotenen Informationen bzw. durch die Nutzung fehlerhafter und unvollständiger Informationen verursacht wurden, sind grundsätzlich ausgeschlossen, sofern seitens des Autors kein nachweislich vorsätzliches oder grob fahrlässiges Verschulden vorliegt.\n\nAlle Angebote sind freibleibend und unverbindlich. Der Autor behält es sich ausdrücklich vor, Teile der Seiten oder das gesamte Angebot ohne gesonderte Ankündigung zu verändern, zu ergänzen, zu löschen oder die Veröffentlichung zeitweise oder endgültig einzustellen.\n\n## Verweise und Links\n\nBei direkten oder indirekten Verweisen auf fremde Internetseiten (»Links«), die außerhalb des Verantwortungsbereiches des Autors liegen, würde eine Haftungsverpflichtung ausschließlich in dem Fall in Kraft treten, in dem der Autor von den Inhalten Kenntnis hat und es ihm technisch möglich und zumutbar wäre, die Nutzung im Falle rechtswidriger Inhalte zu verhindern.  \n Der Autor erklärt hiermit ausdrücklich, dass zum Zeitpunkt der Linksetzung keine illegalen Inhalte auf den zu verlinkenden Seiten erkennbar waren. Auf die aktuelle und zukünftige Gestaltung, die Inhalte oder die Urheberschaft der gelinkten/verknüpften Seiten hat der Autor keinerlei Einfluss. Deshalb distanziert er sich hiermit ausdrücklich von allen Inhalten aller gelinkten/verknüpften Seiten, die nach der Linksetzung verändert wurden. Diese Feststellung gilt für alle innerhalb des eigenen Internetangebotes gesetzten Links und Verweise sowie für Fremdeinträge in vom Autor eingerichteten Gästebüchern, Diskussionsforen und Mailinglisten. Für illegale, fehlerhafte oder unvollständige Inhalte und insbesondere für Schäden, die aus der Nutzung oder Nichtnutzung solcherart dargebotener Informationen entstehen, haftet allein der Anbieter der Seite, auf welche verwiesen wurde, nicht derjenige, der über Links auf die jeweilige Veröffentlichung lediglich verweist.\n\n## Urheber- und Kennzeichenrecht\n\nDer Autor ist bestrebt, in allen Publikationen die Urheberrechte der verwendeten Grafiken, Tondokumente, Videosequenzen und Texte zu beachten, von ihm selbst erstellte Grafiken, Tondokumente, Videosequenzen und Texte zu nutzen oder auf lizenzfreie Grafiken, Tondokumente, Videosequenzen und Texte zurückzugreifen.\n\nAlle innerhalb des Internetangebotes genannten und ggf. durch Dritte geschützten Marken- und Warenzeichen unterliegen uneingeschränkt den Bestimmungen des jeweils gültigen Kennzeichenrechts und den Besitzrechten der jeweiligen eingetragenen Eigentümer. Allein aufgrund der bloßen Nennung ist nicht der Schluss zu ziehen, dass Markenzeichen nicht durch Rechte Dritter geschützt sind!\n\nDas Copyright für veröffentlichte, vom Autor selbst erstellte Objekte bleibt allein beim Autor der Seiten. Eine Vervielfältigung oder Verwendung solcher Grafiken, Tondokumente, Videosequenzen und Texte in anderen elektronischen oder gedruckten Publikationen ist ohne ausdrückliche Zustimmung des Autors nicht gestattet.\n\n## Rechtswirksamkeit dieses Haftungsausschlusses\n\nDieser Haftungsausschluss ist als Teil des Internetangebotes zu betrachten, von dem aus auf diese Seite verwiesen wurde. Sollten Teile oder einzelne Formulierungen dieses Textes der geltenden Rechtslage nicht, nicht mehr oder nicht vollständig entsprechen, bleiben die übrigen Teile des Dokumentes in ihrem Inhalt und ihrer Gültigkeit davon unberührt.\n\n## Datenschutz\n\n[Hier finden Sie unsere Datenschutzerklärung.](/datenschutz)\n\nJetzt Newsletter abonnieren und exklusive Vorteile erhalten!\n\n[Jetzt anmelden](https://www.vag-freiburg.de/newsletter-anmeldung.php)\n\nKundenservice\n\nServiceangebote mit Informationen rund um den Nahverkehr in Freiburg.\n\n[Mehr dazu](/service-infos/beratung-und-kundenservice)\n\n[![Aps Store Icon - Zugang zum App Store](/fileadmin/vag_freiburg_media/bilder/icons/Download_on_the_App_Store_Badge_DE_Source_135x40.svg \"Download VAG Mobil App im App Store (iOS)\")](http://itunes.apple.com/de/app/vag-mobil/id539414172?mt=8 \"Download VAG Mobil App im App Store (iOS)\")\n\n[![Google Play Icon - Zugang zum Google Play Store](/fileadmin/_processed_/0/a/csm_google-play-badge_eec7748d40.png \"Download VAG mobil bei Google Play (Android)\")](https://play.google.com/store/apps/details?id=com.mdv.FRVAGCompanion \"Download VAG mobil bei Google Play (Android)\")\n\nVAG mobil App\n\nLade jetzt kostenfrei die VAG mobil App für iOS und Android herunter!\n\nVAG-Hotline\n\nWir helfen dir gerne weiter  \n 0761/4511-500\n\n[Zum Kontaktformular](/service-infos/beratung-und-kundenservice/kontakt)\n\nFreiburger Verkehrs AG\n| [Datenschutz](/datenschutz \"Datenschutz\")\n| [Impressum](/impressum \"Impressum\")\n| [Beförderungsbedingungen](/befoerderungsbedingungen-vag \"Beförderungsbedingungen\")\n| [Nutzungshinweise](/nutzungshinweise \"Nutzungshinweise\")\n| [Cookie-Einstellungen](#)\n\n* [Facebook](https://www.facebook.com/VAGFreiburg \"Facebook\")\n* [Instagram](https://www.instagram.com/vag_freiburg/ \"Instagram\")\n* [YouTube](https://www.youtube.com/user/VAGFreiburg \"YouTube\")\n\n[Link nach oben](#top \"Nach oben rollen\")\n\nInfos zur Barrierefreiheit\n\n×\n\n[Barrierefreiheit](/service-infos/barrierefreiheit-sicherheit \"Link zu Barrierefreiheit\")[Gebärdensprache](/gebaerdensprache \"Link zu Gebärdensprache\")[Leichte Sprache](/leichte-sprache \"Link zu Einfache Sprache\")\n\nDunkler Modus"
}