{
  "timestamp": "20250722_102552",
  "processing_info": {
    "date": "2025-07-22",
    "time": "10:26:11",
    "timezone": "WEST"
  },
  "url": "https://www.stadtbus-rv-wgt.de",
  "imprint_url": "https://www.stadtbus-rv-wgt.de#impressum",
  "imprint_data": {
    "company_name": "stadtbus Ravensburg Weingarten GmbH",
    "managing_directors": [
      "Dr. Andreas Thiel-Böhm",
      "Jenny Jungnitz"
    ],
    "business_address": {
      "street": "Schussenstraße 22",
      "city": "Ravensburg",
      "postal_code": "88212",
      "country": "Germany"
    },
    "phone_numbers": [
      "0751 804-0"
    ],
    "email_addresses": [
      "info@stadtbus-rv-wgt.de"
    ],
    "website_url": "https://www.stadtbus-rv-wgt.de",
    "registration_details": {
      "trade_register": "Handelsregister",
      "registration_number": "HRB 2542",
      "court": "Ravensburg"
    },
    "vat_id": null,
    "tax_id": null,
    "professional_liability_insurance": null,
    "other_legal_info": {
      "fax_number": "0751 804-1304",
      "data_protection_officer_email": "datenschutz@ravensburg-rvv.de",
      "web_analytics_service": "Google Analytics",
      "data_transmission_security": "HTTPS, Transport Layer Security (TLS)",
      "copyright_statement": "Copyright for self-created objects remains with the operator.",
      "liability_disclaimer_scope": "Content, Links, Copyright, Data Protection, Legal Validity"
    }
  },
  "markdown_content": "stadtbus Ravensburg Weingarten GmbH • Partner des bodo\n\n\n\nBitte ins Hochformat drehen\n\n* [Start](#start)\n* [Aktuell](#aktuell)\n* [Stadtbus](#stadtbus)\n* [tws.mobil/MOBI](#tws-mobil)\n* [Busbahnhof](#busbahnhof)\n* [Fahrplanauskunft](#fahrplaene)\n* [Preise](#preise)\n* [Infostellen](#infostellen)\n* [Kontakt](#kontakt)\n\n![Rutenfest 2025](https://www.stadtbus-rv-wgt.de/wp-content/uploads/2025/07/sb_rutenfest_2025.png)\n\n# Rutenfest 2025\n\nsicher hin und zurück\n\n [mehr erfahren](#aktuell)\n\n## Gut zu wissen\n\nSperrungen/Umleitungen\n:   ### Linie 21 | Stabilisierungsfahrplan: Änderungen aufgrund der Baumaßnahme in der Wangener Straße\n\n    ## Stabilisierungsfahrplan Linie 21: Änderungen aufgrund der Baumaßnahme in der Wangener Straße\n\n    **Ravensburg, 25.06.2025** – Im Zuge der Baumaßnahme in der Wangener Straße wird die halbseitige Sperrung im Zeitraum vom **14. Juli bis einschließlich 24. August 2025** aufgehoben. Dies hat direkte Auswirkungen auf den Fahrplan der Buslinie 21.\n\n    ### Fahrplanregelung im Überblick:\n\n    * **Bis Sonntag, 13.07.2025:** Die Linie 21 verkehrt weiterhin nach dem bekannten **Stabilisierungsfahrplan**.\n    * **Montag, 14.07. bis Sonntag, 24.08.2025:** Die Linie 21 fährt nach dem **regulären Fahrplan**, der **vor der Baumaßnahme** gültig war.\n    * **Ab Montag, 25.08.2025 bis voraussichtlich 30.11.2025:** Rückkehr zum **Stabilisierungsfahrplan** bis zum Ende der Bauarbeiten.\n\n    Zusätzlich ist vorgesehen, dass es während der weiteren Bauphase **zu drei einwöchigen Vollsperrungen** der Wangener Straße kommt. In diesen Zeiträumen **entfallen die Haltestellen „Gänsbühl“ und „Lumper Höhe“**. Die genauen Termine geben wir rechtzeitig bekannt.\n\n    ### Fahrpläne zum Download:\n\n    * [Stabilisierungsfahrplan Linie 21 (bis 13.07.2025 und ab 25.08. bis vsl. 30.11.2025)](https://www.stadtbus-rv-wgt.de/wp-content/uploads/2025/06/21_Stabilisierungsfahrplan_bis13.07._und_25.08.-30.11.2025.pdf)\n    * [Regulärer Fahrplan Linie 21 (14.07.–24.08.2025 und vsl. ab 01.12.2025)](https://www.stadtbus-rv-wgt.de/wp-content/uploads/2025/06/21_regulaererFahrplan_14.07.-24.08._und_ab01.12.pdf)\n\n    📌 **Alle aktuellen Informationen und Fahrpläne finden Sie jederzeit auf dieser Webseite**\n\n    ### Linien 700, 7537 | Busumleitung, Haltausfälle und Fahrplanänderungen aufgrund einer Straßensperrung der B 33 – Verlängerung bis 27.06.2025\n\n    **Für die Buslinien 700 (Ravensburg - Konstanz) und 7537 (Ravensburg - Meersburg) gelten vom 7. Mai bis voraussichtlich **27. Juni 16:00 Uhr** Ersatzfahrpläne. Einige Haltestellen entfallen.**\n    Auf der Bundesstraße 33 zwischen Bavendorf und Ravensburg-Weststadt wird die Fahrbahn saniert. Zugleich wird die Bushaltestelle „Abzw. Riesenhof“ barrierefrei umgebaut und es finden Rohrleitungsarbeiten statt. Die Vollsperrung hat Auswirkungen auf den Busverkehr, da die Buslinien 700 (Ravensburg - Konstanz) und 7537 (Ravensburg - Meersburg) umgeleitet werden, daher gelten für diese Linien ab 07.05.2025 bis zum **27.06.2025 16:00 Uhr** Ersatzfahrpläne.\n    Ab dem 7. Mai kommt es daher zu folgenden Änderungen im Busverkehr:\n    **Linie 700 (Regiobus Ravensburg - Meersburg - Konstanz)**\n\n    * Die Busse von Ravensburg Richtung Konstanz fahren in Ravensburg drei Minuten früher ab.\n    * Umleitung: Nach Bedienen der Haltestelle „Ravensburg, Meersburger Brücke“ ohne weiteren Halt bis Bavendorf. Die Haltestellen „Meersburger Straße“, „Waldorfschule“ und „Gewerbegebiet Erlen“ entfallen.\n    * Gleiches gilt in der Gegenrichtung, jedoch ohne veränderte Fahrplanzeiten. Es ist mit Verspätungen von zwei bis drei Minuten bei der Ankunft in Ravensburg zu rechnen. Relevante Anschlüsse zu anderen Buslinien sowie zur Bahn bleiben jedoch erhalten.\n\n    **Linie 7537 (Ravensburg - Meersburg)**\n\n    * Umleitung teils über Oberzell, teils über Wolketsweiler\n    * Schulrelevante Fahrten zur Ravensburger Waldorfschule fahren über die Weststadt.\n    * Einige Fahrten bedienen das Gewerbegebiet Erlen, um zu den Schichtzeiten der Firma Vetter Verbindungen von und nach Ravensburg zu ermöglichen.\n\n    **Ersatzfahrpläne**\n\n    * [Ersatzfahrplan Linie 700 Ravensburg - Konstanz](https://www.bodo.de/fileadmin/redakteur/pdf/700_vom_07.05._bis_20.06_1.pdf)\n    * [Ersatzfahrplan Linie 7537 Ravensburg - Meersburg](https://www.bodo.de/fileadmin/redakteur/pdf/7537_BauBav2_vom_02._bis_20.06._414537_beide_RAB_1.pdf)\n\n    ### Linien 21, R40, S40 | Halbseitige Sperrung der Wangener Straße führt zu Verspätungen\n\n    Aufgrund einer halbseitigen Sperrung der Wangener Straße ab Montag, 07.04.2025 bis vsl. 29.06.2025 ist mit Verspätungen auf den Linien 21, R40 und S40 zu rechnen. Bitte prüfen Sie Ihre Verbindung und wählen ggf. eine frühere Fahrt. Wir bitten um Verständnis.\n\n16. Juli 2025\n\n### Rutenfest 2025 – Zusatzfahrten auf zahlreichen Buslinien\n\n**Zum Rutenfest 2025 bringt Sie der stadtbus zuverlässig, bequem und sicher zu den Veranstaltungen in die Ravensburger Innenstadt – und wieder nach Hause.**\n\nFür alle **Nachtschwärmer** gibt es von Rutenfreitag, **25.07.2025**, bis Rutendienstag, **29.07.2025**, zusätzliche Fahrten bis ca. 1:30 Uhr ab Ravensburg Bahnhof. Die genauen Fahrzeiten finden Sie unten aufgeführt..\n\nFahrplanauskünfte zu den Zusatzfahrten erhalten Sie auch über die **tws.Mobil-App** oder die **deinbodo-App**.\n\nWie ganzjährig verkehren auch während des Rutenfests in den Nächten von Freitag auf Samstag sowie Samstag auf Sonntag **Nachtbusse**. Auf der **Linie 1** fahren Busse bis 4:23 Uhr Richtung Baindt und bis 3:23 Uhr Richtung Weststadt/Schmalegg. Auf der **Linie 3** in Richtung Eschach und Oberzell verkehren die Busse bis 3:23 Uhr ab Ravensburg Bahnhof.\n\nZusätzlich zu den Nachtfahrten werden am Wochenende und insbesondere am Montag, **28.07.2025**, zum Rutenfestumzug **Verstärkerfahrten** angeboten.\n\n**Tarif-Tipp:** Für eine preiswerte Fahrt während der Festtage empfehlen wir unsere Tageskarten. Die **Einzel-Tageskarte** kostet 7,30 € und gilt für beliebig viele Fahrten im gesamten Stadtbusgebiet – von früh bis Betriebsschluss. Die **Gruppen-Tageskarte** für bis zu 5 Personen kostet 14,20 €.\n\nMit der **bodo eCard** oder bei Bezahlung über die **tws.Mobil-App** reduziert sich der Einzelfahrscheinpreis in der Stadtzone um 30 % – auf 2,10 € pro Fahrt.\n\n**Samstags kostenlos fahren:** An samstagen gilt der **digitale Samstag-Nulltarif** in der Stadtzone Ravensburg-Weingarten. Einfach mit der bodo eCard oder der tws.Mobil-App bzw. deinbodo-App am Samstag zum Nulltarif fahren. Das Angebot „1-Euro-Samstagsbus“ ist entfallen. **Der digitale Samstag-Nulltarif gilt nicht beim Fahrscheinkauf beim Busfahrer.**\n\n  \n  \n\n### Fahrpläne zum Rutenfest 2025\n\n* [Linie 1: Baindt – Baienfurt – Weingarten – Ravensburg – Weststadt - Schmalegg](https://www.stadtbus-rv-wgt.de/wp-content/uploads/2025/07/RF_2025_RAB_Linie-1.pdf)\n* [Linie 3: Hegaustraße – RV-Zentrum – Weißenau – Eschach - Oberzell](https://www.stadtbus-rv-wgt.de/wp-content/uploads/2025/07/RF_2025_RAB_Linie-3.pdf)\n* [Linie 4: RV-Zentrum - Am Mühlbach - Weißenau - Oberzell](https://www.stadtbus-rv-wgt.de/wp-content/uploads/2025/07/RF_2025_RAB_Linie-4.pdf)\n* [Linie 20: Ravensburg - Weingarten - Wolpertswende](https://www.stadtbus-rv-wgt.de/wp-content/uploads/2025/07/RF_2025_VBS_Linie-20.pdf)\n* [Linie 21: Ravensburg - Knollengraben - Grünkraut - Bodnegg](https://www.stadtbus-rv-wgt.de/wp-content/uploads/2025/07/RF_2025_VBS_Linie-21.pdf)\n* [Linie R30: Ravensburg – Bad Waldsee](https://www.stadtbus-rv-wgt.de/wp-content/uploads/2025/07/RF_2025_Mueller_Linie-R30.pdf)\n* [Linie 31: Ravensburg – Bergatreute – Altann - Wolfegg](https://www.stadtbus-rv-wgt.de/wp-content/uploads/2025/07/RF_2025_Mueller_Linie-31.pdf)\n* [Linie R40: Ravensburg - Amtzell - Wangen](https://www.stadtbus-rv-wgt.de/wp-content/uploads/2025/07/RF_2025_RAB_Linie-R40.pdf)\n* [Linie R60: Ravensburg – Berg – Fleischwangen](https://www.stadtbus-rv-wgt.de/wp-content/uploads/2025/07/RF_2025_Grabherr_Linie-R60.pdf)\n* [Linie 61: Ravensburg - Berg](https://www.stadtbus-rv-wgt.de/wp-content/uploads/2025/07/RF_2025_Grabherr_Linie-61.pdf)\n* [Linie R65: Ravensburg - Blitzenreute - Bad Saulgau](https://www.stadtbus-rv-wgt.de/wp-content/uploads/2025/07/RF_2025_RAB_Linie-R65.pdf)\n* [Linie R70: Ravensburg - Horgenzell - Kappel/- Wilhelmsdorf](https://www.stadtbus-rv-wgt.de/wp-content/uploads/2025/07/RF_2025_RAB_Linie-R70.pdf)\n* [Linie 7534: Ravensburg - Weingarten Oberstadt - Erbisreute - Hintermoos](https://www.stadtbus-rv-wgt.de/wp-content/uploads/2025/07/RF_2025_RAB_Linie-7534.pdf)\n* [Linie 7535: Ravensburg - Schlier - Waldburg - Vogt (- Wangen)](https://www.stadtbus-rv-wgt.de/wp-content/uploads/2025/07/RF_2025_RAB_Linie-7535.pdf)\n* [Linie 7537: Ravensburg - Weststadt - Taldorf](https://www.stadtbus-rv-wgt.de/wp-content/uploads/2025/07/RF_2025_RAB_Linie-7537.pdf)\n\n04. Juni 2025\n\n### Badebus ins Flappachbad fährt ab 07.06.2025 im Stundentakt\n\nDie Stadtbuslinie 7A  fährt ab Samstag, 07.06.2025 ab dem Ravensburger Busbahnhof (Bussteig 14) bei guter Witterung im Stundentakt ins Flappachbad. Die erste Fahrt startet ab Busbahnhof um 10.12 Uhr, die letzte Fahrt ab Flappachbad  um 19.25 Uhr. Der Stundentakt wird während der Hauptsaison im Flappachbad bis voraussichtlich  31.08.2025 gefahren.\n\nIm Flappachbad gilt wie in den Vorjahren die Schlechtwetterregelung  während der gesamten Badesaison.\n\nWenn das Bad ab Mittag geöffnet ist, werden drei Garantiefahrten ab Busbahnhof um 12.12 Uhr, 14.12 Uhr und 17.12 Uhr /Rückfahrt ab Flappachbad um 12.25 Uhr, 14.25 Uhr und 17.25 Uhr angeboten.\n\nDie Schlechtwetterregelung gilt auch für den Badebus. Wenn das Bad ganztägig geschlossen ist verkehrt auch kein Badebus.\n\nmehr\n\n07. April 2025\n\n### Kommunaler Verkehrsbetrieb für das mittlere Schussental: Verkehrsbetrieb Hagmann wird zu VBS Verkehrsbetriebe Schussental\n\nDie Städte Ravensburg und Weingarten sowie die Gemeinden Baienfurt und Baindt haben gemeinsam den kommunalen Verkehrsbetrieb VBS Verkehrsbetriebe Schussental (VBS) gegründet.\nNach der Zustimmung der vier kommunalen Gremien im Herbst 2024 erfolgte am 26. Februar 2025 die notarielle Beurkundung der Gesellschaftsverträge für die\n\n* VBS Verkehrsbetriebe Schussental Verwaltungs-GmbH und die\n* VBS Verkehrsbetriebe Schussental GmbH & Co. KG.\n\nIm Zuge dieser Neustrukturierung wurde der bisher zur RVV (Ravensburger Verkehrs- und Versorgungsbetriebe) gehörende **Verkehrsbetrieb Hagmann in VBS Verkehrsbetriebe Schussental**umfirmiert.\nDie **Stadtbuslinien 20 (Mochenwangen/Wolpertswende) und 21 (Grünkraut/Bodnegg) fahren weiterhin wie gewohnt** – nach dem bisherigen Fahrplan, mit den gleichen Fahrzeugen und dem bekannten Fahrpersonal. Auch Adresse und Telefonnummer bleiben unverändert.\n\nAb dem 01. Januar 2027 übernimmt die VBS den operativen Busbetrieb im mittleren Schussental und bedient künftig die bisherigen Stadtbuslinien 1, 3, 4, 5 und 7A.\n\nNeu ab 2027: Die Linie 2 verbindet den BOB-Bahnhof Weingarten mit der Hochschule Weingarten – und im Sommer zusätzlich mit dem Freibad. Sie ersetzt damit die bisherigen Linien 6 und 15.\n\nmehr\n\n27. März 2025\n\n### Fahrplanänderungen auf den Linien 3, 7A und 21 ab 12.04.2025 – Bedienung der neuen Haltestellen Untereschach Ortsmitte und Lumper Höhe\n\nAb Samstag, 12.04.2025 gibt es Änderungen im Stadtbus Ravensburg Weingarten:\n\nIm Rahmen der Umgestaltung der Ortsmitte in Untereschach wurde eine neue Haltestelle \"Untereschach Ortsmitte\" angelegt, die von der [**Linie 3**](https://www.stadtbus-rv-wgt.de/wp-content/uploads/2025/03/3_414303_beide_RAB_1.pdf) bedient wird. Aus Richtung Ravensburg kommend halten alle Fahrten, die in Untereschach enden an dieser neuen barrierefreien Haltestelle. In Richtung Ravensburg wird die Haltestelle von den Fahrten, die aus Richtung Gornhofen kommen angefahren. Die Fahrten, die in Untereschach beginnen und über die Haltestelle Obereschach, Angelestraße in Richtung Ravensburg fahren, bedienen aus umlauftechnischen Gründen nach wie vor die bisherige Haltestelle in Untereschach. Die Linie 3 bedient die Haltestellen in Untereschach im 15 bzw. 30 Minutentakt in Hauptverkehrszeiten.\n\nEbenfalls zum 12.04.2025 wird die neue Haltestelle \"Lumper Höhe“ in Betrieb genommen die von der [**Linie 21**](https://www.stadtbus-rv-wgt.de/wp-content/uploads/2025/03/21_ab-12.04.2025.pdf) nach Grünkraut / Bodnegg bedient wird.\n\nMit der neuen Haltestelle erhalten die Anwohner eine direkte Verbindung zur Ravensburger Innenstadt, dem Bahnhof, den Schulen sowie zur restlichen Oststadt und den Gemeinden Grünkraut und Bodnegg. Die [**Linie 21**](https://www.stadtbus-rv-wgt.de/wp-content/uploads/2025/03/21_ab-12.04.2025.pdf) verkehrt werktags mindestens stündlich, zur Hauptverkehrszeit halbstündlich und an Sonn- und Feiertagen alle zwei Stunden.\n\nZusätzlich wird die Haltestelle \"Lumper Höhe\" ab der Eröffnung des Flappachbades Mitte Mai 2025 auch vom [Flappachbadebus (**Linie 7A**)](https://www.stadtbus-rv-wgt.de/wp-content/uploads/2025/03/7A_414307_beide_RAB_1-1.pdf) angefahren.\n\n06. März 2025\n\n### Neue Haltestelle auf der Regiobuslinie R 45: Mariatal Süd\n\nAb Montag, 10. März, geht in Ravensburg die neue Bushaltestelle „Mariatal Süd“ in Betrieb. Sie liegt direkt an der Friedrichshafener Straße. Statt wie bisher im Gewerbegebiet hält hier künftig die Regiobuslinie R 45 Ravensburg – Tettnang – Friedrichshafen. Sie fährt neu auf direktem Weg und bindet die Wohngebiete von Torkenweiler und Mariatal an.\n\nDer neue Halt „Mariatal Süd“ liegt genau dort, wo eine Fußgängerunterführung die Dorfstraße und die Mariataler Straße miteinander verbindet. Die Linie R45 bietet an allen Tagen der Woche stündliche und direkte Fahrtmöglichkeiten nach Ravensburg, Tettnang und Friedrichshafen. Die Stadtbuslinie 3 bedient wie bisher die Haltestelle Gewerbegebiet Mariatal.\n\nmehr\n\n06. Dezember 2024\n\n### MOBI ab 16.12.2024 auch in Weingarten unterwegs\n\nZum Fahrplanwechsel am 16. Dezember 2024 erweitert MOBI sein Bedienungsgebiet nach Weingarten. Die Gebietserweiterung beinhaltet den Vorderen Ochsen und den Löwenplatz.\n\nDamit übernehmen die zwei MOBI Kleinbusse das Bedienungsgebiet des bisherigen RAB-Rufbusses in Weingarten. Über das MOBI Angebot werden in Weingarten neben den beiden Haltestellen Adolf-Gröber-Haus und Löwenplatz, weitere 15 virtuelle Haltepunkte angeboten. MOBI ist von Montag bis Freitag von 7 -18 Uhr und am Samstag von 7 – 23 Uhr unterwegs.\n\nEine MOBI-Fahrt ist über die kostenlose App twsMobil buchbar. Eine vorherige einmalige Registrierung bei mobil.tws.de ist Voraussetzung. Fahrscheine für die MOBI Mitfahrt können auch über twsMobil gebucht werden. Fahrgäste, die bereits einen Fahrschein haben, wie z. B. das Deutschlandticket, können MOBI kostenlos nutzen, wobei die Buchung der Fahrt über die twsMobil App immer erforderlich ist. Auch mit der bodo e-card kann MOBI genutzt werden.\n\nmehr\n\n22. August 2024\n\n### Samstag-Nulltarif im stadtbus ohne Smartphone mit der bodo e-Card\n\nDie eCard des  bodo ist die elektronische Form des Einzelfahrscheins.  Beim Ein- und Ausstieg in den Bus, beziehungsweise auf dem Bahnsteig, wird die Chipkarte an ein Lesegerät gehalten.  Gegenüber dem herkömmlichen Einzelticket erhalten eCard-Kunden einen Preisnachlass von 30 Prozent. Auch wer samstags mit der eCard innerhalb der Stadttarifzone Ravensburg-Weingarten unterwegs ist, checkt sich ein und aus. Die Fahrt wird dann mit 0,00 Euro berechnet, sofern Check-in und Check-out innerhalb der Stadttarifzone liegen. Die Tickets, die übergangsweise auf Papier ausgegebenen wurden, sind nicht mehr erhältlich.\n\nWer die eCard nutzen möchte, braucht dafür weder Smartphone noch Internetzugang. Denn sowohl die Kartenbestellung als auch die monatliche Abrechnung sind per Post möglich. Für die Herstellung und den Versand der Karte werden einmalig fünf Euro berechnet, für den Versand einer Monatsabrechnung auf dem Postweg jeweils 1,20 Euro. Wer möchte, kann seine Abrechnungen aber auch ohne Versandkosten per E-Mail erhalten.\n\nDas eCard-Guthabenkonto muss stets mit fünf Euro befüllt sein. Sinkt der Füllstand nach einer Monatsabrechnung unter fünf Euro, werden ein oder – wenn nötig – mehrere Einzüge vom Bankkonto angestoßen. Der einzelne Bankeinzug kann wahlweise 15 oder 30 oder 50 oder 100 Euro umfassen.\n\nLaufende Kosten verursacht die eCard nicht. Das bedeutet: Auch wenn die Karte über Wochen und Monate ungenutzt bleibt, ändert sich nichts am Guthaben des eCard-Kontos. Im Fall einer Kündigung wird das volle Guthaben wieder ausbezahlt.\n\nWer die eCard nicht selbst nutzt, kann sie zudem an jede beliebige andere Person ausleihen. Nicht möglich ist die gleichzeitige Nutzung durch mehrere Personen. Hingegen können mehrere Karten auf ein eCard-Kundenkonto ausgestellt werden – gut geeignet zum Beispiel für Familien. Denn die eCard gibt es auch für Kinder. Sie bezahlen damit den regulären Kinderfahrpreis und können auch den Null-Euro-Samstagstarif nutzen.\n\nDer Null-Euro-Samstagstarif ist nicht nur mit der eCard nutzbar, sondern auch mit den Apps der Technischen Werke Schussental („twsMobil“) und des bodo-Verkehrsverbunds („deinbodo“).\n\nmehr\n\n16. Juli 2024\n\n### Höhere Fahrpreise ab 1. August 2024 – Rabatt von 30 % mit der eCard\n\nUm durchschnittlich 7,9 Prozent steigen zum 1. August die Preise für Fahrscheine im stadtbus / bodo-Verkehrsverbund. Wer jedoch auf das bargeldlose Fahren mit der eCard umsteigt, spürt die höheren Kosten für Einzelfahrscheine nur wenig bis gar nicht. Und wer regelmäßig fährt, ist mit dem Deutschlandticket besonders günstig unterwegs.\n\nFür Fahrgäste ist die anstehende Preiserhöhung vor allem im Bereich der Einzelfahrscheine und Tageskarten relevant. So steigt beispielsweise der Preis für die Einzelfahrt eines Erwachsenen im stadtbus  von 2,70 auf 2,90 Euro.\n\nGleichzeitig wird der Rabatt mit der eCard von 25 auf 30 Prozent erhöht, womit der Einzelfahrscheinpreis im stadtbus sich von 2,00 nur auf 2,05 Euro erhöht.\n\nIm Zeitkartenbereich ist das Deutschlandticket zum Preis von 49,00 Euro pro Monat und das Deutschlandticket JugendBW für 365,00 Euro im Jahr eine preislich attraktive Alternative zu den regulären Monatskarten.\n\nDie eCard mit einem Rabatt von 30 % für Einzelfahrten ist im gesamten bodo Gebiet nutzbar und nicht persönlich an den Inhaber gebunden. Beim Ein- und Ausstieg wird sie an ein Lesegerät gehalten. Der Fahrpreis wird anschließend ermittelt und monatlich abgerechnet. Das Guthaben des Kundenkontos füllt sich automatisch per Bankeinzug auf. Der Verkehrsverbund liefert monatlich eine Rechnung, wahlweise per Post oder per E-Mail. Ein Internetzugang ist somit nicht Voraussetzung. Bestellscheine für die eCard und weitere Informationen gibt es auf www.bodo-ecard.de sowie persönlich in den Mobilitätszentralen und Kundencentern.\n\nmehr\n\n01. Juli 2024\n\n### Neu ab 06.Juli: Samstags kostenlos mit digitalem Fahrschein /1-Euro-Samstagsbus entfällt\n\nAb dem 6. Juli ist immer samstags die Fahrt im öffentlichen Nahverkehr innerhalb der Stadtzone Ravensburg-Weingarten kostenlos. Das gilt für die Stadt- und Regionalbusse ebenso wie für die Züge der Bodensee-Oberschwaben-Bahn (BOB).\nDie Stadtzone reicht im Norden bis einschließlich Baindt, im Süden bis Gornhofen und Taldorf, im Osten bis Grünkraut sowie im Westen bis Schmalegg. Die Strecke der BOB zählt von Niederbiegen bis Oberzell dazu. Wer das kostenlose Angebot nutzen möchte, benötigt einen digitalen Fahrschein – erhältlich in der der twsMobilApp und in der bodo-App.\n\nInhaber der bodo-eCard checken wie gewohnt ein und aus. Eine Berechnung der Fahrt findet dann nicht statt. Der kostenlose Fahrschein ist nicht auf Papier erhältlich, und somit auch nicht an den BOB Automaten oder beim Fahrpersonal in den  Bussen. Wer keinen digitalen Fahrschein hat, kann an den BOB Automaten oder beim Fahrpersonal einen Fahrschein zum regulären Tarif kaufen. Da es bei Bezahlung mit der bodo-eCard einen hohen Rabatt von 30 % ab 01.08.2024 gibt, empfiehlt sich die Nutzung der eCard, die auch am Schalter im Ravensburger Bahnhof erhältlich ist.\n\nDer kostenlose digitale Tarif löst ab 06.07.2024 das bisher samstags gültige 1-Euro-Ticket im Stadtbus Ravensburg-Weingarten ab.\n\nmehr\n\n03. Mai 2024\n\n### Linie 20: Fahrplanänderung an Samstagen ab 18.05.2024\n\nAb Samstag, 18.05.2024 verkehren sämtliche Fahrten der Linie 20 an Samstagen 20 Minuten später. Den neuen Fahrplan finden Sie [hier](https://www.stadtbus-rv-wgt.de/wp-content/uploads/2024/05/20_ab18.05.pdf).\n\n14. März 2024\n\n### Elektrobus im Linienverkehr getestet – Fünf Elektrobusse ab 2025 in Ravensburg/Weingarten im Einsatz\n\n[![](https://www.stadtbus-rv-wgt.de/wp-content/uploads/2024/03/rvv_hagmann_elektrobus.jpg)](https://www.stadtbus-rv-wgt.de/wp-content/uploads/2024/03/rvv_hagmann_elektrobus.jpg) Bild (v.l): Dominik Dornfeld, Betriebsleiter vom Verkehrsbetrieb Hagmann und Jenny Jungnitz, Geschäftsleiterin der RVV. Der Verkehrsbetrieb Hagmann testete eine Woche lang einen Elektrobus im Linienverkehr.\n\n#### Auf Herz und Nieren getestet hat der Verkehrsbetrieb Hagmann jetzt einen Elektrobus von MAN auf der Strecke zwischen Ravensburg und Weingarten. Die Betreiber sind zufrieden mit der klimaneutralen Alternative. „Im ersten Halbjahr 2025 kommen fünf Elektrobusse, die wir im Regelbetrieb einsetzen werden. Die drei Solobusse und zwei Gelenkbusse sind bestellt“, berichtet Jenny Jungnitz, Geschäftsleiterin der Ravensburger Verkehrs- und Versorgungsbetriebe (RVV). Der Verkehrsbetrieb Hagmann, der seit Mitte 2021 zur RVV gehört, wertet dies als einen großen Schritt für die nachhaltige Mobilität im Schussental, denn die Busse fahren mit 100 Prozent Ökostrom. „Wir setzen bei der Erneuerung der Busflotte bewusst auf vollelektrische Fahrzeuge und leisten damit einen aktiven und nachhaltigen Beitrag zum Klimaschutz\", so Dominik Dornfeld, Betriebsleiter vom Verkehrsbetrieb Hagmann.\n\n04. Dezember 2023\n\n### Erweiterte Fahrzeiten von MOBI an Samstagen ab dem 10.12.2023\n\nDie zwei Ravensburger Kleinbusse auf Bestellung fahren ab 10. Dezember zu geänderten Zeiten. Die neuen Zeiten sind Montag bis Freitag von 7.00 Uhr bis 18.00 Uhr und neu am Samstag bis 23.00 Uhr. Das Angebot an Sonntagen von 13.00 Uhr bis 18.00 Uhr wird ab dem 10.12.2023 wegen geringer Nachfrage eingestellt.\n\nSeit Ende 2022 gibt es das flexible Fahrtangebot in der Ravensburger Innenstadt, das über die tws.mobil-App gebucht und bezahlt werden kann. Es handelt sich um ein Pilotprojekt, das insgesamt drei Jahre läuft. Die Kleinbusse haben acht Sitzplätze und fahren ohne Fahrplan und ohne feste Route auf digitale Bestellung über die tws.mobil-App. Sie steuern über 100 virtuelle Haltestellen an. Dazu zählen auch Haltestellen, die von größeren Bussen nicht bedient werden können wie zum Beispiel Haltestellen in der Marktstraße, an den Museen oder am Obertor. Zusätzlich werden ab dem Fahrplanwechsel am 10.12.2023 auch Hinzistobel und Sennerbad in das Bediengebiet mit aufgenommen.\n\nmehr\n\n![Gut zu wissen](https://www.stadtbus-rv-wgt.de/wp-content/uploads/2017/03/1rv-huberesch.jpg)\n\n**Ihr stadtbus!**\n\nImmer auf dem Laufenden bleiben\n\n## Der Stadtbus – Partner des bodo\n\nDer stadtbus Ravens­burg Weingarten bietet Ihnen zuverlässige, bequeme und sichere Busverbindungen mit attraktiven Tarifen. Flexibilität, Zuverlässigkeit und Kundenfreundlichkeit zeichnen den stadtbus Ravensburg Weingarten aus. Für be­sondere Anlässe wie z. B. dem Ravensburger Rutenfest bietet der stadtbus Son­derfahrten an, um Sie günstig und bequem hin und zurück zu bringen. Und im Sommer nutzen Sie am besten unseren Badebus, mit dem Sie ganz ohne Parkplatz­sor­gen ins Flappachbad fahren.\n\nDer stadtbus Ravensburg Weingarten ge­hört zum Bodensee-Oberschwaben-Ver­kehrs­verbund „bodo“, der die beiden Landkreise Bodenseekreis und Ra­vensburg mit einem einheitlichen Tarif verbindet. Innerhalb des stadtbus-Gebietes gilt jedoch ein eigener Tarif. Ihr Vorteil: Sie bezahlen für den Einzelfahrschein nur 2,90 € (ab 1.8.2024), egal wie weit Sie innerhalb der drei großen stadtbus-Zonen (30, 31 und 32) fahren. Beim ein- und ausfahrenden Verkehr gilt der bodo-Tarif. Dieser wird anhand der durchfahrenen bodo-Zonen be­rechnet. Bereits im stadtbus kann so z.B. die durchgängige bodo-Fahrkarte nach Wangen oder Überlingen gelöst werden.\n\nWir wünschen Ihnen gute Fahrt im stadtbus Ravensburg Weingarten.\n\n**Partner des Stadtbus**\n\n[![](https://stadtbus-rv-wgt.de/wp-content/uploads/2017/03/partner-rab-1.png)](http://www.bahn.de/rab \"<strong>Regionalverkehr Alb-Bodensee GmbH (RAB)</strong><br>Karlstraße 31-33<br>89073 Ulm \")![](https://www.stadtbus-rv-wgt.de/wp-content/uploads/2025/04/vbs_logo_primer_w.png \"<strong>VBS Verkehrsbetriebe Schussental GmbH & Co. KG</strong><br>Bleicherstraße 28<br>88212 Ravensburg \")[![](https://stadtbus-rv-wgt.de/wp-content/uploads/2017/03/partner-grabherr.png)](http://www.omnibus-grabherr.de \"<strong>Omnibus Grabherr GmbH</strong><br>Am Langholz 8<br>88289 Waldburg \")\n\n[![](https://www.stadtbus-rv-wgt.de/wp-content/uploads/2024/12/RVV_Logo_negativ-300x144.png \"<strong>Ravensburger Verkehrs- und Versorgungsbetriebe</strong><br>Schussenstraße 22<br>88212 Ravensburg \")](https://www.stadtbus-rv-wgt.de/wp-content/uploads/2024/12/RVV_Logo_negativ.png)[![](https://www.stadtbus-rv-wgt.de/wp-content/uploads/2017/03/partner-sw_wgt.png \"<strong>Stadtwerke Weingarten</strong><br>Kirchstraße 1<br>88250 Weingarten \")](https://www.stadtbus-rv-wgt.de/wp-content/uploads/2017/03/partner-sw_wgt.png)\n\n![Der Stadtbus – Partner des bodo](https://www.stadtbus-rv-wgt.de/wp-content/uploads/2017/03/weingarten.jpg)\n\n**Sie haben Ziele?**\n\nWir bringen Sie sicher weiter\n\n## twsMobil\n\n**Profitieren Sie von vernetzter Mobilität**\n\nMit der [twsMobil](https://mobil.tws.de) App profitieren Sie heute schon von vernetzter Mobilität in Ravensburg und Weingarten. Über diesen digitalen Weg können Sie auch Ihre Fahrscheine für den stadtbus erwerben – wann und wo Sie wollen.\n\n**MOBI – flitz und fertig**\n\nDer On-Demand-Bus bewegt Sie mit flexiblen, barrierearmen Kleinbussen und mehr als 120 Abholpunkten, davon über 80 virtuelle Haltestellen, einfach, schnell und unkompliziert durchs Schussental. Dazu benötigen Sie lediglich ein Smartphone.\n\nMOBI auf einen Blick:\n\n* Flexible Ergänzung des Fahrplanangebots\n* Höchstens 300 m zum nächsten Abholpunkt\n* Maximale Wartezeit: 10 Minuten\n* Barrierearm durch Niederflurtechnik\n* Abfahrtszeit nach Fahrgastwunsch\n* Betriebszeiten: Montag bis Freitag  von 7–18 Uhr, samstags bis 23 Uhr\n* **Neu ab 16.12.2024:** **Gebietserweiterung bis Vorderer Ochsen und Löwenplatz in Weingarten**\n\nBuchen und bezahlen können Sie mit der twsMobil-App. ÖPNV-Zeitkarten werden anerkannt.\n\n**ÖPNV-Auskunft und ÖPNV-Ticketing**\n\nVia twsMobil erhalten Sie alle ÖPNV-Informationen für die Region – in Echtzeit inklusive Verspätungsmitteilungen. Auch die bodo-Fahrplan Auskunft ist integriert.\n\nMit ÖPNV-Ticketing können Sie für die Stadtgebiete Ravensburg und Weingarten Ihr Ticket kaufen wann und wo Sie wollen. Das digitale ÖPNV-Ticketing bereichert damit den traditionellen Ticketverkauf. Möglich für ausgewählte [Fahrscheine](#preise): Einzelfahrscheine, Einzel- und Gruppentageskarte, digitaler Samstag-Nulltarif und Kurzstreckenfahrschein. Wie bei der bodo eCard erhalten sie 30% Rabatt ab der ersten Fahrt auf reguläre Einzelfahrscheine und Tageskarten.\n\n**Kombination verschiedener Mobilitätsangebote**\n\nIndividuell planbar, buchbar und bezahlbar – mit twsMobil können Sie eine Reisestrecke mit mehreren Mobilitätsangeboten einfach kombinieren.\n\n* ÖPNV-Auskunft und ÖPNV-Ticketing\n* E-Bike-Verleihsystem im Schussental\n* eCarsharing für neue Bewegungsfreiheit\n* MOBI On-Demand-Bus\n\n**Einfach registrieren – entspannt und flexibel unterwegs**\n\n1. Sie registrieren sich einmalig unter [mobil.tws.de](https://mobil.tws.de) und laden die twsMobil App kostenlos runter\n2. Sie können die verschiedenen Verkehrsmittel einfach digital buchen und losfahren\n3. Sie erhalten monatlich eine Rechnung für alle von Ihnen genutzten Verkehrsmittel\n\nStellen auch Sie sich innerhalb weniger Klicks Ihren persönlichen Mobilitätsmix zusammen.\n\nMehr unter [mobil.tws.de](https://mobil.tws.de)\n\n![twsMobil](https://www.stadtbus-rv-wgt.de/wp-content/uploads/2022/12/twsmobil-2.jpg)\n\n**Einfach buchen:**\n\nvia [tws.mobil](https://mobil.tws.de)\n\n## Der zentrale Omnibusbahnhof (ZOB)\n\nDer zentrale Omnibusbahnhof liegt in unmittelbarer Nähe zum Hauptbahnhof Ravensburg und der dortigen Mobilitätszentrale. An den Bussteigen 1 bis 14 verkehren sämtliche Stadt- und Regionalbuslinien.\n\nAm Abend und in der Nacht fungiert der zentrale Omnibusbahnhof als Rendezvous-Punkt: Die Stadtbuslinien 1, 3/4, 21 sowie die Regionalbuslinien 7535, S40, R65, R70 und die Züge aus Richtung Ulm bzw. Richtung Friedrichshafen treffen sich am Omnibusbahnhof und ermöglichen einen Umstieg zwischen allen Linien.\n\n[![<a href='https://www.stadtbus-rv-wgt.de/wp-content/uploads/2024/12/sb_ZOB_Bussteige_2025.pdf' target='_blank'><em class='fa fa-file-pdf-o'></em> PDF herunterladen</a>](https://www.stadtbus-rv-wgt.de/wp-content/uploads/2024/12/sb_ZOB_Bussteige_2025-300x300.jpg)\n\nZOB ÜbersichtsplanHier sehen Sie auf einen Blick, welche Linien welchen Bussteig bedienen und wo sich die Bussteige befinden.](https://www.stadtbus-rv-wgt.de/wp-content/uploads/2024/12/sb_ZOB_Bussteige_2025.jpg)\n[![<a href='https://www.stadtbus-rv-wgt.de/wp-content/uploads/2024/12/sb_ZOB_2025_Bussteiguebersicht.pdf' target='_blank'><em class='fa fa-file-pdf-o'></em> PDF herunterladen</a>](https://www.stadtbus-rv-wgt.de/wp-content/uploads/2024/12/sb_ZOB_2025_Bussteiguebersicht-300x300.jpg)\n\nLinienübersicht ZOBHier sehen Sie auf einen Blick alle Ziele, welche die Linien anfahren sowie den zugehörigen Abfahrtsplatz.](https://www.stadtbus-rv-wgt.de/wp-content/uploads/2024/12/sb_ZOB_2025_Bussteiguebersicht.jpg)\n[![<a href='https://www.stadtbus-rv-wgt.de/wp-content/uploads/2025/06/stadtbus_Linienplan_April_2025.pdf' target='_blank'><em class='fa fa-file-pdf-o'></em> PDF herunterladen</a>](https://www.stadtbus-rv-wgt.de/wp-content/uploads/2025/06/stadtbus_Linienplan_April_2025-1-300x300.png)\n\nLiniennetzplanHier sehen Sie auf einen Blick sämtliche Linien mit allen Haltestellen.](https://www.stadtbus-rv-wgt.de/wp-content/uploads/2025/06/stadtbus_Linienplan_April_2025-1.png)\n\n![Der zentrale Omnibusbahnhof (ZOB)](https://www.stadtbus-rv-wgt.de/wp-content/uploads/2017/03/busbahnhof.jpg)\n\n**Jetzt einsteigen!**\n\nSprit sparen,\n\ngünstiger fahren\n\n## Fahrpläne zum Download\n\nHier finden Sie die Fahrpläne der Stadtbuslinien zum Download – gültig ab 15.12.2024. Linien mit Rufbusverkehr sind entsprechend markiert. Der Rufbus kommt zu den im Fahrplan angegebenen Zeiten nur dann, wenn er mindestens eine Stunde vor Fahrt bestellt wird. Die Bestellung kann online erfolgen oder telefonisch unter 0731 1550-505, täglich von 8 – 18 Uhr. Es gilt der reguläre Tarif. Weitere Informationen erhalten Sie über die Fahrplanauskunft bei bodo.\n\nStadtverkehr\n:   |  |  |  |\n    | --- | --- | --- |\n    | 1 | Baindt – Weingarten – Ravensburg – Weststadt – Hofgut/Schmalegg |  |\n    | 3 | ab 12.04.25: Hegaustraße – Stadtmitte – Weißenau – Eschach (– Oberzell) |  |\n    | 3 | Hegaustraße – Stadtmitte – Weißenau – Eschach (– Oberzell) |  |\n    | 4 | RV Bahnhof – Weißenau – Oberzell |  |\n    | 5 | RV Bahnhof – Weingarten – Lerchenfeld – Baienfurt Schacherösch |  |\n    | 6 | Weingarten Lerchenfeld – Charlottenplatz – Oberstadt – Hochschule |  |\n    | 7A | RV Bahnhof – Flappachbad (Badebus, verkehrt vor. ab 19. Mai 2025) |  |\n    | 14 | Ringverkehr: Löwenplatz – Argonnenpark – Charlottenplatz  [**Jetzt bestellen, Rufbuszeiten laut Fahrplan**](http://www.mein-fahrtwunsch.de/rab/rv/) |  |\n    | 15 | BOB-Bahnhof Weingarten/Berg – Löwenplatz – Stadtösch – BOB-Bahnhof Weingarten/Berg |  |\n    | 20 | RV Bahnhof – Weingarten – Mochenwangen – Wolpertswende |  |\n    | 21 | RV Bahnhof – Knollengraben – Grünkraut – Bodnegg |  |\n    | R60 | RegioBus: Berg – Fronhofen – Fleischwangen |  |\n    | 61 | Berg |  |\n\nÜberlandverkehr\n:   |  |  |  |\n    | --- | --- | --- |\n    | ► | [Hier geht's zu den bodo Fahrplänen der Überlandlinien](https://www.bodo.de/fahrinfo/linienfahrplaene-als-pdf.html) |  |\n\nLiniennetzplan\n:   [![<a href='https://www.stadtbus-rv-wgt.de/wp-content/uploads/2025/06/stadtbus_Linienplan_April_2025.pdf' target='_blank'><em class='fa fa-file-pdf-o'></em> PDF herunterladen</a>](https://www.stadtbus-rv-wgt.de/wp-content/uploads/2025/06/stadtbus_Linienplan_April_2025-1.png)](https://www.stadtbus-rv-wgt.de/wp-content/uploads/2025/06/stadtbus_Linienplan_April_2025-1.png \"Liniennetzplan ansehen\")\n\n [Fahrplanauskunft bei bodo](http://bodo.de \"Weitere Informationen\")\n\n![Fahrpläne zum Download](https://www.stadtbus-rv-wgt.de/wp-content/uploads/2017/03/fahrplan.jpg)\n\n**Gute Fahrt!**\n\nMit Ihrem stadtbus Ravensburg Weingarten\n\n## Für jeden das Passende\n\n**Preisstand: Ab dem 1.8.2025**Es gelten die Tarif- und Beförderungsbestimmungen des Bodensee-Oberschwaben Verkehrsverbunds (bodo).\n\nBitte klicken Sie die einzelnen Tarife an, um weitere Informationen zu erhalten.\n\n|  |  |\n| --- | --- |\n| **Einzelfahrschein** | 3,00 € |\n| **Kurzstreckentarif mit eCard/tws.mobil** | 1,80 € |\n| **Einzelfahrschein mit eCard/tws.mobil**30% Rabatt ab der 1. Fahrt | 2,10 € |\n| **Einzelfahrschein Kinder**6 bis 14 Jahre | 1,80 € |\n| **Digitaler Samstag-Nulltarif Stadtzone** | 0,00 € |\n| **EinzelTageskarte** | 7,30 € |\n| **EinzelTageskarte mit eCard30** | 5,10 € |\n| **GruppenTageskarte** | 14,20 € |\n| **Wochenkarte**(gilt nicht im Zug) | 26,00 € |\n| **Monatskarte „Jedermann“**übertragbar | 72,50 € |\n| **Monatskarte „Schüler“**nicht übertragbar | 52,50 € |\n| **Monatskarte „Kindergartenkind“** | 25,50 € |\n| **Abo Jedermann**Monatskarten übertragbar, 12x | 58,50 € |\n| **Premium Abokarte**Monatskarten übertragbar, 12x | 67,80 € |\n| **Abo Mobil63**Monatskarten nicht übertragbar, 12x | 66,00 € |\n| **Abo Mobil63 Partnerkarte**Monatskarten nicht übertragbar, 12x | 43,00 € |\n| **Deutschlandticket**pro Monat | 58,00 € |\n| **Deutschlandticket JugendBW**pro Jahr | 473,00 € |\n\n  \n  \n [Abo-online Bestellung über bodo](https://www.bodo.de/tickets/abo-online.html \"Jetzt bestellen!\")\n  \n  \n\nbodo Tageskarten und bodo Sonder­tarife (StudiTicket oder JuniorTicket) gelten auch im stadtbus.\n\n![Für jeden das Passende](https://www.stadtbus-rv-wgt.de/wp-content/uploads/2017/03/feiern.jpg)\n\n**Schönes Wochenende!**\n\nMit zusätzlichen Nachtbus-Angeboten\n\n## Informationsstellen und Zeitkarten\n\n**Mobilitätszentrale Ravensburg**\n\nBei der Mobilitätszentrale Ravensburg im Bahnhofsgebäude erhalten Sie sämtliche Auskünfte und Fahrkarten des Bodensee-Oberschwaben Verkehrsverbundes (bodo) und der DB Bahn, also für den Öffentlichen Personennahverkehr und den Schienenfernverkehr.\n\n**KundenCenter Weingarten**\n\n**VBS Verkehrsbetriebe Schussental GmbH & Co. KG** *(Linien 20, 21)*  \nBleicherstraße 28  \n88212 Ravensburg  \nTelefon 0751 185 280-00  \n[info@vbs-schussental.de](mailto:info@vbs-schussental.de)\n\n**Omnibus Grabherr GmbH** *(Linien R60, 61)*  \nAm Langholz 8  \n88289 Waldburg  \nTelefon 07529 97158-0  \n[info@omnibus-grabherr.de](mailto:info@omnibus-grabherr.de)\n\n![Informationsstellen und Zeitkarten](https://www.stadtbus-rv-wgt.de/wp-content/uploads/2017/03/mobilitaetszentrale.jpg)\n\n**Beste Verbindungen!**\n\nWir freuen uns von Ihnen zu hören\n\n## Wir helfen Ihnen gerne weiter\n\nstadtbus Ravensburg Weingarten GmbH\n\n**Informationsstellen und Zeitkartenverkauf:**\n\nMobilitätszentrale Ravensburg  \nBahnhofplatz 5  \n88214 Ravensburg\n\nKundenCenter Weingarten  \nBahnhofstraße 15  \n88250 Weingarten  \nTelefon 0731 1550-0\n\n![Wir helfen Ihnen gerne weiter](https://www.stadtbus-rv-wgt.de/wp-content/uploads/2017/03/kontakt.jpg)\n\n**Fragen oder Anregungen?!**\n\nLassen Sie uns es wissen\n\n## Datenschutz\n\nMit der nachfolgenden Datenschutzerklärung erhalten Sie die Information darüber, welche Daten wir von Ihnen im Zusammenhang mit der Nutzung unserer Websites und der darüber abrufbaren Funktionen, Module und Komponenten verarbeiten. Vorab erhalten Sie eine Kurzübersicht über die Datenverarbeitung bei Aufruf unserer Website (A. Kurzfassung). Die ausführliche Fassung sowie Informationen über die speziellen Funktionen der Website finden Sie unter (B. Detaillierte Datenschutzerklärung).\n\n### A. Kurzfassung – Datenschutzerklärung\n\n1. **Welche Daten werden bei Aufruf der Website verarbeitet?**  \n   Wenn Sie unsere Website aufrufen, wird die IP-Adresse vom Webserver für die Dauer des Besuchs gespeichert. Aus der IP-Adresse ist für uns kein Rückschluss auf Ihre Person möglich.\n2. **Kommen auf der Website Cookies zum Einsatz?**  \n   Auf unserer Website kommen keine Cookies, zum Einsatz.\n3. **Geben wir Ihre Daten an Dritte weiter?**  \n   Wir geben Ihre Daten nicht an Dritte weiter. Allerdings nutzen wir im Rahmen unseres Webauftritts Funktionen von externen Dienstleistern. Für diese Fälle haben wir jedoch die entsprechenden Datenschutzverträge abgeschlossen und uns anhand der technischen und organisatorischen Maßnahmen versichert, dass diese Dienstleister die erforderlichen Datensicherheitsmaßnahmen einsetzen, um Ihre Daten jederzeit vor Verlust und unbefugtem Zugriff zu schützen.\n4. **An wen können Sie sich bei Fragen wenden?**  \n   Bei jeglichen Fragen rund um das Thema Datenschutz wenden Sie sich bitte an: datenschutz@ravensburg-rvv.de\n\n### B. Detaillierte – Datenschutzerklärung\n\n**1. Geltungsbereich und Gegenstand der Datenschutzerklärung**\n\nGegenstand dieser Datenschutzerklärung ist die Information darüber, welche personenbezogenen Daten wir über unsere Website erheben und zu welchem Zweck wir diese verarbeiten. Soweit auf andere Seiten verlinkt wird, haben wir weder Einfluss noch Kontrolle auf die verlinkten Inhalte und die dortigen Datenschutzbestimmungen. Wir empfehlen, die Datenschutzerklärungen auf den verlinkten Websites zu prüfen, um feststellen zu können, ob und in welchem Umfang personenbezogene Daten erhoben, verarbeitet, genutzt oder Dritten zugänglich gemacht werden.\n\nAus Gründen der besseren Lesbarkeit wird im Folgenden die Sprachform des generischen Maskulinums angewandt. Die juristische Fachsprache nutzt diese Form. Die ausschließliche Verwendung der männlichen Form wird geschlechtsunabhängig (m/w/d) verstanden.\n\n**2. Wichtige Definitionen und Begriffe**\n\nVorab erhalten Sie eine Auswahl einiger gesetzlicher Definitionen, die für das Verständnis der Datenschutzerklärung u.U. hilfreich für Sie sind. Der vollständige Text der Datenschutz-Grundverordnung (DSGVO), einschließlich der weiteren Definitionen und Begriffsbestimmungen, ist unter folgendem Link https://eur-lex.europa.eu/legal-content/DE/TXT/?uri=CELEX%3A32016R0679 abrufbar.\n\nPersonenbezogene Daten: Alle Informationen, die sich auf eine identifizierte oder identifizierbare natürliche Person beziehen. Als identifizierbar wird eine natürliche Person angesehen, die direkt oder indirekt, insbesondere mittels Zuordnung zu einer Kennung wie einem Namen, zu einer Kennnummer, zu Standortdaten, zu einer Online-Kennung oder zu einem oder mehreren besonderen Merkmalen identifiziert werden kann, die Ausdruck der physischen, physiologischen, genetischen, psychischen, wirtschaftlichen, kulturellen oder sozialen Identität dieser natürlichen Person sind.\n\nVerarbeitung: Jeden mit oder ohne Hilfe automatisierter Verfahren ausgeführten Vorgang oder jede solche Vorgangsreihe im Zusammenhang mit personenbezogenen Daten, wie das Erheben, das Erfassen, die Organisation, das Ordnen, die Speicherung, die Anpassung oder Veränderung, das Auslesen, das Abfragen, die Verwendung, die Offenlegung durch Übermittlung, Verbreitung oder eine andere Form der Bereitstellung, den Abgleich oder die Verknüpfung, die Einschränkung, das Löschen oder die Vernichtung.\n\nVerantwortlicher: Bezeichnet die natürliche oder juristische Person, Behörde, Einrichtung oder andere Stelle, die allein oder gemeinsam mit anderen über die Zwecke und Mittel der Verarbeitung von personenbezogenen Daten entscheidet. Sind die Zwecke und Mittel dieser Verarbeitung durch das Unionsrecht oder das Recht der Mitgliedstaaten vorgegeben, so können der Verantwortliche beziehungsweise die bestimmten Kriterien seiner Benennung nach dem Unionsrecht oder dem Recht der Mitgliedstaaten vorgesehen werden.\n\nEmpfänger: Bezeichnet eine natürliche oder juristische Person, Behörde, Einrichtung oder andere Stelle, denen personenbezogene Daten offengelegt werden, unabhängig davon, ob es sich bei ihr um einen Dritten handelt oder nicht. Behörden, die im Rahmen eines bestimmten Untersuchungsauftrags nach dem Unionsrecht oder dem Recht der Mitgliedstaaten möglicherweise personenbezogene Daten erhalten, gelten jedoch nicht als Empfänger. Die Verarbeitung dieser Daten durch die genannten Behörden erfolgt im Einklang mit den geltenden Datenschutzvorschriften gemäß den Zwecken der Verarbeitung.\n\nDritter: Dies ist eine natürliche oder juristische Person, Behörde, Einrichtung oder andere Stelle, außer der betroffenen Person, dem Verantwortlichen, dem Auftragsverarbeiter und den Personen, die unter der unmittelbaren Verantwortung des Verantwortlichen oder des Auftragsverarbeiters befugt sind, die personenbezogenen Daten zu verarbeiten.\n\n**3. Kontaktdaten des Verantwortlichen**\n\nstadtbus Ravensburg Weingarten GmbH,  \nSchussenstraße 22,  \n88212 Ravensburg,  \ninfo@stadtbus-rv-wgt.de  \nTelefon: +49 751 804-0  \nE-Mail: info@stadtbus-rv-wgt.de\n\n**4. Kontaktdaten des Datenschutzbeauftragten**\n\nBei jeglichen Fragen rund um das Thema Datenschutz wenden Sie sich bitte an: datenschutz@ravensburg-rvv.de\n\n**5. Logfiles**\n\nWir erheben beim Aufruf unserer Website sog. Zugriffsdaten und speichern diese in einer Protokolldatei (sog. Logdatei). Zu diesen Zugriffsdaten zählt auch die IP-Adresse. Daneben werden in der Logdatei der Name der abgerufenen Website, die aufgerufene Datei, das Datum und die Uhrzeit des Abrufs, die übertragene Datenmenge und Meldung über den erfolgreichen Abruf, der Browsertyp nebst Version, das Betriebssystem, die sog. Referrer URL (die zuvor besuchte Seite) sowie der anfragende Provider gespeichert.\n\n**Personenbezogene Daten**  \nIP-Adresse;\n\n**Zweck der Datenverarbeitung**  \nDie Logdatei-Daten, einschließlich der IP-Adresse, erheben wir, um einen reibungslosen Verbindungsaufbau der Website zu gewährleisten und eine komfortable Nutzung unserer Website durch die Nutzer zu ermöglichen. Zudem dient die Logdatei der Auswertung der Systemsicherheit und -stabilität sowie zu administrativen Zwecken.\n\n**Interesse an der Datenverarbeitung**  \nDie Logdatei-Daten, einschließlich der IP-Adresse, dienen lediglich der technischen und gestalterischen Optimierung der Website und der Sicherung unserer Systeme (z. B. im Rahmen eines Angriffs auf unsere IT oder eines Sicherheitsvorfalls). Aus den Daten der Logdatei, einschließlich der IP-Adresse, ist für uns im Falle des Aufrufs unserer Website kein Personenbezug herstellbar. Dies kann nur dann der Fall sein, wenn Sie sich gleichzeitig in unserem Kundenportal anmelden. In diesem Fall können wir die IP-Adresse Ihnen direkt zuordnen.\n\nAnbieter: TeleData GmbH  \nZweck der Datenverarbeitung: Website Hosting & BackUp  \nDetails / Informationen zum Datenschutz: https://www.teledata.de/datenschutzerklaerung\n\n**Dauer der Datenspeicherung**   \nDie Logfiles, mithin die darin enthaltene IP-Adresse, werden nach der gesetzlichen Frist automatisch gelöscht.\n\n**Rechtsgrundlage**Art. 6 Abs. 1 lit. f) DSGVO\n\n**Bereitstellung vorgeschrieben oder erforderlich**  \nDie Bereitstellung der vorgenannten personenbezogenen Daten ist weder gesetzlich noch vertraglich vorgeschrieben. Allerdings ist ohne die IP-Adresse der Dienst und die Funktionsfähigkeit der Website nicht gewährleistet oder eingeschränkt.\n\n**6. Kontaktformular**\n\nPersonenbezogene Daten Name, E-Mail-Adresse und die entsprechende Nachricht\n\n**Zweck der Datenverarbeitung**  \nWir nutzen auf unserer Website ein Kontaktformular, um uns mit unseren Kunden und Interessenten auszutauschen und um ihre Anliegen und Anfragen zu beantworten. Die in diesem Zusammenhang an uns gerichteten Anfragen und Informationen verarbeiten wir ausschließlich zur Bearbeitung Ihrer Anfrage und zur Kontaktaufnahme mit Ihnen.\n\n**Dauer der Datenspeicherung**   \nDauer der Bearbeitung und Abwicklung der Anfrage oder bis wir zur Löschung aufgefordert werden.\n\n**Rechtsgrundlage**   \nGrundsätzlich benötigen wir für die Beantwortung der Anfragen keine personenbezogenen Daten. Rechtsgrundlage ist Art. 6 Abs. 1 lit. a) DSGVO. Falls Sie bereits Kunde oder Vertragspartner sind, basiert die Datenverarbeitung auf Art. 6 Abs. 1 lit. b) DSGVO.\n\n**Bereitstellung vorgeschrieben oder erforderlich**  \nDie Bereitstellung der vorgenannten personenbezogenen Daten ist weder gesetzlich noch vertraglich vorgeschrieben. Allerdings ist ohne die Angabe eine Bearbeitung Ihrer Anfrage nicht möglich.\n\n**7. Fonts**\n\nDiese Seite nutzt zur einheitlichen Darstellung von Schriftarten so genannte Web-Fonts. Beim Aufruf einer Seite lädt Ihr Browser die benötigten Web-Fonts in Ihren Browsercache, um Texte und Schriftarten korrekt anzuzeigen. Zu diesem Zweck muss der von Ihnen verwendete Browser Verbindung zu den Servern aufnehmen. Die Nutzung von Web-Fonts erfolgt im Interesse einer einheitlichen und ansprechenden Darstellung unserer Online-Angebote. Dies stellt ein berechtigtes Interesse im Sinne von Art. 6 Abs. 1 lit. f DSGVO dar. Wenn Ihr Browser Web-Fonts nicht unterstützt, wird eine Standardschrift von Ihrem Computer genutzt.\n\nAnbieter: Monotype GmbH  \nDienst: Fast Fonts  \nInformationen: Monotype Fonts. | Monotype.\n\n**8. Datensicherheit**\n\nWir unterhalten aktuelle technische Maßnahmen zur Gewährleistung der Datensicherheit, insbesondere zum Schutz Ihrer personenbezogenen Daten vor Gefahren bei Datenübertragungen sowie vor Kenntniserlangung durch Dritte. Diese werden dem aktuellen Stand der Technik entsprechend fortlaufend angepasst und überprüft. Zur Wahrung der Vertraulichkeit und Integrität, der von Ihnen auf unserer Website angegebenen Daten werden, diese Daten via „https“ und Transport Layer Security (TLS) übertragen.\n\n**9. Ihre Rechte**\n\nSie haben das Recht, jederzeit von uns eine Bestätigung zu verlangen, ob wir personenbezogene Daten von Ihnen verarbeiten und das Recht auf Auskunft über diese personenbezogenen Daten. Daneben haben Sie das Recht auf Berichtigung, Löschung und Einschränkung der Datenverarbeitung, sowie das Recht, jederzeit Widerspruch gegen die Verarbeitung der personenbezogenen Daten einzulegen, bzw. die Einwilligung zur Datenverarbeitung jederzeit zu widerrufen oder die Datenübertragung zu fordern.\n\nAlle Informationswünsche, Auskunftsanfragen, Widerrufe oder Widersprüche zur Datenverarbeitung richten Sie bitte per E-Mail an datenschutz@ravensburg-rvv.de. Darüber hinaus haben Sie das Recht, sich im Falle von Datenschutzverletzungen bei einer Aufsichtsbehörde zu beschweren.\n\n**10. Widerspruchsrecht**\n\nSie haben das Recht, aus Gründen, die sich aus Ihrer besonderen Situation ergeben, jederzeit gegen die Verarbeitung Sie betreffender personenbezogener Daten, die u. a. aufgrund von Art.6 Abs. 1 lit. a) oder lit. f) DSGVO erfolgt, Widerspruch nach Art. 21 DSGVO einzulegen. Wir werden die Verarbeitung Ihrer personenbezogenen Daten einstellen. Es sei denn, wir können zwingende schutzwürdige Gründe für die Verarbeitung nachweisen, die Ihre Interessen, Rechte und Freiheiten überwiegen, oder wenn die Verarbeitung der Geltendmachung, Ausübung oder Verteidigung von Rechtsansprüchen dient. Möchten Sie von Ihrem Widerspruchsrecht Gebrauch machen, genügt eine E-Mail an datenschutz@ravensburg-rvv.de.\n\n## Impressum\n\n**stadtbus Ravensburg Weingarten GmbH**  \nTelefon 0751 804-0  \nTelefax 0751 804-1304  \ninfo@stadtbus-rv-wgt.de\n\nSchussenstraße 22  \n88212 Ravensburg\n\nGeschäftsführer: Dr. Andreas Thiel-Böhm, Jenny Jungnitz  \nHandelsregister: HRB 2542  \nSitz: Ravensburg\n\n**Fotos**  \nAnja Köhler | [www.andereart.de](http://www.andereart.de)  \nAndrea Schnitzer | [www.andrea-schnitzer.de](http://andrea-schnitzer.de)\n\n**Konzept, Gestaltung, Programmierung**  \nd-werk gmbh | [www.d-werk.com](http://www.d-werk.com)\n\n**Haftungshinweis:**\n\n**1. Inhalt des Onlineangebotes**  \nDer Betreiber dieser Internetpräsenz übernimmt keinerlei Gewähr für die Aktualität, Korrektheit, Vollständigkeit oder Qualität der bereitgestellten Informationen. Haftungsansprüche gegen den Betreiber, die sich auf Schäden materieller oder ideeller Art beziehen, welche durch die Nutzung oder Nichtnutzung der dargebotenen Informationen bzw. durch die Nutzung fehlerhafter und unvollständiger Informationen verursacht wurden sind grundsätzlich ausgeschlossen. Alle Angebote sind freibleibend und unverbindlich.  \nDer Betreiber behält es sich ausdrücklich vor, Teile der Seiten oder das gesamte Angebot ohne gesonderte Ankündigung zu verändern, zu ergänzen, zu löschen oder die Veröffentlichung zeitweise oder endgültig einzustellen.\n\n**2. Verweise und Links**  \nBei direkten oder indirekten Links auf fremde Internetseiten, die außerhalb des Verantwortungs-  \nbereiches des Betreibers liegen, haftet dieser nur dann, wenn er von den Inhalten Kenntnis hat und es ihm technisch möglich und zumutbar wäre, die Nutzung im Falle rechtswidriger Inhalte zu verhindern. Der Betreiber erklärt daher ausdrücklich, dass zum Zeitpunkt der Linksetzung die entsprechenden verlinkten Seiten frei von illegalen Inhalten waren.  \nDer Betreiber hat keinerlei Einfluss auf die aktuelle und zukünftige Gestaltung und die Inhalte der gelinkten Seiten. Deshalb distanziert er sich hiermit ausdrücklich von allen Inhalten aller gelinkten Seiten inklusive aller Unterseiten und macht sich ihre Inhalte nicht zu eigen. Diese Erklärung gilt für alle innerhalb des eigenen Internetangebotes angebrachten Links. Für illegale, fehlerhafte oder unvollständige Inhalte und insbesondere für Schäden, die aus der Nutzung oder Nichtnutzung solcher dargebotener Informationen entstehen, haftet allein der Anbieter der Seite, auf welche verwiesen wurde, nicht derjenige, der über Links auf die jeweilige Veröffentlichung lediglich verweist. Diese Erklärung gilt auch für Fremdeinträge in vom Betreiber eingerichteten Gästebüchern, Diskussionsforen und Mailinglisten.\n\n**3. Urheberrecht**  \nDer Betreiber ist bestrebt, in allen Publikationen die Urheberrechte der verwendeten Grafiken, Tondokumente, Videosequenzen und Texte zu beachten, von ihm selbst erstellte Grafiken, Tondokumente, Videosequenzen und Texte zu nutzen oder auf lizenzfreie Grafiken, Tondokumente, Videosequenzen und Texte zurückzugreifen. Die hier veröffentlichten Texte, Grafiken, Bilder und andere Seiten stammen, soweit nicht anders gekennzeichnet, aus seiner Sammlung.  \nAlle innerhalb des Internetangebotes genannten und ggf. durch Dritte geschützten Marken- und Warenzeichen unterliegen uneingeschränkt den Bestimmungen des jeweils gültigen Kennzeichenrechts und den Besitzrechten der jeweiligen eingetragenen Eigentümer. Allein aufgrund der bloßen Nennung ist nicht der Schluss zu ziehen, dass Markenzeichen nicht durch Rechte Dritter geschützt sind.  \nDas Copyright für veröffentlichte, vom Betreiber selbst erstellte Objekte bleibt allein beim Betreiber der Seiten. Eine Vervielfältigung oder Verwendung solcher Grafiken, Tondokumente, Videosequenzen und Texte in anderen elektronischen oder gedruckten Publikationen ist ohne ausdrückliche Zustimmung des Betreibers nicht gestattet.\n\n**4. Datenschutz**  \nBei Eingabe persönlicher Daten, wie E-Mail-Adresse, Name, Anschrift, usw., erfolgt die Preisgabe dieser Daten seitens des Nutzers auf ausdrücklich freiwilliger Basis. Die Inanspruchnahme aller angebotenen Dienste ist, soweit technisch möglich und zumutbar, auch ohne Angabe solcher Daten bzw. unter Angabe anonymisierter Daten oder eines Pseudonyms gestattet.\n\n**5. Google Analytics**  \n\"Diese Website benutzt Google Analytics, einen Webanalysedienst der Google Inc. (Google) Google Analytics verwendet sog. 'Cookies', Textdateien, die auf Ihrem Computer gespeichert werden und die eine Analyse der Benutzung der Website durch Sie ermöglicht. Die durch den Cookie erzeugten Informationen über Ihre Benutzung diese Website (einschließlich Ihrer IP-Adresse) wird an einen Server der Google in den USA übertragen und dort gespeichert. Google wird diese Informationen benutzen, um Ihre Nutzung der Website auszuwerten, um Reports über die Websiteaktivitäten für die Websitebetreiber zusammenzustellen und um weitere mit der Websitenutzung und der Internetnutzung verbundene Dienstleistungen zu erbringen. Auch wird Google diese Informationen gegebenenfalls an Dritte übertragen, sofern dies gesetzlich vorgeschrieben oder soweit Dritte diese Daten im Auftrag von Google verarbeiten. Google wird in keinem Fall Ihre IP-Adresse mit anderen Daten der Google in Verbindung bringen. Sie können die Installation der Cookies durch eine entsprechende Einstellung Ihrer Browser Software verhindern; wir weisen Sie jedoch darauf hin, dass Sie in diesem Fall gegebenenfalls nicht sämtliche Funktionen dieser Website voll umfänglich nutzen können. Durch die Nutzung dieser Website erklären Sie sich mit der Bearbeitung der über Sie erhobenen Daten durch Google in der zuvor beschriebenen Art und Weise und zu dem zuvor benannten Zweck einverstanden.\n\nDer Datenerhebung und -speicherung kann jederzeit mit Wirkung für die Zukunft widersprochen werden. Angesichts der Diskussion um den Einsatz von Analysetools mit vollständigen IP-Adressen möchten wir darauf hinweisen, dass diese Website Google Analytics mit der Erweiterung „\\_anonymizeIp()“ verwendet und daher IP-Adressen nur gekürzt weiterverarbeitet werden, um eine direkte Personenbeziehbarkeit auszuschließen.\n\n**6. Rechtswirksamkeit dieses Haftungsausschlusses**  \nDieser Haftungsausschluss ist als Teil des Internetangebotes zu betrachten, von dem aus auf diese Seite verwiesen wurde. Sofern Teile oder einzelne Formulierungen dieses Textes der geltenden Rechtslage nicht, nicht mehr oder nicht vollständig entsprechen sollten, bleiben die übrigen Teile des Dokumentes in ihrem Inhalt und ihrer Gültigkeit davon unberührt.\n\n[Partner des](http://bodo.de) \n\n[Datenschutz](#datenschutz) | [Impressum](#impressum)"
}