{
  "timestamp": "20250722_101751",
  "processing_info": {
    "date": "2025-07-22",
    "time": "10:18:01",
    "timezone": "WEST"
  },
  "url": "http://www.ov-sihler.de",
  "imprint_url": "https://www.ov-sihler.de/kontakt/impressum",
  "imprint_data": {
    "company_name": "Hildenbrand GmbH Omnibusverkehr",
    "managing_directors": [
      "Isolde Hildenbrand",
      "Tobias Maier"
    ],
    "business_address": {
      "street": null,
      "city": null,
      "postal_code": null,
      "country": null
    },
    "phone_numbers": [
      "+49 7335 9627-0"
    ],
    "email_addresses": [
      "info@ov-hildenbrand.de"
    ],
    "website_url": "https://www.ov-sihler.de",
    "registration_details": {
      "trade_register": "Handelsregister",
      "registration_number": "HRB 540 434",
      "court": "Amtsgericht Ulm"
    },
    "vat_id": "DE 274 678 464",
    "tax_id": null,
    "professional_liability_insurance": null,
    "other_legal_info": {
      "online_dispute_resolution_platform": "https://ec.europa.eu/consumers/odr",
      "consumer_arbitration_statement": "Not willing or obligated to participate in dispute resolution procedures before a consumer arbitration board.",
      "liability_for_content": "As service provider, responsible for own content. Not obligated to monitor transmitted/stored third-party information.",
      "liability_for_links": "No guarantee for external links; responsibility lies with respective provider. Links checked for violations at time of linking; removal upon knowledge of legal violations.",
      "copyright": "Content and works are subject to German copyright. Reproduction, processing, distribution, and any use outside copyright limits require written consent. Downloads and copies for private, non-commercial use only."
    }
  },
  "markdown_content": "Omnibusverkehr Sihler Geislingen/Steige – Kontakt – Impressum\n\n\n\n### [Omnibusverkehr Sihler Geislingen/Steige](https://www.ov-sihler.de)\n\n* [Kontakt](https://www.ov-sihler.de/kontakt)\n  + [Anschrift](https://www.ov-sihler.de/kontakt/anschrift)\n  + [Datenschutz](https://www.ov-sihler.de/kontakt/datenschutz)\n  + [Impressum](https://www.ov-sihler.de/kontakt/impressum)\n\n# Impressum\n\n## Angaben gemäß § 5 TMG:\n\nHildenbrand GmbH   \n Omnibusverkehr\n\n## Vertreten durch:\n\nIsolde Hildenbrand  \nTobias Maier\n\n## Kontakt:\n\nTelefon: +49 7335 9627-0  \nTelefax: +49 7335 9627-20  \nE-Mail: [info@ov-hildenbrand.de](mailto:info@ov-hildenbrand.de)\n\n## Registereintrag:\n\nEintragung im Handelsregister.   \nRegistergericht:Amtsgericht Ulm   \nRegisternummer: HRB 540 434\n\n## Umsatzsteuer:\n\nUmsatzsteuer-Identifikationsnummer gemäß §27 a Umsatzsteuergesetz:  \nDE 274 678 464\n\n## Streitschlichtung\n\nDie Europäische Kommission stellt eine Plattform zur Online-Streitbeilegung (OS) bereit: <https://ec.europa.eu/consumers/odr>.  \n Unsere E-Mail-Adresse finden Sie oben im Impressum.\n\nWir sind nicht bereit oder verpflichtet, an Streitbeilegungsverfahren vor einer Verbraucherschlichtungsstelle teilzunehmen.\n\n### Haftung für Inhalte\n\nAls Diensteanbieter sind wir gemäß § 7 Abs.1 TMG für eigene Inhalte auf diesen Seiten nach den allgemeinen Gesetzen verantwortlich. Nach §§ 8 bis 10 TMG sind wir als Diensteanbieter jedoch nicht verpflichtet, übermittelte oder gespeicherte fremde Informationen zu überwachen oder nach Umständen zu forschen, die auf eine rechtswidrige Tätigkeit hinweisen.\n\nVerpflichtungen zur Entfernung oder Sperrung der Nutzung von Informationen nach den allgemeinen Gesetzen bleiben hiervon unberührt. Eine diesbezügliche Haftung ist jedoch erst ab dem Zeitpunkt der Kenntnis einer konkreten Rechtsverletzung möglich. Bei Bekanntwerden von entsprechenden Rechtsverletzungen werden wir diese Inhalte umgehend entfernen.\n\n### Haftung für Links\n\nUnser Angebot enthält Links zu externen Websites Dritter, auf deren Inhalte wir keinen Einfluss haben. Deshalb können wir für diese fremden Inhalte auch keine Gewähr übernehmen. Für die Inhalte der verlinkten Seiten ist stets der jeweilige Anbieter oder Betreiber der Seiten verantwortlich. Die verlinkten Seiten wurden zum Zeitpunkt der Verlinkung auf mögliche Rechtsverstöße überprüft. Rechtswidrige Inhalte waren zum Zeitpunkt der Verlinkung nicht erkennbar.\n\nEine permanente inhaltliche Kontrolle der verlinkten Seiten ist jedoch ohne konkrete Anhaltspunkte einer Rechtsverletzung nicht zumutbar. Bei Bekanntwerden von Rechtsverletzungen werden wir derartige Links umgehend entfernen.\n\n### Urheberrecht\n\nDie durch die Seitenbetreiber erstellten Inhalte und Werke auf diesen Seiten unterliegen dem deutschen Urheberrecht. Die Vervielfältigung, Bearbeitung, Verbreitung und jede Art der Verwertung außerhalb der Grenzen des Urheberrechtes bedürfen der schriftlichen Zustimmung des jeweiligen Autors bzw. Erstellers. Downloads und Kopien dieser Seite sind nur für den privaten, nicht kommerziellen Gebrauch gestattet.\n\nSoweit die Inhalte auf dieser Seite nicht vom Betreiber erstellt wurden, werden die Urheberrechte Dritter beachtet. Insbesondere werden Inhalte Dritter als solche gekennzeichnet. Sollten Sie trotzdem auf eine Urheberrechtsverletzung aufmerksam werden, bitten wir um einen entsprechenden Hinweis. Bei Bekanntwerden von Rechtsverletzungen werden wir derartige Inhalte umgehend entfernen.\n\n* Copyright 2018  \n   Sihler GmbH Omnibusverkehr\n* [Kontakt](https://www.ov-sihler.de/kontakt)\n* [Impressum](https://www.ov-sihler.de/kontakt/impressum)\n* [Datenschutz](https://www.ov-sihler.de/kontakt/datenschutz)\n\n![](https://www.ov-sihler.de/images/bus.svg)\n\n[Website by kreisform.de](http://www.kreisform.de)"
}